Player 1,Player 2,Similarity
"A. Ali (23, Moss, OBOS Ligaen 2023)","J. González (31, Herrera, Panama LPF 2023)",-12.141836135396744
"A. Ali (23, Moss, OBOS Ligaen 2023)","V. Pimentel (32, Sporting San Miguelito, Panama LPF 2023)",32.61345240682619
"A. Ali (23, Moss, OBOS Ligaen 2023)","V. Ávila (24, Independiente, Panama LPF 2023)",39.52456944048019
"A. Ali (23, Moss, OBOS Ligaen 2023)","J. Vélez (28, César Vallejo, Peruvian Liga 1 2023)",5.622948262643016
"A. Ali (23, Moss, OBOS Ligaen 2023)","Ó. Barreto (30, Unión Comercio, Peruvian Liga 1 2023)",-5.008601741638075
"A. Ali (23, Moss, OBOS Ligaen 2023)","M. Lliuya (31, Sport Huancayo, Peruvian Liga 1 2023)",-2.357063194241589
"A. Ali (23, Moss, OBOS Ligaen 2023)","K. Sandoval (26, Cienciano, Peruvian Liga 1 2023)",30.04554724662588
"A. Ali (23, Moss, OBOS Ligaen 2023)","J. Rojas (33, Deportivo Garcilaso, Peruvian Liga 1 2023)",48.7842472255269
"A. Ali (23, Moss, OBOS Ligaen 2023)","R. Torres (31, Alianza Atlético, Peruvian Liga 1 2023)",-2.0580649486504123
"A. Ali (23, Moss, OBOS Ligaen 2023)","C. Neira (22, Unión Comercio, Peruvian Liga 1 2023)",36.54010838891288
"A. Ali (23, Moss, OBOS Ligaen 2023)","W. Mimbela (31, ADT, Peruvian Liga 1 2023)",5.031234115340332
"A. Ali (23, Moss, OBOS Ligaen 2023)","A. Ayarza (30, Cusco, Peruvian Liga 1 2023)",19.44469408464837
"A. Ali (23, Moss, OBOS Ligaen 2023)","J. Sánchez (33, UTC Cajamarca, Peruvian Liga 1 2023)",18.489509192932577
"A. Ali (23, Moss, OBOS Ligaen 2023)","D. Ramírez (28, Academia Cantolao, Peruvian Liga 1 2023)",20.69272471444372
"A. Ali (23, Moss, OBOS Ligaen 2023)","Luis Fernández (29, Wisła Kraków, Polish I Liga 22-23)",60.23052526124519
"A. Ali (23, Moss, OBOS Ligaen 2023)","Joan Román (30, Podbeskidzie Bielsko-Biała, Polish I Liga 22-23)",53.08535201313433
"A. Ali (23, Moss, OBOS Ligaen 2023)","S. Steblecki (31, Chrobry Głogów, Polish I Liga 22-23)",42.62838106853092
"A. Ali (23, Moss, OBOS Ligaen 2023)","E. Thiakane (31, Puszcza Niepołomice, Polish I Liga 22-23)",31.14770878904122
"A. Ali (23, Moss, OBOS Ligaen 2023)","A. Błąd (32, Katowice, Polish I Liga 22-23)",36.32921621534552
"A. Ali (23, Moss, OBOS Ligaen 2023)","H. Adamczyk (25, Arka Gdynia, Polish I Liga 22-23)",52.60840700042476
"A. Ali (23, Moss, OBOS Ligaen 2023)","D. Olejarka (21, Stal Rzeszów, Polish I Liga 22-23)",52.14279421927971
"A. Ali (23, Moss, OBOS Ligaen 2023)","P. Nocoń (32, SKRA Częstochowa, Polish I Liga 22-23)",20.0400198694832
"A. Ali (23, Moss, OBOS Ligaen 2023)","M. Marzec (28, Katowice, Polish I Liga 22-23)",56.71865102507185
"A. Ali (23, Moss, OBOS Ligaen 2023)","M. Sitek (22, Podbeskidzie Bielsko-Biała, Polish I Liga 22-23)",42.44899849799927
"A. Ali (23, Moss, OBOS Ligaen 2023)","M. Janota (32, Podbeskidzie Bielsko-Biała, Polish I Liga 22-23)",8.05415592916184
"A. Ali (23, Moss, OBOS Ligaen 2023)","H. Tomalski (29, Puszcza Niepołomice, Polish I Liga 22-23)",34.61655225520567
"A. Ali (23, Moss, OBOS Ligaen 2023)","Ł. Janoszka (36, Ruch Chorzów, Polish I Liga 22-23)",24.53375806558193
"A. Ali (23, Moss, OBOS Ligaen 2023)","W. Szumilas (26, Zagłębie Sosnowiec, Polish I Liga 22-23)",1.786059376802709
"A. Ali (23, Moss, OBOS Ligaen 2023)","S. Pawłowski (36, Zagłębie Sosnowiec, Polish I Liga 22-23)",45.49039693756448
"A. Ali (23, Moss, OBOS Ligaen 2023)","D. Hilbrycht (25, Nieciecza, Polish I Liga 22-23)",14.805530528475073
"A. Ali (23, Moss, OBOS Ligaen 2023)","K. Drzazga (27, Podbeskidzie Bielsko-Biała, Polish I Liga 22-23)",48.53702651628841
"A. Ali (23, Moss, OBOS Ligaen 2023)","T. Foszmańczyk (37, Ruch Chorzów, Polish I Liga 22-23)",47.67375985852544
"A. Ali (23, Moss, OBOS Ligaen 2023)","K. Toporkiewicz (21, Sandecja Nowy Sącz, Polish I Liga 22-23)",7.194541047300865
"A. Ali (23, Moss, OBOS Ligaen 2023)","M. Machaj (33, Chrobry Głogów, Polish I Liga 22-23)",13.892742867404635
"A. Ali (23, Moss, OBOS Ligaen 2023)","D. Potoma (23, Sandecja Nowy Sącz, Polish I Liga 22-23)",8.2490081154719
"A. Ali (23, Moss, OBOS Ligaen 2023)","A. Trubeha (25, Nieciecza, Polish I Liga 22-23)",36.18197085239619
"A. Ali (23, Moss, OBOS Ligaen 2023)","P. Pyrdoł (24, SKRA Częstochowa, Polish I Liga 22-23)",37.84743099748325
"A. Ali (23, Moss, OBOS Ligaen 2023)","D. Kościelniak (28, Katowice, Polish I Liga 22-23)",56.28890742201689
"A. Ali (23, Moss, OBOS Ligaen 2023)","R. Gołębiowski (21, SKRA Częstochowa, Polish I Liga 22-23)",27.81392371831797
"A. Ali (23, Moss, OBOS Ligaen 2023)","K. Zapolnik (30, Puszcza Niepołomice, Polish I Liga 22-23)",2.2454187379914146
"A. Ali (23, Moss, OBOS Ligaen 2023)","Vasco Sousa (20, Porto II, Portugal Segunda Liga 22-23)",-1.8291548764713887
"A. Ali (23, Moss, OBOS Ligaen 2023)","J. Toro (26, Academico Viseu, Portugal Segunda Liga 22-23)",21.35649884584935
"A. Ali (23, Moss, OBOS Ligaen 2023)","D. Duarte (35, UD Oliveirense, Portugal Segunda Liga 22-23)",55.20632826133149
"A. Ali (23, Moss, OBOS Ligaen 2023)","L.  Trabulo (28, Mafra, Portugal Segunda Liga 22-23)",20.88773057074188
"A. Ali (23, Moss, OBOS Ligaen 2023)","Alan (23, Moreirense, Portugal Segunda Liga 22-23)",30.668679758773514
"A. Ali (23, Moss, OBOS Ligaen 2023)","Zé Tiago (34, Sporting Covilhã, Portugal Segunda Liga 22-23)",44.81089719973153
"A. Ali (23, Moss, OBOS Ligaen 2023)","P. Santos (27, Moreirense, Portugal Segunda Liga 22-23)",58.426376445181546
"A. Ali (23, Moss, OBOS Ligaen 2023)","Feliz Vaz (34, Penafiel, Portugal Segunda Liga 22-23)",27.83496871740982
"A. Ali (23, Moss, OBOS Ligaen 2023)","Adriano Castanheira (30, Penafiel, Portugal Segunda Liga 22-23)",33.98482895288685
"A. Ali (23, Moss, OBOS Ligaen 2023)","S. Koné (22, Porto II, Portugal Segunda Liga 22-23)",8.080122162358505
"A. Ali (23, Moss, OBOS Ligaen 2023)","Bruno Fernandes (28, Manchester United, Premier League 22-23)",22.465594275665417
"A. Ali (23, Moss, OBOS Ligaen 2023)","M. Mount (24, Chelsea, Premier League 22-23)",45.8610293071811
"A. Ali (23, Moss, OBOS Ligaen 2023)","J. Maddison (26, Leicester City, Premier League 22-23)",34.18548535195111
"A. Ali (23, Moss, OBOS Ligaen 2023)","Matheus Nunes (24, Wolverhampton Wanderers, Premier League 22-23)",42.5839390937283
"A. Ali (23, Moss, OBOS Ligaen 2023)","Lucas Paquetà (25, West Ham United, Premier League 22-23)",12.24452529101559
"A. Ali (23, Moss, OBOS Ligaen 2023)","C. Gallagher (23, Chelsea, Premier League 22-23)",20.153045314571305
"A. Ali (23, Moss, OBOS Ligaen 2023)","B. Aaronson (22, Leeds United, Premier League 22-23)",51.022549972644505
"A. Ali (23, Moss, OBOS Ligaen 2023)","M. Gibbs-White (23, Nottingham Forest, Premier League 22-23)",31.68387773534197
"A. Ali (23, Moss, OBOS Ligaen 2023)","E. Eze (24, Crystal Palace, Premier League 22-23)",32.52453676338095
"A. Ali (23, Moss, OBOS Ligaen 2023)","K. Dewsbury-Hall (24, Leicester City, Premier League 22-23)",7.080736922331503
"A. Ali (23, Moss, OBOS Ligaen 2023)","P. Billing (26, Bournemouth, Premier League 22-23)",45.42852619387831
"A. Ali (23, Moss, OBOS Ligaen 2023)","Andreas Pereira (27, Fulham, Premier League 22-23)",23.115761420844773
"A. Ali (23, Moss, OBOS Ligaen 2023)","C. Alcaraz (20, Southampton, Premier League 22-23)",40.34013077795792
"A. Ali (23, Moss, OBOS Ligaen 2023)","J. Lingard (30, Nottingham Forest, Premier League 22-23)",44.334371198004185
"A. Ali (23, Moss, OBOS Ligaen 2023)","João Moutinho (36, Wolverhampton Wanderers, Premier League 22-23)",4.569430009461479
"A. Ali (23, Moss, OBOS Ligaen 2023)","T. Cairney (32, Fulham, Premier League 22-23)",31.2367650311536
"A. Ali (23, Moss, OBOS Ligaen 2023)","F. Nabiyev (23, Kapaz, Premyer Liqa 22-23)",34.357216869089825
"A. Ali (23, Moss, OBOS Ligaen 2023)","Leandro Andrade (23, Qarabag, Premyer Liqa 22-23)",49.40074573991013
"A. Ali (23, Moss, OBOS Ligaen 2023)","A. Guseynov (23, Turan-T, Premyer Liqa 22-23)",15.825468863098838
"A. Ali (23, Moss, OBOS Ligaen 2023)","M. Hamdaoui (29, Zira, Premyer Liqa 22-23)",26.152089942029267
"A. Ali (23, Moss, OBOS Ligaen 2023)","A. Nuriev (27, Sabah, Premyer Liqa 22-23)",32.72618952236449
"A. Ali (23, Moss, OBOS Ligaen 2023)","E. Safarov (20, Qabala, Premyer Liqa 22-23)",16.613948502755242
"A. Ali (23, Moss, OBOS Ligaen 2023)","K. Aliev (24, Sumqayıt, Premyer Liqa 22-23)",34.735104017876886
"A. Ali (23, Moss, OBOS Ligaen 2023)","M. Ljujić (29, Sabail, Premyer Liqa 22-23)",29.454284410406267
"A. Ali (23, Moss, OBOS Ligaen 2023)","N. Alasgarov (28, Sabah, Premyer Liqa 22-23)",40.22182995856776
"A. Ali (23, Moss, OBOS Ligaen 2023)","Kady (27, Qarabag, Premyer Liqa 22-23)",15.465135170964045
"A. Ali (23, Moss, OBOS Ligaen 2023)","Samu (27, Vizela, Primeira Liga 22-23)",6.925564752738367
"A. Ali (23, Moss, OBOS Ligaen 2023)","K. Fujimoto (23, Gil Vicente, Primeira Liga 22-23)",28.20943130562174
"A. Ali (23, Moss, OBOS Ligaen 2023)","A. Ruiz (29, Arouca, Primeira Liga 22-23)",-15.785280751638425
"A. Ali (23, Moss, OBOS Ligaen 2023)","Ivo Rodrigues (28, Famalicão, Primeira Liga 22-23)",17.756077507947328
"A. Ali (23, Moss, OBOS Ligaen 2023)","João Mendes (28, Chaves, Primeira Liga 22-23)",35.38327648244854
"A. Ali (23, Moss, OBOS Ligaen 2023)","Rafa Silva (30, Benfica, Primeira Liga 22-23)",67.66614060642225
"A. Ali (23, Moss, OBOS Ligaen 2023)","Brais Abelenda (27, Pontevedra, Primera División RFEF 22-23)",48.19686835673798
"A. Ali (23, Moss, OBOS Ligaen 2023)","Diego Esteban (23, SD Logroñés, Primera División RFEF 22-23)",23.093053950464764
"A. Ali (23, Moss, OBOS Ligaen 2023)","Iker Kortajarena (22, Real Sociedad B, Primera División RFEF 22-23)",13.176641510162412
"A. Ali (23, Moss, OBOS Ligaen 2023)","Agüero (27, Alcoyano, Primera División RFEF 22-23)",18.053431516496047
"A. Ali (23, Moss, OBOS Ligaen 2023)","Álex López (35, Racing Ferrol, Primera División RFEF 22-23)",17.26725721636042
"A. Ali (23, Moss, OBOS Ligaen 2023)","Álvaro Romero (26, Algeciras, Primera División RFEF 22-23)",38.18257647024906
"A. Ali (23, Moss, OBOS Ligaen 2023)","Sergio Moyita (30, Alcoyano, Primera División RFEF 22-23)",14.887749261120767
"A. Ali (23, Moss, OBOS Ligaen 2023)","Alberto Solís (25, Cultural Leonesa, Primera División RFEF 22-23)",20.614010327884408
"A. Ali (23, Moss, OBOS Ligaen 2023)","Yelko Pino (26, Pontevedra, Primera División RFEF 22-23)",-18.53402589254212
"A. Ali (23, Moss, OBOS Ligaen 2023)","Emilio Lozano (27, SD Logroñés, Primera División RFEF 22-23)",33.31607400457682
"A. Ali (23, Moss, OBOS Ligaen 2023)","Jesús Carrillo (24, Numancia, Primera División RFEF 22-23)",43.22907707350191
"A. Ali (23, Moss, OBOS Ligaen 2023)","Adri Cuevas (33, Ceuta, Primera División RFEF 22-23)",10.961173516375974
"A. Ali (23, Moss, OBOS Ligaen 2023)","Arnau Ortiz (21, Real Murcia, Primera División RFEF 22-23)",52.60164689301861
"A. Ali (23, Moss, OBOS Ligaen 2023)","Juan Carlos Menudo (31, UD Logroñés, Primera División RFEF 22-23)",29.91880739160476
"A. Ali (23, Moss, OBOS Ligaen 2023)","Raúl Blanco (21, Celta de Vigo B, Primera División RFEF 22-23)",33.49149264809327
"A. Ali (23, Moss, OBOS Ligaen 2023)","Jorge García (30, La Nucía, Primera División RFEF 22-23)",38.86642444640406
"A. Ali (23, Moss, OBOS Ligaen 2023)","Luis Chacón (23, Racing Ferrol, Primera División RFEF 22-23)",52.61299727115378
"A. Ali (23, Moss, OBOS Ligaen 2023)","Álex Arias (33, CD Calahorra, Primera División RFEF 22-23)",10.729503143806236
"A. Ali (23, Moss, OBOS Ligaen 2023)","Asier Osambela (18, Osasuna B, Primera División RFEF 22-23)",-8.950276889693761
"A. Ali (23, Moss, OBOS Ligaen 2023)","Ander Martín (22, Real Sociedad B, Primera División RFEF 22-23)",20.72312732274216
"A. Ali (23, Moss, OBOS Ligaen 2023)","Bicho (27, San Fernando, Primera División RFEF 22-23)",0.0122460192832838
"A. Ali (23, Moss, OBOS Ligaen 2023)","Dani Lorenzo (20, Mérida AD, Primera División RFEF 22-23)",42.75539774410508
"A. Ali (23, Moss, OBOS Ligaen 2023)","Borja Calvo (21, La Nucía, Primera División RFEF 22-23)",54.97707476209609
"A. Ali (23, Moss, OBOS Ligaen 2023)","Alain Ribeiro (25, SD Logroñés, Primera División RFEF 22-23)",38.00176292573251
"A. Ali (23, Moss, OBOS Ligaen 2023)","Borja Díaz (32, Unionistas de Salamanca, Primera División RFEF 22-23)",24.169963664940123
"A. Ali (23, Moss, OBOS Ligaen 2023)","Juan Serrano (23, Algeciras, Primera División RFEF 22-23)",-10.96953709001137
"A. Ali (23, Moss, OBOS Ligaen 2023)","Bashar Rasan (26, Qatar SC, Qatari Stars League 22-23)",24.86795449738546
"A. Ali (23, Moss, OBOS Ligaen 2023)","Nam Tae-Hee (31, Al Duhail, Qatari Stars League 22-23)",53.87648647640175
"A. Ali (23, Moss, OBOS Ligaen 2023)","F. Boulaya (30, Al Gharafa, Qatari Stars League 22-23)",23.46840196414864
"A. Ali (23, Moss, OBOS Ligaen 2023)","João Carlos Teixeira (30, Umm Salal, Qatari Stars League 22-23)",12.135904561343544
"A. Ali (23, Moss, OBOS Ligaen 2023)","F. Sassi (31, Al Duhail, Qatari Stars League 22-23)",10.80073790915517
"A. Ali (23, Moss, OBOS Ligaen 2023)","Akram Afif (26, Al Sadd, Qatari Stars League 22-23)",34.094493858032784
"A. Ali (23, Moss, OBOS Ligaen 2023)","Khaled Mohammed (22, Al Duhail, Qatari Stars League 22-23)",43.08731387354715
"A. Ali (23, Moss, OBOS Ligaen 2023)","Magid Mohamed (37, Al Shamal, Qatari Stars League 22-23)",35.17600814927423
"A. Ali (23, Moss, OBOS Ligaen 2023)","Rodrigo Barbosa Tabata (42, Al Sadd, Qatari Stars League 22-23)",50.58174380522108
"A. Ali (23, Moss, OBOS Ligaen 2023)","A. Roman (29, CSMS Iaşi, Romanian Liga II 22-23)",11.85657423505688
"A. Ali (23, Moss, OBOS Ligaen 2023)","G. Dodoi (24, Viitorul P. Targu Jiu, Romanian Liga II 22-23)",25.570664875617283
"A. Ali (23, Moss, OBOS Ligaen 2023)","S. Jebari (28, Csikszereda Miercurea Ciuc, Romanian Liga II 22-23)",31.7275171921882
"A. Ali (23, Moss, OBOS Ligaen 2023)","A. Mogoș (20, CSMS Iaşi, Romanian Liga II 22-23)",-6.941741424036821
"A. Ali (23, Moss, OBOS Ligaen 2023)","Dudu (24, AS FC Buzău, Romanian Liga II 22-23)",18.9811147268729
"A. Ali (23, Moss, OBOS Ligaen 2023)","K. Kertanov (27, Veles, Russian FNL 2 22-23)",32.942279086091595
"A. Ali (23, Moss, OBOS Ligaen 2023)","A. Lomakin (28, Yenisey, Russian FNL 2 22-23)",32.9945799483411
"A. Ali (23, Moss, OBOS Ligaen 2023)","N. Abdokov (22, Kuban Krasnodar, Russian FNL 2 22-23)",56.300027138754125
"A. Ali (23, Moss, OBOS Ligaen 2023)","M. Palienko (28, Akron Togliatti, Russian FNL 2 22-23)",38.57464279848218
"A. Ali (23, Moss, OBOS Ligaen 2023)","M. Laykin (20, Neftekhimik, Russian FNL 2 22-23)",7.62152168017389
"A. Ali (23, Moss, OBOS Ligaen 2023)","F. Dvoretskov (26, Neftekhimik, Russian FNL 2 22-23)",15.04628871877742
"A. Ali (23, Moss, OBOS Ligaen 2023)","N. Kirsanov (28, Volga Ulyanovsk, Russian FNL 2 22-23)",24.079728399815263
"A. Ali (23, Moss, OBOS Ligaen 2023)","I. Shkolik (22, Neftekhimik, Russian FNL 2 22-23)",36.51926690449916
"A. Ali (23, Moss, OBOS Ligaen 2023)","R. Akbashev (31, Fakel, Russian Premier League 22-23)",22.101374767692803
"A. Ali (23, Moss, OBOS Ligaen 2023)","An. Miranchuk (27, Lokomotiv Moskva, Russian Premier League 22-23)",32.46431564908483
"A. Ali (23, Moss, OBOS Ligaen 2023)","I. Oleynikov (24, Akhmat Grozny, Russian Premier League 22-23)",34.01816163519874
"A. Ali (23, Moss, OBOS Ligaen 2023)","M. Ignatov (23, Spartak Moskva, Russian Premier League 22-23)",44.08962784927034
"A. Ali (23, Moss, OBOS Ligaen 2023)","A. Troshechkin (27, Akhmat Grozny, Russian Premier League 22-23)",11.577625192141044
"A. Ali (23, Moss, OBOS Ligaen 2023)","V. Iljin (31, Akhmat Grozny, Russian Premier League 22-23)",21.018068622390174
"A. Ali (23, Moss, OBOS Ligaen 2023)","R. Vloet (28, Ural, Russian Premier League 22-23)",53.32961019036598
"A. Ali (23, Moss, OBOS Ligaen 2023)","Y. Reyna (29, Torpedo Moskva, Russian Premier League 22-23)",40.32145105554776
"A. Ali (23, Moss, OBOS Ligaen 2023)","Kaká (30, Al Akhdoud, Saudi First Division 22-23)",26.336173729420707
"A. Ali (23, Moss, OBOS Ligaen 2023)","C. Amissi (33, Al Qadisiyah, Saudi First Division 22-23)",-5.748636184811161
"A. Ali (23, Moss, OBOS Ligaen 2023)","Muralha (30, Al Riyadh, Saudi First Division 22-23)",3.505106176236888
"A. Ali (23, Moss, OBOS Ligaen 2023)","Isael (35, Al Jabalain, Saudi First Division 22-23)",-1.051987998298349
"A. Ali (23, Moss, OBOS Ligaen 2023)","Tiago Real (34, Hajer, Saudi First Division 22-23)",5.35620697791338
"A. Ali (23, Moss, OBOS Ligaen 2023)","M. Biteghé (26, Al Sahel, Saudi First Division 22-23)",-21.349885144725704
"A. Ali (23, Moss, OBOS Ligaen 2023)","Saeed Al Zahrani (30, Al Ain, Saudi First Division 22-23)",12.610349431361032
"A. Ali (23, Moss, OBOS Ligaen 2023)","R. Boudebouz (33, Al Ahli, Saudi First Division 22-23)",28.63695723033816
"A. Ali (23, Moss, OBOS Ligaen 2023)","W. Al-Salama (28, Al Qaisoma, Saudi First Division 22-23)",11.898887773701224
"A. Ali (23, Moss, OBOS Ligaen 2023)","M. Vásquez (30, Al Faisaly, Saudi First Division 22-23)",27.748895664444863
"A. Ali (23, Moss, OBOS Ligaen 2023)","Y. El Jebli (30, Ohod, Saudi First Division 22-23)",13.25829746813232
"A. Ali (23, Moss, OBOS Ligaen 2023)","M. Al Telihi (0, Al Kholood, Saudi First Division 22-23)",-3.8520649911037457
"A. Ali (23, Moss, OBOS Ligaen 2023)","Youssef Obama (28, Al Hazem, Saudi First Division 22-23)",56.51987097706783
"A. Ali (23, Moss, OBOS Ligaen 2023)","Abdul Al Dhuwayhi (23, Jeddah, Saudi First Division 22-23)",30.139740585363644
"A. Ali (23, Moss, OBOS Ligaen 2023)","Bander Al Qahtani (0, Al Shoalah, Saudi First Division 22-23)",47.72313095425165
"A. Ali (23, Moss, OBOS Ligaen 2023)","Abdulhadi Al-Harajin (28, Al Hazem, Saudi First Division 22-23)",50.37231506831904
"A. Ali (23, Moss, OBOS Ligaen 2023)","Wesam Waheab (31, Al Arabi, Saudi First Division 22-23)",51.535597659722434
"A. Ali (23, Moss, OBOS Ligaen 2023)","M. Hakizimana (28, Al Kholood, Saudi First Division 22-23)",-16.413831266512886
"A. Ali (23, Moss, OBOS Ligaen 2023)","K. Musona (32, Al Ta'ee, Saudi Professional League 22-23)",32.54412583243983
"A. Ali (23, Moss, OBOS Ligaen 2023)","Igor Coronado (30, Al Ittihad, Saudi Professional League 22-23)",13.160757998043897
"A. Ali (23, Moss, OBOS Ligaen 2023)","Anselmo (34, Al Wahda, Saudi Professional League 22-23)",14.712563912105155
"A. Ali (23, Moss, OBOS Ligaen 2023)","C. Guanca (30, Al Shabab, Saudi Professional League 22-23)",58.16038393826892
"A. Ali (23, Moss, OBOS Ligaen 2023)","F. Fajr (34, Al Wahda, Saudi Professional League 22-23)",3.819109295583333
"A. Ali (23, Moss, OBOS Ligaen 2023)","Romarinho (32, Al Ittihad, Saudi Professional League 22-23)",72.78756302381359
"A. Ali (23, Moss, OBOS Ligaen 2023)","S. Bguir (29, Abha, Saudi Professional League 22-23)",18.839172451861447
"A. Ali (23, Moss, OBOS Ligaen 2023)","S. Bendebka (30, Al Fateh, Saudi Professional League 22-23)",8.495859737949088
"A. Ali (23, Moss, OBOS Ligaen 2023)","Kaku (28, Al Taawon, Saudi Professional League 22-23)",17.646168591922546
"A. Ali (23, Moss, OBOS Ligaen 2023)","Ala''a Al Haji (27, Al Wahda, Saudi Professional League 22-23)",-10.055193470643538
"A. Ali (23, Moss, OBOS Ligaen 2023)","Sami Al Najei (26, Al Nassr, Saudi Professional League 22-23)",42.163363544013045
"A. Ali (23, Moss, OBOS Ligaen 2023)","Cristian Tello (31, Al Fateh, Saudi Professional League 22-23)",28.97083048321598
"A. Ali (23, Moss, OBOS Ligaen 2023)","H. Al Abdan (23, Al Khaleej, Saudi Professional League 22-23)",59.4185845295476
"A. Ali (23, Moss, OBOS Ligaen 2023)","Rakan Al Shamlan (24, Al Batin, Saudi Professional League 22-23)",8.547437686878991
"A. Ali (23, Moss, OBOS Ligaen 2023)","A. Roa (30, Al Batin, Saudi Professional League 22-23)",22.85770246426793
"A. Ali (23, Moss, OBOS Ligaen 2023)","R. Crawford (28, Greenock Morton, Scottish Championship 22-23)",13.671072526488851
"A. Ali (23, Moss, OBOS Ligaen 2023)","M. McKenna (32, Arbroath, Scottish Championship 22-23)",-2.7327674679499623
"A. Ali (23, Moss, OBOS Ligaen 2023)","G. Savoury (22, Queen's Park, Scottish Championship 22-23)",52.76192735840943
"A. Ali (23, Moss, OBOS Ligaen 2023)","K. Turner (25, Partick Thistle, Scottish Championship 22-23)",14.085562767483994
"A. Ali (23, Moss, OBOS Ligaen 2023)","S. Stanton (29, Raith Rovers, Scottish Championship 22-23)",41.94845276804135
"A. Ali (23, Moss, OBOS Ligaen 2023)","N. Shaw (22, Inverness CT, Scottish Championship 22-23)",43.6740006402524
"A. Ali (23, Moss, OBOS Ligaen 2023)","A. Doran (32, Inverness CT, Scottish Championship 22-23)",51.21145529569151
"A. Ali (23, Moss, OBOS Ligaen 2023)","L. Vaughan (27, Raith Rovers, Scottish Championship 22-23)",31.787021026400677
"A. Ali (23, Moss, OBOS Ligaen 2023)","C. McKinnon (20, Partick Thistle, Scottish Championship 22-23)",30.174841443635557
"A. Ali (23, Moss, OBOS Ligaen 2023)","C. Smith (21, Hamilton Academical, Scottish Championship 22-23)",32.96977411494208
"A. Ali (23, Moss, OBOS Ligaen 2023)","C. Mochrie (20, Dunfermline Athletic, Scottish League One 22-23)",49.6449110232899
"A. Ali (23, Moss, OBOS Ligaen 2023)","J. Cardle (36, Kelty Hearts, Scottish League One 22-23)",25.61573739425383
"A. Ali (23, Moss, OBOS Ligaen 2023)","C. Murray (26, Queen of the South, Scottish League One 22-23)",24.587654809093166
"A. Ali (23, Moss, OBOS Ligaen 2023)","L. Donnelly (27, Alloa Athletic, Scottish League One 22-23)",45.77650527464362
"A. Ali (23, Moss, OBOS Ligaen 2023)","L. Connelly (23, Queen of the South, Scottish League One 22-23)",18.82734567837988
"A. Ali (23, Moss, OBOS Ligaen 2023)","J. Hodge (22, Stenhousemuir, Scottish League Two 22-23)",24.093586401010565
"A. Ali (23, Moss, OBOS Ligaen 2023)","B. Spittal (27, Motherwell, Scottish Premiership 22-23)",6.258877396565792
"A. Ali (23, Moss, OBOS Ligaen 2023)","J. Campbell (23, Hibernian, Scottish Premiership 22-23)",16.688145802613352
"A. Ali (23, Moss, OBOS Ligaen 2023)","S. Pittman (30, Livingston, Scottish Premiership 22-23)",11.582547737499343
"A. Ali (23, Moss, OBOS Ligaen 2023)","Y. Dhanda (24, Ross County, Scottish Premiership 22-23)",8.186267274441143
"A. Ali (23, Moss, OBOS Ligaen 2023)","S. Kelly (23, Livingston, Scottish Premiership 22-23)",13.214139694049914
"A. Ali (23, Moss, OBOS Ligaen 2023)","M. Tillman (20, Rangers, Scottish Premiership 22-23)",37.3248214830784
"A. Ali (23, Moss, OBOS Ligaen 2023)","A. Shinnie (33, Livingston, Scottish Premiership 22-23)",-17.757270638306892
"A. Ali (23, Moss, OBOS Ligaen 2023)","R. Callachan (29, Ross County, Scottish Premiership 22-23)",-26.702054689394583
"A. Ali (23, Moss, OBOS Ligaen 2023)","J. Grant (28, Hearts, Scottish Premiership 22-23)",20.07563313796209
"A. Ali (23, Moss, OBOS Ligaen 2023)","E. Henderson (23, Hibernian, Scottish Premiership 22-23)",13.574304606698364
"A. Ali (23, Moss, OBOS Ligaen 2023)","S. Arfield (34, Rangers, Scottish Premiership 22-23)",43.72593014518647
"A. Ali (23, Moss, OBOS Ligaen 2023)","V. Besuijen (21, Aberdeen, Scottish Premiership 22-23)",59.726980619830464
"A. Ali (23, Moss, OBOS Ligaen 2023)","L. Gojković (23, Javor Ivanjica, Serbian SuperLiga 22-23)",36.87117260214836
"A. Ali (23, Moss, OBOS Ligaen 2023)","B. Natcho (35, Partizan, Serbian SuperLiga 22-23)",13.57511183886902
"A. Ali (23, Moss, OBOS Ligaen 2023)","Đ. Ivanović (27, Čukarički, Serbian SuperLiga 22-23)",40.33208138911272
"A. Ali (23, Moss, OBOS Ligaen 2023)","V. Simić (28, Vojvodina, Serbian SuperLiga 22-23)",70.0318383915604
"A. Ali (23, Moss, OBOS Ligaen 2023)","M. Mijić (33, Novi Pazar, Serbian SuperLiga 22-23)",28.933057210252784
"A. Ali (23, Moss, OBOS Ligaen 2023)","P. Mićin (24, Radnički Niš, Serbian SuperLiga 22-23)",34.926474948407574
"A. Ali (23, Moss, OBOS Ligaen 2023)","M. Nešković (23, Voždovac, Serbian SuperLiga 22-23)",47.964229931864594
"A. Ali (23, Moss, OBOS Ligaen 2023)","V. Radivojević (37, Mladost Lučani, Serbian SuperLiga 22-23)",9.58194156033539
"A. Ali (23, Moss, OBOS Ligaen 2023)","N. Subotić (31, Radnik Surdulica, Serbian SuperLiga 22-23)",11.973494293281403
"A. Ali (23, Moss, OBOS Ligaen 2023)","U. Nikolić (29, Vojvodina, Serbian SuperLiga 22-23)",29.16284604885517
"A. Ali (23, Moss, OBOS Ligaen 2023)","S. Tomović (21, Čukarički, Serbian SuperLiga 22-23)",45.6855459430294
"A. Ali (23, Moss, OBOS Ligaen 2023)","P. Đuričković (31, Novi Pazar, Serbian SuperLiga 22-23)",-30.923415284150813
"A. Ali (23, Moss, OBOS Ligaen 2023)","Đ. Gordić (18, Mladost Lučani, Serbian SuperLiga 22-23)",43.379505290802726
"A. Ali (23, Moss, OBOS Ligaen 2023)","S. Dimitrov (30, Mladost Novi Sad, Serbian SuperLiga 22-23)",3.580456859796006
"A. Ali (23, Moss, OBOS Ligaen 2023)","S. Dimić (30, Radnički Niš, Serbian SuperLiga 22-23)",69.41151608139836
"A. Ali (23, Moss, OBOS Ligaen 2023)","S. Babić (32, Radnik Surdulica, Serbian SuperLiga 22-23)",6.8669677247429926
"A. Ali (23, Moss, OBOS Ligaen 2023)","S. Baždar (19, Partizan, Serbian SuperLiga 22-23)",36.82477754994887
"A. Ali (23, Moss, OBOS Ligaen 2023)","N. Vlašić (25, Torino, Serie A 22-23)",75.43274355137603
"A. Ali (23, Moss, OBOS Ligaen 2023)","L. Pellegrini (26, Roma, Serie A 22-23)",25.96149733309643
"A. Ali (23, Moss, OBOS Ligaen 2023)","G. Caprari (29, Monza, Serie A 22-23)",58.85358133568267
"A. Ali (23, Moss, OBOS Ligaen 2023)","L. Ferguson (23, Bologna, Serie A 22-23)",25.648580127911668
"A. Ali (23, Moss, OBOS Ligaen 2023)","Al. Miranchuk (27, Torino, Serie A 22-23)",61.203627168033805
"A. Ali (23, Moss, OBOS Ligaen 2023)","Brahim Diaz (23, Milan, Serie A 22-23)",53.99160970260194
"A. Ali (23, Moss, OBOS Ligaen 2023)","A. Barák (28, Fiorentina, Serie A 22-23)",58.67054135294636
"A. Ali (23, Moss, OBOS Ligaen 2023)","N. Bajrami (24, Sassuolo, Serie A 22-23)",41.81873368828855
"A. Ali (23, Moss, OBOS Ligaen 2023)","T. Baldanzi (20, Empoli, Serie A 22-23)",59.292778615540975
"A. Ali (23, Moss, OBOS Ligaen 2023)","M. Pašalić (28, Atalanta, Serie A 22-23)",65.80517441223576
"A. Ali (23, Moss, OBOS Ligaen 2023)","N. Radonjić (27, Torino, Serie A 22-23)",45.46123539080803
"A. Ali (23, Moss, OBOS Ligaen 2023)","C. De Ketelaere (22, Milan, Serie A 22-23)",51.313533336912656
