Player,Similarity
"B. Stillhart (29, St. Gallen, Swiss Super League 22-23)",78.13390678065893
"Álex Suárez (30, Las Palmas, La Liga 2 22-23)",76.57109123877609
"D. Hall (21, ADO Den Haag, Eerste Divisie 22-23)",76.05830036279956
"J. Jacobs (23, Almere City, Eerste Divisie 22-23)",75.56965526724026
"Y. Pasich (29, Dnipro-1, Ukrainian Premier Liha 22-23)",75.4473600112841
"G. Tsivelekidis (24, Nõmme Kalju, Estonian Meistriliiga 2023)",74.89621790097047
"N. Friberg (27, Haka, Veikkausliiga 2023)",73.61194432058139
"T. Mabua (28, Richards Bay, South Africa PSL 22-23)",73.40050716727976
"N. Stijepović (29, Sutjeska, Montenegro First League 22-23)",72.7335561514919
"V. Larsson (23, Värnamo, Allsvenskan 2023)",72.45117214038082
"F. Espinoza (23, Magallanes, Chilean Primera División 2023)",72.07186750203142
"G. Šlein (27, Nõmme Kalju, Estonian Meistriliiga 2023)",72.0220827262921
"Y. Hurtado (26, Águilas Doradas, Colombian Primera Division 22-23)",71.28190233403629
"P. Poór (29, MTK, NB II 22-23)",71.10454049948285
"A. Dionkou (21, Barcelona B, Primera División RFEF 22-23)",70.94586661884759
"E. Boakye (23, Aris, Cyprus 1. Division 22-23)",70.74125071503617
"V. Regini (32, Rimini, Serie C 22-23)",70.57582082555362
"A. Sha'aban (30, Hapoel Acre, Liga Leumit 22-23)",70.52902523042583
"I. Vujica (26, Macarthur, A-League Men 22-23)",70.42421651208579
"K. Zammit (27, Birkirkara, Malta Premier League 22-23)",70.2518141014035
"V. Jemelka (27, Viktoria Plzeň, Czech Fortuna Liga 22-23)",70.11719739613156
"M. Persson (22, Brage, Superettan 2023)",69.60755613773763
"M. Dal Hende (32, SønderjyskE, Danish 1. Division 22-23)",69.48215859818441
"T. Thomas (27, Charlton Athletic, League One 22-23)",69.43275824804654
"Eric Monjonell (21, Lommel SK, Belgian First Division B 22-23)",69.32104590958258
