Player,Similarity
"E. Wahi (20, Montpellier, Ligue 1 22-23)",91.24777025203706
"B. Dia (26, Salernitana, Serie A 22-23)",88.73409546882446
"L. Foster (22, Westerlo, Belgian Pro League 22-23)",86.33043462628224
"M. Megginson (30, Cove Rangers, Scottish Championship 22-23)",85.74567566449326
"A. Balboa (29, Defensor Sporting, Uruguay Primera División 2023)",85.02033189260078
"J. Okoli (25, Al Mokawloon, Egyptian Premier League 22-23)",84.71686204692377
"V. Striković (20, Sutjeska, Montenegro First League 22-23)",84.39282343111782
"A. Buzaglo (30, Sektzia Nes Tziona, Ligat Ha'al 22-23)",84.37204679702198
"D. Origi (28, Milan, Serie A 22-23)",84.35613908058535
"Dioni (33, Atlético Baleares, Primera División RFEF 22-23)",84.167286019462
"S. Merkaj (25, Virtus Entella, Serie C 22-23)",84.09258894424399
"D. De Belder (31, Deinze, Belgian First Division B 22-23)",84.07889081878248
"J. Montenegro (22, Puntarenas, Costa Rica Primera División 22-23)",84.06913232053816
"T. Fawwazi (21, Bhayangkara F.C., BRI Liga 1 22-23)",83.95086106510125
"L. Vardanyan (19, Noah, Armenian Premier League 22-23)",82.90243940012589
"F. Holender (28, Vasas, NB I 22-23)",82.7689481124383
"B. Thomas-Asante (24, West Bromwich Albion, Championship 22-23)",82.61548023862957
"E. Manu (29, Botev Plovdiv, Bulgarian First League 22-23)",82.46188720917596
"R. Hepburn-Murphy (24, Swindon Town, League Two 22-23)",82.42063577025
"G. Fernández (28, Juárez, Liga MX 22-23)",82.13269514138612
"N. Buso (23, Lecco, Serie C 22-23)",82.0971096117106
"E. Shomurodov (27, Spezia, Serie A 22-23)",82.07603183276142
"Y. Klymchuk (26, Rukh Lviv, Ukrainian Premier Liha 22-23)",82.00992629029169
"D. Martinović (26, Waldhof Mannheim, 3. Liga 22-23)",81.71038978214055
"B. Messaoudi (25, Kortrijk, Belgian Pro League 22-23)",81.69597194109804
