Player,Similarity
"C. Attard (28, Birkirkara, Malta Premier League 22-23)",76.29262195474963
"Abdulelah Al Bukhari (28, Al Wahda, Saudi Professional League 22-23)",75.54652518009438
"G. Vas (19, Paksi SE, NB I 22-23)",75.53169718475233
"M. Jardel (22, Persita, BRI Liga 1 22-23)",74.73026399085268
"E. Fuentes (32, Santa Lucía, Guatemala Liga Nacional 22-23)",74.70680883081285
"Diogo Coelho (30, Sūduva, Lithuanian A Lyga 2023)",71.49456864786818
"B. Uzun (32, Sakaryaspor, Turkish 1. Lig 22-23)",71.37730208451444
"N. Andrič (31, Borac Banja Luka, Bosnian Premier League 22-23)",70.64206978518047
"A. Singh (29, Real Kashmir, I-League 22-23)",70.29063209628093
"O. Bhasera (37, SuperSport United, South Africa PSL 22-23)",68.8258151981891
"L. Martin (27, Kelty Hearts, Scottish League One 22-23)",68.30909475885095
"B. Blasi (27, Central Córdoba SdE, Argentinian Primera División 2023)",68.27487207514669
"D. Szivacski (26, Vasas, NB I 22-23)",67.82607440359108
"A. Villalba (24, Resistencia, Paraguay Division Profesional 2023)",67.77221515171293
"L. De León (27, Cobán Imperial, Guatemala Liga Nacional 22-23)",67.33203229265504
"K. Villalobos Chavarría (27, Puntarenas, Costa Rica Primera División 22-23)",67.05524968025227
"M. Giron (28, Crotone, Serie C 22-23)",66.07913599959794
"D. Gorgenyi (32, Ajka, NB II 22-23)",65.72079702146686
"M. Dobrescu (30, UTA Arad, SuperLiga României 22-23)",65.45866771192782
"A. Cini (31, Sirens, Malta Premier League 22-23)",65.21681011384362
"A. Meli (22, Godoy Cruz, Argentinian Primera División 2023)",65.04127942901468
"J. Guerra (22, Santa Lucía, Guatemala Liga Nacional 22-23)",64.82608806652061
"L. Rjili (30, Hammam-Sousse, Tunisian Ligue 1 22-23)",64.75938528870849
"Saud Fallath (29, Al Qadisiyah, Saudi First Division 22-23)",64.65517852026188
"J. Álvarez (22, Unión Comercio, Peruvian Liga 1 2023)",64.54511950730557
