Player,Similarity
"Felipe Alfonso (30, Mérida AD, Primera División RFEF 22-23)",86.69196337798328
"F. Rizzi (25, Argeș, SuperLiga României 22-23)",83.25214349322408
"Yeon-Wang Kim (29, Nowon United, K4 League 2023)",80.86498333298479
"David Morillas (36, Alcorcón, Primera División RFEF 22-23)",80.82717959357947
"A. Georgiev (25, Arda, Bulgarian First League 22-23)",80.2676917563323
"R. Yuzepchuk (25, Torpedo Moskva, Russian Premier League 22-23)",79.83506391137831
"M. Schjonning-Larsen (22, Levadia, Estonian Meistriliiga 2023)",79.77842990034664
"R. McKeown (30, Crusaders, Northern Ireland Premiership 22-23)",79.1335627377219
"D. Nagiyev (27, Inhulets, Ukrainian Premier Liha 22-23)",79.09708948104817
"G. Nedelea (22, Oţelul, Romanian Liga II 22-23)",78.41743638754654
"M. Devetak (24, Viterbese, Serie C 22-23)",78.28684890802224
"M. Vukčević (29, UTA Arad, SuperLiga României 22-23)",78.1880282271742
"D. Magda (25, Zemplín Michalovce, Slovak Super Liga 22-23)",77.8113700773315
"K. Pallesen (33, AaB, Superliga 22-23)",77.52590532964521
"H. Beganović (21, Sloboda Tuzla, Bosnian Premier League 22-23)",77.42064104068035
"G. Nesta (23, Viterbese, Serie C 22-23)",77.10373415449506
"U. Akdemir (34, Gençlerbirliği, Turkish 1. Lig 22-23)",76.91295398396075
"C. Zamfirescu (24, Ripensia Timişoara, Romanian Liga II 22-23)",76.83939740486977
"R. Finnie (28, Cowdenbeath, Scottish League Two 22-23)",76.78119530099984
"D. Diekmeier (33, Sandhausen, 2. Bundesliga 22-23)",76.04278511274714
"G. Tanner (23, Bristol City, Championship 22-23)",75.94536297598108
"D. Chouchoumis (28, Panetolikos FC, Greek Super League 22-23)",75.73662267014313
"E. Tchato (20, Montpellier, Ligue 1 22-23)",75.55129779839226
"D. Prishchepa (21, Veles, Russian FNL 2 22-23)",75.50680303737684
"A. Dagarchaoui (0, Al Ain, Saudi First Division 22-23)",75.45423193369632
