Player,Similarity
"I. Bondarenco (27, Milsami, Moldovan Super Liga 22-23)",91.15155340449476
"A. Savinov (21, Shinnik, Russian FNL 2 22-23)",89.25198163647818
"L. Ibertsberger (19, Liefering, Austrian 2. Liga 22-23)",87.40985194693059
"D. Carson (27, Inverness CT, Scottish Championship 22-23)",86.56887364656257
"A. Steeves (28, Montrose, Scottish League One 22-23)",85.33718573600252
"G. Gallagher (32, Stranraer, Scottish League Two 22-23)",84.08942379406089
"G. Clichy (37, Servette, Swiss Super League 22-23)",83.96657790549575
"J. Houston (23, Ayr United, Scottish Championship 22-23)",83.12027918871223
"I. Tsyupa (29, Okzhetpes, Kazakh Premier League 2023)",83.02243822957165
"J. Brannefalk (25, Sligo Rovers, League of Ireland PL 2023)",82.72323284682255
"M. Murati (29, Shkendija, North Macedonia First League 22-23)",82.05071731132367
"J. Ekani (30, Mosta, Malta Premier League 22-23)",81.79443723729125
"N. Miroshi (20, Zulte-Waregem, Belgian Pro League 22-23)",81.62002918979205
"M. Dombrowka (31, Meppen, 3. Liga 22-23)",81.274759892143
"B. Schmitz (28, Köln, Bundesliga 22-23)",81.21464536959479
"B. Burns (34, Crusaders, Northern Ireland Premiership 22-23)",80.89376607686997
"A. Raimo (24, Siena, Serie C 22-23)",80.67734748741839
"L. James-Wildin (25, Stevenage, League Two 22-23)",80.57942329755255
"D. Love (28, Morecambe, League One 22-23)",80.39900343463981
"M. Peleg (29, Hapoel Petah Tikva, Liga Leumit 22-23)",80.38830382341384
"L. Obexer (25, Stade Lausanne-Ouchy, Swiss Challenge League 22-23)",80.28538736909319
"P. Steinhart (30, 1860 München, 3. Liga 22-23)",80.22144395562685
"L. Vignali (27, Como, Serie B 22-23)",79.94446748120049
"B. Conus (25, Aarau, Swiss Challenge League 22-23)",79.78032410950823
"A. Dorobantu (18, Unirea Slobozia, Romanian Liga II 22-23)",79.730210412896
