Player,Similarity
"R. Ziko (25, Laçi, Albanian Premier League 22-23)",80.96127119430389
"B. Uzun (32, Sakaryaspor, Turkish 1. Lig 22-23)",76.58011392244859
"S. Fetai (34, Renova, North Macedonia First League 22-23)",75.6216558987585
"L. Fauriel (20, Akritas, Cyprus 1. Division 22-23)",75.34885528513769
"Hazza Salem (33, Al Wasl, UAE Pro League 22-23)",73.6321328610001
"H. Haghverdi (30, Neftchi, Premyer Liqa 22-23)",73.35063997919897
"D. Palacios (23, Los Angeles FC, MLS 2023)",72.68322122777516
"Mohamed Adel (27, Ceramica, Egyptian Premier League 22-23)",72.6025792073968
"C. Mavrias (29, Apollon, Cyprus 1. Division 22-23)",72.34503308186635
"H. Bhatt (26, Rajasthan United, I-League 22-23)",72.0223375588601
"A. Salahly (29, Neftchi, Premyer Liqa 22-23)",70.83895725727885
"K. Brauzman (19, Abdish-Ata, Kyrgyz Premier League 2023)",70.51425952838115
"P. Buxhelaj (20, Partizani Tirana, Albanian Premier League 22-23)",70.17363815184041
"N. Andrič (31, Borac Banja Luka, Bosnian Premier League 22-23)",69.91716021093319
"F. Përgjoni (25, Tirana, Albanian Premier League 22-23)",69.9027880227694
"Marc Cucurella (24, Chelsea, Premier League 22-23)",69.23297314333097
"A. Yokokawa (21, Albirex Niigata S, Singapore Premier League 2023)",69.10968840927868
"Joel Ferreira (31, Leixões, Portugal Segunda Liga 22-23)",69.08114383346005
"M. Munyai (31, TS Galaxy FC, South Africa PSL 22-23)",68.82533699690643
"C. Jiménez (28, Antigua GFC, Guatemala Liga Nacional 22-23)",68.8029677146552
"M. Totka (22, Tatran Liptovský Mikuláš, Slovak Super Liga 22-23)",68.7010451716071
"Tiago Mesquita (32, Academico Viseu, Portugal Segunda Liga 22-23)",68.5362608116766
"Gexan Elosegi (23, SD Logroñés, Primera División RFEF 22-23)",68.53567421942844
"A. Ballah (22, Persebaya Surabaya, BRI Liga 1 22-23)",68.52415127200065
"Salem Obaid (29, Al Jazira, UAE Pro League 22-23)",68.49286521265942
