Player 1,Player 2,Similarity
"A. Casar (22, Hallescher FC, 3. Liga 22-23)","D. Gnaase (26, Saarbrücken, 3. Liga 22-23)",47.09494851229825
"A. Casar (22, Hallescher FC, 3. Liga 22-23)","N. Tarnat (25, Rot-Weiss Essen, 3. Liga 22-23)",14.383692033152723
"A. Casar (22, Hallescher FC, 3. Liga 22-23)","M. Bakalorz (33, MSV Duisburg, 3. Liga 22-23)",37.07587931977503
"A. Casar (22, Hallescher FC, 3. Liga 22-23)","S. Schreck (24, Erzgebirge Aue, 3. Liga 22-23)",12.385750357318209
"A. Casar (22, Hallescher FC, 3. Liga 22-23)","V. Sapina (27, Verl, 3. Liga 22-23)",78.97169620458895
"A. Casar (22, Hallescher FC, 3. Liga 22-23)","Y. Engelhardt (22, Freiburg II, 3. Liga 22-23)",69.23245464998953
"A. Casar (22, Hallescher FC, 3. Liga 22-23)","C. Jander (20, MSV Duisburg, 3. Liga 22-23)",32.97093143132768
"A. Casar (22, Hallescher FC, 3. Liga 22-23)","B. Rother (26, Rot-Weiss Essen, 3. Liga 22-23)",38.83360513191481
"A. Casar (22, Hallescher FC, 3. Liga 22-23)","O. Käuper (26, Meppen, 3. Liga 22-23)",50.90951213822634
"A. Casar (22, Hallescher FC, 3. Liga 22-23)","T. Latteier (23, Bayreuth, 3. Liga 22-23)",31.99179920443929
"A. Casar (22, Hallescher FC, 3. Liga 22-23)","T. Rieder (29, 1860 München, 3. Liga 22-23)",11.013534524865957
"A. Casar (22, Hallescher FC, 3. Liga 22-23)","A. Groiß (24, Bayreuth, 3. Liga 22-23)",31.111408119366097
"A. Casar (22, Hallescher FC, 3. Liga 22-23)","M. Wörl (19, 1860 München, 3. Liga 22-23)",26.651642376242314
"A. Casar (22, Hallescher FC, 3. Liga 22-23)","U. Taffertshofer (31, Erzgebirge Aue, 3. Liga 22-23)",64.31864376364585
"A. Casar (22, Hallescher FC, 3. Liga 22-23)","N. Stierlin (23, MSV Duisburg, 3. Liga 22-23)",43.24370570323307
"A. Casar (22, Hallescher FC, 3. Liga 22-23)","A. Malachowski (25, Waldhof Mannheim, 3. Liga 22-23)",16.874907488984363
"A. Casar (22, Hallescher FC, 3. Liga 22-23)","Q. Moll (32, 1860 München, 3. Liga 22-23)",41.91675062267023
"A. Casar (22, Hallescher FC, 3. Liga 22-23)","C. Fandrich (32, Rot-Weiss Essen, 3. Liga 22-23)",20.75568993530852
"A. Casar (22, Hallescher FC, 3. Liga 22-23)","S. Russo (22, Waldhof Mannheim, 3. Liga 22-23)",70.80879269127195
"A. Casar (22, Hallescher FC, 3. Liga 22-23)","N. Gorzel (24, Erzgebirge Aue, 3. Liga 22-23)",32.60024785482732
"A. Casar (22, Hallescher FC, 3. Liga 22-23)","L. Brattan (33, Sydney, A-League Men 22-23)",65.47689156997757
"A. Casar (22, Hallescher FC, 3. Liga 22-23)","A. O'Neill (24, Melbourne City, A-League Men 22-23)",47.95911152532438
"A. Casar (22, Hallescher FC, 3. Liga 22-23)","Isaías Sánchez (36, Adelaide United, A-League Men 22-23)",67.69320795230553
"A. Casar (22, Hallescher FC, 3. Liga 22-23)","L. D'Arrigo (21, Adelaide United, A-League Men 22-23)",21.98577193626805
"A. Casar (22, Hallescher FC, 3. Liga 22-23)","D. De Silva (26, Macarthur, A-League Men 22-23)",-10.898690250833557
"A. Casar (22, Hallescher FC, 3. Liga 22-23)","J. Hollman (21, Macarthur, A-League Men 22-23)",52.813118203295886
"A. Casar (22, Hallescher FC, 3. Liga 22-23)","L. Bodnar (23, Perth Glory, A-League Men 22-23)",35.33095576750439
"A. Casar (22, Hallescher FC, 3. Liga 22-23)","Z. Duncan (22, Perth Glory, A-League Men 22-23)",36.65811515330018
"A. Casar (22, Hallescher FC, 3. Liga 22-23)","A. Aleksi (30, Tirana, Albanian Premier League 22-23)",75.70902178952257
"A. Casar (22, Hallescher FC, 3. Liga 22-23)","A. Karakaçi (30, Kastrioti Krujë, Albanian Premier League 22-23)",52.12509284587043
"A. Casar (22, Hallescher FC, 3. Liga 22-23)","I. Manellari (25, Laçi, Albanian Premier League 22-23)",43.42740036625104
"A. Casar (22, Hallescher FC, 3. Liga 22-23)","C. Massanga (23, Partizani Tirana, Albanian Premier League 22-23)",67.18776978164077
"A. Casar (22, Hallescher FC, 3. Liga 22-23)","X. Maçolli (21, Bylis Ballsh, Albanian Premier League 22-23)",69.8548779964906
"A. Casar (22, Hallescher FC, 3. Liga 22-23)","O. Onanuga (25, Kastrioti Krujë, Albanian Premier League 22-23)",59.58036694581386
"A. Casar (22, Hallescher FC, 3. Liga 22-23)","R. Alivoda (20, Vllaznia Shkodër, Albanian Premier League 22-23)",-4.0766555663590704
"A. Casar (22, Hallescher FC, 3. Liga 22-23)","L. Boshnjaku (27, Vllaznia Shkodër, Albanian Premier League 22-23)",32.41961709809304
"A. Casar (22, Hallescher FC, 3. Liga 22-23)","E. Karabeci (34, Teuta Durrës, Albanian Premier League 22-23)",7.96627433378003
"A. Casar (22, Hallescher FC, 3. Liga 22-23)","A. El Id (23, Kukësi, Albanian Premier League 22-23)",70.84929558860983
"A. Casar (22, Hallescher FC, 3. Liga 22-23)","D. Mëllugja (28, Egnatia Rrogozhinë, Albanian Premier League 22-23)",52.59131712496652
"A. Casar (22, Hallescher FC, 3. Liga 22-23)","A. Qoshku (22, Bylis Ballsh, Albanian Premier League 22-23)",53.25253111612055
"A. Casar (22, Hallescher FC, 3. Liga 22-23)","A. Borysiuk (31, Laçi, Albanian Premier League 22-23)",57.1285500843905
"A. Casar (22, Hallescher FC, 3. Liga 22-23)","T. Tekie (26, Hammarby, Allsvenskan 2023)",6.885248881178649
"A. Casar (22, Hallescher FC, 3. Liga 22-23)","J. Gustavsson (28, Mjällby, Allsvenskan 2023)",32.67787810040374
"A. Casar (22, Hallescher FC, 3. Liga 22-23)","A. Rømer (29, Elfsborg, Allsvenskan 2023)",46.52069328557796
"A. Casar (22, Hallescher FC, 3. Liga 22-23)","D. Stensson (26, Sirius, Allsvenskan 2023)",8.93722567094073
"A. Casar (22, Hallescher FC, 3. Liga 22-23)","H. Larsson (18, Malmö FF, Allsvenskan 2023)",48.46062137562453
"A. Casar (22, Hallescher FC, 3. Liga 22-23)","S. Peña (27, Malmö FF, Allsvenskan 2023)",45.66696561395061
"A. Casar (22, Hallescher FC, 3. Liga 22-23)","Sam. Gustafson (28, Häcken, Allsvenskan 2023)",24.42581585894333
"A. Casar (22, Hallescher FC, 3. Liga 22-23)","A. Traustason (30, IFK Norrköping, Allsvenskan 2023)",13.957372710109455
"A. Casar (22, Hallescher FC, 3. Liga 22-23)","L. Sadiku (31, Hammarby, Allsvenskan 2023)",27.639877116109275
"A. Casar (22, Hallescher FC, 3. Liga 22-23)","J. Roche (22, Sirius, Allsvenskan 2023)",41.15178786049849
"A. Casar (22, Hallescher FC, 3. Liga 22-23)","A. Carlén (22, IFK Göteborg, Allsvenskan 2023)",49.31400222513296
"A. Casar (22, Hallescher FC, 3. Liga 22-23)","Joao Teixeira (26, Ordino, Andorra Primera Divisió 22-23)",54.91781230658924
"A. Casar (22, Hallescher FC, 3. Liga 22-23)","Sergio Mendoza (29, UE Santa Coloma, Andorra Primera Divisió 22-23)",68.28415711384463
"A. Casar (22, Hallescher FC, 3. Liga 22-23)","Daniel Toribio (34, FC Santa Coloma, Andorra Primera Divisió 22-23)",40.27863838056127
"A. Casar (22, Hallescher FC, 3. Liga 22-23)","Víctor Alonso (28, Atlètic Club d'Escaldes, Andorra Primera Divisió 22-23)",59.61690518662367
"A. Casar (22, Hallescher FC, 3. Liga 22-23)","H. Ryahi (29, Atlètic Club d'Escaldes, Andorra Primera Divisió 22-23)",32.97000009310342
"A. Casar (22, Hallescher FC, 3. Liga 22-23)","Youssef El Ghzaoui (22, UE Santa Coloma, Andorra Primera Divisió 22-23)",32.411560224667554
"A. Casar (22, Hallescher FC, 3. Liga 22-23)","K. Tassin (25, Sant Julià, Andorra Primera Divisió 22-23)",8.9289565680256
"A. Casar (22, Hallescher FC, 3. Liga 22-23)","J. Rodríguez (27, Estudiantes, Argentinian Primera División 2023)",74.56552311236874
"A. Casar (22, Hallescher FC, 3. Liga 22-23)","J. Sforza (21, Newell's Old Boys, Argentinian Primera División 2023)",76.21890792740666
"A. Casar (22, Hallescher FC, 3. Liga 22-23)","G. Abrego (23, Godoy Cruz, Argentinian Primera División 2023)",21.54535981413404
"A. Casar (22, Hallescher FC, 3. Liga 22-23)","T. Belmonte (25, Lanús, Argentinian Primera División 2023)",51.90800249060966
"A. Casar (22, Hallescher FC, 3. Liga 22-23)","F. Peña Biafore (22, Arsenal de Srandí, Argentinian Primera División 2023)",42.47219660110434
"A. Casar (22, Hallescher FC, 3. Liga 22-23)","K. Gutiérrez (25, Defensa y Justicia, Argentinian Primera División 2023)",52.32895442047856
"A. Casar (22, Hallescher FC, 3. Liga 22-23)","F. Moyano (25, Argentinos Juniors, Argentinian Primera División 2023)",39.63929966519321
"A. Casar (22, Hallescher FC, 3. Liga 22-23)","E. Pérez (37, River Plate, Argentinian Primera División 2023)",73.58306521712822
"A. Casar (22, Hallescher FC, 3. Liga 22-23)","G. Acosta (34, Atlético Tucumán, Argentinian Primera División 2023)",67.95216369792256
"A. Casar (22, Hallescher FC, 3. Liga 22-23)","A. Varela (21, Boca Juniors, Argentinian Primera División 2023)",68.07156510547111
"A. Casar (22, Hallescher FC, 3. Liga 22-23)","J. López (23, Defensa y Justicia, Argentinian Primera División 2023)",21.89592384436789
"A. Casar (22, Hallescher FC, 3. Liga 22-23)","J. Florentín (26, Vélez Sarsfield, Argentinian Primera División 2023)",60.3087327731184
"A. Casar (22, Hallescher FC, 3. Liga 22-23)","I. Miramón (19, Gimnasia La Plata, Argentinian Primera División 2023)",66.37930694478142
"A. Casar (22, Hallescher FC, 3. Liga 22-23)","A. Moreno (24, Racing Club, Argentinian Primera División 2023)",77.79916555290804
"A. Casar (22, Hallescher FC, 3. Liga 22-23)","R. Aliendro (32, River Plate, Argentinian Primera División 2023)",69.69549405401536
"A. Casar (22, Hallescher FC, 3. Liga 22-23)","B. Leyes (21, Godoy Cruz, Argentinian Primera División 2023)",67.25699040670237
"A. Casar (22, Hallescher FC, 3. Liga 22-23)","A. Bolívar (27, Gimnasia La Plata, Argentinian Primera División 2023)",42.14405684178897
"A. Casar (22, Hallescher FC, 3. Liga 22-23)","B. Kociubinski (22, Atlético Tucumán, Argentinian Primera División 2023)",57.79334340498483
"A. Casar (22, Hallescher FC, 3. Liga 22-23)","I. Rossi (29, Platense, Argentinian Primera División 2023)",53.32631529195167
"A. Casar (22, Hallescher FC, 3. Liga 22-23)","J. Chicco (25, Colón, Argentinian Primera División 2023)",75.58612233818658
"A. Casar (22, Hallescher FC, 3. Liga 22-23)","C. Zabala (25, Tigre, Argentinian Primera División 2023)",75.5922788752219
"A. Casar (22, Hallescher FC, 3. Liga 22-23)","A. Cardozo (26, Tigre, Argentinian Primera División 2023)",39.297173082114206
"A. Casar (22, Hallescher FC, 3. Liga 22-23)","F. Díaz (22, Platense, Argentinian Primera División 2023)",26.827902780347276
"A. Casar (22, Hallescher FC, 3. Liga 22-23)","F. Redondo (20, Argentinos Juniors, Argentinian Primera División 2023)",61.42623355538082
"A. Casar (22, Hallescher FC, 3. Liga 22-23)","U. Iwu (23, Urartu, Armenian Premier League 22-23)",62.50371817559584
"A. Casar (22, Hallescher FC, 3. Liga 22-23)","D. Aghbalyan (24, BKMA, Armenian Premier League 22-23)",37.793771352520565
"A. Casar (22, Hallescher FC, 3. Liga 22-23)","A. Grigoryan (35, Alashkert, Armenian Premier League 22-23)",50.53740858709988
"A. Casar (22, Hallescher FC, 3. Liga 22-23)","K. Sow (23, Lernayin Artsakh, Armenian Premier League 22-23)",59.35405110998588
"A. Casar (22, Hallescher FC, 3. Liga 22-23)","G. Malakyan (28, Ararat, Armenian Premier League 22-23)",31.923373115921816
"A. Casar (22, Hallescher FC, 3. Liga 22-23)","R. Baghramyan (20, Noah, Armenian Premier League 22-23)",17.658183261341865
"A. Casar (22, Hallescher FC, 3. Liga 22-23)","S. Shahinyan (27, Alashkert, Armenian Premier League 22-23)",31.13728550685541
"A. Casar (22, Hallescher FC, 3. Liga 22-23)","N. Aghasaryan (21, Urartu, Armenian Premier League 22-23)",38.06286718675541
"A. Casar (22, Hallescher FC, 3. Liga 22-23)","M. Perchtold (34, Grazer AK, Austrian 2. Liga 22-23)",59.83170825389234
"A. Casar (22, Hallescher FC, 3. Liga 22-23)","D. Saurer (22, Sturm Graz II, Austrian 2. Liga 22-23)",67.63611009499803
"A. Casar (22, Hallescher FC, 3. Liga 22-23)","L. Mätzler (21, Dornbirn, Austrian 2. Liga 22-23)",33.86175348199599
"A. Casar (22, Hallescher FC, 3. Liga 22-23)","K. Abazović (19, First Vienna, Austrian 2. Liga 22-23)",47.09124375881596
"A. Casar (22, Hallescher FC, 3. Liga 22-23)","D. Bosnjak (26, Rapid Wien II, Austrian 2. Liga 22-23)",61.455562860210456
"A. Casar (22, Hallescher FC, 3. Liga 22-23)","T. Sahin (18, Liefering, Austrian 2. Liga 22-23)",32.549150007420266
"A. Casar (22, Hallescher FC, 3. Liga 22-23)","K. Conté (23, St. Pölten, Austrian 2. Liga 22-23)",68.79862179822257
"A. Casar (22, Hallescher FC, 3. Liga 22-23)","N. Sattlberger (19, Rapid Wien II, Austrian 2. Liga 22-23)",43.225306652286
"A. Casar (22, Hallescher FC, 3. Liga 22-23)","N. Zdichynec (21, Vorwärts Steyr, Austrian 2. Liga 22-23)",48.61760618292889
"A. Casar (22, Hallescher FC, 3. Liga 22-23)","J. Gorenc-Stankovič (27, Sturm Graz, Austrian Bundesliga 22-23)",57.11430448622304
"A. Casar (22, Hallescher FC, 3. Liga 22-23)","N. Seiwald (22, Salzburg, Austrian Bundesliga 22-23)",-0.2533316879301048
"A. Casar (22, Hallescher FC, 3. Liga 22-23)","P. Grabher (29, Austria Lustenau, Austrian Bundesliga 22-23)",50.040951401386266
"A. Casar (22, Hallescher FC, 3. Liga 22-23)","V. Müller (24, WSG Swarovski Tirol, Austrian Bundesliga 22-23)",56.349415606467126
"A. Casar (22, Hallescher FC, 3. Liga 22-23)","T. Kainz (30, Hartberg, Austrian Bundesliga 22-23)",16.791797856589046
"A. Casar (22, Hallescher FC, 3. Liga 22-23)","P. Michorl (28, LASK, Austrian Bundesliga 22-23)",-10.753272182103348
"A. Casar (22, Hallescher FC, 3. Liga 22-23)","S. Horvath (26, LASK, Austrian Bundesliga 22-23)",-13.375058803369145
"A. Casar (22, Hallescher FC, 3. Liga 22-23)","K. Gkezos (30, Austria Klagenfurt, Austrian Bundesliga 22-23)",46.562283611791
"A. Casar (22, Hallescher FC, 3. Liga 22-23)","A. Pejić (23, Rapid Wien, Austrian Bundesliga 22-23)",52.29988624914432
"A. Casar (22, Hallescher FC, 3. Liga 22-23)","R. Kerschbaum (29, Rapid Wien, Austrian Bundesliga 22-23)",38.65732451667681
"A. Casar (22, Hallescher FC, 3. Liga 22-23)","B. Jovičić (30, LASK, Austrian Bundesliga 22-23)",51.62157284233644
"A. Casar (22, Hallescher FC, 3. Liga 22-23)","E. Omić (20, Wolfsberger AC, Austrian Bundesliga 22-23)",16.068124325465643
"A. Casar (22, Hallescher FC, 3. Liga 22-23)","S. Haudum (28, Rheindorf Altach, Austrian Bundesliga 22-23)",40.95672889828646
"A. Casar (22, Hallescher FC, 3. Liga 22-23)","M. Leitgeb (34, Wolfsberger AC, Austrian Bundesliga 22-23)",42.26589244095488
"A. Casar (22, Hallescher FC, 3. Liga 22-23)","R. Benatelli (31, Austria Klagenfurt, Austrian Bundesliga 22-23)",42.33917058185416
"A. Casar (22, Hallescher FC, 3. Liga 22-23)","L. Gourna-Douath (19, Salzburg, Austrian Bundesliga 22-23)",75.93072582719677
"A. Casar (22, Hallescher FC, 3. Liga 22-23)","C. Türkmen (21, Austria Lustenau, Austrian Bundesliga 22-23)",30.966920762406296
"A. Casar (22, Hallescher FC, 3. Liga 22-23)","N. Rôdes (25, Dender, Belgian First Division B 22-23)",19.73111611228576
"A. Casar (22, Hallescher FC, 3. Liga 22-23)","G. Hendrickx (28, Deinze, Belgian First Division B 22-23)",0.1459137085914965
"A. Casar (22, Hallescher FC, 3. Liga 22-23)","S. Banse (22, Standard Liège II, Belgian First Division B 22-23)",15.070277124137558
"A. Casar (22, Hallescher FC, 3. Liga 22-23)","D. Hubert (35, Anderlecht II, Belgian First Division B 22-23)",64.19847117478182
"A. Casar (22, Hallescher FC, 3. Liga 22-23)","Liam De Smet (19, Club Brugge II, Belgian First Division B 22-23)",16.253323332561724
"A. Casar (22, Hallescher FC, 3. Liga 22-23)","J. Geusens (21, Genk II, Belgian First Division B 22-23)",-11.568346481779788
"A. Casar (22, Hallescher FC, 3. Liga 22-23)","I. Bangoura (19, Genk II, Belgian First Division B 22-23)",43.180959418030106
"A. Casar (22, Hallescher FC, 3. Liga 22-23)","L. Fraser (25, Deinze, Belgian First Division B 22-23)",63.470961549661695
"A. Casar (22, Hallescher FC, 3. Liga 22-23)","K. Van De Perre (19, Genk II, Belgian First Division B 22-23)",42.586456440514034
"A. Casar (22, Hallescher FC, 3. Liga 22-23)","T. Leoni (23, Anderlecht II, Belgian First Division B 22-23)",23.53273407431382
"A. Casar (22, Hallescher FC, 3. Liga 22-23)","S. De Ridder (36, Deinze, Belgian First Division B 22-23)",58.65545263403423
"A. Casar (22, Hallescher FC, 3. Liga 22-23)","Álex Granell (34, Lommel SK, Belgian First Division B 22-23)",63.281654672839046
"A. Casar (22, Hallescher FC, 3. Liga 22-23)","W. Simba (22, Club Brugge II, Belgian First Division B 22-23)",22.587164173678115
"A. Casar (22, Hallescher FC, 3. Liga 22-23)","P. Hrošovský (31, Genk, Belgian Pro League 22-23)",48.25269300580953
"A. Casar (22, Hallescher FC, 3. Liga 22-23)","B. Heynen (26, Genk, Belgian Pro League 22-23)",9.785950839949162
"A. Casar (22, Hallescher FC, 3. Liga 22-23)","S. Lynen (24, Union Saint-Gilloise, Belgian Pro League 22-23)",29.3215635378654
"A. Casar (22, Hallescher FC, 3. Liga 22-23)","N. Rommens (28, Zulte-Waregem, Belgian Pro League 22-23)",5.661065895412073
"A. Casar (22, Hallescher FC, 3. Liga 22-23)","R. Onyedika (22, Club Brugge, Belgian Pro League 22-23)",73.47368396210582
"A. Casar (22, Hallescher FC, 3. Liga 22-23)","F. Boya (26, Sint-Truiden, Belgian Pro League 22-23)",19.627002946460063
"A. Casar (22, Hallescher FC, 3. Liga 22-23)","R. Schoofs (29, Mechelen, Belgian Pro League 22-23)",12.945346393476544
"A. Casar (22, Hallescher FC, 3. Liga 22-23)","A. Vermeeren (18, Antwerp, Belgian Pro League 22-23)",30.43451117828255
"A. Casar (22, Hallescher FC, 3. Liga 22-23)","C. Lepoint (38, RFC Seraing, Belgian Pro League 22-23)",9.790932222986967
"A. Casar (22, Hallescher FC, 3. Liga 22-23)","M. Konaté (29, Sint-Truiden, Belgian Pro League 22-23)",20.55649493264414
"A. Casar (22, Hallescher FC, 3. Liga 22-23)","D. Lavalée (26, Mechelen, Belgian Pro League 22-23)",60.06135701139137
"A. Casar (22, Hallescher FC, 3. Liga 22-23)","B. Verstraete (29, Mechelen, Belgian Pro League 22-23)",52.26422508054871
"A. Casar (22, Hallescher FC, 3. Liga 22-23)","A. Yusuf (22, Antwerp, Belgian Pro League 22-23)",54.16227271228233
"A. Casar (22, Hallescher FC, 3. Liga 22-23)","A. Diawara (25, Anderlecht, Belgian Pro League 22-23)",55.10296031670892
"A. Casar (22, Hallescher FC, 3. Liga 22-23)","S. Lahssaini (24, RFC Seraing, Belgian Pro League 22-23)",35.13970567872021
"A. Casar (22, Hallescher FC, 3. Liga 22-23)","P. Gerkens (28, Antwerp, Belgian Pro League 22-23)",35.253005112967664
"A. Casar (22, Hallescher FC, 3. Liga 22-23)","M. Keita (21, Antwerp, Belgian Pro League 22-23)",35.68869634679131
"A. Casar (22, Hallescher FC, 3. Liga 22-23)","N. Raskin (21, Standard Liège, Belgian Pro League 22-23)",9.890995994107996
"A. Casar (22, Hallescher FC, 3. Liga 22-23)","J. Dom (33, OH Leuven, Belgian Pro League 22-23)",10.920555426694849
"A. Casar (22, Hallescher FC, 3. Liga 22-23)","S. Lončar (26, Kortrijk, Belgian Pro League 22-23)",6.859075909118053
"A. Casar (22, Hallescher FC, 3. Liga 22-23)","R. Morioka (32, Charleroi, Belgian Pro League 22-23)",13.161188400221008
"A. Casar (22, Hallescher FC, 3. Liga 22-23)","J. Jeggo (30, Eupen, Belgian Pro League 22-23)",47.57877929435027
"A. Casar (22, Hallescher FC, 3. Liga 22-23)","O. El Azzouzi (22, Union Saint-Gilloise, Belgian Pro League 22-23)",47.75940231661929
"A. Casar (22, Hallescher FC, 3. Liga 22-23)","K. Mrabti (29, Mechelen, Belgian Pro League 22-23)",10.050967616343298
"A. Casar (22, Hallescher FC, 3. Liga 22-23)","N. Popara (31, Sloga Doboj, Bosnian Premier League 22-23)",14.294184760191234
"A. Casar (22, Hallescher FC, 3. Liga 22-23)","A. Hodžić (23, Željezničar, Bosnian Premier League 22-23)",38.135205919263285
"A. Casar (22, Hallescher FC, 3. Liga 22-23)","H. Karjasević (25, Tuzla City, Bosnian Premier League 22-23)",54.533680400436936
"A. Casar (22, Hallescher FC, 3. Liga 22-23)","M. Osmić (24, Sloboda Tuzla, Bosnian Premier League 22-23)",39.38667813403963
"A. Casar (22, Hallescher FC, 3. Liga 22-23)","P. Sučić (19, Zrinjski, Bosnian Premier League 22-23)",38.702537612309904
"A. Casar (22, Hallescher FC, 3. Liga 22-23)","A. Vošnjak (22, Sloboda Tuzla, Bosnian Premier League 22-23)",9.298254600222966
"A. Casar (22, Hallescher FC, 3. Liga 22-23)","O. Pršeš (28, Velež, Bosnian Premier League 22-23)",22.80683676243688
"A. Casar (22, Hallescher FC, 3. Liga 22-23)","H. Karić (20, Tuzla City, Bosnian Premier League 22-23)",32.75861767745823
"A. Casar (22, Hallescher FC, 3. Liga 22-23)","F. Čirjak (27, Sarajevo, Bosnian Premier League 22-23)",38.17906733285359
"A. Casar (22, Hallescher FC, 3. Liga 22-23)","A. Kurtalić (23, Sloboda Tuzla, Bosnian Premier League 22-23)",32.34452972293428
"A. Casar (22, Hallescher FC, 3. Liga 22-23)","M. Vrančić (34, Sarajevo, Bosnian Premier League 22-23)",9.916520839417563
"A. Casar (22, Hallescher FC, 3. Liga 22-23)","I. Jelić Balta (30, Sarajevo, Bosnian Premier League 22-23)",48.5056974768552
"A. Casar (22, Hallescher FC, 3. Liga 22-23)","D. Matković (21, Leotar, Bosnian Premier League 22-23)",13.442891610591962
"A. Casar (22, Hallescher FC, 3. Liga 22-23)","D. Zlomislić (31, Zrinjski, Bosnian Premier League 22-23)",49.13630222844008
"A. Casar (22, Hallescher FC, 3. Liga 22-23)","O. Beća (21, Željezničar, Bosnian Premier League 22-23)",13.2568739374607
"A. Casar (22, Hallescher FC, 3. Liga 22-23)","M. Hrimat (28, FAR Rabat, Botola Pro 22-23)",70.53046921029636
"A. Casar (22, Hallescher FC, 3. Liga 22-23)","N. Aarab (32, Ittihad Tanger, Botola Pro 22-23)",73.70587305235571
"A. Casar (22, Hallescher FC, 3. Liga 22-23)","Y. Jabrane (31, Wydad Casablanca, Botola Pro 22-23)",80.95799066170704
"A. Casar (22, Hallescher FC, 3. Liga 22-23)","B. Sylla (26, Maghreb Fès, Botola Pro 22-23)",22.135122987421912
"A. Casar (22, Hallescher FC, 3. Liga 22-23)","E. Chichane (31, Difaâ El Jadida, Botola Pro 22-23)",64.36207530187049
"A. Casar (22, Hallescher FC, 3. Liga 22-23)","O. Mahrous (27, Olympic Safi, Botola Pro 22-23)",80.61778804540056
"A. Casar (22, Hallescher FC, 3. Liga 22-23)","C. Nsundi (22, Difaâ El Jadida, Botola Pro 22-23)",48.556371094565634
"A. Casar (22, Hallescher FC, 3. Liga 22-23)","Y. Labhiri (28, RSB Berkane, Botola Pro 22-23)",-2.5744830090126305
"A. Casar (22, Hallescher FC, 3. Liga 22-23)","W. Rhailouf (24, Olympic Safi, Botola Pro 22-23)",61.5050364837346
"A. Casar (22, Hallescher FC, 3. Liga 22-23)","R. Aholou (29, Raja Casablanca, Botola Pro 22-23)",70.48336911847638
"A. Casar (22, Hallescher FC, 3. Liga 22-23)","A. Serrhat (26, Mouloudia Oujda, Botola Pro 22-23)",55.0203794628538
"A. Casar (22, Hallescher FC, 3. Liga 22-23)","B. El Helali (35, RSB Berkane, Botola Pro 22-23)",19.32074491187836
"A. Casar (22, Hallescher FC, 3. Liga 22-23)","A. El Hassnaoui (34, Moghreb Tétouan, Botola Pro 22-23)",44.17636292764981
"A. Casar (22, Hallescher FC, 3. Liga 22-23)","R. Jaadi (28, Wydad Casablanca, Botola Pro 22-23)",22.746185396333438
"A. Casar (22, Hallescher FC, 3. Liga 22-23)","M. Bemammer (33, Maghreb Fès, Botola Pro 22-23)",64.42815056978233
"A. Casar (22, Hallescher FC, 3. Liga 22-23)","M. Al Makaazi (28, Raja Casablanca, Botola Pro 22-23)",45.32804324433391
"A. Casar (22, Hallescher FC, 3. Liga 22-23)","M. Said Bouksyr (26, Ittihad Tanger, Botola Pro 22-23)",38.30270252814457
"A. Casar (22, Hallescher FC, 3. Liga 22-23)","J. Tachtach (28, Hassania Agadir, Botola Pro 22-23)",30.366172618582087
"A. Casar (22, Hallescher FC, 3. Liga 22-23)","A. Traoré (28, JS Soualem, Botola Pro 22-23)",7.948759943143585
"A. Casar (22, Hallescher FC, 3. Liga 22-23)","M. Afallah (29, Chabab Mohammédia, Botola Pro 22-23)",39.59496015912507
"A. Casar (22, Hallescher FC, 3. Liga 22-23)","S. El Moudane (29, Ittihad Tanger, Botola Pro 22-23)",17.510861542558448
"A. Casar (22, Hallescher FC, 3. Liga 22-23)","L. Naji (32, FAR Rabat, Botola Pro 22-23)",43.650288584346775
"A. Casar (22, Hallescher FC, 3. Liga 22-23)","H. Marzak (27, JS Soualem, Botola Pro 22-23)",15.825424059861652
"A. Casar (22, Hallescher FC, 3. Liga 22-23)","A. Sabyh (34, JS Soualem, Botola Pro 22-23)",48.580262680105776
"A. Casar (22, Hallescher FC, 3. Liga 22-23)","S. Karkache (23, Khouribga, Botola Pro 22-23)",46.61075890844034
"A. Casar (22, Hallescher FC, 3. Liga 22-23)","H. Afsal (26, Hassania Agadir, Botola Pro 22-23)",30.09022170158832
"A. Casar (22, Hallescher FC, 3. Liga 22-23)","J. Daoudi (34, Wydad Casablanca, Botola Pro 22-23)",41.73387902990985
"A. Casar (22, Hallescher FC, 3. Liga 22-23)","W. Sabbar (27, Raja Casablanca, Botola Pro 22-23)",19.49174354934273
"A. Casar (22, Hallescher FC, 3. Liga 22-23)","K. Ait Mohamed (23, Hassania Agadir, Botola Pro 22-23)",33.729949665905394
"A. Casar (22, Hallescher FC, 3. Liga 22-23)","B. Pradana (31, Barito Putera, BRI Liga 1 22-23)",31.92373759928634
"A. Casar (22, Hallescher FC, 3. Liga 22-23)","R. Chand (31, Persik Kediri, BRI Liga 1 22-23)",42.64069284422671
"A. Casar (22, Hallescher FC, 3. Liga 22-23)","Sin-Young Bae (30, Persita, BRI Liga 1 22-23)",53.65482925351027
"A. Casar (22, Hallescher FC, 3. Liga 22-23)","A. Tanjung (29, PSM, BRI Liga 1 22-23)",2.9607633583319863
"A. Casar (22, Hallescher FC, 3. Liga 22-23)","R. Yamaguchi (30, Arema, BRI Liga 1 22-23)",50.61776451562283
"A. Casar (22, Hallescher FC, 3. Liga 22-23)","K. Kurniawan (33, PSS Sleman, BRI Liga 1 22-23)",-2.4090053941668
"A. Casar (22, Hallescher FC, 3. Liga 22-23)","Brwa Nouri (36, Bali United, BRI Liga 1 22-23)",55.0495941277566
"A. Casar (22, Hallescher FC, 3. Liga 22-23)","M. Slamat (24, Persebaya Surabaya, BRI Liga 1 22-23)",29.575113991363544
"A. Casar (22, Hallescher FC, 3. Liga 22-23)","T. Infantrie (23, Persikabo 1973, BRI Liga 1 22-23)",26.921983124290715
"A. Casar (22, Hallescher FC, 3. Liga 22-23)","T. Numberi (21, Dewa United, BRI Liga 1 22-23)",40.372257619650966
"A. Casar (22, Hallescher FC, 3. Liga 22-23)","Y. Lee (33, Madura United, BRI Liga 1 22-23)",22.58469342900764
"A. Casar (22, Hallescher FC, 3. Liga 22-23)","J. Hariono (26, Arema, BRI Liga 1 22-23)",53.36929501335364
"A. Casar (22, Hallescher FC, 3. Liga 22-23)","Lucas Ramos (28, Dewa United, BRI Liga 1 22-23)",58.855720272293134
"A. Casar (22, Hallescher FC, 3. Liga 22-23)","S. Tan (28, Persis Solo, BRI Liga 1 22-23)",62.39660542204511
"A. Casar (22, Hallescher FC, 3. Liga 22-23)","M. Hidayat (26, Persebaya Surabaya, BRI Liga 1 22-23)",49.04406105696033
"A. Casar (22, Hallescher FC, 3. Liga 22-23)","N. Nurzaidin (27, Barito Putera, BRI Liga 1 22-23)",44.896244000220165
