Player,Similarity
"Julio Gracia (25, Real Murcia, Primera División RFEF 22-23)",79.04108229939376
"A. Gerbo (33, Juve Stabia, Serie C 22-23)",75.96100283316424
"M. Maita (28, Bari, Serie B 22-23)",75.74925225868613
"D. Houska (29, Jablonec, Czech Fortuna Liga 22-23)",75.50590357310872
"O. Abuhav (19, Hapoel Ramat Gan, Liga Leumit 22-23)",74.78916164113515
"Riki Rodríguez (25, Albacete, La Liga 2 22-23)",73.6080616465001
"Rai Marchán (29, Melbourne Victory, A-League Men 22-23)",73.43014418585491
"F. Fonseca (31, Farense, Portugal Segunda Liga 22-23)",73.09526331102407
"J. Williams (26, Bristol City, Championship 22-23)",72.81491774796356
"K. Kakashvili (29, Gagra, Erovnuli Liga 2023)",71.9061738163966
"A. Deliu (25, Tirana, Albanian Premier League 22-23)",71.82608844606008
"Y. Tejeda (31, Herediano, Costa Rica Primera División 22-23)",71.70475258326309
"In-Beom Hwang (26, Olympiacos Piraeus, Greek Super League 22-23)",71.53697065807025
"V. Dragomir (24, Pafos, Cyprus 1. Division 22-23)",71.17959010336682
"B. Kristensen (30, Hibernians, Malta Premier League 22-23)",70.3717230630254
"D. Salou (25, Urartu, Armenian Premier League 22-23)",70.21844761722224
"M. Uribe (32, Porto, Primeira Liga 22-23)",70.20002429554437
"R. Mulumba (30, Bandırmaspor, Turkish 1. Lig 22-23)",69.91165876958935
"Jong-Sung Lee (30, Suwon Bluewings, K League 1 2023)",69.88201376470757
"A. Zejnullai (24, Shkendija, North Macedonia First League 22-23)",69.87741549489004
"L. Krasniqi (31, Terengganu, Malaysian Super League 2023)",69.65819053384338
"G. İnler (38, Adana Demirspor, Süper Lig 22-23)",69.16193000921274
"S. Ngernprasert (28, Khon Kaen United, Thai League 1 22-23)",69.15076158995595
"T. Cseri (35, Mezőkövesd-Zsóry, NB I 22-23)",69.11522150685518
"Victor Bobsin (23, Santa Clara, Primeira Liga 22-23)",68.85942260145934
