Player,Similarity
"W. Szumilas (26, Zagłębie Sosnowiec, Polish I Liga 22-23)",83.62459516233214
"R. Akbashev (31, Fakel, Russian Premier League 22-23)",83.23179639082633
"O. Hajrovic (27, Jedinstvo, Montenegro First League 22-23)",82.97391158635129
"C. Smith (21, Hamilton Academical, Scottish Championship 22-23)",82.78206203407201
"A. Guseynov (23, Turan-T, Premyer Liqa 22-23)",82.40535558412067
"Andreas Pereira (27, Fulham, Premier League 22-23)",81.83920534649889
"Agüero (27, Alcoyano, Primera División RFEF 22-23)",81.83345977812604
"R. Zalazar (23, Schalke 04, Bundesliga 22-23)",81.48336847881356
"O. Haffari (23, Khouribga, Botola Pro 22-23)",81.26755465233992
"K. Barlow (19, Sligo Rovers, League of Ireland PL 2023)",80.34590017468331
"J. Velásquez (29, Xelajú, Guatemala Liga Nacional 22-23)",80.03919365098686
"S. Kelly (23, Livingston, Scottish Premiership 22-23)",79.8506556820331
"Z. Jánó (18, Liefering, Austrian 2. Liga 22-23)",79.37257034090916
"C. Calaidjoglu (22, Sfîntul Gheorghe, Moldovan Super Liga 22-23)",79.12439276584564
"D. Danu (20, CSF Bălți, Moldovan Super Liga 22-23)",79.10134276106938
"A. Vutov (26, Lokomotiv Sofia 1929, Bulgarian First League 22-23)",78.77012130293609
"L. Pellegrini (26, Roma, Serie A 22-23)",78.76810757273877
"P. Mišić (28, Tuzla City, Bosnian Premier League 22-23)",78.6525974056405
"K. Ouarkhane (23, JS Soualem, Botola Pro 22-23)",78.471870301427
"K. Köböl (21, Soroksár SC, NB II 22-23)",77.9385137356227
"V. Fazliu (27, Aarau, Swiss Challenge League 22-23)",77.92271804026473
"D. Hilbrycht (25, Nieciecza, Polish I Liga 22-23)",77.66252397879556
"B. Bodin (31, Oxford United, League One 22-23)",77.55981307063612
"G. Lulukyan (20, BKMA, Armenian Premier League 22-23)",77.55612769387263
"J. Wurtz (30, Wehen Wiesbaden, 3. Liga 22-23)",77.4533875760232
