Player,Similarity
"Ronivaldo (34, Blau-Weiß Linz, Austrian 2. Liga 22-23)",90.28885728626967
"B. Labeau (27, Lausanne Sport, Swiss Challenge League 22-23)",90.06415789094586
"Rafaelson (26, Binh Dinh, V League 1 2023)",89.41311729271854
"M. Hernández (33, Cartaginés, Costa Rica Primera División 22-23)",89.17072751988796
"D. Souza (29, Samsunspor, Turkish 1. Lig 22-23)",89.00592234465861
"Iván Barbero (24, Osasuna B, Primera División RFEF 22-23)",88.8293167751961
"D. McGoldrick (35, Derby County, League One 22-23)",88.74586057768634
"Wander (30, Rans Nusantara, BRI Liga 1 22-23)",88.31270846778764
"K. Denkey (22, Cercle Brugge, Belgian Pro League 22-23)",88.25692136904225
"Hossam Hassan (29, Smouha, Egyptian Premier League 22-23)",88.24046124658787
"Matheus Pato (27, Borneo FC, BRI Liga 1 22-23)",87.98300066629953
"J. Ferrante (27, Cesena, Serie C 22-23)",87.75650395159859
"M. Altiparmakovski (31, Struga, North Macedonia First League 22-23)",87.48079310824151
"R. Aguirre (28, Monterrey, Liga MX 22-23)",87.18102704311718
"A. Zeqiri (23, Basel, Swiss Super League 22-23)",87.16014384299014
"A. Boiciuc (25, AS FC Buzău, Romanian Liga II 22-23)",87.1390832941063
"A. Ryan (28, Larne, Northern Ireland Premiership 22-23)",86.88874923570079
"J. Venegas (34, Alajuelense, Costa Rica Primera División 22-23)",86.70384789909927
"Marwan Hamdi (26, Al Masry, Egyptian Premier League 22-23)",86.6919800194927
"J. Nsamé (30, Young Boys, Swiss Super League 22-23)",86.67593384358223
"C. Stanciu (32, Progresul Spartac, Romanian Liga II 22-23)",86.63133029870703
"L. Garate (29, Unión Española, Chilean Primera División 2023)",86.51181693666064
"M. Çuni (21, Saarbrücken, 3. Liga 22-23)",86.34553026328368
"A. Baroan (22, Botev Plovdiv, Bulgarian First League 22-23)",86.32100531827984
"J. Dinenno (28, Pumas UNAM, Liga MX 22-23)",86.21047248500022
