Player,Similarity
"D. Terteryan (25, Ararat-Armenia, Armenian Premier League 22-23)",93.06236116201536
"M. Gusto (20, Olympique Lyonnais, Ligue 1 22-23)",92.56145213424054
"T. Cancellotti (31, Pescara, Serie C 22-23)",92.4275332735306
"R. Oliveira (27, Torreense, Portugal Segunda Liga 22-23)",92.30623058458458
"V. Dubinchak (24, Dynamo Kyiv, Ukrainian Premier Liha 22-23)",92.19872547280386
"Óscar de Marcos (34, Athletic Bilbao, La Liga 22-23)",92.07653610282853
"P. Cornud (26, Maccabi Haifa, Ligat Ha'al 22-23)",91.75233366543202
"U. Garcia (27, Young Boys, Swiss Super League 22-23)",91.62714074189849
"A. Rizzo (24, Avellino, Serie C 22-23)",91.53950290059544
"Vanderson (21, Monaco, Ligue 1 22-23)",91.30167921085224
"D. Lunga (28, Golden Arrows, South Africa PSL 22-23)",91.15468704378335
"Tiago Gonçalves (22, Pontedera, Serie C 22-23)",91.08928881436448
"I. Touray (28, Salford City, League Two 22-23)",90.91092157248276
"S. Rosen (20, Hapoel Kfar Saba, Liga Leumit 22-23)",90.86955520048184
"J. Edwards (22, Dunfermline Athletic, Scottish League One 22-23)",90.85858547125946
"L. Blum (21, Young Boys, Swiss Super League 22-23)",90.82722906944728
"A. Mozo (26, Guadalajara, Liga MX 22-23)",90.77272544788654
"D. Ulrich (25, Vaduz, Swiss Challenge League 22-23)",90.57894209107651
"J. Čorluka (28, Zrinjski, Bosnian Premier League 22-23)",90.48644445804102
"H. Hakobyan (26, Ararat-Armenia, Armenian Premier League 22-23)",90.32581694639046
"N. Weerawatnodom (28, Buriram United, Thai League 1 22-23)",90.31896843334764
"D. Zappella (25, Virtus Entella, Serie C 22-23)",90.31484705265876
"K. Savichev (29, Akron Togliatti, Russian FNL 2 22-23)",90.1125088828494
"S. Medgyes (29, Diósgyőr, NB II 22-23)",90.09672298282985
"Tony Abad (26, Eldense, Primera División RFEF 22-23)",89.97812499420932
