Player,Similarity
"N. Balongo (24, Łódzki KS, Polish I Liga 22-23)",91.65943518497043
"L. McIntosh (30, Cove Rangers, Scottish Championship 22-23)",91.55184012587718
"B. House (23, Lincoln City, League One 22-23)",89.40793426387668
"K. Kanatsızkuş (26, Rizespor, Turkish 1. Lig 22-23)",86.87414423074271
"B. Arabuli (29, Macarthur, A-League Men 22-23)",86.30066592978146
"M. Franko (22, Dukla Banská Bystrica, Slovak Super Liga 22-23)",86.12485138033573
"S. Infantino (36, Gelbison, Serie C 22-23)",85.91066856414564
"L. Mryan (23, Shirak, Armenian Premier League 22-23)",84.85688151073082
"F. Vecheta (20, Slovácko, Czech Fortuna Liga 22-23)",84.33940478381957
"Asier Villalibre (25, Deportivo Alavés, La Liga 2 22-23)",83.91597773611701
"C. Tommasini (25, Taranto, Serie C 22-23)",82.98346106671846
"J. Matt (33, Walsall, League Two 22-23)",82.88491777633972
"V. Oliver (31, Bradford City, League Two 22-23)",82.76449402512233
"R. Jelena (25, Csikszereda Miercurea Ciuc, Romanian Liga II 22-23)",82.61751545543221
"A. Osorio (20, Vélez Sarsfield, Argentinian Primera División 2023)",82.15564878595261
"C. El Bahri (30, RSB Berkane, Botola Pro 22-23)",81.47061115454255
"M. Kukharevych (21, Hibernian, Scottish Premiership 22-23)",81.28594633160894
"A. Amutu (30, Al Ittihad, Egyptian Premier League 22-23)",80.91116590718737
"M. Romero (24, Racing Club, Argentinian Primera División 2023)",80.72044625843434
"D. Strelec (22, Reggina, Serie B 22-23)",80.10328018421978
"J. Martínez (25, Municipal, Guatemala Liga Nacional 22-23)",80.02155701171787
"K. Bychek (23, Metalist 1925 Kharkiv, Ukrainian Premier Liha 22-23)",79.97541669792493
"P. lves (26, Farense, Portugal Segunda Liga 22-23)",79.91915598690646
"C. Santos (34, Juve Stabia, Serie C 22-23)",79.67075818310747
"M. Hernaus (22, Floridsdorfer AC, Austrian 2. Liga 22-23)",79.1764382391342
