Player,Similarity
"J. Gorenc-Stankovič (27, Sturm Graz, Austrian Bundesliga 22-23)",80.72498839650558
"C. Clay (31, Leyton Orient, League Two 22-23)",76.12866784589036
"A. Şut (24, FCS Bucureşti, SuperLiga României 22-23)",75.48240398091234
"Samú Costa (22, Almería, La Liga 22-23)",72.39055750924305
"D. Codrea (25, Concordia Chiajna, Romanian Liga II 22-23)",71.61425055769291
"M. Boateng (20, Queen's Park, Scottish Championship 22-23)",70.23719445572222
"L. Maloney (23, Heidenheim, 2. Bundesliga 22-23)",70.19497182169712
"I. Jelić Balta (30, Wisła Kraków, Polish I Liga 22-23)",70.04609616031556
"N. Pavan (29, Cittadella, Serie B 22-23)",69.84666819625366
"F. Sule (26, Larne, Northern Ireland Premiership 22-23)",68.98154458436832
"Jacques Mbé (23, Etoile du Sahel, Tunisian Ligue 1 22-23)",68.55912324378268
"R. Krausz (27, Pécsi MFC, NB II 22-23)",68.20341332567436
"B. Végh (26, Mosonmagyaróvári TE, NB II 22-23)",67.91066061113398
"T. Devlin (19, Glentoran, Northern Ireland Premiership 22-23)",67.5213685455904
"F. Kiss (32, Al Ittihad Kalba, UAE Pro League 22-23)",66.97126184612272
"R. Croasdale (28, Stockport County, League Two 22-23)",66.66261098451218
"D. Ventúra (27, Sigma Olomouc, Czech Fortuna Liga 22-23)",66.57928535511833
"A. Busnić (25, Vojvodina, Serbian SuperLiga 22-23)",66.42020478834547
"R. Ziętarski (29, VfB Oldenburg, 3. Liga 22-23)",66.41507565849255
"J. Čađenović (28, Panevėžys, Lithuanian A Lyga 2023)",66.29265567723296
"D. Brînzan (26, Viitorul P. Targu Jiu, Romanian Liga II 22-23)",66.14712942094681
"K. Green (25, Grimsby Town, League Two 22-23)",65.76360035003962
"C. Gallagher (24, Cliftonville, Northern Ireland Premiership 22-23)",65.6450182102576
"V. Bubanja (24, Lokomotiva Zagreb, 1. HNL 22-23)",65.19730643139465
"S. Field (25, Queens Park Rangers, Championship 22-23)",64.70195600736767
