Player,Similarity
"S. Zúñiga (26, Alajuelense, Costa Rica Primera División 22-23)",93.38034454058126
"J. Čorluka (28, Zrinjski, Bosnian Premier League 22-23)",93.08387837555198
"D. Zappella (25, Virtus Entella, Serie C 22-23)",92.6724220680524
"J. González (25, Xelajú, Guatemala Liga Nacional 22-23)",92.28666976597182
"F. Rillo (22, Potenza, Serie C 22-23)",91.47328309934343
"K. Shirai (29, Kyoto Sanga, J1 2023)",91.23459781812842
"E. Hakaj (26, Vllaznia Shkodër, Albanian Premier League 22-23)",90.44167077460268
"L. Blum (21, Young Boys, Swiss Super League 22-23)",89.75574920502969
"N. Serdal (30, Hapoel Umm al-Fahm, Liga Leumit 22-23)",89.55261177278297
"R. Oliveira (27, Torreense, Portugal Segunda Liga 22-23)",89.49067236264109
"A. Jafer (28, Bnei Yehuda, Liga Leumit 22-23)",89.41587779220967
"N. Weerawatnodom (28, Buriram United, Thai League 1 22-23)",89.1925478883827
"L. Dickmann (26, SPAL, Serie B 22-23)",89.07350521862556
"K. Malcuit (31, Ankaragücü, Süper Lig 22-23)",89.05906142705197
"D. Church (22, Alloa Athletic, Scottish League One 22-23)",89.04011324548154
"J. Edwards (22, Dunfermline Athletic, Scottish League One 22-23)",88.80379504168769
"A. Marzak (28, Hassania Agadir, Botola Pro 22-23)",88.76248652795404
"T. Cancellotti (31, Pescara, Serie C 22-23)",88.74324422736782
"D. Ulrich (25, Vaduz, Swiss Challenge League 22-23)",88.71854188272971
"J. Juroška (30, Baník Ostrava, Czech Fortuna Liga 22-23)",88.69567399148629
"M. Neubauer (27, Elversberg, 3. Liga 22-23)",88.5189464463901
"B. Cipetić (28, Lokomotiva Zagreb, 1. HNL 22-23)",88.43787279664659
"M. Ziemann (27, Zagłębie Sosnowiec, Polish I Liga 22-23)",88.40443083654517
"C. Drameh (21, Luton Town, Championship 22-23)",88.12577173239406
"Bader Nasser (21, Shabab Al Ahli Dubai, UAE Pro League 22-23)",88.0200906247407
