Player,Similarity
"I. Acuña (33, Municipal, Guatemala Liga Nacional 22-23)",87.51564876442154
"N. Vujnović (26, Gorica, 1. HNL 22-23)",85.74494116913834
"W. Kanga (25, Hertha BSC, Bundesliga 22-23)",85.6940439624621
"N. Austin (29, Kelty Hearts, Scottish League One 22-23)",85.5070491326973
"J. Cádiz (27, Famalicão, Primeira Liga 22-23)",85.18805437797806
"M. Niang (21, Cornellà, Primera División RFEF 22-23)",84.5098803317228
"G. Zigoni (32, Juve Stabia, Serie C 22-23)",84.27131621109007
"G. Bajde (29, Celje, 1. SNL 22-23)",84.26217338413241
"Crislan (31, Nakhon Ratchasima, Thai League 1 22-23)",83.95836768240113
"C. González (30, Toluca, Liga MX 22-23)",83.62654986513422
"Javi Siverio (25, Hyderabad FC, Indian Super League 22-23)",83.51013883822237
"A. Ahmedov (28, Slavia Sofia, Bulgarian First League 22-23)",83.49003045147964
"D. Peham (31, Grazer AK, Austrian 2. Liga 22-23)",83.21710820939454
"Aritz Pascual (23, CD Calahorra, Primera División RFEF 22-23)",83.01947245002339
"N. Bonfanti (21, Modena, Serie B 22-23)",82.6973914575632
"J. March (26, Forest Green Rovers, League One 22-23)",82.51722165372165
"L. Di Yorio (26, León, Liga MX 22-23)",82.50029693325742
"Diego García (23, Fuenlabrada, Primera División RFEF 22-23)",82.42281099231273
"Claudio Medina (29, Cultural Leonesa, Primera División RFEF 22-23)",82.35403263770891
"Wesley Tanque (26, Trofense, Portugal Segunda Liga 22-23)",82.23972993112312
"D. Baumann (28, Zwickau, 3. Liga 22-23)",82.09960484073633
"N. Ibáñez (28, Tigres UANL, Liga MX 22-23)",81.16505515999185
"O. Bogle (29, Newport County, League Two 22-23)",81.00239190896075
"G. Tinoco (34, Xinabajul, Guatemala Liga Nacional 22-23)",80.88922785777372
"S. Diédhiou (31, UTS Rabat, Botola Pro 22-23)",80.72235012771705
