Player,Similarity
"Rodrigo Pinheiro (20, Porto II, Portugal Segunda Liga 22-23)",86.07594708231116
"A. Nukić (25, Tuzla City, Bosnian Premier League 22-23)",84.0144059786906
"M. Ristovski (26, Rabotnički, North Macedonia First League 22-23)",83.48118209685089
"Javi Antón (22, Castellón, Primera División RFEF 22-23)",81.89074950978711
"A. Jahja (23, Struga, North Macedonia First League 22-23)",81.87491791982528
"G. Mygas (29, Ionikos, Greek Super League 22-23)",80.84963608676567
"A. Panagiotou (28, Apollon, Cyprus 1. Division 22-23)",80.83943539272634
"Samuel Teles (26, Feirense, Portugal Segunda Liga 22-23)",80.28736238338122
"S. Oyewale (22, Giugliano, Serie C 22-23)",80.24434931394792
"S. Hussein (26, Maccabi Ahi Nazareth, Liga Leumit 22-23)",80.22626620549617
"C. Bradley (19, Bolton Wanderers, League One 22-23)",80.1850767111329
"Alain García (24, Ceuta, Primera División RFEF 22-23)",80.03533694409074
"Miguel Silva (27, Leixões, Portugal Segunda Liga 22-23)",79.95437322171948
"Thiago Paulo da Silva (18, Standard Liège II, Belgian First Division B 22-23)",79.93988515097695
"Z. Bévárdi (24, Debrecen, NB I 22-23)",79.90921835530555
"T. Knost (23, Verl, 3. Liga 22-23)",78.74978681135491
"T. Muzi (21, Ironi Kiryat Shmona, Ligat Ha'al 22-23)",78.68189068928496
"Gustavo (24, Nacional, Portugal Segunda Liga 22-23)",78.49427143328725
"G. Masouras (26, Miedź Legnica, Ekstraklasa 22-23)",78.49109389493948
"M. Gaye (24, Riga FC, Virsliga 2023)",78.36639917712895
"H. Kamara (29, Watford, Championship 22-23)",78.0222892733775
"Y. Yefremov (29, Šiauliai, Lithuanian A Lyga 2023)",77.95316091933168
"M. Lavinier (22, Swindon Town, League Two 22-23)",77.90466774555394
"Eudald Vergés (26, UD Logroñés, Primera División RFEF 22-23)",77.8945176576353
"M. Mittelstädt (26, Hertha BSC, Bundesliga 22-23)",77.87354098560522
