Player,Similarity
"A. Tirlea (23, Gimnàstic Tarragona, Primera División RFEF 22-23)",75.85264964781419
"K. Gómez (23, Puntarenas, Costa Rica Primera División 22-23)",73.53418670804895
"M. Sylla (24, Hebar 1918, Bulgarian First League 22-23)",72.61417304709344
"C. Amirli (26, Sabail, Premyer Liqa 22-23)",72.26103311755459
"J. Harustak (21, BFC Daugavpils, Virsliga 2023)",71.8197063496373
"M. Cash (25, Aston Villa, Premier League 22-23)",71.77480987115152
"J. Saborido (25, General Caballero JLM, Paraguay Division Profesional 2023)",71.56680786692276
"Ahmed Abdel Rahman Zola (29, El Geish, Egyptian Premier League 22-23)",70.55016189203073
"G. Brown (25, Árabe Unido, Panama LPF 2023)",69.88071747757724
"P. Martino (25, Cosenza, Serie B 22-23)",69.73372069781047
"I. Rata (23, Hapoel Ramat HaSharon, Liga Leumit 22-23)",69.4704890236097
"Tiago Almeida (21, Tondela, Portugal Segunda Liga 22-23)",68.29348079494042
"B. Balázs (33, Duna Aszfalt Tiszakécskei, NB II 22-23)",67.90603627177116
"P. Möschl (30, VfB Oldenburg, 3. Liga 22-23)",67.18713151365124
"G. Carmona (37, Academia Cantolao, Peruvian Liga 1 2023)",66.97225481736687
"J. Nisembaum (29, Hapoel Acre, Liga Leumit 22-23)",66.75127023722666
"M. Galić (27, Željezničar, Bosnian Premier League 22-23)",66.39901426084171
"K. Walker-Peters (26, Southampton, Premier League 22-23)",65.91686040718785
"F. Donati (22, Ascoli, Serie B 22-23)",65.8955935464974
"V. Silvestro (24, Mantova, Serie C 22-23)",65.49399717953362
"A. Krčík (27, Skalica, Slovak Super Liga 22-23)",64.46467095990937
"Ž. Baltrūnas (21, Sūduva, Lithuanian A Lyga 2023)",64.43811811999349
"J. Gyamerah (27, Nürnberg, 2. Bundesliga 22-23)",64.37337733307515
"T. Boukhriss (23, Difaâ El Jadida, Botola Pro 22-23)",64.32808811827884
"Enol Coto (22, Racing Ferrol, Primera División RFEF 22-23)",64.32499673330098
