Player 1,Player 2,Similarity
"B. Duke (22, CF Montréal, MLS 2023)","D. Hümmet (26, Rizespor, Turkish 1. Lig 22-23)",-12.467869862809223
"B. Duke (22, CF Montréal, MLS 2023)","F. Miya (25, Rizespor, Turkish 1. Lig 22-23)",34.269328485065934
"B. Duke (22, CF Montréal, MLS 2023)","A. Aosman (28, Pendikspor, Turkish 1. Lig 22-23)",27.90678899833176
"B. Duke (22, CF Montréal, MLS 2023)","João Novais (29, Al Bataeh, UAE Pro League 22-23)",67.34054545506353
"B. Duke (22, CF Montréal, MLS 2023)","T. Dhliwayo (22, Dibba Al Fujairah, UAE Pro League 22-23)",21.358179117554304
"B. Duke (22, CF Montréal, MLS 2023)","A. Taarabt (33, Al Nasr, UAE Pro League 22-23)",43.70159906985547
"B. Duke (22, CF Montréal, MLS 2023)","F. Cartabia (30, Shabab Al Ahli Dubai, UAE Pro League 22-23)",35.0292071268542
"B. Duke (22, CF Montréal, MLS 2023)","F. Tănase (28, Al Jazira, UAE Pro League 22-23)",12.65359659184801
"B. Duke (22, CF Montréal, MLS 2023)","M. Palacios (21, Al Ain, UAE Pro League 22-23)",32.586198801487875
"B. Duke (22, CF Montréal, MLS 2023)","S. Sidibe (20, Al Wasl, UAE Pro League 22-23)",-8.667528980752499
"B. Duke (22, CF Montréal, MLS 2023)","Khalfan Mubarak (28, Al Jazira, UAE Pro League 22-23)",71.17134454533975
"B. Duke (22, CF Montréal, MLS 2023)","G. Milanov (31, Al Dhafra, UAE Pro League 22-23)",50.28917997524404
"B. Duke (22, CF Montréal, MLS 2023)","Khalid Al Baloushi (24, Al Ain, UAE Pro League 22-23)",27.178704242339048
"B. Duke (22, CF Montréal, MLS 2023)","V. Buyalskyi (30, Dynamo Kyiv, Ukrainian Premier Liha 22-23)",17.893272881712292
"B. Duke (22, CF Montréal, MLS 2023)","S. Buletsa (24, Zorya, Ukrainian Premier Liha 22-23)",46.91697297907845
"B. Duke (22, CF Montréal, MLS 2023)","Talles (25, Rukh Lviv, Ukrainian Premier Liha 22-23)",43.80462145469361
"B. Duke (22, CF Montréal, MLS 2023)","S. Bolbat (29, Kolos Kovalivka, Ukrainian Premier Liha 22-23)",67.5103856846348
"B. Duke (22, CF Montréal, MLS 2023)","D. Oliynyk (35, Vorskla, Ukrainian Premier Liha 22-23)",29.08040461197353
"B. Duke (22, CF Montréal, MLS 2023)","O. Lebedenko (33, Veres, Ukrainian Premier Liha 22-23)",16.58500717551413
"B. Duke (22, CF Montréal, MLS 2023)","S. Sharay (26, Veres, Ukrainian Premier Liha 22-23)",16.519573422062162
"B. Duke (22, CF Montréal, MLS 2023)","Y. Smyrnyi (24, Kolos Kovalivka, Ukrainian Premier Liha 22-23)",-1.40402763192474
"B. Duke (22, CF Montréal, MLS 2023)","E. Mustafaev (21, Oleksandria, Ukrainian Premier Liha 22-23)",47.38731953740773
"B. Duke (22, CF Montréal, MLS 2023)","O. Belyaev (23, Lviv, Ukrainian Premier Liha 22-23)",41.663113827093945
"B. Duke (22, CF Montréal, MLS 2023)","M. Lunyov (25, Kryvbas KR, Ukrainian Premier Liha 22-23)",26.644819244832817
"B. Duke (22, CF Montréal, MLS 2023)","S. Rodríguez (30, Peñarol, Uruguay Primera División 2023)",46.31511050187683
"B. Duke (22, CF Montréal, MLS 2023)","D. Zabala (31, Nacional, Uruguay Primera División 2023)",55.50192415359696
"B. Duke (22, CF Montréal, MLS 2023)","J. Iskandarov (29, Navbahor, Uzbek Super League 2023)",62.73042871574921
"B. Duke (22, CF Montréal, MLS 2023)","K. Iminov (23, Buxoro, Uzbek Super League 2023)",65.89934895509805
"B. Duke (22, CF Montréal, MLS 2023)","Willis Furtado (25, KTP, Veikkausliiga 2023)",24.62914272823193
"B. Duke (22, CF Montréal, MLS 2023)","J. Laine (22, Haka, Veikkausliiga 2023)",54.21165799649401
"B. Duke (22, CF Montréal, MLS 2023)","L. Vapne (19, FK Metta, Virsliga 2023)",61.74689313584477
