Player 1,Player 2,Similarity
"B. Duke (22, CF Montréal, MLS 2023)","P. Vite (21, Vancouver Whitecaps, MLS 2023)",5.42812702835197
"B. Duke (22, CF Montréal, MLS 2023)","F. Fragapane (30, Minnesota United, MLS 2023)",44.50058078942868
"B. Duke (22, CF Montréal, MLS 2023)","S. Driussi (27, Austin FC, MLS 2023)",29.16052221562732
"B. Duke (22, CF Montréal, MLS 2023)","N. Stefanelli (28, Inter Miami, MLS 2023)",58.65546208876442
"B. Duke (22, CF Montréal, MLS 2023)","X. Shaqiri (31, Chicago Fire, MLS 2023)",69.16157602909853
"B. Duke (22, CF Montréal, MLS 2023)","R. Gînsari (31, Milsami, Moldovan Super Liga 22-23)",30.655890522743828
"B. Duke (22, CF Montréal, MLS 2023)","D. Danu (20, CSF Bălți, Moldovan Super Liga 22-23)",45.125357768705896
"B. Duke (22, CF Montréal, MLS 2023)","C. Calaidjoglu (22, Sfîntul Gheorghe, Moldovan Super Liga 22-23)",57.64792328244237
"B. Duke (22, CF Montréal, MLS 2023)","V. Pavlović (29, Jezero, Montenegro First League 22-23)",-16.105834966159545
"B. Duke (22, CF Montréal, MLS 2023)","D. Božović (34, Dečić, Montenegro First League 22-23)",66.82248520614877
"B. Duke (22, CF Montréal, MLS 2023)","N. Eraković (23, Sutjeska, Montenegro First League 22-23)",39.99088739984912
"B. Duke (22, CF Montréal, MLS 2023)","A. Adžović (29, Petrovac, Montenegro First League 22-23)",39.00200358449135
"B. Duke (22, CF Montréal, MLS 2023)","Ž. Popović (23, Iskra, Montenegro First League 22-23)",41.47163301795304
"B. Duke (22, CF Montréal, MLS 2023)","O. Hajrovic (27, Jedinstvo, Montenegro First League 22-23)",49.40839908364805
"B. Duke (22, CF Montréal, MLS 2023)","A. Lucero (24, Budućnost, Montenegro First League 22-23)",62.93370386723417
"B. Duke (22, CF Montréal, MLS 2023)","V. Janketić (26, Rudar, Montenegro First League 22-23)",20.914166631958725
"B. Duke (22, CF Montréal, MLS 2023)","E. Vucaj (32, Dečić, Montenegro First League 22-23)",29.23271313420304
"B. Duke (22, CF Montréal, MLS 2023)","B. Boričić (26, Petrovac, Montenegro First League 22-23)",44.67849096029954
"B. Duke (22, CF Montréal, MLS 2023)","P. Pavlićević (23, Iskra, Montenegro First League 22-23)",1.5090166231265407
"B. Duke (22, CF Montréal, MLS 2023)","Demir Škrijelj (25, Mornar, Montenegro First League 22-23)",33.467454034585124
"B. Duke (22, CF Montréal, MLS 2023)","N. Carević (19, Petrovac, Montenegro First League 22-23)",59.148143751728696
"B. Duke (22, CF Montréal, MLS 2023)","M. Bakić (29, Budućnost, Montenegro First League 22-23)",27.84123932268964
"B. Duke (22, CF Montréal, MLS 2023)","D. Beširović (29, Mezőkövesd-Zsóry, NB I 22-23)",32.38472374276291
"B. Duke (22, CF Montréal, MLS 2023)","B. Dzsudzsák (36, Debrecen, NB I 22-23)",63.611508850700105
"B. Duke (22, CF Montréal, MLS 2023)","P. Dárdai (24, Fehérvár, NB I 22-23)",50.87527113201561
"B. Duke (22, CF Montréal, MLS 2023)","R. Makowski (26, Várda SE, NB I 22-23)",-2.205808313169652
"B. Duke (22, CF Montréal, MLS 2023)","M. Katona (23, Fehérvár, NB I 22-23)",16.8949566402449
"B. Duke (22, CF Montréal, MLS 2023)","Marquinhos (23, Ferencváros, NB I 22-23)",20.20886506473465
"B. Duke (22, CF Montréal, MLS 2023)","D. Zsótér (27, Honvéd, NB I 22-23)",69.56452433731137
"B. Duke (22, CF Montréal, MLS 2023)","A. Băluță (29, Puskás FC, NB I 22-23)",63.98896295528053
"B. Duke (22, CF Montréal, MLS 2023)","T. Nguen (29, Ferencváros, NB I 22-23)",43.73953719162788
"B. Duke (22, CF Montréal, MLS 2023)","Z. Haraszti (31, Paksi SE, NB I 22-23)",59.89146618842112
"B. Duke (22, CF Montréal, MLS 2023)","J. Levi (27, Puskás FC, NB I 22-23)",55.200730714123125
"B. Duke (22, CF Montréal, MLS 2023)","L. Jakobi (21, Újpest, NB I 22-23)",49.041258072979566
"B. Duke (22, CF Montréal, MLS 2023)","L. Houri (27, Fehérvár, NB I 22-23)",70.6775896525608
"B. Duke (22, CF Montréal, MLS 2023)","I. Bognár (32, MTK, NB II 22-23)",58.821611615099
"B. Duke (22, CF Montréal, MLS 2023)","A.  Lőrinczy (29, Diósgyőr, NB II 22-23)",71.63275108012839
"B. Duke (22, CF Montréal, MLS 2023)","B. Rácz (27, Szombathelyi Haladás, NB II 22-23)",65.65834749698945
"B. Duke (22, CF Montréal, MLS 2023)","Z. Daróczi (23, Szentlőrinc SE, NB II 22-23)",59.11209431755822
"B. Duke (22, CF Montréal, MLS 2023)","V. Gazdag (19, Csákvári TK, NB II 22-23)",50.791964079738406
"B. Duke (22, CF Montréal, MLS 2023)","M. Vitális (21, Győri ETO, NB II 22-23)",59.1440515171091
"B. Duke (22, CF Montréal, MLS 2023)","V. Sejben (26, Ajka, NB II 22-23)",10.429907460893622
"B. Duke (22, CF Montréal, MLS 2023)","D. Illés (29, Mosonmagyaróvári TE, NB II 22-23)",66.10882463125556
"B. Duke (22, CF Montréal, MLS 2023)","N. Pantović (29, Nyíregyháza Spartacus, NB II 22-23)",56.23779784979526
"B. Duke (22, CF Montréal, MLS 2023)","Márió Németh (28, Budafoki MTE, NB II 22-23)",64.68731699347352
"B. Duke (22, CF Montréal, MLS 2023)","R. Zsolnai (28, Ajka, NB II 22-23)",24.74566991007857
"B. Duke (22, CF Montréal, MLS 2023)","L. Szatmári (35, Szeged 2011, NB II 22-23)",55.27292189008324
"B. Duke (22, CF Montréal, MLS 2023)","K. Berzsenyi (19, Ajka, NB II 22-23)",11.240168529581489
"B. Duke (22, CF Montréal, MLS 2023)","K. Köböl (21, Soroksár SC, NB II 22-23)",66.02478484087707
"B. Duke (22, CF Montréal, MLS 2023)","B. Szabó (27, Kazincbarcika, NB II 22-23)",-0.1376267716853021
"B. Duke (22, CF Montréal, MLS 2023)","D. Székely (27, Kazincbarcika, NB II 22-23)",-16.334290938487015
"B. Duke (22, CF Montréal, MLS 2023)","P. Nyári (21, Siófok, NB II 22-23)",57.54169252538419
"B. Duke (22, CF Montréal, MLS 2023)","B. Bozinovski (42, Makedonija GjP, North Macedonia First League 22-23)",37.31702235247704
"B. Duke (22, CF Montréal, MLS 2023)","F. Álvarez (28, Shkupi, North Macedonia First League 22-23)",65.70153001061615
"B. Duke (22, CF Montréal, MLS 2023)","L. Stankovski (20, Rabotnički, North Macedonia First League 22-23)",42.55046985283894
"B. Duke (22, CF Montréal, MLS 2023)","M. Mircevski (26, Vardar, North Macedonia First League 22-23)",20.89051103581029
"B. Duke (22, CF Montréal, MLS 2023)","D. Todorovski (20, Rabotnički, North Macedonia First League 22-23)",41.3721698352809
"B. Duke (22, CF Montréal, MLS 2023)","F. Jusufi (27, Renova, North Macedonia First League 22-23)",36.68538719898201
"B. Duke (22, CF Montréal, MLS 2023)","Fernando Silva (31, Borec, North Macedonia First League 22-23)",22.951025417383597
"B. Duke (22, CF Montréal, MLS 2023)","E. Totre (26, Shkendija, North Macedonia First League 22-23)",34.75412423839981
"B. Duke (22, CF Montréal, MLS 2023)","K. Stojkoski (31, Rabotnički, North Macedonia First League 22-23)",47.65849930418506
"B. Duke (22, CF Montréal, MLS 2023)","L. Anderson (25, Carrick Rangers, Northern Ireland Premiership 22-23)",-10.429130844274273
"B. Duke (22, CF Montréal, MLS 2023)","R. Hale (26, Cliftonville, Northern Ireland Premiership 22-23)",37.32248910648584
"B. Duke (22, CF Montréal, MLS 2023)","L. Lynch (31, Coleraine, Northern Ireland Premiership 22-23)",61.69619401896254
"B. Duke (22, CF Montréal, MLS 2023)","J. Winchester (30, Crusaders, Northern Ireland Premiership 22-23)",5.562466469168605
"B. Duke (22, CF Montréal, MLS 2023)","S. McCartan (28, Glentoran, Northern Ireland Premiership 22-23)",48.8738793042412
"B. Duke (22, CF Montréal, MLS 2023)","R. Mayse (29, Dungannon Swifts, Northern Ireland Premiership 22-23)",65.17391728724834
"B. Duke (22, CF Montréal, MLS 2023)","J. O'Mahony (23, Coleraine, Northern Ireland Premiership 22-23)",-0.8209776512143021
"B. Duke (22, CF Montréal, MLS 2023)","C. Palmer (22, Linfield, Northern Ireland Premiership 22-23)",11.353111943562876
"B. Duke (22, CF Montréal, MLS 2023)","A. Clarke (20, Linfield, Northern Ireland Premiership 22-23)",11.264594304209332
"B. Duke (22, CF Montréal, MLS 2023)","M. O'Connor (35, Glenavon, Northern Ireland Premiership 22-23)",48.25063806028945
"B. Duke (22, CF Montréal, MLS 2023)","N. Alexandersson (21, Moss, OBOS Ligaen 2023)",64.94869231593529
"B. Duke (22, CF Montréal, MLS 2023)","A. Ali (23, Moss, OBOS Ligaen 2023)",-8.436493580852538
"B. Duke (22, CF Montréal, MLS 2023)","J. González (31, Herrera, Panama LPF 2023)",75.5128802861484
"B. Duke (22, CF Montréal, MLS 2023)","V. Pimentel (32, Sporting San Miguelito, Panama LPF 2023)",-2.4223361769262914
"B. Duke (22, CF Montréal, MLS 2023)","V. Ávila (24, Independiente, Panama LPF 2023)",63.37691815512421
"B. Duke (22, CF Montréal, MLS 2023)","J. Vélez (28, César Vallejo, Peruvian Liga 1 2023)",53.85215830038532
"B. Duke (22, CF Montréal, MLS 2023)","Ó. Barreto (30, Unión Comercio, Peruvian Liga 1 2023)",63.304109450611215
"B. Duke (22, CF Montréal, MLS 2023)","M. Lliuya (31, Sport Huancayo, Peruvian Liga 1 2023)",27.18849537754579
"B. Duke (22, CF Montréal, MLS 2023)","K. Sandoval (26, Cienciano, Peruvian Liga 1 2023)",63.74711039103318
"B. Duke (22, CF Montréal, MLS 2023)","J. Rojas (33, Deportivo Garcilaso, Peruvian Liga 1 2023)",31.28515232252084
"B. Duke (22, CF Montréal, MLS 2023)","R. Torres (31, Alianza Atlético, Peruvian Liga 1 2023)",71.87281616663525
"B. Duke (22, CF Montréal, MLS 2023)","C. Neira (22, Unión Comercio, Peruvian Liga 1 2023)",58.29657424552476
"B. Duke (22, CF Montréal, MLS 2023)","W. Mimbela (31, ADT, Peruvian Liga 1 2023)",61.78508869064001
"B. Duke (22, CF Montréal, MLS 2023)","A. Ayarza (30, Cusco, Peruvian Liga 1 2023)",-0.352272918109715
"B. Duke (22, CF Montréal, MLS 2023)","J. Sánchez (33, UTC Cajamarca, Peruvian Liga 1 2023)",50.51361092209348
"B. Duke (22, CF Montréal, MLS 2023)","D. Ramírez (28, Academia Cantolao, Peruvian Liga 1 2023)",34.24850915875758
"B. Duke (22, CF Montréal, MLS 2023)","Luis Fernández (29, Wisła Kraków, Polish I Liga 22-23)",27.51709147882088
"B. Duke (22, CF Montréal, MLS 2023)","Joan Román (30, Podbeskidzie Bielsko-Biała, Polish I Liga 22-23)",34.68765277449214
"B. Duke (22, CF Montréal, MLS 2023)","S. Steblecki (31, Chrobry Głogów, Polish I Liga 22-23)",19.06688928159036
"B. Duke (22, CF Montréal, MLS 2023)","E. Thiakane (31, Puszcza Niepołomice, Polish I Liga 22-23)",-17.819559078915407
"B. Duke (22, CF Montréal, MLS 2023)","A. Błąd (32, Katowice, Polish I Liga 22-23)",37.1994565852648
"B. Duke (22, CF Montréal, MLS 2023)","H. Adamczyk (25, Arka Gdynia, Polish I Liga 22-23)",21.452053324197067
"B. Duke (22, CF Montréal, MLS 2023)","D. Olejarka (21, Stal Rzeszów, Polish I Liga 22-23)",15.406538484297212
"B. Duke (22, CF Montréal, MLS 2023)","P. Nocoń (32, SKRA Częstochowa, Polish I Liga 22-23)",30.203513319020264
"B. Duke (22, CF Montréal, MLS 2023)","M. Marzec (28, Katowice, Polish I Liga 22-23)",9.228495435232707
"B. Duke (22, CF Montréal, MLS 2023)","M. Sitek (22, Podbeskidzie Bielsko-Biała, Polish I Liga 22-23)",-4.11077552707223
"B. Duke (22, CF Montréal, MLS 2023)","M. Janota (32, Podbeskidzie Bielsko-Biała, Polish I Liga 22-23)",56.02576666895087
"B. Duke (22, CF Montréal, MLS 2023)","H. Tomalski (29, Puszcza Niepołomice, Polish I Liga 22-23)",5.723684349532715
"B. Duke (22, CF Montréal, MLS 2023)","Ł. Janoszka (36, Ruch Chorzów, Polish I Liga 22-23)",57.1290742588345
"B. Duke (22, CF Montréal, MLS 2023)","W. Szumilas (26, Zagłębie Sosnowiec, Polish I Liga 22-23)",58.3261236484783
"B. Duke (22, CF Montréal, MLS 2023)","S. Pawłowski (36, Zagłębie Sosnowiec, Polish I Liga 22-23)",26.566573325944294
"B. Duke (22, CF Montréal, MLS 2023)","D. Hilbrycht (25, Nieciecza, Polish I Liga 22-23)",28.80075477341315
"B. Duke (22, CF Montréal, MLS 2023)","K. Drzazga (27, Podbeskidzie Bielsko-Biała, Polish I Liga 22-23)",49.18441638128594
"B. Duke (22, CF Montréal, MLS 2023)","T. Foszmańczyk (37, Ruch Chorzów, Polish I Liga 22-23)",16.558287771563663
"B. Duke (22, CF Montréal, MLS 2023)","K. Toporkiewicz (21, Sandecja Nowy Sącz, Polish I Liga 22-23)",29.35538279288292
"B. Duke (22, CF Montréal, MLS 2023)","M. Machaj (33, Chrobry Głogów, Polish I Liga 22-23)",55.17203065068299
"B. Duke (22, CF Montréal, MLS 2023)","D. Potoma (23, Sandecja Nowy Sącz, Polish I Liga 22-23)",-4.053126784198372
"B. Duke (22, CF Montréal, MLS 2023)","A. Trubeha (25, Nieciecza, Polish I Liga 22-23)",-1.7374394712294443
"B. Duke (22, CF Montréal, MLS 2023)","P. Pyrdoł (24, SKRA Częstochowa, Polish I Liga 22-23)",-2.2237023634382744
"B. Duke (22, CF Montréal, MLS 2023)","D. Kościelniak (28, Katowice, Polish I Liga 22-23)",11.180578766225096
"B. Duke (22, CF Montréal, MLS 2023)","R. Gołębiowski (21, SKRA Częstochowa, Polish I Liga 22-23)",37.784852232160695
"B. Duke (22, CF Montréal, MLS 2023)","K. Zapolnik (30, Puszcza Niepołomice, Polish I Liga 22-23)",8.69667620099664
"B. Duke (22, CF Montréal, MLS 2023)","Vasco Sousa (20, Porto II, Portugal Segunda Liga 22-23)",25.32671465552905
"B. Duke (22, CF Montréal, MLS 2023)","J. Toro (26, Academico Viseu, Portugal Segunda Liga 22-23)",8.685794712080789
"B. Duke (22, CF Montréal, MLS 2023)","D. Duarte (35, UD Oliveirense, Portugal Segunda Liga 22-23)",22.378955754420524
"B. Duke (22, CF Montréal, MLS 2023)","L.  Trabulo (28, Mafra, Portugal Segunda Liga 22-23)",10.970312189709578
"B. Duke (22, CF Montréal, MLS 2023)","Alan (23, Moreirense, Portugal Segunda Liga 22-23)",53.376181323959926
"B. Duke (22, CF Montréal, MLS 2023)","Zé Tiago (34, Sporting Covilhã, Portugal Segunda Liga 22-23)",25.301833683955227
"B. Duke (22, CF Montréal, MLS 2023)","P. Santos (27, Moreirense, Portugal Segunda Liga 22-23)",33.96885141036134
"B. Duke (22, CF Montréal, MLS 2023)","Feliz Vaz (34, Penafiel, Portugal Segunda Liga 22-23)",53.04456234105424
"B. Duke (22, CF Montréal, MLS 2023)","Adriano Castanheira (30, Penafiel, Portugal Segunda Liga 22-23)",43.63092189268004
"B. Duke (22, CF Montréal, MLS 2023)","S. Koné (22, Porto II, Portugal Segunda Liga 22-23)",31.45794093799987
"B. Duke (22, CF Montréal, MLS 2023)","Bruno Fernandes (28, Manchester United, Premier League 22-23)",49.20874913097581
"B. Duke (22, CF Montréal, MLS 2023)","M. Mount (24, Chelsea, Premier League 22-23)",42.29430517274576
"B. Duke (22, CF Montréal, MLS 2023)","J. Maddison (26, Leicester City, Premier League 22-23)",62.049251554023584
"B. Duke (22, CF Montréal, MLS 2023)","Matheus Nunes (24, Wolverhampton Wanderers, Premier League 22-23)",27.43324848861484
"B. Duke (22, CF Montréal, MLS 2023)","Lucas Paquetà (25, West Ham United, Premier League 22-23)",45.5446606489316
"B. Duke (22, CF Montréal, MLS 2023)","C. Gallagher (23, Chelsea, Premier League 22-23)",-1.2011696837218249
"B. Duke (22, CF Montréal, MLS 2023)","B. Aaronson (22, Leeds United, Premier League 22-23)",41.12078730017444
"B. Duke (22, CF Montréal, MLS 2023)","M. Gibbs-White (23, Nottingham Forest, Premier League 22-23)",62.45089578789389
"B. Duke (22, CF Montréal, MLS 2023)","E. Eze (24, Crystal Palace, Premier League 22-23)",72.1440808718792
"B. Duke (22, CF Montréal, MLS 2023)","K. Dewsbury-Hall (24, Leicester City, Premier League 22-23)",38.039592056594365
"B. Duke (22, CF Montréal, MLS 2023)","P. Billing (26, Bournemouth, Premier League 22-23)",-3.189003164753601
"B. Duke (22, CF Montréal, MLS 2023)","Andreas Pereira (27, Fulham, Premier League 22-23)",57.73283960257232
"B. Duke (22, CF Montréal, MLS 2023)","C. Alcaraz (20, Southampton, Premier League 22-23)",0.1989752187415185
"B. Duke (22, CF Montréal, MLS 2023)","J. Lingard (30, Nottingham Forest, Premier League 22-23)",9.446791961472991
"B. Duke (22, CF Montréal, MLS 2023)","João Moutinho (36, Wolverhampton Wanderers, Premier League 22-23)",49.79417528765647
"B. Duke (22, CF Montréal, MLS 2023)","T. Cairney (32, Fulham, Premier League 22-23)",27.70541227303715
"B. Duke (22, CF Montréal, MLS 2023)","F. Nabiyev (23, Kapaz, Premyer Liqa 22-23)",69.20547867880059
"B. Duke (22, CF Montréal, MLS 2023)","Leandro Andrade (23, Qarabag, Premyer Liqa 22-23)",25.51138037218704
"B. Duke (22, CF Montréal, MLS 2023)","A. Guseynov (23, Turan-T, Premyer Liqa 22-23)",58.37356712168924
"B. Duke (22, CF Montréal, MLS 2023)","M. Hamdaoui (29, Zira, Premyer Liqa 22-23)",68.70551017308242
"B. Duke (22, CF Montréal, MLS 2023)","A. Nuriev (27, Sabah, Premyer Liqa 22-23)",34.58621509109373
"B. Duke (22, CF Montréal, MLS 2023)","E. Safarov (20, Qabala, Premyer Liqa 22-23)",16.110630449397316
"B. Duke (22, CF Montréal, MLS 2023)","K. Aliev (24, Sumqayıt, Premyer Liqa 22-23)",62.37029164599299
"B. Duke (22, CF Montréal, MLS 2023)","M. Ljujić (29, Sabail, Premyer Liqa 22-23)",48.78222816827721
"B. Duke (22, CF Montréal, MLS 2023)","N. Alasgarov (28, Sabah, Premyer Liqa 22-23)",-4.391368356142852
"B. Duke (22, CF Montréal, MLS 2023)","Kady (27, Qarabag, Premyer Liqa 22-23)",62.16441683082935
"B. Duke (22, CF Montréal, MLS 2023)","Samu (27, Vizela, Primeira Liga 22-23)",33.19792977009541
"B. Duke (22, CF Montréal, MLS 2023)","K. Fujimoto (23, Gil Vicente, Primeira Liga 22-23)",49.93766116057627
"B. Duke (22, CF Montréal, MLS 2023)","A. Ruiz (29, Arouca, Primeira Liga 22-23)",63.35192370733071
"B. Duke (22, CF Montréal, MLS 2023)","Ivo Rodrigues (28, Famalicão, Primeira Liga 22-23)",38.65685798600108
"B. Duke (22, CF Montréal, MLS 2023)","João Mendes (28, Chaves, Primeira Liga 22-23)",41.66051977479368
"B. Duke (22, CF Montréal, MLS 2023)","Rafa Silva (30, Benfica, Primeira Liga 22-23)",11.173825497130965
"B. Duke (22, CF Montréal, MLS 2023)","Brais Abelenda (27, Pontevedra, Primera División RFEF 22-23)",27.04740882953888
"B. Duke (22, CF Montréal, MLS 2023)","Diego Esteban (23, SD Logroñés, Primera División RFEF 22-23)",62.75942640797805
"B. Duke (22, CF Montréal, MLS 2023)","Iker Kortajarena (22, Real Sociedad B, Primera División RFEF 22-23)",-2.0662771312706787
"B. Duke (22, CF Montréal, MLS 2023)","Agüero (27, Alcoyano, Primera División RFEF 22-23)",50.9596989115018
"B. Duke (22, CF Montréal, MLS 2023)","Álex López (35, Racing Ferrol, Primera División RFEF 22-23)",40.38644016369361
"B. Duke (22, CF Montréal, MLS 2023)","Álvaro Romero (26, Algeciras, Primera División RFEF 22-23)",48.02059818621294
"B. Duke (22, CF Montréal, MLS 2023)","Sergio Moyita (30, Alcoyano, Primera División RFEF 22-23)",61.75072376667041
"B. Duke (22, CF Montréal, MLS 2023)","Alberto Solís (25, Cultural Leonesa, Primera División RFEF 22-23)",57.09053278970562
"B. Duke (22, CF Montréal, MLS 2023)","Yelko Pino (26, Pontevedra, Primera División RFEF 22-23)",61.18337506091673
"B. Duke (22, CF Montréal, MLS 2023)","Emilio Lozano (27, SD Logroñés, Primera División RFEF 22-23)",-1.1791783503231337
"B. Duke (22, CF Montréal, MLS 2023)","Jesús Carrillo (24, Numancia, Primera División RFEF 22-23)",56.33037818148029
"B. Duke (22, CF Montréal, MLS 2023)","Adri Cuevas (33, Ceuta, Primera División RFEF 22-23)",22.88829754181788
"B. Duke (22, CF Montréal, MLS 2023)","Arnau Ortiz (21, Real Murcia, Primera División RFEF 22-23)",24.562088500514108
"B. Duke (22, CF Montréal, MLS 2023)","Juan Carlos Menudo (31, UD Logroñés, Primera División RFEF 22-23)",73.5742485894996
"B. Duke (22, CF Montréal, MLS 2023)","Raúl Blanco (21, Celta de Vigo B, Primera División RFEF 22-23)",66.97084620272915
"B. Duke (22, CF Montréal, MLS 2023)","Jorge García (30, La Nucía, Primera División RFEF 22-23)",52.71832687062074
"B. Duke (22, CF Montréal, MLS 2023)","Luis Chacón (23, Racing Ferrol, Primera División RFEF 22-23)",25.1187873230562
"B. Duke (22, CF Montréal, MLS 2023)","Álex Arias (33, CD Calahorra, Primera División RFEF 22-23)",64.06839250795551
"B. Duke (22, CF Montréal, MLS 2023)","Asier Osambela (18, Osasuna B, Primera División RFEF 22-23)",-15.411365551924566
"B. Duke (22, CF Montréal, MLS 2023)","Ander Martín (22, Real Sociedad B, Primera División RFEF 22-23)",72.83704411039244
"B. Duke (22, CF Montréal, MLS 2023)","Bicho (27, San Fernando, Primera División RFEF 22-23)",54.12436895153307
"B. Duke (22, CF Montréal, MLS 2023)","Dani Lorenzo (20, Mérida AD, Primera División RFEF 22-23)",9.9228508556742
"B. Duke (22, CF Montréal, MLS 2023)","Borja Calvo (21, La Nucía, Primera División RFEF 22-23)",-0.2033013123138954
"B. Duke (22, CF Montréal, MLS 2023)","Alain Ribeiro (25, SD Logroñés, Primera División RFEF 22-23)",-17.340242942086963
"B. Duke (22, CF Montréal, MLS 2023)","Borja Díaz (32, Unionistas de Salamanca, Primera División RFEF 22-23)",-15.400190264967868
"B. Duke (22, CF Montréal, MLS 2023)","Juan Serrano (23, Algeciras, Primera División RFEF 22-23)",3.785451387206472
"B. Duke (22, CF Montréal, MLS 2023)","Bashar Rasan (26, Qatar SC, Qatari Stars League 22-23)",41.01026874343493
"B. Duke (22, CF Montréal, MLS 2023)","Nam Tae-Hee (31, Al Duhail, Qatari Stars League 22-23)",39.99413384552122
"B. Duke (22, CF Montréal, MLS 2023)","F. Boulaya (30, Al Gharafa, Qatari Stars League 22-23)",34.60623065405611
"B. Duke (22, CF Montréal, MLS 2023)","João Carlos Teixeira (30, Umm Salal, Qatari Stars League 22-23)",68.01589329923574
"B. Duke (22, CF Montréal, MLS 2023)","F. Sassi (31, Al Duhail, Qatari Stars League 22-23)",46.35094194228528
"B. Duke (22, CF Montréal, MLS 2023)","Akram Afif (26, Al Sadd, Qatari Stars League 22-23)",31.338183881357264
"B. Duke (22, CF Montréal, MLS 2023)","Khaled Mohammed (22, Al Duhail, Qatari Stars League 22-23)",23.452493781290755
"B. Duke (22, CF Montréal, MLS 2023)","Magid Mohamed (37, Al Shamal, Qatari Stars League 22-23)",9.672021162620055
"B. Duke (22, CF Montréal, MLS 2023)","Rodrigo Barbosa Tabata (42, Al Sadd, Qatari Stars League 22-23)",38.32737648184305
"B. Duke (22, CF Montréal, MLS 2023)","A. Roman (29, CSMS Iaşi, Romanian Liga II 22-23)",65.39167246782132
"B. Duke (22, CF Montréal, MLS 2023)","G. Dodoi (24, Viitorul P. Targu Jiu, Romanian Liga II 22-23)",18.142002424927707
"B. Duke (22, CF Montréal, MLS 2023)","S. Jebari (28, Csikszereda Miercurea Ciuc, Romanian Liga II 22-23)",50.95080816718539
"B. Duke (22, CF Montréal, MLS 2023)","A. Mogoș (20, CSMS Iaşi, Romanian Liga II 22-23)",9.912340493033694
"B. Duke (22, CF Montréal, MLS 2023)","Dudu (24, AS FC Buzău, Romanian Liga II 22-23)",58.68811436098822
"B. Duke (22, CF Montréal, MLS 2023)","K. Kertanov (27, Veles, Russian FNL 2 22-23)",61.37721682020182
"B. Duke (22, CF Montréal, MLS 2023)","A. Lomakin (28, Yenisey, Russian FNL 2 22-23)",44.81620908734827
"B. Duke (22, CF Montréal, MLS 2023)","N. Abdokov (22, Kuban Krasnodar, Russian FNL 2 22-23)",12.73040432531925
"B. Duke (22, CF Montréal, MLS 2023)","M. Palienko (28, Akron Togliatti, Russian FNL 2 22-23)",44.68489418488482
"B. Duke (22, CF Montréal, MLS 2023)","M. Laykin (20, Neftekhimik, Russian FNL 2 22-23)",37.06519434298944
"B. Duke (22, CF Montréal, MLS 2023)","F. Dvoretskov (26, Neftekhimik, Russian FNL 2 22-23)",25.487906628924883
"B. Duke (22, CF Montréal, MLS 2023)","N. Kirsanov (28, Volga Ulyanovsk, Russian FNL 2 22-23)",0.3036232707762105
"B. Duke (22, CF Montréal, MLS 2023)","I. Shkolik (22, Neftekhimik, Russian FNL 2 22-23)",34.17560555455697
"B. Duke (22, CF Montréal, MLS 2023)","R. Akbashev (31, Fakel, Russian Premier League 22-23)",51.63088784131531
"B. Duke (22, CF Montréal, MLS 2023)","An. Miranchuk (27, Lokomotiv Moskva, Russian Premier League 22-23)",53.36236601206922
"B. Duke (22, CF Montréal, MLS 2023)","I. Oleynikov (24, Akhmat Grozny, Russian Premier League 22-23)",27.474157324218023
"B. Duke (22, CF Montréal, MLS 2023)","M. Ignatov (23, Spartak Moskva, Russian Premier League 22-23)",17.055263556326405
"B. Duke (22, CF Montréal, MLS 2023)","A. Troshechkin (27, Akhmat Grozny, Russian Premier League 22-23)",20.720571919247227
"B. Duke (22, CF Montréal, MLS 2023)","V. Iljin (31, Akhmat Grozny, Russian Premier League 22-23)",-1.8997238661975768
"B. Duke (22, CF Montréal, MLS 2023)","R. Vloet (28, Ural, Russian Premier League 22-23)",17.11776112199044
"B. Duke (22, CF Montréal, MLS 2023)","Y. Reyna (29, Torpedo Moskva, Russian Premier League 22-23)",48.16249163924648
"B. Duke (22, CF Montréal, MLS 2023)","Kaká (30, Al Akhdoud, Saudi First Division 22-23)",41.1360695250446
"B. Duke (22, CF Montréal, MLS 2023)","C. Amissi (33, Al Qadisiyah, Saudi First Division 22-23)",67.48530238008884
"B. Duke (22, CF Montréal, MLS 2023)","Muralha (30, Al Riyadh, Saudi First Division 22-23)",68.74979140909132
"B. Duke (22, CF Montréal, MLS 2023)","Isael (35, Al Jabalain, Saudi First Division 22-23)",75.45717856087228
"B. Duke (22, CF Montréal, MLS 2023)","Tiago Real (34, Hajer, Saudi First Division 22-23)",74.35145281086758
"B. Duke (22, CF Montréal, MLS 2023)","M. Biteghé (26, Al Sahel, Saudi First Division 22-23)",73.8294886440659
"B. Duke (22, CF Montréal, MLS 2023)","Saeed Al Zahrani (30, Al Ain, Saudi First Division 22-23)",59.1054438309262
"B. Duke (22, CF Montréal, MLS 2023)","R. Boudebouz (33, Al Ahli, Saudi First Division 22-23)",60.4823957272529
"B. Duke (22, CF Montréal, MLS 2023)","W. Al-Salama (28, Al Qaisoma, Saudi First Division 22-23)",21.989611535581957
"B. Duke (22, CF Montréal, MLS 2023)","M. Vásquez (30, Al Faisaly, Saudi First Division 22-23)",57.51852696124834
"B. Duke (22, CF Montréal, MLS 2023)","Y. El Jebli (30, Ohod, Saudi First Division 22-23)",72.68419657013285
"B. Duke (22, CF Montréal, MLS 2023)","M. Al Telihi (0, Al Kholood, Saudi First Division 22-23)",59.442210725124426
"B. Duke (22, CF Montréal, MLS 2023)","Youssef Obama (28, Al Hazem, Saudi First Division 22-23)",34.007805717342
"B. Duke (22, CF Montréal, MLS 2023)","Abdul Al Dhuwayhi (23, Jeddah, Saudi First Division 22-23)",8.481746765822763
"B. Duke (22, CF Montréal, MLS 2023)","Bander Al Qahtani (0, Al Shoalah, Saudi First Division 22-23)",22.514668024816377
"B. Duke (22, CF Montréal, MLS 2023)","Abdulhadi Al-Harajin (28, Al Hazem, Saudi First Division 22-23)",9.162335375784595
"B. Duke (22, CF Montréal, MLS 2023)","Wesam Waheab (31, Al Arabi, Saudi First Division 22-23)",16.199490460755886
