Player,Similarity
"J. Lankester (23, Cambridge United, League One 22-23)",88.06447721922221
"Jorge García (30, La Nucía, Primera División RFEF 22-23)",85.98248676159537
"C. Chaplin (26, Ipswich Town, League One 22-23)",85.60779224154695
"M. Harness (27, Ipswich Town, League One 22-23)",84.96460650916363
"Brais Abelenda (27, Pontevedra, Primera División RFEF 22-23)",84.63294057669385
"S. Pawłowski (36, Zagłębie Sosnowiec, Polish I Liga 22-23)",84.32028644813094
"D. Romanovskij (26, Šiauliai, Lithuanian A Lyga 2023)",84.18876573115959
"Hussein Faisal (24, Smouha, Egyptian Premier League 22-23)",83.82842293768508
"S. Seslar (21, Olimpija, 1. SNL 22-23)",83.66339771780686
"D. Dos Santos (20, Thun, Swiss Challenge League 22-23)",83.11285685111463
"M. Tillman (20, Rangers, Scottish Premiership 22-23)",83.05521131980714
"A. Suárez (20, Alajuelense, Costa Rica Primera División 22-23)",82.94337236832996
"T. Svetlin (21, AŠK Bravo, 1. SNL 22-23)",82.93603996392278
"A. Kotnik (27, Koper, 1. SNL 22-23)",82.73292806481703
"G. Ivanov (35, Slavia Sofia, Bulgarian First League 22-23)",82.65194517579143
"R. Wolski (30, Wisła Płock, Ekstraklasa 22-23)",82.50568605057478
"F. Colidio (23, Tigre, Argentinian Primera División 2023)",82.27152812454163
"F. Papoulis (38, Omonia Nicosia, Cyprus 1. Division 22-23)",82.1953140629882
"Joan Román (30, Podbeskidzie Bielsko-Biała, Polish I Liga 22-23)",82.16360036982256
"A. Taarabt (33, Al Nasr, UAE Pro League 22-23)",81.83089330880036
"R. Matsumura (28, Persis Solo, BRI Liga 1 22-23)",81.7699976687081
"T. Nguen (29, Ferencváros, NB I 22-23)",81.73167846254046
"O. Mongae (29, TS Galaxy FC, South Africa PSL 22-23)",80.92567033221312
"C. Wright (23, Plymouth Argyle, League One 22-23)",80.80294539396023
"V. Besuijen (21, Aberdeen, Scottish Premiership 22-23)",80.76409516356973
