Player 1,Player 2,Similarity
"B. Szabó (27, Kazincbarcika, NB II 22-23)","D. Székely (27, Kazincbarcika, NB II 22-23)",21.400548448729317
"B. Szabó (27, Kazincbarcika, NB II 22-23)","P. Nyári (21, Siófok, NB II 22-23)",-1.6929233144184967
"B. Szabó (27, Kazincbarcika, NB II 22-23)","B. Bozinovski (42, Makedonija GjP, North Macedonia First League 22-23)",16.458089989254944
"B. Szabó (27, Kazincbarcika, NB II 22-23)","F. Álvarez (28, Shkupi, North Macedonia First League 22-23)",-6.021387038180664
"B. Szabó (27, Kazincbarcika, NB II 22-23)","L. Stankovski (20, Rabotnički, North Macedonia First League 22-23)",17.064457827931527
"B. Szabó (27, Kazincbarcika, NB II 22-23)","M. Mircevski (26, Vardar, North Macedonia First League 22-23)",27.14377615735064
"B. Szabó (27, Kazincbarcika, NB II 22-23)","D. Todorovski (20, Rabotnički, North Macedonia First League 22-23)",-8.540986153888657
"B. Szabó (27, Kazincbarcika, NB II 22-23)","F. Jusufi (27, Renova, North Macedonia First League 22-23)",15.418325325959788
"B. Szabó (27, Kazincbarcika, NB II 22-23)","Fernando Silva (31, Borec, North Macedonia First League 22-23)",-17.938115076310538
"B. Szabó (27, Kazincbarcika, NB II 22-23)","E. Totre (26, Shkendija, North Macedonia First League 22-23)",-6.481135645462924
"B. Szabó (27, Kazincbarcika, NB II 22-23)","K. Stojkoski (31, Rabotnički, North Macedonia First League 22-23)",12.686926524456291
"B. Szabó (27, Kazincbarcika, NB II 22-23)","L. Anderson (25, Carrick Rangers, Northern Ireland Premiership 22-23)",45.56432847264671
"B. Szabó (27, Kazincbarcika, NB II 22-23)","R. Hale (26, Cliftonville, Northern Ireland Premiership 22-23)",30.134440620863167
"B. Szabó (27, Kazincbarcika, NB II 22-23)","L. Lynch (31, Coleraine, Northern Ireland Premiership 22-23)",7.669332052160381
"B. Szabó (27, Kazincbarcika, NB II 22-23)","J. Winchester (30, Crusaders, Northern Ireland Premiership 22-23)",33.29088470254298
"B. Szabó (27, Kazincbarcika, NB II 22-23)","S. McCartan (28, Glentoran, Northern Ireland Premiership 22-23)",43.03643153425649
"B. Szabó (27, Kazincbarcika, NB II 22-23)","R. Mayse (29, Dungannon Swifts, Northern Ireland Premiership 22-23)",28.09401023757861
"B. Szabó (27, Kazincbarcika, NB II 22-23)","J. O'Mahony (23, Coleraine, Northern Ireland Premiership 22-23)",26.495982317495336
"B. Szabó (27, Kazincbarcika, NB II 22-23)","C. Palmer (22, Linfield, Northern Ireland Premiership 22-23)",-21.077927716595344
"B. Szabó (27, Kazincbarcika, NB II 22-23)","A. Clarke (20, Linfield, Northern Ireland Premiership 22-23)",25.15838472309719
"B. Szabó (27, Kazincbarcika, NB II 22-23)","M. O'Connor (35, Glenavon, Northern Ireland Premiership 22-23)",-9.569546285225316
"B. Szabó (27, Kazincbarcika, NB II 22-23)","N. Alexandersson (21, Moss, OBOS Ligaen 2023)",4.065962618975083
"B. Szabó (27, Kazincbarcika, NB II 22-23)","A. Ali (23, Moss, OBOS Ligaen 2023)",34.32912101432641
"B. Szabó (27, Kazincbarcika, NB II 22-23)","J. González (31, Herrera, Panama LPF 2023)",1.0014886295047865
"B. Szabó (27, Kazincbarcika, NB II 22-23)","V. Pimentel (32, Sporting San Miguelito, Panama LPF 2023)",8.255997296875247
"B. Szabó (27, Kazincbarcika, NB II 22-23)","V. Ávila (24, Independiente, Panama LPF 2023)",12.528178792060237
"B. Szabó (27, Kazincbarcika, NB II 22-23)","J. Vélez (28, César Vallejo, Peruvian Liga 1 2023)",12.57576532344683
"B. Szabó (27, Kazincbarcika, NB II 22-23)","Ó. Barreto (30, Unión Comercio, Peruvian Liga 1 2023)",-10.803030093356307
"B. Szabó (27, Kazincbarcika, NB II 22-23)","M. Lliuya (31, Sport Huancayo, Peruvian Liga 1 2023)",-7.386607415685454
"B. Szabó (27, Kazincbarcika, NB II 22-23)","K. Sandoval (26, Cienciano, Peruvian Liga 1 2023)",2.818196749067634
"B. Szabó (27, Kazincbarcika, NB II 22-23)","J. Rojas (33, Deportivo Garcilaso, Peruvian Liga 1 2023)",21.68018927786912
"B. Szabó (27, Kazincbarcika, NB II 22-23)","R. Torres (31, Alianza Atlético, Peruvian Liga 1 2023)",3.2440898485791783
"B. Szabó (27, Kazincbarcika, NB II 22-23)","C. Neira (22, Unión Comercio, Peruvian Liga 1 2023)",16.06819442484443
"B. Szabó (27, Kazincbarcika, NB II 22-23)","W. Mimbela (31, ADT, Peruvian Liga 1 2023)",-0.4031470625498597
"B. Szabó (27, Kazincbarcika, NB II 22-23)","A. Ayarza (30, Cusco, Peruvian Liga 1 2023)",31.989319812501392
"B. Szabó (27, Kazincbarcika, NB II 22-23)","J. Sánchez (33, UTC Cajamarca, Peruvian Liga 1 2023)",4.6615210480881535
"B. Szabó (27, Kazincbarcika, NB II 22-23)","D. Ramírez (28, Academia Cantolao, Peruvian Liga 1 2023)",-4.067311441765628
"B. Szabó (27, Kazincbarcika, NB II 22-23)","Luis Fernández (29, Wisła Kraków, Polish I Liga 22-23)",27.142395808751825
"B. Szabó (27, Kazincbarcika, NB II 22-23)","Joan Román (30, Podbeskidzie Bielsko-Biała, Polish I Liga 22-23)",32.5314634382673
"B. Szabó (27, Kazincbarcika, NB II 22-23)","S. Steblecki (31, Chrobry Głogów, Polish I Liga 22-23)",34.224720955404166
"B. Szabó (27, Kazincbarcika, NB II 22-23)","E. Thiakane (31, Puszcza Niepołomice, Polish I Liga 22-23)",42.142903942700485
"B. Szabó (27, Kazincbarcika, NB II 22-23)","A. Błąd (32, Katowice, Polish I Liga 22-23)",25.822357199964507
"B. Szabó (27, Kazincbarcika, NB II 22-23)","H. Adamczyk (25, Arka Gdynia, Polish I Liga 22-23)",30.62279017581836
"B. Szabó (27, Kazincbarcika, NB II 22-23)","D. Olejarka (21, Stal Rzeszów, Polish I Liga 22-23)",43.98542844938577
"B. Szabó (27, Kazincbarcika, NB II 22-23)","P. Nocoń (32, SKRA Częstochowa, Polish I Liga 22-23)",42.56720309944365
"B. Szabó (27, Kazincbarcika, NB II 22-23)","M. Marzec (28, Katowice, Polish I Liga 22-23)",49.95901826033586
"B. Szabó (27, Kazincbarcika, NB II 22-23)","M. Sitek (22, Podbeskidzie Bielsko-Biała, Polish I Liga 22-23)",44.42390012488116
"B. Szabó (27, Kazincbarcika, NB II 22-23)","M. Janota (32, Podbeskidzie Bielsko-Biała, Polish I Liga 22-23)",5.188251372639282
"B. Szabó (27, Kazincbarcika, NB II 22-23)","H. Tomalski (29, Puszcza Niepołomice, Polish I Liga 22-23)",40.57743223992058
"B. Szabó (27, Kazincbarcika, NB II 22-23)","Ł. Janoszka (36, Ruch Chorzów, Polish I Liga 22-23)",-1.832834731116922
"B. Szabó (27, Kazincbarcika, NB II 22-23)","W. Szumilas (26, Zagłębie Sosnowiec, Polish I Liga 22-23)",-1.4353924529885052
"B. Szabó (27, Kazincbarcika, NB II 22-23)","S. Pawłowski (36, Zagłębie Sosnowiec, Polish I Liga 22-23)",48.54240760869466
"B. Szabó (27, Kazincbarcika, NB II 22-23)","D. Hilbrycht (25, Nieciecza, Polish I Liga 22-23)",30.980127787786344
"B. Szabó (27, Kazincbarcika, NB II 22-23)","K. Drzazga (27, Podbeskidzie Bielsko-Biała, Polish I Liga 22-23)",11.830675822007407
"B. Szabó (27, Kazincbarcika, NB II 22-23)","T. Foszmańczyk (37, Ruch Chorzów, Polish I Liga 22-23)",22.65369698962019
"B. Szabó (27, Kazincbarcika, NB II 22-23)","K. Toporkiewicz (21, Sandecja Nowy Sącz, Polish I Liga 22-23)",40.33740646473942
"B. Szabó (27, Kazincbarcika, NB II 22-23)","M. Machaj (33, Chrobry Głogów, Polish I Liga 22-23)",12.277470743607273
"B. Szabó (27, Kazincbarcika, NB II 22-23)","D. Potoma (23, Sandecja Nowy Sącz, Polish I Liga 22-23)",-6.440591521055211
"B. Szabó (27, Kazincbarcika, NB II 22-23)","A. Trubeha (25, Nieciecza, Polish I Liga 22-23)",42.30646384907759
"B. Szabó (27, Kazincbarcika, NB II 22-23)","P. Pyrdoł (24, SKRA Częstochowa, Polish I Liga 22-23)",15.549269081203764
"B. Szabó (27, Kazincbarcika, NB II 22-23)","D. Kościelniak (28, Katowice, Polish I Liga 22-23)",42.61354577817415
"B. Szabó (27, Kazincbarcika, NB II 22-23)","R. Gołębiowski (21, SKRA Częstochowa, Polish I Liga 22-23)",49.85041172461314
"B. Szabó (27, Kazincbarcika, NB II 22-23)","K. Zapolnik (30, Puszcza Niepołomice, Polish I Liga 22-23)",27.22721501583312
"B. Szabó (27, Kazincbarcika, NB II 22-23)","Vasco Sousa (20, Porto II, Portugal Segunda Liga 22-23)",-11.810936768580891
"B. Szabó (27, Kazincbarcika, NB II 22-23)","J. Toro (26, Academico Viseu, Portugal Segunda Liga 22-23)",19.82482371798304
"B. Szabó (27, Kazincbarcika, NB II 22-23)","D. Duarte (35, UD Oliveirense, Portugal Segunda Liga 22-23)",34.58588486631144
"B. Szabó (27, Kazincbarcika, NB II 22-23)","L.  Trabulo (28, Mafra, Portugal Segunda Liga 22-23)",35.26993007439408
"B. Szabó (27, Kazincbarcika, NB II 22-23)","Alan (23, Moreirense, Portugal Segunda Liga 22-23)",1.7476360237272768
"B. Szabó (27, Kazincbarcika, NB II 22-23)","Zé Tiago (34, Sporting Covilhã, Portugal Segunda Liga 22-23)",33.4663357696141
"B. Szabó (27, Kazincbarcika, NB II 22-23)","P. Santos (27, Moreirense, Portugal Segunda Liga 22-23)",26.942945135143752
"B. Szabó (27, Kazincbarcika, NB II 22-23)","Feliz Vaz (34, Penafiel, Portugal Segunda Liga 22-23)",10.630418118916094
"B. Szabó (27, Kazincbarcika, NB II 22-23)","Adriano Castanheira (30, Penafiel, Portugal Segunda Liga 22-23)",29.61728477890184
"B. Szabó (27, Kazincbarcika, NB II 22-23)","S. Koné (22, Porto II, Portugal Segunda Liga 22-23)",9.098848749881888
"B. Szabó (27, Kazincbarcika, NB II 22-23)","Bruno Fernandes (28, Manchester United, Premier League 22-23)",11.358946545195028
"B. Szabó (27, Kazincbarcika, NB II 22-23)","M. Mount (24, Chelsea, Premier League 22-23)",9.450964254114949
"B. Szabó (27, Kazincbarcika, NB II 22-23)","J. Maddison (26, Leicester City, Premier League 22-23)",20.40530387240242
"B. Szabó (27, Kazincbarcika, NB II 22-23)","Matheus Nunes (24, Wolverhampton Wanderers, Premier League 22-23)",25.24725947838693
"B. Szabó (27, Kazincbarcika, NB II 22-23)","Lucas Paquetà (25, West Ham United, Premier League 22-23)",3.142050797976434
"B. Szabó (27, Kazincbarcika, NB II 22-23)","C. Gallagher (23, Chelsea, Premier League 22-23)",14.802073581019249
"B. Szabó (27, Kazincbarcika, NB II 22-23)","B. Aaronson (22, Leeds United, Premier League 22-23)",30.426259596353077
"B. Szabó (27, Kazincbarcika, NB II 22-23)","M. Gibbs-White (23, Nottingham Forest, Premier League 22-23)",15.372539847080008
"B. Szabó (27, Kazincbarcika, NB II 22-23)","E. Eze (24, Crystal Palace, Premier League 22-23)",6.598146455311365
"B. Szabó (27, Kazincbarcika, NB II 22-23)","K. Dewsbury-Hall (24, Leicester City, Premier League 22-23)",7.284151708900582
"B. Szabó (27, Kazincbarcika, NB II 22-23)","P. Billing (26, Bournemouth, Premier League 22-23)",-9.525215802607716
"B. Szabó (27, Kazincbarcika, NB II 22-23)","Andreas Pereira (27, Fulham, Premier League 22-23)",16.121043312780774
"B. Szabó (27, Kazincbarcika, NB II 22-23)","C. Alcaraz (20, Southampton, Premier League 22-23)",48.47037239371078
"B. Szabó (27, Kazincbarcika, NB II 22-23)","J. Lingard (30, Nottingham Forest, Premier League 22-23)",1.042174254070741
"B. Szabó (27, Kazincbarcika, NB II 22-23)","João Moutinho (36, Wolverhampton Wanderers, Premier League 22-23)",-14.581840996466822
"B. Szabó (27, Kazincbarcika, NB II 22-23)","T. Cairney (32, Fulham, Premier League 22-23)",-3.156820550923562
"B. Szabó (27, Kazincbarcika, NB II 22-23)","F. Nabiyev (23, Kapaz, Premyer Liqa 22-23)",15.300935872965034
"B. Szabó (27, Kazincbarcika, NB II 22-23)","Leandro Andrade (23, Qarabag, Premyer Liqa 22-23)",15.095892254330694
"B. Szabó (27, Kazincbarcika, NB II 22-23)","A. Guseynov (23, Turan-T, Premyer Liqa 22-23)",9.879021941536196
"B. Szabó (27, Kazincbarcika, NB II 22-23)","M. Hamdaoui (29, Zira, Premyer Liqa 22-23)",1.9465953020869864
"B. Szabó (27, Kazincbarcika, NB II 22-23)","A. Nuriev (27, Sabah, Premyer Liqa 22-23)",24.334940464621265
"B. Szabó (27, Kazincbarcika, NB II 22-23)","E. Safarov (20, Qabala, Premyer Liqa 22-23)",14.352324063832985
"B. Szabó (27, Kazincbarcika, NB II 22-23)","K. Aliev (24, Sumqayıt, Premyer Liqa 22-23)",7.272851324224231
"B. Szabó (27, Kazincbarcika, NB II 22-23)","M. Ljujić (29, Sabail, Premyer Liqa 22-23)",16.734647066519106
"B. Szabó (27, Kazincbarcika, NB II 22-23)","N. Alasgarov (28, Sabah, Premyer Liqa 22-23)",29.0903996614504
"B. Szabó (27, Kazincbarcika, NB II 22-23)","Kady (27, Qarabag, Premyer Liqa 22-23)",9.21130554244017
"B. Szabó (27, Kazincbarcika, NB II 22-23)","Samu (27, Vizela, Primeira Liga 22-23)",-9.654830953977992
"B. Szabó (27, Kazincbarcika, NB II 22-23)","K. Fujimoto (23, Gil Vicente, Primeira Liga 22-23)",-0.7279866694212709
"B. Szabó (27, Kazincbarcika, NB II 22-23)","A. Ruiz (29, Arouca, Primeira Liga 22-23)",10.160682013634084
"B. Szabó (27, Kazincbarcika, NB II 22-23)","Ivo Rodrigues (28, Famalicão, Primeira Liga 22-23)",12.30899502065806
"B. Szabó (27, Kazincbarcika, NB II 22-23)","João Mendes (28, Chaves, Primeira Liga 22-23)",16.45002400137595
"B. Szabó (27, Kazincbarcika, NB II 22-23)","Rafa Silva (30, Benfica, Primeira Liga 22-23)",30.61307939530036
"B. Szabó (27, Kazincbarcika, NB II 22-23)","Brais Abelenda (27, Pontevedra, Primera División RFEF 22-23)",29.80102919042098
"B. Szabó (27, Kazincbarcika, NB II 22-23)","Diego Esteban (23, SD Logroñés, Primera División RFEF 22-23)",32.83637850936298
"B. Szabó (27, Kazincbarcika, NB II 22-23)","Iker Kortajarena (22, Real Sociedad B, Primera División RFEF 22-23)",-15.384559347730503
"B. Szabó (27, Kazincbarcika, NB II 22-23)","Agüero (27, Alcoyano, Primera División RFEF 22-23)",11.030781978353094
"B. Szabó (27, Kazincbarcika, NB II 22-23)","Álex López (35, Racing Ferrol, Primera División RFEF 22-23)",-11.302583522959846
"B. Szabó (27, Kazincbarcika, NB II 22-23)","Álvaro Romero (26, Algeciras, Primera División RFEF 22-23)",43.470208145745495
"B. Szabó (27, Kazincbarcika, NB II 22-23)","Sergio Moyita (30, Alcoyano, Primera División RFEF 22-23)",18.23588901926744
"B. Szabó (27, Kazincbarcika, NB II 22-23)","Alberto Solís (25, Cultural Leonesa, Primera División RFEF 22-23)",1.2873530569604097
"B. Szabó (27, Kazincbarcika, NB II 22-23)","Yelko Pino (26, Pontevedra, Primera División RFEF 22-23)",-8.054514953477874
"B. Szabó (27, Kazincbarcika, NB II 22-23)","Emilio Lozano (27, SD Logroñés, Primera División RFEF 22-23)",-7.6469436191734115
"B. Szabó (27, Kazincbarcika, NB II 22-23)","Jesús Carrillo (24, Numancia, Primera División RFEF 22-23)",25.84742387981482
"B. Szabó (27, Kazincbarcika, NB II 22-23)","Adri Cuevas (33, Ceuta, Primera División RFEF 22-23)",20.946824054851906
"B. Szabó (27, Kazincbarcika, NB II 22-23)","Arnau Ortiz (21, Real Murcia, Primera División RFEF 22-23)",40.34763409137643
"B. Szabó (27, Kazincbarcika, NB II 22-23)","Juan Carlos Menudo (31, UD Logroñés, Primera División RFEF 22-23)",10.853757077453007
"B. Szabó (27, Kazincbarcika, NB II 22-23)","Raúl Blanco (21, Celta de Vigo B, Primera División RFEF 22-23)",26.068109475812086
"B. Szabó (27, Kazincbarcika, NB II 22-23)","Jorge García (30, La Nucía, Primera División RFEF 22-23)",43.02445224677651
"B. Szabó (27, Kazincbarcika, NB II 22-23)","Luis Chacón (23, Racing Ferrol, Primera División RFEF 22-23)",21.954491711644167
"B. Szabó (27, Kazincbarcika, NB II 22-23)","Álex Arias (33, CD Calahorra, Primera División RFEF 22-23)",10.180300827681885
"B. Szabó (27, Kazincbarcika, NB II 22-23)","Asier Osambela (18, Osasuna B, Primera División RFEF 22-23)",21.77110204032838
"B. Szabó (27, Kazincbarcika, NB II 22-23)","Ander Martín (22, Real Sociedad B, Primera División RFEF 22-23)",13.599415491540888
"B. Szabó (27, Kazincbarcika, NB II 22-23)","Bicho (27, San Fernando, Primera División RFEF 22-23)",3.1320017343946858
"B. Szabó (27, Kazincbarcika, NB II 22-23)","Dani Lorenzo (20, Mérida AD, Primera División RFEF 22-23)",-0.9228103584882278
"B. Szabó (27, Kazincbarcika, NB II 22-23)","Borja Calvo (21, La Nucía, Primera División RFEF 22-23)",26.59490042223913
"B. Szabó (27, Kazincbarcika, NB II 22-23)","Alain Ribeiro (25, SD Logroñés, Primera División RFEF 22-23)",25.31296636650264
"B. Szabó (27, Kazincbarcika, NB II 22-23)","Borja Díaz (32, Unionistas de Salamanca, Primera División RFEF 22-23)",42.4902615935418
"B. Szabó (27, Kazincbarcika, NB II 22-23)","Juan Serrano (23, Algeciras, Primera División RFEF 22-23)",43.73094051789109
"B. Szabó (27, Kazincbarcika, NB II 22-23)","Bashar Rasan (26, Qatar SC, Qatari Stars League 22-23)",11.757208061103327
"B. Szabó (27, Kazincbarcika, NB II 22-23)","Nam Tae-Hee (31, Al Duhail, Qatari Stars League 22-23)",8.397113715740911
"B. Szabó (27, Kazincbarcika, NB II 22-23)","F. Boulaya (30, Al Gharafa, Qatari Stars League 22-23)",1.3115029765211812
"B. Szabó (27, Kazincbarcika, NB II 22-23)","João Carlos Teixeira (30, Umm Salal, Qatari Stars League 22-23)",11.91517508527269
"B. Szabó (27, Kazincbarcika, NB II 22-23)","F. Sassi (31, Al Duhail, Qatari Stars League 22-23)",4.053449677703987
"B. Szabó (27, Kazincbarcika, NB II 22-23)","Akram Afif (26, Al Sadd, Qatari Stars League 22-23)",14.84202275668892
"B. Szabó (27, Kazincbarcika, NB II 22-23)","Khaled Mohammed (22, Al Duhail, Qatari Stars League 22-23)",2.23847515978566
"B. Szabó (27, Kazincbarcika, NB II 22-23)","Magid Mohamed (37, Al Shamal, Qatari Stars League 22-23)",1.7117644540782324
"B. Szabó (27, Kazincbarcika, NB II 22-23)","Rodrigo Barbosa Tabata (42, Al Sadd, Qatari Stars League 22-23)",10.57112933584487
"B. Szabó (27, Kazincbarcika, NB II 22-23)","A. Roman (29, CSMS Iaşi, Romanian Liga II 22-23)",13.41808743425366
"B. Szabó (27, Kazincbarcika, NB II 22-23)","G. Dodoi (24, Viitorul P. Targu Jiu, Romanian Liga II 22-23)",55.66240391735192
"B. Szabó (27, Kazincbarcika, NB II 22-23)","S. Jebari (28, Csikszereda Miercurea Ciuc, Romanian Liga II 22-23)",19.658954581520067
"B. Szabó (27, Kazincbarcika, NB II 22-23)","A. Mogoș (20, CSMS Iaşi, Romanian Liga II 22-23)",34.491901547595035
"B. Szabó (27, Kazincbarcika, NB II 22-23)","Dudu (24, AS FC Buzău, Romanian Liga II 22-23)",2.9666686931768904
"B. Szabó (27, Kazincbarcika, NB II 22-23)","K. Kertanov (27, Veles, Russian FNL 2 22-23)",16.10472469616513
"B. Szabó (27, Kazincbarcika, NB II 22-23)","A. Lomakin (28, Yenisey, Russian FNL 2 22-23)",15.824021339767382
"B. Szabó (27, Kazincbarcika, NB II 22-23)","N. Abdokov (22, Kuban Krasnodar, Russian FNL 2 22-23)",38.69226733423483
"B. Szabó (27, Kazincbarcika, NB II 22-23)","M. Palienko (28, Akron Togliatti, Russian FNL 2 22-23)",12.21805925489779
"B. Szabó (27, Kazincbarcika, NB II 22-23)","M. Laykin (20, Neftekhimik, Russian FNL 2 22-23)",38.05619752503349
"B. Szabó (27, Kazincbarcika, NB II 22-23)","F. Dvoretskov (26, Neftekhimik, Russian FNL 2 22-23)",8.034662057608559
"B. Szabó (27, Kazincbarcika, NB II 22-23)","N. Kirsanov (28, Volga Ulyanovsk, Russian FNL 2 22-23)",21.512533161958856
"B. Szabó (27, Kazincbarcika, NB II 22-23)","I. Shkolik (22, Neftekhimik, Russian FNL 2 22-23)",38.48786764650233
"B. Szabó (27, Kazincbarcika, NB II 22-23)","R. Akbashev (31, Fakel, Russian Premier League 22-23)",12.737826801511265
"B. Szabó (27, Kazincbarcika, NB II 22-23)","An. Miranchuk (27, Lokomotiv Moskva, Russian Premier League 22-23)",14.959113842464026
"B. Szabó (27, Kazincbarcika, NB II 22-23)","I. Oleynikov (24, Akhmat Grozny, Russian Premier League 22-23)",45.12046139610387
"B. Szabó (27, Kazincbarcika, NB II 22-23)","M. Ignatov (23, Spartak Moskva, Russian Premier League 22-23)",24.3976264341734
"B. Szabó (27, Kazincbarcika, NB II 22-23)","A. Troshechkin (27, Akhmat Grozny, Russian Premier League 22-23)",31.470474664414866
"B. Szabó (27, Kazincbarcika, NB II 22-23)","V. Iljin (31, Akhmat Grozny, Russian Premier League 22-23)",22.67916049262483
"B. Szabó (27, Kazincbarcika, NB II 22-23)","R. Vloet (28, Ural, Russian Premier League 22-23)",35.14121723184393
"B. Szabó (27, Kazincbarcika, NB II 22-23)","Y. Reyna (29, Torpedo Moskva, Russian Premier League 22-23)",19.744198463997265
"B. Szabó (27, Kazincbarcika, NB II 22-23)","Kaká (30, Al Akhdoud, Saudi First Division 22-23)",23.931077633513866
"B. Szabó (27, Kazincbarcika, NB II 22-23)","C. Amissi (33, Al Qadisiyah, Saudi First Division 22-23)",-4.403271285620643
"B. Szabó (27, Kazincbarcika, NB II 22-23)","Muralha (30, Al Riyadh, Saudi First Division 22-23)",1.5193306409858192
"B. Szabó (27, Kazincbarcika, NB II 22-23)","Isael (35, Al Jabalain, Saudi First Division 22-23)",10.196221461417071
"B. Szabó (27, Kazincbarcika, NB II 22-23)","Tiago Real (34, Hajer, Saudi First Division 22-23)",8.279403684282634
"B. Szabó (27, Kazincbarcika, NB II 22-23)","M. Biteghé (26, Al Sahel, Saudi First Division 22-23)",-6.110605742273887
"B. Szabó (27, Kazincbarcika, NB II 22-23)","Saeed Al Zahrani (30, Al Ain, Saudi First Division 22-23)",23.172667157586258
"B. Szabó (27, Kazincbarcika, NB II 22-23)","R. Boudebouz (33, Al Ahli, Saudi First Division 22-23)",2.982835303112682
"B. Szabó (27, Kazincbarcika, NB II 22-23)","W. Al-Salama (28, Al Qaisoma, Saudi First Division 22-23)",8.56259113153891
"B. Szabó (27, Kazincbarcika, NB II 22-23)","M. Vásquez (30, Al Faisaly, Saudi First Division 22-23)",8.095392019352596
"B. Szabó (27, Kazincbarcika, NB II 22-23)","Y. El Jebli (30, Ohod, Saudi First Division 22-23)",8.699848942193519
"B. Szabó (27, Kazincbarcika, NB II 22-23)","M. Al Telihi (0, Al Kholood, Saudi First Division 22-23)",6.031021108085799
"B. Szabó (27, Kazincbarcika, NB II 22-23)","Youssef Obama (28, Al Hazem, Saudi First Division 22-23)",2.99593382755906
"B. Szabó (27, Kazincbarcika, NB II 22-23)","Abdul Al Dhuwayhi (23, Jeddah, Saudi First Division 22-23)",33.41430925454106
"B. Szabó (27, Kazincbarcika, NB II 22-23)","Bander Al Qahtani (0, Al Shoalah, Saudi First Division 22-23)",31.202357380753572
"B. Szabó (27, Kazincbarcika, NB II 22-23)","Abdulhadi Al-Harajin (28, Al Hazem, Saudi First Division 22-23)",41.70189798118082
"B. Szabó (27, Kazincbarcika, NB II 22-23)","Wesam Waheab (31, Al Arabi, Saudi First Division 22-23)",7.267717761608085
"B. Szabó (27, Kazincbarcika, NB II 22-23)","M. Hakizimana (28, Al Kholood, Saudi First Division 22-23)",27.35833776305589
"B. Szabó (27, Kazincbarcika, NB II 22-23)","K. Musona (32, Al Ta'ee, Saudi Professional League 22-23)",15.406532557170436
"B. Szabó (27, Kazincbarcika, NB II 22-23)","Igor Coronado (30, Al Ittihad, Saudi Professional League 22-23)",5.029650608080749
"B. Szabó (27, Kazincbarcika, NB II 22-23)","Anselmo (34, Al Wahda, Saudi Professional League 22-23)",23.11393750164346
"B. Szabó (27, Kazincbarcika, NB II 22-23)","C. Guanca (30, Al Shabab, Saudi Professional League 22-23)",25.062843131760403
"B. Szabó (27, Kazincbarcika, NB II 22-23)","F. Fajr (34, Al Wahda, Saudi Professional League 22-23)",-13.887562785387948
"B. Szabó (27, Kazincbarcika, NB II 22-23)","Romarinho (32, Al Ittihad, Saudi Professional League 22-23)",12.583596401422392
"B. Szabó (27, Kazincbarcika, NB II 22-23)","S. Bguir (29, Abha, Saudi Professional League 22-23)",-12.13664715746548
"B. Szabó (27, Kazincbarcika, NB II 22-23)","S. Bendebka (30, Al Fateh, Saudi Professional League 22-23)",-13.544798222367044
"B. Szabó (27, Kazincbarcika, NB II 22-23)","Kaku (28, Al Taawon, Saudi Professional League 22-23)",7.580424132554608
"B. Szabó (27, Kazincbarcika, NB II 22-23)","Ala''a Al Haji (27, Al Wahda, Saudi Professional League 22-23)",-27.377998962035733
"B. Szabó (27, Kazincbarcika, NB II 22-23)","Sami Al Najei (26, Al Nassr, Saudi Professional League 22-23)",0.8030705466801844
"B. Szabó (27, Kazincbarcika, NB II 22-23)","Cristian Tello (31, Al Fateh, Saudi Professional League 22-23)",12.020957077116252
"B. Szabó (27, Kazincbarcika, NB II 22-23)","H. Al Abdan (23, Al Khaleej, Saudi Professional League 22-23)",18.72766512352278
"B. Szabó (27, Kazincbarcika, NB II 22-23)","Rakan Al Shamlan (24, Al Batin, Saudi Professional League 22-23)",7.354945825180459
"B. Szabó (27, Kazincbarcika, NB II 22-23)","A. Roa (30, Al Batin, Saudi Professional League 22-23)",16.19058158495648
"B. Szabó (27, Kazincbarcika, NB II 22-23)","R. Crawford (28, Greenock Morton, Scottish Championship 22-23)",24.98110829406688
"B. Szabó (27, Kazincbarcika, NB II 22-23)","M. McKenna (32, Arbroath, Scottish Championship 22-23)",25.255724478944973
"B. Szabó (27, Kazincbarcika, NB II 22-23)","G. Savoury (22, Queen's Park, Scottish Championship 22-23)",17.49935872491489
"B. Szabó (27, Kazincbarcika, NB II 22-23)","K. Turner (25, Partick Thistle, Scottish Championship 22-23)",-4.417096956754374
"B. Szabó (27, Kazincbarcika, NB II 22-23)","S. Stanton (29, Raith Rovers, Scottish Championship 22-23)",35.22572307614363
"B. Szabó (27, Kazincbarcika, NB II 22-23)","N. Shaw (22, Inverness CT, Scottish Championship 22-23)",41.54146340583869
"B. Szabó (27, Kazincbarcika, NB II 22-23)","A. Doran (32, Inverness CT, Scottish Championship 22-23)",29.639056764978605
"B. Szabó (27, Kazincbarcika, NB II 22-23)","L. Vaughan (27, Raith Rovers, Scottish Championship 22-23)",44.02089942348525
"B. Szabó (27, Kazincbarcika, NB II 22-23)","C. McKinnon (20, Partick Thistle, Scottish Championship 22-23)",10.577691210527624
"B. Szabó (27, Kazincbarcika, NB II 22-23)","C. Smith (21, Hamilton Academical, Scottish Championship 22-23)",21.982501791898237
"B. Szabó (27, Kazincbarcika, NB II 22-23)","C. Mochrie (20, Dunfermline Athletic, Scottish League One 22-23)",20.55027680627979
"B. Szabó (27, Kazincbarcika, NB II 22-23)","J. Cardle (36, Kelty Hearts, Scottish League One 22-23)",30.032751467588607
"B. Szabó (27, Kazincbarcika, NB II 22-23)","C. Murray (26, Queen of the South, Scottish League One 22-23)",3.4587159337215865
"B. Szabó (27, Kazincbarcika, NB II 22-23)","L. Donnelly (27, Alloa Athletic, Scottish League One 22-23)",27.68727289686252
"B. Szabó (27, Kazincbarcika, NB II 22-23)","L. Connelly (23, Queen of the South, Scottish League One 22-23)",34.35323863092832
"B. Szabó (27, Kazincbarcika, NB II 22-23)","J. Hodge (22, Stenhousemuir, Scottish League Two 22-23)",26.999437571341588
"B. Szabó (27, Kazincbarcika, NB II 22-23)","B. Spittal (27, Motherwell, Scottish Premiership 22-23)",11.710471622164336
"B. Szabó (27, Kazincbarcika, NB II 22-23)","J. Campbell (23, Hibernian, Scottish Premiership 22-23)",32.14027873494651
