Player,Similarity
"P. Pušić (24, Grasshopper, Swiss Super League 22-23)",92.23964358843467
"Y. Benrahou (24, Hajduk Split, 1. HNL 22-23)",92.19879143912212
"C. Marrugo (37, Santa Fe, Colombian Primera Division 22-23)",91.89833073108616
"R. Ito (25, Albirex Niigata, J1 2023)",91.3171878896773
"Higor Vidal (26, Persebaya Surabaya, BRI Liga 1 22-23)",91.12468448894508
"C. Matei (31, Sepsi, SuperLiga României 22-23)",90.89227209511648
"L. Fernández (24, Toluca, Liga MX 22-23)",90.45179688901445
"S. Muzhikov (33, Tobol, Kazakh Premier League 2023)",90.28491415995234
"J. Swift (27, West Bromwich Albion, Championship 22-23)",90.10081506532494
"Márió Németh (28, Budafoki MTE, NB II 22-23)",90.02937089053417
"N. Pantović (29, Nyíregyháza Spartacus, NB II 22-23)",89.72872881452302
"Zé Valente (28, Persebaya Surabaya, BRI Liga 1 22-23)",89.63808799911325
"L. Lynch (31, Coleraine, Northern Ireland Premiership 22-23)",89.6227661494223
"B. Rácz (27, Szombathelyi Haladás, NB II 22-23)",89.58649762888345
"R. Cabella (33, Lille, Ligue 1 22-23)",89.51059243659077
"J. Maddison (26, Leicester City, Premier League 22-23)",89.3022343392568
"N. Alexandersson (21, Moss, OBOS Ligaen 2023)",89.20882563758632
"D. Zabala (31, Nacional, Uruguay Primera División 2023)",88.85268332358315
"Y. El Jebli (30, Ohod, Saudi First Division 22-23)",88.57511645362106
"J. Brandt (27, Borussia Dortmund, Bundesliga 22-23)",88.57003022972714
"A. Arena (22, Gubbio, Serie C 22-23)",88.42945026580804
"J. Byrne (27, Shamrock Rovers, League of Ireland PL 2023)",88.2717225262457
"D. Fitz (23, Austria Wien, Austrian Bundesliga 22-23)",88.21788844584135
"S. Buletsa (24, Zorya, Ukrainian Premier Liha 22-23)",88.20771637063584
"Igor Coronado (30, Al Ittihad, Saudi Professional League 22-23)",88.08543926659263
