Player,Similarity
"Y. Vorogovskiy (26, RWD Molenbeek, Belgian First Division B 22-23)",83.51419375701906
"I. Mafi (28, Jerv, OBOS Ligaen 2023)",83.42108850350367
"P. Joly (22, Dijon, Ligue 2 22-23)",81.88418131101447
"A. Davies (24, Dundalk, League of Ireland PL 2023)",79.78460924678144
"N. Abergil (32, Ironi Tiberias, Liga Leumit 22-23)",79.19877387174795
"M. Lavinier (22, Swindon Town, League Two 22-23)",79.08907599617191
"R. Kitto (28, Adelaide United, A-League Men 22-23)",78.97884921880795
"H. Bockhorn (28, Magdeburg, 2. Bundesliga 22-23)",78.82003445983543
"L. Engel (24, Silkeborg, Superliga 22-23)",78.11625398438834
"A. Dumitrescu (22, Sepsi, SuperLiga României 22-23)",78.04240546797452
"K. Alizhonov (26, Pakhtakor, Uzbek Super League 2023)",77.90787095125634
"M. Neubauer (27, Elversberg, 3. Liga 22-23)",77.52248831982085
"J. Pintado (25, Defensor Sporting, Uruguay Primera División 2023)",77.43238135607342
"M. Vešović (31, Qarabag, Premyer Liqa 22-23)",77.33048534727583
"D. Douděra (25, Slavia Praha, Czech Fortuna Liga 22-23)",76.85985122707197
"E. Hakaj (26, Vllaznia Shkodër, Albanian Premier League 22-23)",76.66282301653722
"G. Martirena (23, Liverpool, Uruguay Primera División 2023)",76.45640059067624
"R. Hutton (24, Swindon Town, League Two 22-23)",76.41401783608158
"Álvaro Fernández (20, Preston North End, Championship 22-23)",76.20278385741702
"E. Jordanov (29, Westerlo, Belgian Pro League 22-23)",76.07360226169408
"J. Čorluka (28, Zrinjski, Bosnian Premier League 22-23)",76.05829502689751
"M. Udol (27, Metz, Ligue 2 22-23)",76.04139769763509
"E. Deveney (20, Airdrieonians, Scottish League One 22-23)",76.03515076123131
"A. Bernabéi (22, Celtic, Scottish Premiership 22-23)",76.0052109942127
"Vinícius Nogueira (21, Varbergs, Allsvenskan 2023)",75.96006043346041
