Player,Similarity
"E. Abedini (24, Winterthur, Swiss Super League 22-23)",90.47110974243196
"W. Ndidi (26, Leicester City, Premier League 22-23)",82.6122431521243
"J. Arthur (23, Samgurali, Erovnuli Liga 2023)",82.14912422782334
"M. Soldo (21, FC Schaffhausen, Swiss Challenge League 22-23)",81.32967063958047
"L. N'dao (30, Stade Tunisien, Tunisian Ligue 1 22-23)",79.50740414943166
"Rafael Salama (25, Rayo Majadahonda, Primera División RFEF 22-23)",79.1850987155732
"Samuel Casais (31, Ceuta, Primera División RFEF 22-23)",78.02767028696597
"K. Koizumi (28, Tokyo, J1 2023)",77.21500754892226
"D. Dodo (19, Smouha, Egyptian Premier League 22-23)",76.87690553090401
"C. Türkmen (21, Austria Lustenau, Austrian Bundesliga 22-23)",76.69627744410587
"I. Šunjić (26, Hertha BSC, Bundesliga 22-23)",76.43229922362767
"A. Yoda (22, Hobro, Danish 1. Division 22-23)",76.13549534787086
"O. Perianu (21, Chindia Târgovişte, SuperLiga României 22-23)",75.95478147406986
"S. Cueni (22, Wil, Swiss Challenge League 22-23)",75.43394818525712
"T. Numberi (21, Dewa United, BRI Liga 1 22-23)",75.29946942880636
"S. Karkache (23, Khouribga, Botola Pro 22-23)",74.97325630964255
"K. Chimezie (27, El Daklyeh, Egyptian Premier League 22-23)",74.80808323251303
"B. Stevenson (26, Forest Green Rovers, League One 22-23)",74.7684634896176
"John Nwankwo (22, Elche, La Liga 22-23)",74.62026452235769
"A. Ralyuchenko (27, Metalist Kharkiv, Ukrainian Premier Liha 22-23)",74.54324432723398
"E. Páucar (26, Deportivo Garcilaso, Peruvian Liga 1 2023)",73.88925904082659
"T. Múdry (23, Zlaté Moravce, Slovak Super Liga 22-23)",73.57475761467315
"D. Giraldo (30, Millonarios, Colombian Primera Division 22-23)",73.50274436970948
"Ahmed Fadel (30, Al Wakrah, Qatari Stars League 22-23)",73.12045373143273
"J. Grajeda (22, Antigua GFC, Guatemala Liga Nacional 22-23)",72.73374228398775
