Player,Similarity
"R. de Paul (29, Atlético Madrid, La Liga 22-23)",93.51446369177285
"L. Görtler (28, St. Gallen, Swiss Super League 22-23)",89.85073405433519
"V. Eysseric (31, Kasımpaşa, Süper Lig 22-23)",89.48283665017615
"Y. Wadudu (28, Real Kashmir, I-League 22-23)",89.28323370943264
"S. Ezatolahi (26, Vejle, Danish 1. Division 22-23)",88.92392960646025
"Dani Alves (40, Pumas UNAM, Liga MX 22-23)",88.55911026528757
"L. Vera (26, Orenburg, Russian Premier League 22-23)",88.05441031786636
"M. Randall (33, Larne, Northern Ireland Premiership 22-23)",87.04306629976652
"D. Olaru (25, FCS Bucureşti, SuperLiga României 22-23)",86.55547907718174
"Nasser Maher (26, Future, Egyptian Premier League 22-23)",85.84211805885903
"A. Frizzell (25, Airdrieonians, Scottish League One 22-23)",85.7752877324147
"C. Rodríguez (26, Cruz Azul, Liga MX 22-23)",85.67416877812347
"A. Zorgane (23, Charleroi, Belgian Pro League 22-23)",85.27275569873963
"V. Odjidja-Ofoe (34, Gent, Belgian Pro League 22-23)",85.062475697552
"D. Steffè (26, Potenza, Serie C 22-23)",84.8302922262655
"H. Calcaterra (34, Universitario, Peruvian Liga 1 2023)",84.80149205297646
"S. Mezei (22, MTK, NB II 22-23)",84.76709216607786
"G. Acheampong (26, Mosta, Malta Premier League 22-23)",84.75142359403566
"Negueba (31, Port FC, Thai League 1 22-23)",83.392413158487
"B. Kayal (35, Bnei Sakhnin, Ligat Ha'al 22-23)",83.3595785681187
"B. Bannan (33, Sheffield Wednesday, League One 22-23)",83.32444772798976
"Octávio (29, CSKA 1948 Sofia, Bulgarian First League 22-23)",83.19144753253308
"A. Prass (22, Sturm Graz, Austrian Bundesliga 22-23)",83.16785992109031
"I. Tučević (27, Sutjeska, Montenegro First League 22-23)",83.147462314699
"A. Silva (33, Olimpia, Paraguay Division Profesional 2023)",83.11219103870454
