Player,Similarity
"Jesús Álvarez (23, Cultural Leonesa, Primera División RFEF 22-23)",78.1298500498925
"E. Zaracho (33, Sportivo Ameliano, Paraguay Division Profesional 2023)",70.40001539819552
"G. Milojko (29, Kaisar, Kazakh Premier League 2023)",68.46108646172316
"M. Grima (22, Balzan, Malta Premier League 22-23)",64.90728389319675
"G. Palace (24, Maritzburg United, South Africa PSL 22-23)",63.7817129767125
"L. O'Connor (22, Tranmere Rovers, League Two 22-23)",63.601712234285145
"Antonio Caballero (29, Córdoba, Primera División RFEF 22-23)",63.26437260471046
"S. Benchamma (22, Niort, Ligue 2 22-23)",62.95690764295124
"Alberto del Moral (22, Villarreal B, La Liga 2 22-23)",62.75981942023917
"Mostafa Gamal (32, Haras El Hodood, Egyptian Premier League 22-23)",62.47121949618387
"J. Singh (21, Kerala Blasters, Indian Super League 22-23)",62.36124945854201
"A. Bernede (24, Lausanne Sport, Swiss Challenge League 22-23)",61.90690339233673
"D. Louiserre (28, Guingamp, Ligue 2 22-23)",61.79413941221095
"C. Evans (32, Sunderland, Championship 22-23)",61.03721685725303
"D. Nejašmić (24, Osijek, 1. HNL 22-23)",60.90112246177443
"A. Tamèze (29, Hellas Verona, Serie A 22-23)",60.74167280552805
"A. Bach (25, FUS Rabat, Botola Pro 22-23)",59.93027590059864
"Kang-Hee Lee (21, Gyeongnam, K League 2 2023)",59.885227005304486
"Jaber Issa (25, Al Jabalain, Saudi First Division 22-23)",59.87747862361095
"J. Humanante (27, Guayaquil City, Ecuador Liga Pro 2023)",59.49913362031168
"J. Lerma (28, Bournemouth, Premier League 22-23)",58.912220242004686
"F. Fattori (30, Huracán, Argentinian Primera División 2023)",58.876348020510505
"J. Olivero (31, Guanacasteca, Costa Rica Primera División 22-23)",58.72832426617672
"J. Rodríguez (26, León, Liga MX 22-23)",58.594166448800834
"D. Horvath (22, Kozármisleny, NB II 22-23)",58.52485532612369
