Player,Similarity
"Ibrahim Al Zubaidi (34, Al Ahli, Saudi First Division 22-23)",89.6365501073198
"R. Chávez (28, Atlético de San Luis, Liga MX 22-23)",89.46496850844716
"F. Ponsi (22, Modena, Serie B 22-23)",86.94698074052982
"L. Arce (25, Godoy Cruz, Argentinian Primera División 2023)",86.66774485868018
"F. Giraudo (24, Cittadella, Serie B 22-23)",85.40125188546061
"R. Manuylov (27, Arsenal Tula, Russian FNL 2 22-23)",84.47351696086528
"M. Braida (26, San Lorenzo, Argentinian Primera División 2023)",83.94302035160027
"I. Yuldoshev (22, Nizhny Novgorod, Russian Premier League 22-23)",83.8905974586949
"I. Lawrence (21, Alajuelense, Costa Rica Primera División 22-23)",83.83425660990173
"M. Ruggeri (20, Atalanta, Serie A 22-23)",83.78891808860568
"S. Janssen (22, VVV Venlo, Eerste Divisie 22-23)",83.77578060370186
"G. Fuentes (26, Real Zaragoza, La Liga 2 22-23)",83.41109946624033
"A. Abramov (32, KAMAZ, Russian FNL 2 22-23)",83.35729806257815
"Fran García (30, Burgos, La Liga 2 22-23)",83.30084371708884
"P. Cornud (26, Maccabi Haifa, Ligat Ha'al 22-23)",82.94494000125744
"N. Setiawan (29, Bali United, BRI Liga 1 22-23)",82.41053426799871
"Tomás Tavares (22, Spartak Moskva, Russian Premier League 22-23)",82.26434376680226
"M. Gobeljić (30, Crvena Zvezda, Serbian SuperLiga 22-23)",82.19727850028113
"D. Hodžić (29, Radnik Surdulica, Serbian SuperLiga 22-23)",82.06795125784166
"R. Giger (25, Lausanne Sport, Swiss Challenge League 22-23)",81.57391658568311
"G. Benedetti (22, Estudiantes, Argentinian Primera División 2023)",81.25877141609307
"T. Mkhize (34, Cape Town, South Africa PSL 22-23)",81.17295405105868
"Seung-beom Ryu (23, Paju Citizen, K3 League 2023)",81.11764638501782
"L. Loor (22, Universidad Católica, Ecuador Liga Pro 2023)",80.78440959651493
"J. Medvedev (26, Slovan Bratislava, Slovak Super Liga 22-23)",80.46620858886574
