Player,Similarity
"João Mário (23, Porto, Primeira Liga 22-23)",87.92367231710118
"J. Vansteenkiste (30, Deinze, Belgian First Division B 22-23)",87.73382867293526
"S. Lárusson (31, Valur, Iceland Besta-Deild Karla 2023)",86.62988306374567
"A. Barkarson (22, SønderjyskE, Danish 1. Division 22-23)",84.31053998618565
"N. Bancu (30, Universitatea Craiova, SuperLiga României 22-23)",83.08275395745291
"T. Delaine (31, Strasbourg, Ligue 1 22-23)",82.62097249351616
"T. Teniste (35, Tartu Tammeka, Estonian Meistriliiga 2023)",81.48642648624559
"L. Blum (21, Young Boys, Swiss Super League 22-23)",80.97120498822515
"F. Kostić (30, Juventus, Serie A 22-23)",80.43034838475494
"S. Leuko (29, Nea Salamis, Cyprus 1. Division 22-23)",80.22345663525569
"T. Wiesner (25, Sparta Praha, Czech Fortuna Liga 22-23)",80.20662464040184
"W. Burns (28, Ipswich Town, League One 22-23)",79.69916405818788
"M. Kandil (29, Maccabi Tel Aviv, Ligat Ha'al 22-23)",79.65002353227086
"G. Martirena (23, Liverpool, Uruguay Primera División 2023)",79.34256911369117
"S. Pirkl (26, Blau-Weiß Linz, Austrian 2. Liga 22-23)",79.25166634750417
"J. Clauss (30, Olympique Marseille, Ligue 1 22-23)",79.2304170583089
"P. Larsen (28, HB Køge, Danish 1. Division 22-23)",79.16147481179597
"Tiago Gonçalves (22, Pontedera, Serie C 22-23)",79.15932530340044
"Saleh Al-Qumayzi (31, Al Faisaly, Saudi First Division 22-23)",79.05382376901039
"F. Ramli (30, Tampines Rovers, Singapore Premier League 2023)",79.01830744629555
"L. Görlich (23, PEC Zwolle, Eerste Divisie 22-23)",78.57047228752386
"Mohammed Al-Amri (31, Al Faisaly, Saudi First Division 22-23)",78.42205382435907
"K. Mbabu (28, Servette, Swiss Super League 22-23)",78.29934146725414
"Marcelo Dias (37, Gzira United, Malta Premier League 22-23)",78.16445018043002
"P. Dorn (26, Luzern, Swiss Super League 22-23)",78.0868869738548
