Player,Similarity
"J. Posito (33, ADT, Peruvian Liga 1 2023)",91.64223099097808
"I. Mashukov (28, Alaniya Vladikavkaz, Russian FNL 2 22-23)",89.88098235300508
"S. Kulenović (23, Lokomotiva Zagreb, 1. HNL 22-23)",89.07609155124464
"N. Haskić (33, Velež, Bosnian Premier League 22-23)",89.03147094447566
"M. de Jesús (31, Unión Comercio, Peruvian Liga 1 2023)",88.91457295767341
"M. Smith (31, Sheffield Wednesday, League One 22-23)",87.59870365813318
"N. Da Silva (26, Resistencia, Paraguay Division Profesional 2023)",87.59575672350789
"A. Kashtanov (27, Ural, Russian Premier League 22-23)",87.57429658494459
"R. Krishna (35, Bengaluru, Indian Super League 22-23)",87.47281599662347
"H. Martín (30, América, Liga MX 22-23)",87.19269621587577
"Renan Oliveira (26, Sarajevo, Bosnian Premier League 22-23)",87.0898372721927
"S. Caturano (32, Potenza, Serie C 22-23)",86.94212282054947
"O. Bogle (29, Newport County, League Two 22-23)",86.57492885651341
"G. Hirst (24, Ipswich Town, League One 22-23)",86.43380306847045
"Ahmed Al Naqbi (25, Al Ittihad Kalba, UAE Pro League 22-23)",86.11672157547574
"S. Kaba (27, Midtjylland, Superliga 22-23)",85.53271151332181
"G. Ávalos (32, Argentinos Juniors, Argentinian Primera División 2023)",85.45428105212048
"Jefferson (28, Gzira United, Malta Premier League 22-23)",85.44291565947066
"M. Kaufmann (22, Karlsruher SC, 2. Bundesliga 22-23)",85.33091531358656
"S. Harrison (25, CSMS Iaşi, Romanian Liga II 22-23)",85.23713393159333
"Z. Robinson (20, Dundee, Scottish Championship 22-23)",85.19142509974857
"L. Akins (34, Mansfield Town, League Two 22-23)",85.0569523471886
"J. Mbakogu (30, Triestina, Serie C 22-23)",85.00229585720759
"Uilliam (28, Al Kholood, Saudi First Division 22-23)",84.98821894705736
"V. Vermeij (28, Freiburg II, 3. Liga 22-23)",84.97566656814828
