Player,Similarity
"L. Stassin (18, Anderlecht II, Belgian First Division B 22-23)",90.48400409109058
"Jefferson (28, Gzira United, Malta Premier League 22-23)",89.88523762555185
"V. Osimhen (24, Napoli, Serie A 22-23)",89.69920363003669
"M. Uzuni (27, Granada, La Liga 2 22-23)",89.18465984037942
"Thiago Bezerra (36, Al Orubah, Saudi First Division 22-23)",88.54258362739547
"B. Bimenyimana (25, Kaizer Chiefs, South Africa PSL 22-23)",88.43957312925814
"R. de La Rosa (23, Pachuca, Liga MX 22-23)",88.37629710325525
"A. Isak (23, Newcastle United, Premier League 22-23)",88.34334225200996
"Jeong Woo-Geun (32, Police Tero, Thai League 1 22-23)",88.25999997765807
"A. Sowe (28, Ankaragücü, Süper Lig 22-23)",87.94929071347384
"F. Balogun (21, Reims, Ligue 1 22-23)",87.66305602735261
"A. Šporar (29, Panathinaikos, Greek Super League 22-23)",87.5685102401125
"C. Ndiaye (27, Adana Demirspor, Süper Lig 22-23)",87.49772494907944
"I. Wadji (28, Saint-Étienne, Ligue 2 22-23)",86.52331962945205
"I. Nicolăescu (24, Beitar Jerusalem, Ligat Ha'al 22-23)",86.50384223450052
"G. Bajde (29, Celje, 1. SNL 22-23)",86.38546064207287
"Y. Njie (29, Boavista, Primeira Liga 22-23)",86.37811691929446
"A. Hamdallah (32, Al Ittihad, Saudi Professional League 22-23)",86.19377793633595
"M. Krmenčík (30, Persija, BRI Liga 1 22-23)",86.19256405598546
"A. Majdevac (25, Novi Pazar, Serbian SuperLiga 22-23)",85.80486931356687
"Andre Clóvis (25, Academico Viseu, Portugal Segunda Liga 22-23)",85.76799793121339
"Rafael Silva (32, Barito Putera, BRI Liga 1 22-23)",85.69065594526911
"G. Mbenza Kamboleke (23, Al Ta'ee, Saudi Professional League 22-23)",85.37567950415306
"L. Jović (25, Fiorentina, Serie A 22-23)",85.3608431549678
"J. David (23, Lille, Ligue 1 22-23)",85.3316647208513
