Player,Similarity
"A. Amade (23, Oostende, Belgian Pro League 22-23)",79.40548659514046
"C. Chapman (28, Melbourne Victory, A-League Men 22-23)",78.64925230713436
"D. Glaby (27, Coquimbo Unido, Chilean Primera División 2023)",77.79944012807763
"C. Ortiz (34, Monterrey, Liga MX 22-23)",77.45102010001447
"M. Vorobjovas (27, Chindia Târgovişte, SuperLiga României 22-23)",76.97427830578982
"R. Abdelouahab (28, Moghreb Tétouan, Botola Pro 22-23)",76.17182623047107
"S. Singh (22, Bengaluru, Indian Super League 22-23)",75.48004994013516
"C. Twigt (20, Volendam, Eredivisie 22-23)",73.78795505726478
"B. Touré (30, Auxerre, Ligue 1 22-23)",72.54622552880873
"S. Longo (25, Belgrano, Argentinian Primera División 2023)",72.26084952069084
"M. Kabasakal (27, İstanbulspor, Süper Lig 22-23)",72.01424171101291
"Jae-Hun Choi (27, Gimpo Citizen, K League 2 2023)",71.38694210376234
"R. Cristóbal (27, River Plate, Uruguay Primera División 2023)",71.37916775120145
"K. Sibo (24, Amorebieta, Primera División RFEF 22-23)",71.2968989250502
"Y. Diarra (24, Córdoba, Primera División RFEF 22-23)",70.8435368424407
"J. Olivero (31, Guanacasteca, Costa Rica Primera División 22-23)",70.7492440616095
"M. Gönülaçar (28, Denizlispor, Turkish 1. Lig 22-23)",70.61549240355546
"T. Malepe (26, AmaZulu, South Africa PSL 22-23)",70.45687885425016
"J. Esquivel (25, Necaxa, Liga MX 22-23)",70.39754505322874
"N. Linares (27, Instituto, Argentinian Primera División 2023)",70.35906826343313
"B. Comley (27, Walsall, League Two 22-23)",70.16015890871039
"I. Mirlanbek (0, OshMU Aldier, Kyrgyz Premier League 2023)",70.01781089305909
"L. Paz (34, América de Cali, Colombian Primera Division 22-23)",69.66418691463542
"M. Frendrup (22, Genoa, Serie B 22-23)",69.17224040362832
"B. Ľupták (31, Dukla Banská Bystrica, Slovak Super Liga 22-23)",68.6156258407335
