Player,Similarity
"L. Stellwagen (24, Verl, 3. Liga 22-23)",84.85473727420889
"R. Adamski (30, Resovia Rzeszów, Polish I Liga 22-23)",84.48798173697037
"J. Maxwell (21, Doncaster Rovers, League Two 22-23)",83.33974035716898
"M. Stamatov (24, Orenburg, Russian Premier League 22-23)",81.7925092700732
"A. Poulsen (23, AaB, Superliga 22-23)",81.36997604858709
"M. Stoychev (19, Septemvri Sofia, Bulgarian First League 22-23)",79.09218936266461
"J. Gallagher (27, Austin FC, MLS 2023)",78.21574332671646
"S. Kočić (24, Kolubara, Serbian SuperLiga 22-23)",78.1233140997124
"E. Ndreca (28, Kukësi, Albanian Premier League 22-23)",77.99948240686342
"L. Hujber (23, Istra 1961, 1. HNL 22-23)",77.90835833278553
"E. Holm (22, Spezia, Serie A 22-23)",77.80886129499277
"N. Tsaroulla (24, Crawley Town, League Two 22-23)",77.72512214786603
"N. Williams (22, Nottingham Forest, Premier League 22-23)",77.5780222255913
"F. Yeats (19, Falkirk, Scottish League One 22-23)",77.06046483713583
"H. Milne (26, Partick Thistle, Scottish Championship 22-23)",76.91052674336596
"C. Braun (31, CFR Cluj, SuperLiga României 22-23)",76.87078069273063
"G. Masouras (26, Miedź Legnica, Ekstraklasa 22-23)",76.78197975610718
"A. Dedić (20, Salzburg, Austrian Bundesliga 22-23)",76.69531741270204
"Diogo Tavares (25, Belenenses, Portugal Segunda Liga 22-23)",76.6688378326623
"Diego Moreno (21, Osasuna B, Primera División RFEF 22-23)",76.62505743540133
"M. Millar (26, Macarthur, A-League Men 22-23)",76.59310164973549
"Álvaro Fernández (20, Preston North End, Championship 22-23)",76.26732482121923
"A. Balaruban (21, Neuchâtel Xamax, Swiss Challenge League 22-23)",76.12058481461858
"A. Taha (21, Kfar Kasem, Liga Leumit 22-23)",76.02303887165581
"M. Poaty (25, RFC Seraing, Belgian Pro League 22-23)",75.94889975392559
