Player,Similarity
"A. Salem (23, Bnei Yehuda, Liga Leumit 22-23)",92.51475835635163
"S. Zúñiga (26, Alajuelense, Costa Rica Primera División 22-23)",92.40805372771624
"N. Serdal (30, Hapoel Umm al-Fahm, Liga Leumit 22-23)",92.05108892632614
"A. Kruja (29, Vllaznia Shkodër, Albanian Premier League 22-23)",92.0236814575314
"J. Edwards (22, Dunfermline Athletic, Scottish League One 22-23)",91.37414734144598
"K. MacDonald (23, Dunfermline Athletic, Scottish League One 22-23)",91.11276124817786
"B. Barišić (30, Rangers, Scottish Premiership 22-23)",90.88838219415712
"R. Hutton (24, Swindon Town, League Two 22-23)",90.55899027554378
"A. Ndrecka (21, Pro Patria, Serie C 22-23)",90.28055983571556
"D. Church (22, Alloa Athletic, Scottish League One 22-23)",90.14637180514836
"E. Hakaj (26, Vllaznia Shkodër, Albanian Premier League 22-23)",89.90623560457756
"J. Čorluka (28, Zrinjski, Bosnian Premier League 22-23)",89.69521931510994
"Y. Armougom (25, Sochaux, Ligue 2 22-23)",89.57872036727606
"I. Touray (28, Salford City, League Two 22-23)",89.4923114478248
"M. Johnson (32, Sheffield Wednesday, League One 22-23)",89.17960736306144
"I. Miličević (24, Lokomotiva Zagreb, 1. HNL 22-23)",89.16969329018883
"M. Cicconi (25, Carrarese, Serie C 22-23)",89.05091788129064
"P. Fall (22, Valmiera FC, Virsliga 2023)",88.96924841100521
"O. Viteritti (29, Monopoli, Serie C 22-23)",88.86686848391679
"R. Camenzuli (28, Hamrun Spartans, Malta Premier League 22-23)",88.82497003125552
"Joel Pereira (26, Lech Poznań, Ekstraklasa 22-23)",88.8122729914662
"S. Medgyes (29, Diósgyőr, NB II 22-23)",88.77639798316196
"T. Gjertsen (31, Kristiansund, OBOS Ligaen 2023)",88.77492515411149
"D. Ulrich (25, Vaduz, Swiss Challenge League 22-23)",88.74875004963604
"E. Hajsafi (33, AEK Athens, Greek Super League 22-23)",88.59618827643177
