Player,Similarity
"J. Maggiotti (27, Laval, Ligue 2 22-23)",79.45482473770348
"C. Rodríguez (26, Cruz Azul, Liga MX 22-23)",78.26228975713373
"B. Bannan (33, Sheffield Wednesday, League One 22-23)",77.94769174122116
"D. Šovšić (33, Cheonan City, K League 2 2023)",75.56334706538335
"C. Ojeda (27, Iztapa, Guatemala Liga Nacional 22-23)",75.27912945486555
"L. Refaelov (37, Anderlecht, Belgian Pro League 22-23)",75.18477166152768
"Dani Alves (40, Pumas UNAM, Liga MX 22-23)",75.16015088854174
"K. De Bruyne (31, Manchester City, Premier League 22-23)",75.03140844656564
"A. Tessiore (23, Triestina, Serie C 22-23)",74.92062940854777
"I. Bel Hassani (30, RKC Waalwijk, Eredivisie 22-23)",74.58678978473681
"Fidel (33, Elche, La Liga 22-23)",74.28514494297886
"A. Dybevik (25, Bryne, OBOS Ligaen 2023)",74.27409295631873
"A. Kuen (28, Atromitos, Greek Super League 22-23)",74.2682246559143
"Sergi Darder (29, Espanyol, La Liga 22-23)",74.22240340069274
"Nasser Maher (26, Future, Egyptian Premier League 22-23)",74.12051395102631
"G. Acheampong (26, Mosta, Malta Premier League 22-23)",73.95367244063839
"R. de Paul (29, Atlético Madrid, La Liga 22-23)",73.7740104036991
"S. Shopov (21, CSKA Sofia, Bulgarian First League 22-23)",73.74155096260863
"M. Levi (22, Maccabi Petah Tikva, Liga Leumit 22-23)",73.65852930235232
"N. Stanciu (30, Wuhan Three Towns, Chinese Super League 2023)",73.63923268716339
"M. Randall (33, Larne, Northern Ireland Premiership 22-23)",73.58072557149703
"D. Steffè (26, Potenza, Serie C 22-23)",72.97052176908055
"S. Ezatolahi (26, Vejle, Danish 1. Division 22-23)",72.95377073642074
"Miguel Luís (24, Warta Poznań, Ekstraklasa 22-23)",72.71510890731615
"M. Pospíšil (31, Jagiellonia Białystok, Ekstraklasa 22-23)",72.60839017670186
