Player,Similarity
"R. Saito (30, Blaublitz Akita, J2 2023)",68.58943005941416
"F. Hadzhiyev (24, Turan-T, Premyer Liqa 22-23)",68.28916584245336
"S. Sarıkaya (25, Altay, Turkish 1. Lig 22-23)",64.90588810874536
"J. Currie (20, AFC Wimbledon, League Two 22-23)",63.71919303607873
"K. Agustín (26, Xinabajul, Guatemala Liga Nacional 22-23)",63.32348864513553
"E. Kharin (27, Akhmat Grozny, Russian Premier League 22-23)",62.45831016337022
"Hussain Abbas Juma (28, Bani Yas, UAE Pro League 22-23)",62.05098581753133
"Saleh Al Nashmi (27, Al Sahel, Saudi First Division 22-23)",61.80438115840894
"C. Bayrak (23, BB Erzurumspor, Turkish 1. Lig 22-23)",60.72535828438013
"G. Vaglica (20, Pro Sesto, Serie C 22-23)",60.35425130554012
"Z. Ashworth (20, Burton Albion, League One 22-23)",60.11641902265848
"Fran Rodríguez (28, Unionistas de Salamanca, Primera División RFEF 22-23)",59.616271769673865
"A. Fangaj (25, Egnatia Rrogozhinë, Albanian Premier League 22-23)",59.59667372741306
"D. Kornyushin (21, Nizhny Novgorod, Russian Premier League 22-23)",59.58974217476565
"G. Kamel (28, Pharco, Egyptian Premier League 22-23)",59.568670488570376
"A. Idrus (30, Bali United, BRI Liga 1 22-23)",59.42134290015836
"I. Mitran (21, Slatina, Romanian Liga II 22-23)",59.38360749547953
"A. Danek (28, Korona Kielce, Ekstraklasa 22-23)",59.13164240475628
"J. Mirkovic (21, Arsenal Tivat, Montenegro First League 22-23)",58.98224085484325
"K. Kállai (21, Mezőkövesd-Zsóry, NB I 22-23)",58.67933818007389
"M. Shiels (22, Hamilton Academical, Scottish Championship 22-23)",58.462337468978085
"T. Warren (24, Barrow, League Two 22-23)",58.337760597866605
"Z. Milic (25, Leotar, Bosnian Premier League 22-23)",58.054069303645086
"Y. Güreler (31, Ankaragücü, Süper Lig 22-23)",58.03139516750173
"N. Sperotto (31, Olbia, Serie C 22-23)",57.99405083641712
