Player,Similarity
"J. Falkingham (32, Harrogate Town, League Two 22-23)",81.36107090080633
"S. Allardice (25, Inverness CT, Scottish Championship 22-23)",80.97611876471777
"A. Power (35, Kilmarnock, Scottish Premiership 22-23)",80.76969166763479
"A. Lucero (38, Enosis, Cyprus 1. Division 22-23)",78.8802173916882
"R. Petrović (34, Ordabasy, Kazakh Premier League 2023)",78.3377257464718
"M. García (26, Floriana, Malta Premier League 22-23)",78.24391154156935
"C. Balgiu (28, CSA Steaua Bucureşti, Romanian Liga II 22-23)",77.94250582248297
"J. De Sart (28, Gent, Belgian Pro League 22-23)",77.75096038739242
"Pedro Capó (32, Eldense, Primera División RFEF 22-23)",77.71402410880017
"M. Jansen (30, Zwickau, 3. Liga 22-23)",77.51357569257334
"B. Berríos (25, Everton, Chilean Primera División 2023)",76.90482515454329
"M. Mellado (30, OFI, Greek Super League 22-23)",76.86843724348674
"A. Harmach (30, UTS Rabat, Botola Pro 22-23)",75.70337718861579
"M. de Roon (32, Atalanta, Serie A 22-23)",75.45538140249958
"K. Kakashvili (29, Gagra, Erovnuli Liga 2023)",75.27243550550014
"J. Güemez (31, Atlético de San Luis, Liga MX 22-23)",74.91017623981885
"A. Bernede (24, Lausanne Sport, Swiss Challenge League 22-23)",74.51650276906192
"M. Timm (31, Orlando Pirates, South Africa PSL 22-23)",74.39216716731353
"Marc Montalvo (21, Gimnàstic Tarragona, Primera División RFEF 22-23)",74.37856921857538
"M. Brandner (28, Blau-Weiß Linz, Austrian 2. Liga 22-23)",74.29209425926273
"R. Mulumba (30, Bandırmaspor, Turkish 1. Lig 22-23)",74.2907707579163
"J. Van Damme (31, SK Beveren, Belgian First Division B 22-23)",74.11571728323109
"M. Panos (26, Csikszereda Miercurea Ciuc, Romanian Liga II 22-23)",74.02686041692806
"S. Zdjelar (28, CSKA Moskva, Russian Premier League 22-23)",73.84546669323353
"S. Matei (24, Progresul Spartac, Romanian Liga II 22-23)",73.40361127393729
