Player,Similarity
"T. Mangani (36, Ajaccio, Ligue 1 22-23)",80.57988024600658
"S. Khemissi (23, Stade Tunisien, Tunisian Ligue 1 22-23)",80.4195852698589
"Sang-Hyeob Lee (33, Paju Citizen, K3 League 2023)",79.02784111955057
"T. Conlon (27, Port Vale, League One 22-23)",78.97496941062727
"Paulo Estrela (24, Portimonense, Primeira Liga 22-23)",78.81442189092061
"J. Valverde (24, El Nacional, Ecuador Liga Pro 2023)",78.4521920699001
"A. Chhetri (23, RoundGlass Punjab FC, I-League 22-23)",77.88621286306397
"Toni Arranz (29, Numancia, Primera División RFEF 22-23)",77.82094452676608
"J. Pedroza (24, Al Batin, Saudi Professional League 22-23)",77.24580231023089
"I. Đorić (27, Sloga Doboj, Bosnian Premier League 22-23)",76.48539334096347
"Erick Pluas (21, Orense, Ecuador Liga Pro 2023)",76.4674797174751
"J. Brenes (26, Herediano, Costa Rica Primera División 22-23)",75.29953126984826
"E. Aydoğan (25, Altınordu, Turkish 1. Lig 22-23)",75.15489657461164
"Borja Domínguez (30, Pontevedra, Primera División RFEF 22-23)",75.1047780252248
"G. Notsuda (28, Sanfrecce Hiroshima, J1 2023)",74.71962896351343
"José Ángel Jurado (30, Tenerife, La Liga 2 22-23)",74.68820005728895
"Héctor Nespral (30, Unionistas de Salamanca, Primera División RFEF 22-23)",74.56690944668
"C. Cásseres (23, New York RB, MLS 2023)",74.52437641650307
"N. Jambor (27, Slaven Belupo, 1. HNL 22-23)",74.09115335152056
"M. Healy (21, Cork City, League of Ireland PL 2023)",74.07832770815676
"S. Johansen (32, Queens Park Rangers, Championship 22-23)",73.9116936534027
"F. Zuqui (31, Estudiantes, Argentinian Primera División 2023)",73.87148610574792
"J. Smeets (28, Almere City, Eerste Divisie 22-23)",73.83145137417945
"S. Abimanyu (23, Persija, BRI Liga 1 22-23)",73.46994073499916
"M. Veloso (31, Neuchâtel Xamax, Swiss Challenge League 22-23)",72.9004128982772
