Player,Similarity
"A. Timovski (28, Sileks, North Macedonia First League 22-23)",93.30521864738556
"R. Strain (26, St. Mirren, Scottish Premiership 22-23)",93.19394973457408
"K. Wołkowicz (28, Tychy 71, Polish I Liga 22-23)",92.78765472605252
"F. Costa (28, Foggia, Serie C 22-23)",91.5254551017248
"D. Andrew (32, Fleetwood Town, League One 22-23)",91.26619370099972
"Iker Seguín (33, Amorebieta, Primera División RFEF 22-23)",91.08762292747232
"Tiago André (26, Trofense, Portugal Segunda Liga 22-23)",91.0396654144281
"F. Lepore (37, Lecco, Serie C 22-23)",90.95379822487624
"A. Büttner (34, De Graafschap, Eerste Divisie 22-23)",90.35276130575856
"K. Pileas (24, Aris, Cyprus 1. Division 22-23)",90.03873511283447
"D. Kabutov (31, Rubin Kazan', Russian FNL 2 22-23)",89.8355834523996
"T. Mohr (27, Schalke 04, Bundesliga 22-23)",89.54417299929833
"N. Kreuzer (30, Hallescher FC, 3. Liga 22-23)",89.31034427540145
"Carlos Calderón (28, CD Badajoz, Primera División RFEF 22-23)",89.24042001151753
"M. Calderoni (34, Cesena, Serie C 22-23)",89.05713019399045
"Iñaki Sáenz (35, UD Logroñés, Primera División RFEF 22-23)",88.97683371316707
"A. Batsula (31, Vorskla, Ukrainian Premier Liha 22-23)",88.7662350298776
"L. Lukačević (24, Admira, Austrian 2. Liga 22-23)",88.75222838566108
"R. Brady (31, Preston North End, Championship 22-23)",88.71099697300862
"Ali Fawzi (31, ENPPI, Egyptian Premier League 22-23)",88.69369675543821
"A. Driscoll-Glennon (23, Grimsby Town, League Two 22-23)",88.37398118460783
"C. Trimmel (36, Union Berlin, Bundesliga 22-23)",88.15471920199215
"B. Gergényi (25, Zalaegerszegi TE, NB I 22-23)",87.94405869166364
"D. Gojny (28, Arka Gdynia, Polish I Liga 22-23)",87.68709372140785
"H. Siquet (20, Cercle Brugge, Belgian Pro League 22-23)",87.59792070261167
