Player,Similarity
"Seong-ho Choi (22, Pyeongtaek Citizen, K4 League 2023)",68.01897866533031
"E. Leopold (22, Hannover 96, 2. Bundesliga 22-23)",66.87665231020134
"B. Vachiberadze (27, Metalist 1925 Kharkiv, Ukrainian Premier Liha 22-23)",62.23435525901056
"S. Nakamura (29, Avispa Fukuoka, J1 2023)",62.10790246186883
"P. Sieben (23, Roda JC, Eerste Divisie 22-23)",61.46895202629247
"M. Shyshka (28, Minaj, Ukrainian Premier Liha 22-23)",57.92052308619988
"A. Gabelok (28, Metalist 1925 Kharkiv, Ukrainian Premier Liha 22-23)",56.82100482285543
"A. Cierpka (28, Concordia Chiajna, Romanian Liga II 22-23)",56.71726522764892
"Hamad Al Obaidi (32, Al Sailiya, Qatari Stars League 22-23)",56.67484532619754
"M. Arfan (25, PSM, BRI Liga 1 22-23)",53.81632102411357
"J. Toba (23, Lernayin Artsakh, Armenian Premier League 22-23)",52.57367618594421
"Nawaf Al Harthi (24, Al Ain, Saudi First Division 22-23)",52.241727416992
"N. Kiss (19, Duna Aszfalt Tiszakécskei, NB II 22-23)",52.028980310966745
"A. Ahmetaj (23, Gorica, 1. SNL 22-23)",51.51891349255724
"Javi Ros (33, Rayo Majadahonda, Primera División RFEF 22-23)",51.36541785678356
"Z. Yildirim (32, Altay, Turkish 1. Lig 22-23)",51.31973395639287
"Zimbabwe (28, Sporting Covilhã, Portugal Segunda Liga 22-23)",50.75645118804019
"I. Baba (27, Mallorca, La Liga 22-23)",50.74494760983082
"Ho Wai Loon (29, Balestier Khalsa, Singapore Premier League 2023)",49.8191033733182
"G. Nutz (29, Lafnitz, Austrian 2. Liga 22-23)",49.73133958422741
"D. Manoyan (32, Van, Armenian Premier League 22-23)",49.5150896494315
"Omar Al Emadi (28, Qatar SC, Qatari Stars League 22-23)",49.03392007667738
"A. Hernández (36, La Luz, Uruguay Primera División 2023)",48.790108505062655
"J. Arthur (25, Gudja United, Malta Premier League 22-23)",48.53341477612725
"Javi Serrano (20, Ibiza, La Liga 2 22-23)",48.337496571083896
