Player 1,Player 2,Similarity
"D. Stensson (26, Sirius, Allsvenskan 2023)","H. Larsson (18, Malmö FF, Allsvenskan 2023)",21.97983387960064
"D. Stensson (26, Sirius, Allsvenskan 2023)","S. Peña (27, Malmö FF, Allsvenskan 2023)",60.474520675526975
"D. Stensson (26, Sirius, Allsvenskan 2023)","Sam. Gustafson (28, Häcken, Allsvenskan 2023)",43.91384788142348
"D. Stensson (26, Sirius, Allsvenskan 2023)","A. Traustason (30, IFK Norrköping, Allsvenskan 2023)",-26.41181169558545
"D. Stensson (26, Sirius, Allsvenskan 2023)","L. Sadiku (31, Hammarby, Allsvenskan 2023)",7.174480508972829
"D. Stensson (26, Sirius, Allsvenskan 2023)","J. Roche (22, Sirius, Allsvenskan 2023)",-8.06115999173179
"D. Stensson (26, Sirius, Allsvenskan 2023)","A. Carlén (22, IFK Göteborg, Allsvenskan 2023)",15.376347185174952
"D. Stensson (26, Sirius, Allsvenskan 2023)","Joao Teixeira (26, Ordino, Andorra Primera Divisió 22-23)",6.690815312636487
"D. Stensson (26, Sirius, Allsvenskan 2023)","Sergio Mendoza (29, UE Santa Coloma, Andorra Primera Divisió 22-23)",7.753215534418525
"D. Stensson (26, Sirius, Allsvenskan 2023)","Daniel Toribio (34, FC Santa Coloma, Andorra Primera Divisió 22-23)",20.002188477180237
"D. Stensson (26, Sirius, Allsvenskan 2023)","Víctor Alonso (28, Atlètic Club d'Escaldes, Andorra Primera Divisió 22-23)",18.331870963741785
"D. Stensson (26, Sirius, Allsvenskan 2023)","H. Ryahi (29, Atlètic Club d'Escaldes, Andorra Primera Divisió 22-23)",-0.7835152540563486
"D. Stensson (26, Sirius, Allsvenskan 2023)","Youssef El Ghzaoui (22, UE Santa Coloma, Andorra Primera Divisió 22-23)",0.9880928506262188
"D. Stensson (26, Sirius, Allsvenskan 2023)","K. Tassin (25, Sant Julià, Andorra Primera Divisió 22-23)",-38.40560860282201
"D. Stensson (26, Sirius, Allsvenskan 2023)","J. Rodríguez (27, Estudiantes, Argentinian Primera División 2023)",13.828122716927076
"D. Stensson (26, Sirius, Allsvenskan 2023)","J. Sforza (21, Newell's Old Boys, Argentinian Primera División 2023)",16.68400847081599
"D. Stensson (26, Sirius, Allsvenskan 2023)","G. Abrego (23, Godoy Cruz, Argentinian Primera División 2023)",-0.1806394059116036
"D. Stensson (26, Sirius, Allsvenskan 2023)","T. Belmonte (25, Lanús, Argentinian Primera División 2023)",-24.132708477804343
"D. Stensson (26, Sirius, Allsvenskan 2023)","F. Peña Biafore (22, Arsenal de Srandí, Argentinian Primera División 2023)",-37.38541891098413
"D. Stensson (26, Sirius, Allsvenskan 2023)","K. Gutiérrez (25, Defensa y Justicia, Argentinian Primera División 2023)",27.4244616763516
"D. Stensson (26, Sirius, Allsvenskan 2023)","F. Moyano (25, Argentinos Juniors, Argentinian Primera División 2023)",3.649698419016375
"D. Stensson (26, Sirius, Allsvenskan 2023)","E. Pérez (37, River Plate, Argentinian Primera División 2023)",34.391991708569655
"D. Stensson (26, Sirius, Allsvenskan 2023)","G. Acosta (34, Atlético Tucumán, Argentinian Primera División 2023)",10.010034562582936
"D. Stensson (26, Sirius, Allsvenskan 2023)","A. Varela (21, Boca Juniors, Argentinian Primera División 2023)",-3.948234291069117
"D. Stensson (26, Sirius, Allsvenskan 2023)","J. López (23, Defensa y Justicia, Argentinian Primera División 2023)",-9.625646373235432
"D. Stensson (26, Sirius, Allsvenskan 2023)","J. Florentín (26, Vélez Sarsfield, Argentinian Primera División 2023)",6.39074763686178
"D. Stensson (26, Sirius, Allsvenskan 2023)","I. Miramón (19, Gimnasia La Plata, Argentinian Primera División 2023)",-2.3644289802481637
"D. Stensson (26, Sirius, Allsvenskan 2023)","A. Moreno (24, Racing Club, Argentinian Primera División 2023)",9.65806393206042
"D. Stensson (26, Sirius, Allsvenskan 2023)","R. Aliendro (32, River Plate, Argentinian Primera División 2023)",37.95131814236825
"D. Stensson (26, Sirius, Allsvenskan 2023)","B. Leyes (21, Godoy Cruz, Argentinian Primera División 2023)",5.087900827690584
"D. Stensson (26, Sirius, Allsvenskan 2023)","A. Bolívar (27, Gimnasia La Plata, Argentinian Primera División 2023)",-37.03429516825043
"D. Stensson (26, Sirius, Allsvenskan 2023)","B. Kociubinski (22, Atlético Tucumán, Argentinian Primera División 2023)",0.8196058196234226
"D. Stensson (26, Sirius, Allsvenskan 2023)","I. Rossi (29, Platense, Argentinian Primera División 2023)",-26.07520877817209
"D. Stensson (26, Sirius, Allsvenskan 2023)","J. Chicco (25, Colón, Argentinian Primera División 2023)",11.302803133950176
"D. Stensson (26, Sirius, Allsvenskan 2023)","C. Zabala (25, Tigre, Argentinian Primera División 2023)",21.394809907010963
"D. Stensson (26, Sirius, Allsvenskan 2023)","A. Cardozo (26, Tigre, Argentinian Primera División 2023)",-19.73395456241861
"D. Stensson (26, Sirius, Allsvenskan 2023)","F. Díaz (22, Platense, Argentinian Primera División 2023)",10.02343855810435
"D. Stensson (26, Sirius, Allsvenskan 2023)","F. Redondo (20, Argentinos Juniors, Argentinian Primera División 2023)",9.116486276111848
"D. Stensson (26, Sirius, Allsvenskan 2023)","U. Iwu (23, Urartu, Armenian Premier League 22-23)",19.14331447944675
"D. Stensson (26, Sirius, Allsvenskan 2023)","D. Aghbalyan (24, BKMA, Armenian Premier League 22-23)",-14.50039827048419
"D. Stensson (26, Sirius, Allsvenskan 2023)","A. Grigoryan (35, Alashkert, Armenian Premier League 22-23)",-2.940440544832647
"D. Stensson (26, Sirius, Allsvenskan 2023)","K. Sow (23, Lernayin Artsakh, Armenian Premier League 22-23)",11.949558080437482
"D. Stensson (26, Sirius, Allsvenskan 2023)","G. Malakyan (28, Ararat, Armenian Premier League 22-23)",46.7180769000313
"D. Stensson (26, Sirius, Allsvenskan 2023)","R. Baghramyan (20, Noah, Armenian Premier League 22-23)",-29.25766194140183
"D. Stensson (26, Sirius, Allsvenskan 2023)","S. Shahinyan (27, Alashkert, Armenian Premier League 22-23)",59.70872341702825
"D. Stensson (26, Sirius, Allsvenskan 2023)","N. Aghasaryan (21, Urartu, Armenian Premier League 22-23)",69.41852189902797
"D. Stensson (26, Sirius, Allsvenskan 2023)","M. Perchtold (34, Grazer AK, Austrian 2. Liga 22-23)",3.2001168226033565
"D. Stensson (26, Sirius, Allsvenskan 2023)","D. Saurer (22, Sturm Graz II, Austrian 2. Liga 22-23)",2.3589712247394945
"D. Stensson (26, Sirius, Allsvenskan 2023)","L. Mätzler (21, Dornbirn, Austrian 2. Liga 22-23)",-16.204910028281265
"D. Stensson (26, Sirius, Allsvenskan 2023)","K. Abazović (19, First Vienna, Austrian 2. Liga 22-23)",-25.55366744944284
"D. Stensson (26, Sirius, Allsvenskan 2023)","D. Bosnjak (26, Rapid Wien II, Austrian 2. Liga 22-23)",37.93737630481559
"D. Stensson (26, Sirius, Allsvenskan 2023)","T. Sahin (18, Liefering, Austrian 2. Liga 22-23)",31.43427962220888
"D. Stensson (26, Sirius, Allsvenskan 2023)","K. Conté (23, St. Pölten, Austrian 2. Liga 22-23)",21.865564416767672
"D. Stensson (26, Sirius, Allsvenskan 2023)","N. Sattlberger (19, Rapid Wien II, Austrian 2. Liga 22-23)",-13.233008388855422
"D. Stensson (26, Sirius, Allsvenskan 2023)","N. Zdichynec (21, Vorwärts Steyr, Austrian 2. Liga 22-23)",0.3055293557550626
"D. Stensson (26, Sirius, Allsvenskan 2023)","J. Gorenc-Stankovič (27, Sturm Graz, Austrian Bundesliga 22-23)",0.822767483645481
"D. Stensson (26, Sirius, Allsvenskan 2023)","N. Seiwald (22, Salzburg, Austrian Bundesliga 22-23)",45.753701529485646
"D. Stensson (26, Sirius, Allsvenskan 2023)","P. Grabher (29, Austria Lustenau, Austrian Bundesliga 22-23)",-7.158848267718255
"D. Stensson (26, Sirius, Allsvenskan 2023)","V. Müller (24, WSG Swarovski Tirol, Austrian Bundesliga 22-23)",-1.5969725926772569
"D. Stensson (26, Sirius, Allsvenskan 2023)","T. Kainz (30, Hartberg, Austrian Bundesliga 22-23)",38.2121786360489
"D. Stensson (26, Sirius, Allsvenskan 2023)","P. Michorl (28, LASK, Austrian Bundesliga 22-23)",42.89160667528632
"D. Stensson (26, Sirius, Allsvenskan 2023)","S. Horvath (26, LASK, Austrian Bundesliga 22-23)",30.03115154662647
"D. Stensson (26, Sirius, Allsvenskan 2023)","K. Gkezos (30, Austria Klagenfurt, Austrian Bundesliga 22-23)",-7.048943422628342
"D. Stensson (26, Sirius, Allsvenskan 2023)","A. Pejić (23, Rapid Wien, Austrian Bundesliga 22-23)",-27.05109022389235
"D. Stensson (26, Sirius, Allsvenskan 2023)","R. Kerschbaum (29, Rapid Wien, Austrian Bundesliga 22-23)",14.15737988942235
"D. Stensson (26, Sirius, Allsvenskan 2023)","B. Jovičić (30, LASK, Austrian Bundesliga 22-23)",-17.888099665891804
"D. Stensson (26, Sirius, Allsvenskan 2023)","E. Omić (20, Wolfsberger AC, Austrian Bundesliga 22-23)",11.89920167817479
"D. Stensson (26, Sirius, Allsvenskan 2023)","S. Haudum (28, Rheindorf Altach, Austrian Bundesliga 22-23)",-13.666016146599596
"D. Stensson (26, Sirius, Allsvenskan 2023)","M. Leitgeb (34, Wolfsberger AC, Austrian Bundesliga 22-23)",-25.021694446414223
"D. Stensson (26, Sirius, Allsvenskan 2023)","R. Benatelli (31, Austria Klagenfurt, Austrian Bundesliga 22-23)",-22.254996445110088
"D. Stensson (26, Sirius, Allsvenskan 2023)","L. Gourna-Douath (19, Salzburg, Austrian Bundesliga 22-23)",23.814293868874987
"D. Stensson (26, Sirius, Allsvenskan 2023)","C. Türkmen (21, Austria Lustenau, Austrian Bundesliga 22-23)",-14.45224421544463
"D. Stensson (26, Sirius, Allsvenskan 2023)","N. Rôdes (25, Dender, Belgian First Division B 22-23)",-23.50119447892053
"D. Stensson (26, Sirius, Allsvenskan 2023)","G. Hendrickx (28, Deinze, Belgian First Division B 22-23)",49.75637998972245
"D. Stensson (26, Sirius, Allsvenskan 2023)","S. Banse (22, Standard Liège II, Belgian First Division B 22-23)",-4.387560460782314
"D. Stensson (26, Sirius, Allsvenskan 2023)","D. Hubert (35, Anderlecht II, Belgian First Division B 22-23)",18.74822233733817
"D. Stensson (26, Sirius, Allsvenskan 2023)","Liam De Smet (19, Club Brugge II, Belgian First Division B 22-23)",-8.899872853793989
"D. Stensson (26, Sirius, Allsvenskan 2023)","J. Geusens (21, Genk II, Belgian First Division B 22-23)",47.576752250402464
"D. Stensson (26, Sirius, Allsvenskan 2023)","I. Bangoura (19, Genk II, Belgian First Division B 22-23)",-7.310647770682686
"D. Stensson (26, Sirius, Allsvenskan 2023)","L. Fraser (25, Deinze, Belgian First Division B 22-23)",22.53848693730359
"D. Stensson (26, Sirius, Allsvenskan 2023)","K. Van De Perre (19, Genk II, Belgian First Division B 22-23)",36.83556306298702
"D. Stensson (26, Sirius, Allsvenskan 2023)","T. Leoni (23, Anderlecht II, Belgian First Division B 22-23)",73.09889330081336
"D. Stensson (26, Sirius, Allsvenskan 2023)","S. De Ridder (36, Deinze, Belgian First Division B 22-23)",14.234203678275737
"D. Stensson (26, Sirius, Allsvenskan 2023)","Álex Granell (34, Lommel SK, Belgian First Division B 22-23)",30.82046639631517
"D. Stensson (26, Sirius, Allsvenskan 2023)","W. Simba (22, Club Brugge II, Belgian First Division B 22-23)",-18.18003894776593
"D. Stensson (26, Sirius, Allsvenskan 2023)","P. Hrošovský (31, Genk, Belgian Pro League 22-23)",5.3948517444918425
"D. Stensson (26, Sirius, Allsvenskan 2023)","B. Heynen (26, Genk, Belgian Pro League 22-23)",34.567435763572085
"D. Stensson (26, Sirius, Allsvenskan 2023)","S. Lynen (24, Union Saint-Gilloise, Belgian Pro League 22-23)",14.938006910544605
"D. Stensson (26, Sirius, Allsvenskan 2023)","N. Rommens (28, Zulte-Waregem, Belgian Pro League 22-23)",17.497133331618144
"D. Stensson (26, Sirius, Allsvenskan 2023)","R. Onyedika (22, Club Brugge, Belgian Pro League 22-23)",18.089710466557055
"D. Stensson (26, Sirius, Allsvenskan 2023)","F. Boya (26, Sint-Truiden, Belgian Pro League 22-23)",-3.359687141514678
"D. Stensson (26, Sirius, Allsvenskan 2023)","R. Schoofs (29, Mechelen, Belgian Pro League 22-23)",58.00763866663008
"D. Stensson (26, Sirius, Allsvenskan 2023)","A. Vermeeren (18, Antwerp, Belgian Pro League 22-23)",13.50014279138256
"D. Stensson (26, Sirius, Allsvenskan 2023)","C. Lepoint (38, RFC Seraing, Belgian Pro League 22-23)",-29.378214759908595
"D. Stensson (26, Sirius, Allsvenskan 2023)","M. Konaté (29, Sint-Truiden, Belgian Pro League 22-23)",-21.70563355191
"D. Stensson (26, Sirius, Allsvenskan 2023)","D. Lavalée (26, Mechelen, Belgian Pro League 22-23)",-2.333627670173185
"D. Stensson (26, Sirius, Allsvenskan 2023)","B. Verstraete (29, Mechelen, Belgian Pro League 22-23)",-5.644258885044678
"D. Stensson (26, Sirius, Allsvenskan 2023)","A. Yusuf (22, Antwerp, Belgian Pro League 22-23)",-4.493833109785264
"D. Stensson (26, Sirius, Allsvenskan 2023)","A. Diawara (25, Anderlecht, Belgian Pro League 22-23)",29.86971218587176
"D. Stensson (26, Sirius, Allsvenskan 2023)","S. Lahssaini (24, RFC Seraing, Belgian Pro League 22-23)",-5.405581650659226
"D. Stensson (26, Sirius, Allsvenskan 2023)","P. Gerkens (28, Antwerp, Belgian Pro League 22-23)",-2.030107075119148
"D. Stensson (26, Sirius, Allsvenskan 2023)","M. Keita (21, Antwerp, Belgian Pro League 22-23)",-8.096589060933027
"D. Stensson (26, Sirius, Allsvenskan 2023)","N. Raskin (21, Standard Liège, Belgian Pro League 22-23)",46.9615673385076
"D. Stensson (26, Sirius, Allsvenskan 2023)","J. Dom (33, OH Leuven, Belgian Pro League 22-23)",-31.640972713848036
"D. Stensson (26, Sirius, Allsvenskan 2023)","S. Lončar (26, Kortrijk, Belgian Pro League 22-23)",10.413602867170892
"D. Stensson (26, Sirius, Allsvenskan 2023)","R. Morioka (32, Charleroi, Belgian Pro League 22-23)",64.3814302177835
"D. Stensson (26, Sirius, Allsvenskan 2023)","J. Jeggo (30, Eupen, Belgian Pro League 22-23)",-8.245703240031267
"D. Stensson (26, Sirius, Allsvenskan 2023)","O. El Azzouzi (22, Union Saint-Gilloise, Belgian Pro League 22-23)",-8.175288516341414
"D. Stensson (26, Sirius, Allsvenskan 2023)","K. Mrabti (29, Mechelen, Belgian Pro League 22-23)",20.721574396253377
"D. Stensson (26, Sirius, Allsvenskan 2023)","N. Popara (31, Sloga Doboj, Bosnian Premier League 22-23)",-29.390286149470324
"D. Stensson (26, Sirius, Allsvenskan 2023)","A. Hodžić (23, Željezničar, Bosnian Premier League 22-23)",-19.70560757940077
"D. Stensson (26, Sirius, Allsvenskan 2023)","H. Karjasević (25, Tuzla City, Bosnian Premier League 22-23)",-8.820683475399644
"D. Stensson (26, Sirius, Allsvenskan 2023)","M. Osmić (24, Sloboda Tuzla, Bosnian Premier League 22-23)",-13.0088054621069
"D. Stensson (26, Sirius, Allsvenskan 2023)","P. Sučić (19, Zrinjski, Bosnian Premier League 22-23)",35.88440303530918
"D. Stensson (26, Sirius, Allsvenskan 2023)","A. Vošnjak (22, Sloboda Tuzla, Bosnian Premier League 22-23)",-7.156858466278513
"D. Stensson (26, Sirius, Allsvenskan 2023)","O. Pršeš (28, Velež, Bosnian Premier League 22-23)",52.07044099173183
"D. Stensson (26, Sirius, Allsvenskan 2023)","H. Karić (20, Tuzla City, Bosnian Premier League 22-23)",-19.82244963504524
"D. Stensson (26, Sirius, Allsvenskan 2023)","F. Čirjak (27, Sarajevo, Bosnian Premier League 22-23)",65.05322023272153
"D. Stensson (26, Sirius, Allsvenskan 2023)","A. Kurtalić (23, Sloboda Tuzla, Bosnian Premier League 22-23)",-4.839068769516218
"D. Stensson (26, Sirius, Allsvenskan 2023)","M. Vrančić (34, Sarajevo, Bosnian Premier League 22-23)",53.497041805700775
"D. Stensson (26, Sirius, Allsvenskan 2023)","I. Jelić Balta (30, Sarajevo, Bosnian Premier League 22-23)",12.101418651856305
"D. Stensson (26, Sirius, Allsvenskan 2023)","D. Matković (21, Leotar, Bosnian Premier League 22-23)",-22.14875529007917
"D. Stensson (26, Sirius, Allsvenskan 2023)","D. Zlomislić (31, Zrinjski, Bosnian Premier League 22-23)",25.17542959687985
"D. Stensson (26, Sirius, Allsvenskan 2023)","O. Beća (21, Željezničar, Bosnian Premier League 22-23)",-9.06204070856907
"D. Stensson (26, Sirius, Allsvenskan 2023)","M. Hrimat (28, FAR Rabat, Botola Pro 22-23)",2.5370383955021256
"D. Stensson (26, Sirius, Allsvenskan 2023)","N. Aarab (32, Ittihad Tanger, Botola Pro 22-23)",14.73119559249892
"D. Stensson (26, Sirius, Allsvenskan 2023)","Y. Jabrane (31, Wydad Casablanca, Botola Pro 22-23)",18.828499266381808
"D. Stensson (26, Sirius, Allsvenskan 2023)","B. Sylla (26, Maghreb Fès, Botola Pro 22-23)",-30.50731476153392
"D. Stensson (26, Sirius, Allsvenskan 2023)","E. Chichane (31, Difaâ El Jadida, Botola Pro 22-23)",-1.0418034164295815
"D. Stensson (26, Sirius, Allsvenskan 2023)","O. Mahrous (27, Olympic Safi, Botola Pro 22-23)",14.305230733008864
"D. Stensson (26, Sirius, Allsvenskan 2023)","C. Nsundi (22, Difaâ El Jadida, Botola Pro 22-23)",23.418026120022464
"D. Stensson (26, Sirius, Allsvenskan 2023)","Y. Labhiri (28, RSB Berkane, Botola Pro 22-23)",51.72878984125444
"D. Stensson (26, Sirius, Allsvenskan 2023)","W. Rhailouf (24, Olympic Safi, Botola Pro 22-23)",-10.497133841572506
"D. Stensson (26, Sirius, Allsvenskan 2023)","R. Aholou (29, Raja Casablanca, Botola Pro 22-23)",0.8322233132620992
"D. Stensson (26, Sirius, Allsvenskan 2023)","A. Serrhat (26, Mouloudia Oujda, Botola Pro 22-23)",15.933717018923552
"D. Stensson (26, Sirius, Allsvenskan 2023)","B. El Helali (35, RSB Berkane, Botola Pro 22-23)",52.45380579549986
"D. Stensson (26, Sirius, Allsvenskan 2023)","A. El Hassnaoui (34, Moghreb Tétouan, Botola Pro 22-23)",16.890192981908502
"D. Stensson (26, Sirius, Allsvenskan 2023)","R. Jaadi (28, Wydad Casablanca, Botola Pro 22-23)",52.177540033716326
"D. Stensson (26, Sirius, Allsvenskan 2023)","M. Bemammer (33, Maghreb Fès, Botola Pro 22-23)",25.358069952306234
"D. Stensson (26, Sirius, Allsvenskan 2023)","M. Al Makaazi (28, Raja Casablanca, Botola Pro 22-23)",40.46694281283881
"D. Stensson (26, Sirius, Allsvenskan 2023)","M. Said Bouksyr (26, Ittihad Tanger, Botola Pro 22-23)",54.47423705472863
"D. Stensson (26, Sirius, Allsvenskan 2023)","J. Tachtach (28, Hassania Agadir, Botola Pro 22-23)",20.76925122884147
"D. Stensson (26, Sirius, Allsvenskan 2023)","A. Traoré (28, JS Soualem, Botola Pro 22-23)",-28.360820824698763
"D. Stensson (26, Sirius, Allsvenskan 2023)","M. Afallah (29, Chabab Mohammédia, Botola Pro 22-23)",14.13098057299998
"D. Stensson (26, Sirius, Allsvenskan 2023)","S. El Moudane (29, Ittihad Tanger, Botola Pro 22-23)",45.93293044143698
"D. Stensson (26, Sirius, Allsvenskan 2023)","L. Naji (32, FAR Rabat, Botola Pro 22-23)",-2.2061076222623743
"D. Stensson (26, Sirius, Allsvenskan 2023)","H. Marzak (27, JS Soualem, Botola Pro 22-23)",-1.4779298622322472
"D. Stensson (26, Sirius, Allsvenskan 2023)","A. Sabyh (34, JS Soualem, Botola Pro 22-23)",22.71801644710834
"D. Stensson (26, Sirius, Allsvenskan 2023)","S. Karkache (23, Khouribga, Botola Pro 22-23)",-10.088848691423106
"D. Stensson (26, Sirius, Allsvenskan 2023)","H. Afsal (26, Hassania Agadir, Botola Pro 22-23)",22.94760640970177
"D. Stensson (26, Sirius, Allsvenskan 2023)","J. Daoudi (34, Wydad Casablanca, Botola Pro 22-23)",33.73815992587409
"D. Stensson (26, Sirius, Allsvenskan 2023)","W. Sabbar (27, Raja Casablanca, Botola Pro 22-23)",61.41165852680347
"D. Stensson (26, Sirius, Allsvenskan 2023)","K. Ait Mohamed (23, Hassania Agadir, Botola Pro 22-23)",30.959554787419464
"D. Stensson (26, Sirius, Allsvenskan 2023)","B. Pradana (31, Barito Putera, BRI Liga 1 22-23)",7.127060732778907
"D. Stensson (26, Sirius, Allsvenskan 2023)","R. Chand (31, Persik Kediri, BRI Liga 1 22-23)",-14.578459747139602
"D. Stensson (26, Sirius, Allsvenskan 2023)","Sin-Young Bae (30, Persita, BRI Liga 1 22-23)",38.04633782403541
"D. Stensson (26, Sirius, Allsvenskan 2023)","A. Tanjung (29, PSM, BRI Liga 1 22-23)",-30.076768610732064
"D. Stensson (26, Sirius, Allsvenskan 2023)","R. Yamaguchi (30, Arema, BRI Liga 1 22-23)",-7.803494499440704
"D. Stensson (26, Sirius, Allsvenskan 2023)","K. Kurniawan (33, PSS Sleman, BRI Liga 1 22-23)",9.146540604913213
"D. Stensson (26, Sirius, Allsvenskan 2023)","Brwa Nouri (36, Bali United, BRI Liga 1 22-23)",-1.7529902442603371
"D. Stensson (26, Sirius, Allsvenskan 2023)","M. Slamat (24, Persebaya Surabaya, BRI Liga 1 22-23)",46.74477870608781
"D. Stensson (26, Sirius, Allsvenskan 2023)","T. Infantrie (23, Persikabo 1973, BRI Liga 1 22-23)",23.141842306764687
"D. Stensson (26, Sirius, Allsvenskan 2023)","T. Numberi (21, Dewa United, BRI Liga 1 22-23)",2.311739605136275
"D. Stensson (26, Sirius, Allsvenskan 2023)","Y. Lee (33, Madura United, BRI Liga 1 22-23)",7.354186290990285
"D. Stensson (26, Sirius, Allsvenskan 2023)","J. Hariono (26, Arema, BRI Liga 1 22-23)",29.65488733843494
"D. Stensson (26, Sirius, Allsvenskan 2023)","Lucas Ramos (28, Dewa United, BRI Liga 1 22-23)",17.48929102406306
"D. Stensson (26, Sirius, Allsvenskan 2023)","S. Tan (28, Persis Solo, BRI Liga 1 22-23)",-15.988565883288002
"D. Stensson (26, Sirius, Allsvenskan 2023)","M. Hidayat (26, Persebaya Surabaya, BRI Liga 1 22-23)",5.056750443932993
"D. Stensson (26, Sirius, Allsvenskan 2023)","N. Nurzaidin (27, Barito Putera, BRI Liga 1 22-23)",6.807582724078307
"D. Stensson (26, Sirius, Allsvenskan 2023)","L. Kamal (24, PSIS Semarang, BRI Liga 1 22-23)",10.908736702991124
"D. Stensson (26, Sirius, Allsvenskan 2023)","D. Rumbino (27, PSIS Semarang, BRI Liga 1 22-23)",13.953708591293156
"D. Stensson (26, Sirius, Allsvenskan 2023)","I. Kurniawan (27, Dewa United, BRI Liga 1 22-23)",-10.086733889172375
"D. Stensson (26, Sirius, Allsvenskan 2023)","Jehad Ayoub (28, PSS Sleman, BRI Liga 1 22-23)",43.614889148628095
"D. Stensson (26, Sirius, Allsvenskan 2023)","T. Febriyanto (26, Persis Solo, BRI Liga 1 22-23)",-1.734516009443264
"D. Stensson (26, Sirius, Allsvenskan 2023)","Zulfiandi (27, Madura United, BRI Liga 1 22-23)",-6.505237640406405
"D. Stensson (26, Sirius, Allsvenskan 2023)","Adi Eko Jayanto (29, Persik Kediri, BRI Liga 1 22-23)",-8.283247820492726
"D. Stensson (26, Sirius, Allsvenskan 2023)","A. Berlian (32, Dewa United, BRI Liga 1 22-23)",30.179637817779717
"D. Stensson (26, Sirius, Allsvenskan 2023)","M. Lestusen (29, Persikabo 1973, BRI Liga 1 22-23)",3.750373237677284
"D. Stensson (26, Sirius, Allsvenskan 2023)","F. Pasamba (29, Rans Nusantara, BRI Liga 1 22-23)",0.0160903787007403
"D. Stensson (26, Sirius, Allsvenskan 2023)","M. Tahir (29, Rans Nusantara, BRI Liga 1 22-23)",23.96360305318604
"D. Stensson (26, Sirius, Allsvenskan 2023)","R. Pellu (30, Bali United, BRI Liga 1 22-23)",-14.85019117430015
"D. Stensson (26, Sirius, Allsvenskan 2023)","F. Sausu (38, Bali United, BRI Liga 1 22-23)",46.106568021786096
"D. Stensson (26, Sirius, Allsvenskan 2023)","F. Krastev (21, Levski Sofia, Bulgarian First League 22-23)",37.18537440594453
"D. Stensson (26, Sirius, Allsvenskan 2023)","V. Panayotov (32, Cherno More, Bulgarian First League 22-23)",45.0329314197613
"D. Stensson (26, Sirius, Allsvenskan 2023)","I. Chochev (30, CSKA 1948 Sofia, Bulgarian First League 22-23)",15.509398700602516
"D. Stensson (26, Sirius, Allsvenskan 2023)","P. Zebli (25, Lokomotiv Plovdiv, Bulgarian First League 22-23)",-4.209576987584408
"D. Stensson (26, Sirius, Allsvenskan 2023)","I. Yurukov (23, Arda, Bulgarian First League 22-23)",-13.689326051165052
"D. Stensson (26, Sirius, Allsvenskan 2023)","R. Tsonev (28, Arda, Bulgarian First League 22-23)",49.46188587456245
"D. Stensson (26, Sirius, Allsvenskan 2023)","A. Kraev (24, Levski Sofia, Bulgarian First League 22-23)",13.287071752834764
"D. Stensson (26, Sirius, Allsvenskan 2023)","J. Eto'o (22, Botev Plovdiv, Bulgarian First League 22-23)",58.19116789890376
"D. Stensson (26, Sirius, Allsvenskan 2023)","V. Bengyuzov (32, OFK Pirin, Bulgarian First League 22-23)",53.08638228401562
"D. Stensson (26, Sirius, Allsvenskan 2023)","J. Piotrowski (25, Ludogorets, Bulgarian First League 22-23)",41.32696526148238
"D. Stensson (26, Sirius, Allsvenskan 2023)","Álex Serrano (28, Hebar 1918, Bulgarian First League 22-23)",5.498411012770498
"D. Stensson (26, Sirius, Allsvenskan 2023)","G. Karakashev (24, Lokomotiv Plovdiv, Bulgarian First League 22-23)",-22.55002388974312
"D. Stensson (26, Sirius, Allsvenskan 2023)","G. Valchev (32, Hebar 1918, Bulgarian First League 22-23)",-5.677507837421393
"D. Stensson (26, Sirius, Allsvenskan 2023)","A. Chandarov (24, Levski Sofia, Bulgarian First League 22-23)",-2.800072256461018
"D. Stensson (26, Sirius, Allsvenskan 2023)","S. Shokolarov (33, OFK Pirin, Bulgarian First League 22-23)",19.9582972727953
"D. Stensson (26, Sirius, Allsvenskan 2023)","L. Kotev (25, Arda, Bulgarian First League 22-23)",3.2359372645789133
"D. Stensson (26, Sirius, Allsvenskan 2023)","M. Carreazo (23, CSKA Sofia, Bulgarian First League 22-23)",2.8070428535876006
"D. Stensson (26, Sirius, Allsvenskan 2023)","K. Nguena (22, Slavia Sofia, Bulgarian First League 22-23)",-25.386439520081417
"D. Stensson (26, Sirius, Allsvenskan 2023)","Matheus Clemente (24, Cherno More, Bulgarian First League 22-23)",15.728144023392474
"D. Stensson (26, Sirius, Allsvenskan 2023)","Geferson (29, CSKA Sofia, Bulgarian First League 22-23)",-6.581833377623185
"D. Stensson (26, Sirius, Allsvenskan 2023)","Pedro Naressi (25, Ludogorets, Bulgarian First League 22-23)",47.63017763279556
"D. Stensson (26, Sirius, Allsvenskan 2023)","Show (24, Ludogorets, Bulgarian First League 22-23)",46.24259122314288
"D. Stensson (26, Sirius, Allsvenskan 2023)","A. Anicet (33, Beroe, Bulgarian First League 22-23)",-8.07019781005426
"D. Stensson (26, Sirius, Allsvenskan 2023)","Mimito Biai (25, Cherno More, Bulgarian First League 22-23)",-18.87699491412905
"D. Stensson (26, Sirius, Allsvenskan 2023)","C. Gonçalves (29, Ludogorets, Bulgarian First League 22-23)",29.07934220881159
"D. Stensson (26, Sirius, Allsvenskan 2023)","R. Khedira (29, Union Berlin, Bundesliga 22-23)",-37.30947864561325
"D. Stensson (26, Sirius, Allsvenskan 2023)","E. Skhiri (28, Köln, Bundesliga 22-23)",0.6387796480466942
"D. Stensson (26, Sirius, Allsvenskan 2023)","J. Kimmich (28, Bayern München, Bundesliga 22-23)",63.51983916542342
"D. Stensson (26, Sirius, Allsvenskan 2023)","M. Arnold (29, Wolfsburg, Bundesliga 22-23)",39.67505842318938
"D. Stensson (26, Sirius, Allsvenskan 2023)","A. Losilla (37, Bochum, Bundesliga 22-23)",-21.59565690564139
"D. Stensson (26, Sirius, Allsvenskan 2023)","J. Bellingham (19, Borussia Dortmund, Bundesliga 22-23)",50.19860353268666
"D. Stensson (26, Sirius, Allsvenskan 2023)","M. Koné (22, Borussia M'gladbach, Bundesliga 22-23)",8.08589480818854
