Player,Similarity
"B. Whitfield (27, Barrow, League Two 22-23)",88.68492125164397
"S. Barns (26, Richards Bay, South Africa PSL 22-23)",88.37196321401564
"Pedro León (36, Real Murcia, Primera División RFEF 22-23)",88.03785471529288
"N. Srećković (27, Spartak Subotica, Serbian SuperLiga 22-23)",87.21828020974549
"D. László (21, Szentlőrinc SE, NB II 22-23)",87.16128068093444
"M. Matias (34, Farense, Portugal Segunda Liga 22-23)",87.12900675304601
"A. Habbassi (21, CS Sfaxien, Tunisian Ligue 1 22-23)",86.97526915105291
"R. Slim (23, FAR Rabat, Botola Pro 22-23)",86.94809289876243
"Dae-Won Kim (26, Gangwon, K League 1 2023)",86.17798698658812
"L. Ayçiçek (29, Bandırmaspor, Turkish 1. Lig 22-23)",86.06548593447087
"D. Samoilov (29, Shinnik, Russian FNL 2 22-23)",85.87838269448507
"D. Rooney (25, Drogheda United, League of Ireland PL 2023)",85.82787175207291
"A. Ocampo (25, Fénix, Uruguay Primera División 2023)",85.72572701837862
"M. Kozak (26, Górnik Łęczna, Polish I Liga 22-23)",85.71611618042445
"L. Pekár (30, Nyíregyháza Spartacus, NB II 22-23)",85.67476481036526
"А. Tučný (21, Ružomberok, Slovak Super Liga 22-23)",85.43346227262596
"D. Lloyd (31, Rochdale, League Two 22-23)",85.40002822161988
"C. Souza (27, Bellinzona, Swiss Challenge League 22-23)",85.34249059916115
"A. Cocian (22, Unirea Dej, Romanian Liga II 22-23)",85.33308892184492
"B. Brahmi (30, EO Sidi Bouzid, Tunisian Ligue 1 22-23)",85.04571030845234
"J. Livolant (25, Guingamp, Ligue 2 22-23)",85.03599126203144
"Hugo Rodríguez (33, Atlético Baleares, Primera División RFEF 22-23)",85.01343588642973
"Mateus (28, Nagoya Grampus, J1 2023)",84.96055423960792
"A. Amador (22, Pérez Zeledón, Costa Rica Primera División 22-23)",84.47871912034016
"Pau Martínez (22, Osasuna B, Primera División RFEF 22-23)",84.41183595791023
