Player,Similarity
"G. Luperini (29, Perugia, Serie B 22-23)",79.99193046437061
"H. Pell (32, AFC Wimbledon, League Two 22-23)",75.83424889053714
"Omar Bugiel (29, Sutton United, League Two 22-23)",75.08802208129376
"S. van de Streek (30, Utrecht, Eredivisie 22-23)",69.3021440643243
"M. Helm (19, Burton Albion, League One 22-23)",65.66374267642061
"L. Anderson (25, Carrick Rangers, Northern Ireland Premiership 22-23)",65.56055761398751
"J. Bachmann (27, Sandhausen, 2. Bundesliga 22-23)",64.30825850263719
"G. Lapslie (25, Gillingham, League Two 22-23)",64.2000873361549
"B. Coffey (22, Cork City, League of Ireland PL 2023)",63.4629873939339
"D. Vogt (22, Meppen, 3. Liga 22-23)",63.31682438039049
"T. Onyango (20, Forest Green Rovers, League One 22-23)",62.91379044386459
"K. Phillips (21, Shrewsbury Town, League One 22-23)",60.394335618262005
"Asier Osambela (18, Osasuna B, Primera División RFEF 22-23)",60.01941549081966
"I. Stefanov (24, Levski Sofia, Bulgarian First League 22-23)",58.132001087896526
"A. Ayarza (30, Cusco, Peruvian Liga 1 2023)",57.41388434758984
"L. Reischl (19, Liefering, Austrian 2. Liga 22-23)",57.09248255398451
"E. Thiakane (31, Puszcza Niepołomice, Polish I Liga 22-23)",56.50546757564604
"M. Hakizimana (28, Al Kholood, Saudi First Division 22-23)",55.61326458635556
"K. Zapolnik (30, Puszcza Niepołomice, Polish I Liga 22-23)",55.33442734119228
"H. Knibbs (24, Cambridge United, League One 22-23)",54.18985872925765
"A. Troshechkin (27, Akhmat Grozny, Russian Premier League 22-23)",54.034359576145874
"C. Kouan (23, Perugia, Serie B 22-23)",53.86070278701338
"M. Starke (32, VfB Oldenburg, 3. Liga 22-23)",53.74790395945157
"Alain Ribeiro (25, SD Logroñés, Primera División RFEF 22-23)",53.17705107504798
"S. Pittman (30, Livingston, Scottish Premiership 22-23)",52.79504592244406
