Player,Similarity
"S. Papa (33, Gelbison, Serie C 22-23)",78.6740741703991
"B. Spencer (27, Raith Rovers, Scottish Championship 22-23)",78.27097079975759
"S. Maselli (22, Juve Stabia, Serie C 22-23)",75.81066443148725
"J. Rodríguez (27, Estudiantes, Argentinian Primera División 2023)",75.08897744080626
"R. Garrett (35, Glenavon, Northern Ireland Premiership 22-23)",74.92176829602481
"M. Büchel (32, Ascoli, Serie B 22-23)",74.79066248073794
"L. Mirković (32, Budućnost, Montenegro First League 22-23)",74.77389939365904
"A. Casar (22, Hallescher FC, 3. Liga 22-23)",74.54809193002322
"S. Golan (24, Kfar Kasem, Liga Leumit 22-23)",74.34260006227399
"N. Aarab (32, Ittihad Tanger, Botola Pro 22-23)",73.89673287997573
"R. Weir (34, Crusaders, Northern Ireland Premiership 22-23)",73.57369852609297
"F. Giorno (29, Piacenza, Serie C 22-23)",73.41073925891007
"R. Ayagwa (25, Aswan FC, Egyptian Premier League 22-23)",73.29666713695137
"Romario (34, Universitatea Cluj, SuperLiga României 22-23)",73.06678139584034
"U. Taffertshofer (31, Erzgebirge Aue, 3. Liga 22-23)",72.94199730139762
"V. Hamdiu (24, FC Schaffhausen, Swiss Challenge League 22-23)",72.86639264291571
"D. Flores (26, Fehérvár, NB I 22-23)",72.23927968791112
"G. Dobson (25, Charlton Athletic, League One 22-23)",72.10861160216287
"M. Badelj (34, Genoa, Serie B 22-23)",72.0115250002396
"F. Rüdlin (26, Thun, Swiss Challenge League 22-23)",71.9771218882793
"O. Jäckle (30, Aarau, Swiss Challenge League 22-23)",71.86484453082679
"D. Bosnjak (26, Rapid Wien II, Austrian 2. Liga 22-23)",71.25875581185095
"K. Buckley (30, Bohemians, League of Ireland PL 2023)",71.13254399584625
"S. Russo (22, Waldhof Mannheim, 3. Liga 22-23)",71.05791573296226
"J. Tverskov (30, OB, Superliga 22-23)",70.90808677423888
