Player,Similarity
"A. Shvets (30, Akhmat Grozny, Russian Premier League 22-23)",82.1082418040719
"R. Akhmatov (26, Chindia Târgovişte, SuperLiga României 22-23)",82.1050559230229
"A. Cabrera (30, Banfield, Argentinian Primera División 2023)",81.97166014927299
"M. Maiga (28, Nizhny Novgorod, Russian Premier League 22-23)",80.96337795680878
"L. Krasniqi (22, Floridsdorfer AC, Austrian 2. Liga 22-23)",80.50396764439299
"R. Parkins (22, Alajuelense, Costa Rica Primera División 22-23)",80.43053367173557
"J. Franco (19, Municipal, Guatemala Liga Nacional 22-23)",79.69773062865913
"K. Baccus (31, Macarthur, A-League Men 22-23)",79.17541290906406
"C. Balgiu (28, CSA Steaua Bucureşti, Romanian Liga II 22-23)",78.61380732934748
"Miguel Núñez (34, Eldense, Primera División RFEF 22-23)",78.1060317343876
"P. Aquino (28, América, Liga MX 22-23)",78.0647654122801
"Aitor Sanz (38, Tenerife, La Liga 2 22-23)",77.5595111890898
"C. Ohene (29, CSKA 1948 Sofia, Bulgarian First League 22-23)",76.90629850826794
"D. Pavelka (31, Sparta Praha, Czech Fortuna Liga 22-23)",76.58940469305205
"S. Sprangler (28, Vorwärts Steyr, Austrian 2. Liga 22-23)",76.20351345869457
"F. Gino (30, PAS Giannina, Greek Super League 22-23)",75.75471876622719
"A. Ješić (28, Mladost Lučani, Serbian SuperLiga 22-23)",75.64069417349938
"G. Roemeratoe (23, Hapoel Tel Aviv, Ligat Ha'al 22-23)",75.11691256848707
"A. Haidara (25, RB Leipzig, Bundesliga 22-23)",74.59140728622545
"F. Kunze (24, Hannover 96, 2. Bundesliga 22-23)",74.07990003457286
"D. Talalay (31, Volgar Astrakhan, Russian FNL 2 22-23)",73.9870288188017
"C. Alvarado (24, Xinabajul, Guatemala Liga Nacional 22-23)",73.93829700944404
"J. Van Damme (31, SK Beveren, Belgian First Division B 22-23)",73.90857634279983
"E. Kancepolsky (19, Hapoel Tel Aviv, Ligat Ha'al 22-23)",73.68946236916477
"M. Dulca (24, Chindia Târgovişte, SuperLiga României 22-23)",73.68504221150157
