Player,Similarity
"A. Diané (25, Maccabi Ahi Nazareth, Liga Leumit 22-23)",81.36848566080931
"S. Dancák (25, Mladá Boleslav, Czech Fortuna Liga 22-23)",79.79723854094716
"A. Pasche (32, Neuchâtel Xamax, Swiss Challenge League 22-23)",78.18243600933157
"J. Esquivel (25, Necaxa, Liga MX 22-23)",77.80667291079905
"C. Alvarado (24, Xinabajul, Guatemala Liga Nacional 22-23)",77.67909410328622
"Marc Montalvo (21, Gimnàstic Tarragona, Primera División RFEF 22-23)",76.29834787075804
"S. Sprangler (28, Vorwärts Steyr, Austrian 2. Liga 22-23)",75.56926819239652
"L. Vágó (30, Kecskeméti TE, NB I 22-23)",74.98507863723593
"D. Zdravkovski (25, AEL, Cyprus 1. Division 22-23)",74.7036252296846
"M. Mellado (30, OFI, Greek Super League 22-23)",74.08726189975113
"J. Franco (19, Municipal, Guatemala Liga Nacional 22-23)",73.89623559191745
"A. Cabrera (30, Banfield, Argentinian Primera División 2023)",73.67572308363953
"O. Mamageishvili (20, Saburtalo, Erovnuli Liga 2023)",73.37457213194708
"D. Wieser (21, Pro Sesto, Serie C 22-23)",73.09989908198911
"M. Kranevitter (29, Monterrey, Liga MX 22-23)",72.92000871502388
"K. Aldair (21, Comunicaciones, Guatemala Liga Nacional 22-23)",72.91453247974903
"A. Khamoyan (23, BKMA, Armenian Premier League 22-23)",72.32874446347154
"Álex Bernal (32, Eldense, Primera División RFEF 22-23)",72.30172760581549
"A. Harmach (30, UTS Rabat, Botola Pro 22-23)",72.25566239825521
"B. Alceus (27, Olympiakos, Cyprus 1. Division 22-23)",72.17318322797837
"A. Soto (28, Zebbug Rangers, Malta Premier League 22-23)",72.01420092688858
"S. Udo (27, Ararat-Armenia, Armenian Premier League 22-23)",71.9290375163084
"Miguel Núñez (34, Eldense, Primera División RFEF 22-23)",71.81950366614853
"Joan Jordán (28, Sevilla, La Liga 22-23)",71.53837679414212
"R. Akhmatov (26, Chindia Târgovişte, SuperLiga României 22-23)",71.4287253617838
