Player,Similarity
"L. Boyé (27, Elche, La Liga 22-23)",92.50665193236408
"D. Szczepan (28, Ruch Chorzów, Polish I Liga 22-23)",89.83263214824078
"Rodrigo Angelotti (25, Omiya Ardija, J2 2023)",88.22782718066954
"Miguel De La Fuente (23, Deportivo Alavés, La Liga 2 22-23)",87.7679414792433
"E. Cabrera (23, Birkirkara, Malta Premier League 22-23)",87.71418277588128
"Paollo Madeira (26, Hoang Anh Gia Lai, V League 1 2023)",87.17382151886963
"Y. Muritala (23, Hibernians, Malta Premier League 22-23)",86.78012980110746
"J. Mbakogu (30, Triestina, Serie C 22-23)",86.76655670736686
"S. Stehle (21, Viktoria Köln, 3. Liga 22-23)",86.51005026225911
"M. Giménez (24, Independiente, Argentinian Primera División 2023)",86.40496671117863
"E. Mashike (28, Hamrun Spartans, Malta Premier League 22-23)",86.30789245415743
"K. Sherman (31, Sri Pahang, Malaysian Super League 2023)",86.28716113208283
"A. Gouiri (23, Rennes, Ligue 1 22-23)",86.1465598672369
"Alex (29, Bhayangkara F.C., BRI Liga 1 22-23)",86.0792486247926
"E. Nketiah (24, Arsenal, Premier League 22-23)",85.79519258444965
"G. Bayrakdar (21, Bodrumspor, Turkish 1. Lig 22-23)",85.78494497472893
"T. Conraad (26, Sutjeska, Montenegro First League 22-23)",85.7740564683055
"A. Londono (21, Comunicaciones, Guatemala Liga Nacional 22-23)",85.67278938379806
"Z. Robinson (20, Dundee, Scottish Championship 22-23)",85.67192986835026
"B. Labeau (27, Lausanne Sport, Swiss Challenge League 22-23)",85.53935753311325
"A. Taiwo (24, Spartak Trnava, Slovak Super Liga 22-23)",85.46896341082237
"A. Mahamid (25, Hapoel Umm al-Fahm, Liga Leumit 22-23)",85.45861757732858
"W. Eza (26, Ararat-Armenia, Armenian Premier League 22-23)",85.41709897162161
"A. Porras (32, Guastatoya, Guatemala Liga Nacional 22-23)",85.2392494013362
"M. Nzola (26, Spezia, Serie A 22-23)",85.22048931350864
