Player,Similarity
"D. Zappella (25, Virtus Entella, Serie C 22-23)",87.62116144355655
"E. Musta (31, Egnatia Rrogozhinë, Albanian Premier League 22-23)",86.24524188892315
"M. Koscelník (28, Rapid Wien, Austrian Bundesliga 22-23)",86.0150895025265
"D. Jakubik (33, Radomiak Radom, Ekstraklasa 22-23)",85.85168822582773
"I. Touray (28, Salford City, League Two 22-23)",85.46446483922873
"J. Edwards (22, Dunfermline Athletic, Scottish League One 22-23)",85.40373440244777
"Alex Pinto (24, DAC, Slovak Super Liga 22-23)",85.12475061540374
"D. Church (22, Alloa Athletic, Scottish League One 22-23)",84.79686392264769
"N. Englezou (29, AEK Larnaca , Cyprus 1. Division 22-23)",84.53040416302706
"A. Jafer (28, Bnei Yehuda, Liga Leumit 22-23)",84.49380393447315
"J. Čorluka (28, Zrinjski, Bosnian Premier League 22-23)",84.18616466153225
"B. Bitton (32, Hapoel Tel Aviv, Ligat Ha'al 22-23)",84.05037970712439
"S. Medgyes (29, Diósgyőr, NB II 22-23)",83.88112481814967
"S. Oukhadda (24, Modena, Serie B 22-23)",83.84077216837873
"Y. Cohen (26, Maccabi Petah Tikva, Liga Leumit 22-23)",83.71213986686995
"E. Hakaj (26, Vllaznia Shkodër, Albanian Premier League 22-23)",83.68180101867384
"A. Beganović (23, Mura, 1. SNL 22-23)",83.56571536057832
"D. Ulrich (25, Vaduz, Swiss Challenge League 22-23)",83.50401099902498
"J. González (25, Xelajú, Guatemala Liga Nacional 22-23)",83.35981287981397
"T. Casasola (27, Perugia, Serie B 22-23)",83.32686403853839
"E. Valentini (34, Nürnberg, 2. Bundesliga 22-23)",83.32010184177389
"C. Rizzuto (31, Saarbrücken, 3. Liga 22-23)",82.98196871981762
"A. Rustum (24, Maccabi Ahi Nazareth, Liga Leumit 22-23)",82.89403962357827
"S. Klaiber (28, Utrecht, Eredivisie 22-23)",82.82303282463079
"S. Zúñiga (26, Alajuelense, Costa Rica Primera División 22-23)",82.49366906329946
