Player,Similarity
"M. Kravchenko (25, Kolos Kovalivka, Ukrainian Premier Liha 22-23)",87.76944245388233
"A. Rami (25, Kastrioti Krujë, Albanian Premier League 22-23)",86.47034283622193
"T. Căpușă (25, Chindia Târgovişte, SuperLiga României 22-23)",86.3490930523495
"P. Beruatto (24, Pisa, Serie B 22-23)",84.23472239330306
"M. Vukčević (29, UTA Arad, SuperLiga României 22-23)",84.15970400897011
"N. Campos (29, Torreense, Portugal Segunda Liga 22-23)",83.49202707431218
"M. Cedidla (21, Trinity Zlín, Czech Fortuna Liga 22-23)",83.33441479419392
"M. Spasić (25, Riteriai, Lithuanian A Lyga 2023)",83.33257361620463
"L. Malešević (24, Petrovac, Montenegro First League 22-23)",83.23982217175383
"A. Tofan (26, Argeș, SuperLiga României 22-23)",83.07785322782706
"L. Ferroni (27, Intercity SJ D' Alacant, Primera División RFEF 22-23)",83.00586527343037
"Mikel Kortazar (24, CD Calahorra, Primera División RFEF 22-23)",82.97905725254657
"D. Lippert (27, Bayreuth, 3. Liga 22-23)",82.89644022474624
"P. Ojog (32, Sfîntul Gheorghe, Moldovan Super Liga 22-23)",82.75923568889792
"F. Nevarez (22, Juárez, Liga MX 22-23)",82.57048524806667
"L. Heeney (24, Drogheda United, League of Ireland PL 2023)",82.31323784453674
"I. Bors (20, Sfîntul Gheorghe, Moldovan Super Liga 22-23)",82.23513226746545
"Park Hyun-Joon (22, Busan Transportation, K3 League 2023)",81.94618275717175
"M. Doyle (31, Alloa Athletic, Scottish League One 22-23)",81.84085273789495
"T. Kapetanović (19, Sloboda Tuzla, Bosnian Premier League 22-23)",81.57625561129382
"E. Canales (21, UTC Cajamarca, Peruvian Liga 1 2023)",81.38045605880997
"J. Iskra (20, Sandecja Nowy Sącz, Polish I Liga 22-23)",81.23936666504311
"E. Nielsen (23, Vendsyssel, Danish 1. Division 22-23)",81.0224409025253
"D. Foulquier (30, Valencia, La Liga 22-23)",80.89936048609411
"M. Galić (27, Željezničar, Bosnian Premier League 22-23)",80.89379857607369
