Player,Similarity
"J. van Duiven (18, PSV II, Eerste Divisie 22-23)",89.66787673136199
"D. Baumann (28, Zwickau, 3. Liga 22-23)",89.55934372543483
"M. Koszta (26, Maccabi Bnei Raina, Ligat Ha'al 22-23)",89.01459617003394
"I. Acuña (33, Municipal, Guatemala Liga Nacional 22-23)",88.81660403395766
"M. Škrbić (27, Radnički Niš, Serbian SuperLiga 22-23)",88.20278554144927
"P. Schwaizer (24, Mafra, Portugal Segunda Liga 22-23)",87.95185737598939
"A. Ueda (24, Cercle Brugge, Belgian Pro League 22-23)",87.92194667465881
"Fábio Fortes (31, Penafiel, Portugal Segunda Liga 22-23)",87.82740068776529
"G. Zigoni (32, Juve Stabia, Serie C 22-23)",87.69719286798636
"A. Mendy (29, Caen, Ligue 2 22-23)",87.6214184410084
"P. Cissé (38, Amiens SC, Ligue 2 22-23)",87.56898478618473
"F. Grandolfo (30, Arzignano Valchiampo, Serie C 22-23)",87.3579964592942
"G. Durbant (31, Laval, Ligue 2 22-23)",87.30823521384062
"R. Becerra (35, Deportivo Cuenca, Ecuador Liga Pro 2023)",87.29848259768406
"Xemi Fernández (28, Intercity SJ D' Alacant, Primera División RFEF 22-23)",87.18460444405481
"G. Gomez (29, Crotone, Serie C 22-23)",87.16018430988996
"J. Cádiz (27, Famalicão, Primeira Liga 22-23)",87.09621040403489
"C. González (30, Toluca, Liga MX 22-23)",87.09221814809236
"M. Uysal (23, Manisa BBSK, Turkish 1. Lig 22-23)",86.93604413699558
"G. Gongadze (27, Fakel, Russian Premier League 22-23)",86.73283303505221
"R. Bajić (29, Giresunspor, Süper Lig 22-23)",86.71595901085907
"V. Postolachi (23, UTA Arad, SuperLiga României 22-23)",86.70985628396735
"K. Aboubakar (27, Sumqayıt, Premyer Liqa 22-23)",86.48822858913101
"Tiago (30, Al Dhafra, UAE Pro League 22-23)",86.41309572429975
"B. Sambou (24, Wydad Casablanca, Botola Pro 22-23)",86.19596624133298
