Player,Similarity
"N. Janković (21, Zrinjski, Bosnian Premier League 22-23)",71.43652577197933
"E. Vidal (27, Persita, BRI Liga 1 22-23)",71.25640549758448
"C. Buonaiuto (30, Cremonese, Serie A 22-23)",71.2439491948482
"M. McKenna (32, Arbroath, Scottish Championship 22-23)",69.93950789290453
"M. Radi (40, Hapoel Nof HaGalil, Liga Leumit 22-23)",69.01306165364716
"A. Roman (29, CSMS Iaşi, Romanian Liga II 22-23)",68.95356772898161
"V. Savićević (29, Giresunspor, Süper Lig 22-23)",68.5446227194758
"D. Mertens (36, Galatasaray, Süper Lig 22-23)",67.97345604914437
"E. Agyiri (25, Levadia, Estonian Meistriliiga 2023)",67.50985208168784
"M. Aramu (28, Genoa, Serie B 22-23)",67.39415192144656
"M. Mier (32, Bhayangkara F.C., BRI Liga 1 22-23)",67.12185637568916
"J. Busuttil (24, Floriana, Malta Premier League 22-23)",67.02417376411674
"G. Milanov (31, Al Dhafra, UAE Pro League 22-23)",66.9613961704504
"W. Mimbela (31, ADT, Peruvian Liga 1 2023)",66.55460161491469
"Z. Boutmene (22, Etoile du Sahel, Tunisian Ligue 1 22-23)",66.4515740073212
"V. Fazliu (27, Aarau, Swiss Challenge League 22-23)",66.44895765474404
"F. Rieder (21, Young Boys, Swiss Super League 22-23)",65.76113369409421
"I. Oulad Omar (25, Dinamo Tbilisi, Erovnuli Liga 2023)",65.61265563899707
"O. Velanas (24, NAC Breda, Eerste Divisie 22-23)",65.52542035440759
"L. Zelarayán (30, Columbus Crew, MLS 2023)",65.46980131465855
"Abdelrahman Khaled (27, Al Mokawloon, Egyptian Premier League 22-23)",65.39431453732311
"C. Pasquato (33, Trento, Serie C 22-23)",65.37930457732763
"E. Hoti (26, Partizani Tirana, Albanian Premier League 22-23)",65.23784850536843
"A. Dabbur (32, Maccabi Ahi Nazareth, Liga Leumit 22-23)",65.2217799234615
"N. Ninković (28, Borac Banja Luka, Bosnian Premier League 22-23)",65.06878923936726
