Player,Similarity
"H. Karjasević (25, Tuzla City, Bosnian Premier League 22-23)",87.02146762022446
"J. Rosales (29, Municipal, Guatemala Liga Nacional 22-23)",80.3685511453442
"Roberto Olabe (27, Deportivo La Coruña, Primera División RFEF 22-23)",79.82963052611103
"C. Guerra (28, Iztapa, Guatemala Liga Nacional 22-23)",78.59233901330569
"F. Vassallo (29, Monopoli, Serie C 22-23)",78.4253344569052
"Sergio Mendoza (29, UE Santa Coloma, Andorra Primera Divisió 22-23)",77.224217669152
"B. Dita (30, Shkendija, North Macedonia First League 22-23)",76.65550476997063
"C. Santos (28, Farense, Portugal Segunda Liga 22-23)",76.60663330188807
"V. Zvekanov (23, Szombathelyi Haladás, NB II 22-23)",76.114998218316
"D. Lisu (21, Sfîntul Gheorghe, Moldovan Super Liga 22-23)",75.95311715115523
"S. Sissoko (22, Čukarički, Serbian SuperLiga 22-23)",75.81809291234144
"L. Heraldez (30, Sporting San Miguelito, Panama LPF 2023)",75.53031162534569
"P. Etebo (27, Aris, Greek Super League 22-23)",74.66257489661348
"Q. Al Kaibari (0, Al Qadisiyah, Saudi First Division 22-23)",74.26366096864305
"A. Murgia (26, SPAL, Serie B 22-23)",74.16045312044064
"R. Levi (25, Hapoel Petah Tikva, Liga Leumit 22-23)",73.48664984352062
"B. Pierret (23, Quevilly Rouen, Ligue 2 22-23)",73.40178107005787
"S. Sithole (24, Belenenses, Portugal Segunda Liga 22-23)",73.38916744539193
"F. Abu Akel (26, Qabala, Premyer Liqa 22-23)",73.11277774052563
"I. Sackey (29, Ümranıyespor, Süper Lig 22-23)",73.01233853680502
"G. Sebastião (27, Torreense, Portugal Segunda Liga 22-23)",72.8267633303324
"B. Ambina (21, Cape Town, South Africa PSL 22-23)",72.77559108146771
"A. Colorado (24, Partizan, Serbian SuperLiga 22-23)",72.68854276145022
"Lucas Ramos (28, Dewa United, BRI Liga 1 22-23)",72.35146552297638
"F. Ibarra (22, Atlanta United, MLS 2023)",72.1987149048561
