Player,Similarity
"O. Shukurov (26, Fatih Karagümrük, Süper Lig 22-23)",82.04241180423746
"Aitor Sanz (38, Tenerife, La Liga 2 22-23)",79.51000383151559
"M. Maiga (28, Nizhny Novgorod, Russian Premier League 22-23)",78.3620750750531
"F. Abdullahi (20, Doxa, Cyprus 1. Division 22-23)",77.76980814268664
"A. Tshibola (28, AEL, Cyprus 1. Division 22-23)",76.07604166499402
"G. Roemeratoe (23, Hapoel Tel Aviv, Ligat Ha'al 22-23)",75.67754043843946
"A. Njie (23, Aarau, Swiss Challenge League 22-23)",75.17283274575298
"Fede San Emeterio (26, Cádiz, La Liga 22-23)",74.56263089342289
"F. Kunze (24, Hannover 96, 2. Bundesliga 22-23)",74.42053102698073
"J. Mora (30, Sporting San José, Costa Rica Primera División 22-23)",74.0717656792759
"Jaume Grau (26, Real Zaragoza, La Liga 2 22-23)",73.93280380358667
"Luismi (31, Real Oviedo, La Liga 2 22-23)",73.77346697434757
"C. Baeza (29, Toluca, Liga MX 22-23)",73.56002925096622
"L. Vega (24, Sporting Covilhã, Portugal Segunda Liga 22-23)",73.38165602749021
"L. Krasniqi (22, Floridsdorfer AC, Austrian 2. Liga 22-23)",73.34152575218201
"M. Marin (24, Pisa, Serie B 22-23)",73.22446618265498
"A. Besagic (24, Igman Konjic, Bosnian Premier League 22-23)",72.87656941509988
"A. Khamoyan (23, BKMA, Armenian Premier League 22-23)",72.46249114859653
"E. Tagiyev (23, Sabail, Premyer Liqa 22-23)",72.28391304228181
"Jaime Sierra (25, UD Logroñés, Primera División RFEF 22-23)",72.28266553169456
"Iñigo Ruiz de Galarreta (29, Mallorca, La Liga 22-23)",72.24846819061229
"R. Akhmatov (26, Chindia Târgovişte, SuperLiga României 22-23)",72.09454083774372
"Francisco Reguera (27, Talavera CF, Primera División RFEF 22-23)",72.05777040468986
"Aritz Aldasoro (23, Racing Santander, La Liga 2 22-23)",71.99558489644818
"S. Tassanai (31, Police Tero, Thai League 1 22-23)",71.9415667259672
