Player,Similarity
"G. Nurse (24, Shrewsbury Town, League One 22-23)",81.47532339726912
"H. Lintott (20, Northampton Town, League Two 22-23)",81.46937774076439
"A. Ozols (23, FK Tukums 2000/Telms, Virsliga 2023)",80.91461723093568
"K. Székely (24, Kazincbarcika, NB II 22-23)",79.9299135599134
"A. McGowan (26, Northampton Town, League Two 22-23)",79.12542919779307
"R. McKenzie (24, Gillingham, League Two 22-23)",79.06524770663601
"Josema (26, Leganés, La Liga 2 22-23)",78.41330901536348
"Jung-ho Lee (25, Chuncheon, K3 League 2023)",78.30159172774887
"R. Finnie (28, Cowdenbeath, Scottish League Two 22-23)",78.23136439476669
"D. Magda (25, Zemplín Michalovce, Slovak Super Liga 22-23)",77.81697679557436
"L. Chapman (28, Portadown, Northern Ireland Premiership 22-23)",77.54926018249486
"S. Risch (23, Meppen, 3. Liga 22-23)",77.2053437349171
"T. Warren (24, Barrow, League Two 22-23)",77.10568649361824
"R. Alborno (29, Guaireña, Paraguay Division Profesional 2023)",77.09546197601887
"S. Ottesen (22, Stabæk, Eliteserien 2023)",76.95169801445768
"N. Devlin (29, Livingston, Scottish Premiership 22-23)",76.83099011234799
"R. McKeown (30, Crusaders, Northern Ireland Premiership 22-23)",76.68888709220347
"T. Sims (24, Harrogate Town, League Two 22-23)",75.7653418694207
"B. Williams (24, Cheltenham Town, League One 22-23)",75.54940905270429
"K. Forsythe (20, Carrick Rangers, Northern Ireland Premiership 22-23)",75.01790260050745
"Felipe Alfonso (30, Mérida AD, Primera División RFEF 22-23)",74.49870081620756
"E. Mclevy (22, Brechin City, Scottish League Two 22-23)",74.36752017058775
"H. Biler (22, AFC Wimbledon, League Two 22-23)",74.13316407045673
"D. Zator (28, Korona Kielce, Ekstraklasa 22-23)",74.05033799948205
"M. Shiels (22, Hamilton Academical, Scottish Championship 22-23)",73.81894398680154
