Player,Similarity
"C. Sepúlveda (30, Huachipato, Chilean Primera División 2023)",86.73812657722387
"C. Kaboré (35, Niort, Ligue 2 22-23)",86.02221000489864
"Víctor Alonso (28, Atlètic Club d'Escaldes, Andorra Primera Divisió 22-23)",84.53981077056204
"R. Melo (27, Deportivo Cuenca, Ecuador Liga Pro 2023)",83.62872307241524
"L. Álvarez (33, Atlético Grau, Peruvian Liga 1 2023)",81.88350174836411
"F. Shawky (33, El Geish, Egyptian Premier League 22-23)",81.00208011064348
"Ž. Jevšenak (20, Benfica II, Portugal Segunda Liga 22-23)",80.65660078396785
"B. Al Sayali (0, Al Hazem, Saudi First Division 22-23)",79.40546725153646
"M. Medina (25, Deportivo Pereira, Colombian Primera Division 22-23)",79.37109940304792
"J. Gustavsson (28, Mjällby, Allsvenskan 2023)",78.26858324131976
"L. Brattan (33, Sydney, A-League Men 22-23)",78.25463261646601
"W. Trapp (30, Minnesota United, MLS 2023)",77.24167101457215
"S. Lavrinčík (21, Trenčín, Slovak Super Liga 22-23)",77.11470677917643
"A. Cubas (27, Vancouver Whitecaps, MLS 2023)",76.83403814595363
"J. Åberg (24, GAIS, Superettan 2023)",76.72785696803578
"Petros (34, Al Fateh, Saudi Professional League 22-23)",76.36071222453815
"K. Aktaş (28, Altınordu, Turkish 1. Lig 22-23)",76.2463757319542
"S. Flores (28, Guadalajara, Liga MX 22-23)",76.17999667579093
"G. Akuowua (22, Maccabi Petah Tikva, Liga Leumit 22-23)",75.67016974216757
"O. Ergün (30, İstanbulspor, Süper Lig 22-23)",75.3982430338831
"T. Adams (24, Leeds United, Premier League 22-23)",75.3339996224349
"Rubén Pérez (34, Panathinaikos, Greek Super League 22-23)",75.27703507682564
"F. Cerro (35, Wanderers, Uruguay Primera División 2023)",74.98863777262844
"E. Pavez (33, Colo Colo, Chilean Primera División 2023)",74.36104497495079
"L. Biglia (37, İstanbul Başakşehir, Süper Lig 22-23)",73.96296770674992
