Player,Similarity
"Basem Ali (34, Future, Egyptian Premier League 22-23)",82.82753090015596
"G. Cotugno (28, Deportivo Maldonado, Uruguay Primera División 2023)",82.49154690567589
"F. Di-Michele-Sanchez (20, NAC Breda, Eerste Divisie 22-23)",82.38509344948922
"K. Melichenko (23, Dynamo Dresden, 3. Liga 22-23)",82.23926676418127
"Z. Morgan (23, Ironi Kiryat Shmona, Ligat Ha'al 22-23)",81.82312623518118
"R. Radunović (31, FCS Bucureşti, SuperLiga României 22-23)",79.82233871034474
"M. Hrabina (30, Zbrojovka Brno, Czech Fortuna Liga 22-23)",79.52647052662766
"E. Kaplan (22, Bandırmaspor, Turkish 1. Lig 22-23)",79.09306447325635
"V. Jemelka (27, Viktoria Plzeň, Czech Fortuna Liga 22-23)",78.7348753430197
"M. Lang (32, Basel, Swiss Super League 22-23)",78.48931530264377
"A. Jallow (25, Brescia, Serie B 22-23)",78.4892945020379
"Sergi Cardona (23, Las Palmas, La Liga 2 22-23)",77.82531163831801
"M. Papp (33, Dorogi FC, NB II 22-23)",77.68948109484629
"T. Mütallimov (28, Sabah, Premyer Liqa 22-23)",77.6427481699271
"Y. Uchida (28, Vegalta Sendai, J2 2023)",77.62321317717607
"Gabriel (34, Dinamo Bucureşti, Romanian Liga II 22-23)",77.55080550705893
"E. Gurishta (28, Vllaznia Shkodër, Albanian Premier League 22-23)",77.45183945175965
"E. Herrera (24, Junior, Colombian Primera Division 22-23)",77.39725910733075
"M. Busch (28, Heidenheim, 2. Bundesliga 22-23)",77.36280108767794
"A. Abazov (26, Volga Ulyanovsk, Russian FNL 2 22-23)",77.12761394701874
"O. Isaenko (23, Krasnodar II, Russian FNL 2 22-23)",76.6748326566966
"Seung-Wook Park (26, Pohang Steelers, K League 1 2023)",76.64902340151414
"R. Pucino (32, Bari, Serie B 22-23)",76.63537297353248
"B. Butko (32, Zorya, Ukrainian Premier Liha 22-23)",76.57787503304047
"A. Abeid (25, UTA Arad, SuperLiga României 22-23)",76.53951119312497
