Player,Similarity
"L. Sangaré (21, Talavera CF, Primera División RFEF 22-23)",85.03906292394029
"S. McTominay (26, Manchester United, Premier League 22-23)",80.80830924965096
"Adi Eko Jayanto (29, Persik Kediri, BRI Liga 1 22-23)",80.56206287222527
"F. Alves (31, UD Oliveirense, Portugal Segunda Liga 22-23)",79.84939278211733
"A. Bajović (19, Dečić, Montenegro First League 22-23)",79.47376602838358
"I. Bangoura (19, Genk II, Belgian First Division B 22-23)",79.30900938813343
"L. Diack (22, Ankaragücü, Süper Lig 22-23)",79.07589194181087
"L. Heraldez (30, Sporting San Miguelito, Panama LPF 2023)",78.95548665745982
"Mario Martín (19, Real Madrid Castilla, Primera División RFEF 22-23)",78.16687821289605
"Z. Hamlili (32, Monopoli, Serie C 22-23)",78.06329180897063
"H. Evrard (33, Leixões, Portugal Segunda Liga 22-23)",77.52112459930936
"D. Moreno (31, Junior, Colombian Primera Division 22-23)",77.47913098026248
"D. Padilla (29, Jaguares de Córdoba, Colombian Primera Division 22-23)",77.39444082478933
"L. Grgić (27, Hajduk Split, 1. HNL 22-23)",77.34070486267048
"B. Asan (25, Boluspor, Turkish 1. Lig 22-23)",77.1960246899862
"Oriol Romeu (31, Girona, La Liga 22-23)",76.92390460672827
"Geferson (29, CSKA Sofia, Bulgarian First League 22-23)",76.92149243727417
"S. Kobedi (27, Royal AM, South Africa PSL 22-23)",76.87314319436756
"K. Vacek (36, Pardubice, Czech Fortuna Liga 22-23)",76.77241718318494
"F. Ibarra (22, Atlanta United, MLS 2023)",76.74050893468439
"R. Pellu (30, Bali United, BRI Liga 1 22-23)",76.22476589071593
"Armando Corbalán (29, Sabadell, Primera División RFEF 22-23)",75.47454610673765
"A. Ceitil (28, Vilafranquense, Portugal Segunda Liga 22-23)",75.31341681711902
"A. Erlingmark (25, Atromitos, Greek Super League 22-23)",75.2920840540499
"O. Sklyar (32, Vorskla, Ukrainian Premier Liha 22-23)",75.28584994937493
