Player,Similarity
"P. Zebli (25, Lokomotiv Plovdiv, Bulgarian First League 22-23)",84.60312708689837
"F. Flórez (30, Alianza Petrolera, Colombian Primera Division 22-23)",82.58793888841213
"F. Castro (31, Deportivo Cali, Colombian Primera Division 22-23)",82.14351625074453
"R. González (29, Guadalajara, Liga MX 22-23)",81.63557892832752
"C. Türkmen (21, Austria Lustenau, Austrian Bundesliga 22-23)",80.68295811393139
"R. Levi (25, Hapoel Petah Tikva, Liga Leumit 22-23)",80.64506061817457
"T. Múdry (23, Zlaté Moravce, Slovak Super Liga 22-23)",80.42091951110281
"S. Karkache (23, Khouribga, Botola Pro 22-23)",79.98744350481694
"A. Chandarov (24, Levski Sofia, Bulgarian First League 22-23)",79.81858611879657
"Sultan Al Ghafri (36, Al Dhafra, UAE Pro League 22-23)",79.4877015464495
"Samuel Casais (31, Ceuta, Primera División RFEF 22-23)",79.29264749781555
"A. Erlingmark (25, Atromitos, Greek Super League 22-23)",79.2419188622009
"Y. Martynyuk (34, Metalist 1925 Kharkiv, Ukrainian Premier Liha 22-23)",78.74094601130173
"F. Pasamba (29, Rans Nusantara, BRI Liga 1 22-23)",78.68122484940966
"B. Stevenson (26, Forest Green Rovers, League One 22-23)",77.95626654319709
"Mohammed Al Jabri (32, Al Shamal, Qatari Stars League 22-23)",77.27129289282448
"T. Graham (30, Maritzburg United, South Africa PSL 22-23)",77.18570183372036
"Z. Duncan (22, Perth Glory, A-League Men 22-23)",76.96391054321468
"D. Jones (26, Charlotte FC, MLS 2023)",76.95697144239865
"João Gamboa (26, Estoril, Primeira Liga 22-23)",76.81819836255644
"J. Szöke (27, Aris, Cyprus 1. Division 22-23)",76.75184891170105
"T. Szeles (29, Pécsi MFC, NB II 22-23)",76.58022341599387
"M. De Iriondo (30, Rayo Majadahonda, Primera División RFEF 22-23)",76.56659159201816
"E. Abedini (24, Winterthur, Swiss Super League 22-23)",76.47905042974192
"C. Gruezo (28, SJ Earthquakes, MLS 2023)",76.43229922362767
