Player,Similarity
"A. Filipović (28, Partizan, Serbian SuperLiga 22-23)",81.95336252295708
"L. Lozano (24, Nacional, Uruguay Primera División 2023)",77.47199421242263
"H. Takahashi (24, Renofa Yamaguchi, J2 2023)",74.22329482966904
"G. Mina (27, Orense, Ecuador Liga Pro 2023)",72.01394260705312
"G. Jánvári (33, Nyíregyháza Spartacus, NB II 22-23)",71.49584211638096
" Jiwoo Park (22, Pyeongchang United, K4 League 2023)",69.23744496823248
"A. Garzia (21, Floriana, Malta Premier League 22-23)",68.81529708976123
"K. Apostolakis (23, Panetolikos FC, Greek Super League 22-23)",68.46293421618324
"M. Lang (32, Basel, Swiss Super League 22-23)",67.4421479214212
"C. Râpă (33, Cracovia Kraków, Ekstraklasa 22-23)",66.82894901342353
"M. Sylla (24, Hebar 1918, Bulgarian First League 22-23)",66.79505190155173
"N. Kovács (23, Ajka, NB II 22-23)",66.76206008658745
"W. Tebalán (22, Xelajú, Guatemala Liga Nacional 22-23)",66.72900733179567
"B. Deutsch (30, Nyíregyháza Spartacus, NB II 22-23)",66.3924959657185
"S. Mendoza (29, Sportivo Trinidense, Paraguay Division Profesional 2023)",66.25321533142592
"K. Galván (27, Sporting San Miguelito, Panama LPF 2023)",66.11894660246361
"E. Díaz (27, River Plate, Argentinian Primera División 2023)",65.52352149843058
"F. Ibrian (29, Unirea Slobozia, Romanian Liga II 22-23)",65.05175692830188
"I. Arhirii (26, 1599 Şelimbăr, Romanian Liga II 22-23)",64.947260142917
"N. Tošić (26, Čukarički, Serbian SuperLiga 22-23)",64.53628167557196
"M. Hrabina (30, Zbrojovka Brno, Czech Fortuna Liga 22-23)",64.45143303516087
"Hussein Al Sayed (31, Al Masry, Egyptian Premier League 22-23)",64.30556136915048
"S. Kachmazov (31, Alaniya Vladikavkaz, Russian FNL 2 22-23)",64.21460721543023
"B. Rymaniak (33, Arka Gdynia, Polish I Liga 22-23)",64.00138086107872
"G. Cotugno (28, Deportivo Maldonado, Uruguay Primera División 2023)",63.9311616143197
