Player 1,Similarity
"S. Mezei (22, MTK, NB II 22-23)",88.47636786418043
"A. Zorgane (23, Charleroi, Belgian Pro League 22-23)",87.3475224829277
"B. Iseni (26, Shkupi, North Macedonia First League 22-23)",85.5561093131646
"Á. Madrid (28, Everton, Chilean Primera División 2023)",83.75325255201763
"S. Mkrtchyan (21, Urartu, Armenian Premier League 22-23)",83.37006156692182
"J. Concha (24, Alianza Lima, Peruvian Liga 1 2023)",83.27568614031473
"L. Romero (29, León, Liga MX 22-23)",83.05232836002064
"R. de Paul (29, Atlético Madrid, La Liga 22-23)",82.97007987133502
"F. de Jong (26, Barcelona, La Liga 22-23)",82.92926052914675
"J. Concha (24, Alianza Lima, Peruvian Liga 1 2023)",82.2373367656512
"F. Tait (30, Rennes, Ligue 1 22-23)",82.18857945580405
"L. Krasniqi (31, Terengganu, Malaysian Super League 2023)",82.18784833326184
"J. Pineda (25, Águilas Doradas, Colombian Primera Division 22-23)",82.06657341674698
"J. Zuluaga (29, Deportivo Pereira, Colombian Primera Division 22-23)",81.83586482238651
"J. Concha (24, Alianza Lima, Peruvian Liga 1 2023)",81.14344934802537
"Jajá (28, Madura United, BRI Liga 1 22-23)",80.72403951574917
"J. Concha (24, Alianza Lima, Peruvian Liga 1 2023)",80.65139483840369
"J. Concha (24, Alianza Lima, Peruvian Liga 1 2023)",80.4654601185573
"F. Gorriarán (28, Tigres UANL, Liga MX 22-23)",80.16708388438322
"D. Avramovski (28, Sarajevo, Bosnian Premier League 22-23)",79.75637662990084
"J. Concha (24, Alianza Lima, Peruvian Liga 1 2023)",79.54067324468232
"A. Silva (33, Olimpia, Paraguay Division Profesional 2023)",79.4135815315189
"J. Concha (24, Alianza Lima, Peruvian Liga 1 2023)",79.16756438986596
"M. Doumbia (24, Slovan Liberec, Czech Fortuna Liga 22-23)",78.95073807581288
"J. Concha (24, Alianza Lima, Peruvian Liga 1 2023)",78.72444562311523
