Player,Similarity
"D. Kajević (34, Mornar, Montenegro First League 22-23)",88.74996351956557
"A. Şengül (24, Bandırmaspor, Turkish 1. Lig 22-23)",87.48563292262784
"D. Bernard (26, Forest Green Rovers, League One 22-23)",83.3601677101263
"J. Ward (33, Crystal Palace, Premier League 22-23)",83.30584539452587
"Saeed Sulaiman (24, Ajman, UAE Pro League 22-23)",82.62073684816967
"I. Pata (22, TOP Oss, Eerste Divisie 22-23)",82.44296380071417
"L. Chiti (22, Montevarchi, Serie C 22-23)",80.55852614902555
"F. Miguel (26, Huesca, La Liga 2 22-23)",80.19115378280468
"P. Bennevendo (23, Pumas UNAM, Liga MX 22-23)",79.97799000759072
"P. Poór (29, MTK, NB II 22-23)",79.55727892288583
"Lillo Castellano (34, Alcoyano, Primera División RFEF 22-23)",79.38739216984956
"L. Schwechlen (33, Denizlispor, Turkish 1. Lig 22-23)",78.64485939216196
"L. Mayo (23, Kilmarnock, Scottish Premiership 22-23)",78.35078082426747
"F. Sokoy (25, Barito Putera, BRI Liga 1 22-23)",77.98210603225142
"Z. Szokol (33, Nyíregyháza Spartacus, NB II 22-23)",77.6233368868068
"M. Mareco (29, General Caballero JLM, Paraguay Division Profesional 2023)",76.97702434041518
"J. Jacobs (23, Almere City, Eerste Divisie 22-23)",76.85147461027803
"D. Vukovic (30, Marsaxlokk, Malta Premier League 22-23)",75.93765783447117
"Adel Sabeel (25, Khorfakkan, UAE Pro League 22-23)",75.67949198763235
"O. Korsia (20, Enosis, Cyprus 1. Division 22-23)",75.45480240110824
"L. Asprilla (22, Tauro, Panama LPF 2023)",74.67306717525244
"D. Schmidt (31, Cambuur, Eredivisie 22-23)",74.5014838976256
"I. Govea (26, Club Tijuana, Liga MX 22-23)",74.47411139942014
"O. Obradović (23, Iskra, Montenegro First League 22-23)",74.43553069228427
"Hazza Salem (33, Al Wasl, UAE Pro League 22-23)",74.17377774737365
