Player,Similarity
"M. Eisa (28, Milton Keynes Dons, League One 22-23)",87.32347916125272
"H. Nur Yulianto (33, PSIS Semarang, BRI Liga 1 22-23)",86.47992463213538
"M. Škrbić (27, Radnički Niš, Serbian SuperLiga 22-23)",86.18401331780035
"A. Ngueukam (34, Mariehamn, Veikkausliiga 2023)",85.11972903612183
"J. Rodriguez (33, Burnley, Championship 22-23)",85.04514066825081
"N. Karelis (31, Panetolikos FC, Greek Super League 22-23)",84.50082242040673
"R. Becerra (35, Deportivo Cuenca, Ecuador Liga Pro 2023)",84.27164989935228
"O. Omoijuanfo (29, Brøndby, Superliga 22-23)",83.8820377273915
"Thuram (32, Pendikspor, Turkish 1. Lig 22-23)",83.67890765071978
"Héctor Hernández (27, Chaves, Primeira Liga 22-23)",83.26506346291421
"N. Ibáñez (28, Tigres UANL, Liga MX 22-23)",83.07722439568398
"G. Britos (33, Atlético Huila, Colombian Primera Division 22-23)",82.88909962147687
"D. Molinga (0, Al Shoalah, Saudi First Division 22-23)",82.81462150900803
"Sergio Camello (22, Rayo Vallecano, La Liga 22-23)",82.76666247919442
"Léo Bonatini (29, Atlético de San Luis, Liga MX 22-23)",82.65685361650628
"Y. Abuhatzira (26, Hapoel Kfar Saba, Liga Leumit 22-23)",82.60675142449205
"F. Ladapo (30, Ipswich Town, League One 22-23)",82.49735509684231
"N. Servetto (27, Platense, Argentinian Primera División 2023)",82.39730768518336
"M. Uysal (23, Manisa BBSK, Turkish 1. Lig 22-23)",82.35833334341709
"R. Huaccha (29, Sport Huancayo, Peruvian Liga 1 2023)",82.23827617206393
"S. Guirassy (27, Stuttgart, Bundesliga 22-23)",82.17485374480779
"E. Rotondi (31, Municipal, Guatemala Liga Nacional 22-23)",82.15426060810992
"G. Melamed (30, Bnei Sakhnin, Ligat Ha'al 22-23)",82.07701117500665
"B. Bíró (24, Szeged 2011, NB II 22-23)",82.07085781416819
"Rafa Mir (25, Sevilla, La Liga 22-23)",82.01996430604581
