Player,Similarity
"Jae-Suk Oh (33, Daejeon Citizen, K League 1 2023)",80.46407351431661
"Ahmed Hany (26, Ceramica, Egyptian Premier League 22-23)",79.96239259733497
"N. Clyne (32, Crystal Palace, Premier League 22-23)",75.4364522217114
"M. Sylla (24, Hebar 1918, Bulgarian First League 22-23)",74.04532290648544
"A. Filipović (28, Partizan, Serbian SuperLiga 22-23)",73.32509755076127
"F. Escobar (28, Houston Dynamo, MLS 2023)",72.72239884628603
"A. Dohling (27, Goa, Indian Super League 22-23)",72.12220213681375
"J. Gutiérrez (20, Huachipato, Chilean Primera División 2023)",70.74421920154435
"Ž. Baltrūnas (21, Sūduva, Lithuanian A Lyga 2023)",70.50599603136965
"Jeong Lee (22, Busan IPark, K4 League 2023)",70.19773118141227
"A. Langovich (20, Rostov, Russian Premier League 22-23)",69.66507168345188
"L. Lozano (24, Nacional, Uruguay Primera División 2023)",69.37348870486684
"L. Benito (31, Young Boys, Swiss Super League 22-23)",68.17174874344356
"B. Rymaniak (33, Arka Gdynia, Polish I Liga 22-23)",68.14859899389096
"B. Bedi (26, Zalaegerszegi TE, NB I 22-23)",67.58445927422544
"S. Sutton (21, Wellington Phoenix, A-League Men 22-23)",67.08669330366982
"Aihen Muñoz (25, Real Sociedad, La Liga 22-23)",67.06242576641411
"J. Justin (24, Leicester City, Premier League 22-23)",67.0093658880542
"O. Dadia (25, Hapoel Be'er Sheva, Ligat Ha'al 22-23)",66.81849814688641
"J. Hingert (32, Brisbane Roar, A-League Men 22-23)",66.61211326464034
"S. Sincere (25, Kauno Žalgiris, Lithuanian A Lyga 2023)",66.48320527032669
"D. Mijić (29, Ararat, Armenian Premier League 22-23)",66.38939521693854
"G. Cotugno (28, Deportivo Maldonado, Uruguay Primera División 2023)",66.31743171156515
"J. Nelson (24, St. Louis City , MLS 2023)",66.20555903112381
"Nasser Al Khalifa (26, Hajer, Saudi First Division 22-23)",65.84496654956365
