Player,Similarity
"E. Rodas (29, Atlético Grau, Peruvian Liga 1 2023)",75.128305735948
"V. Salazar (29, Olimpia, Paraguay Division Profesional 2023)",74.19113444975073
"J. Iskra (20, Sandecja Nowy Sącz, Polish I Liga 22-23)",70.83629112539148
"P. Beruatto (24, Pisa, Serie B 22-23)",70.8203505674865
"Kim Jin-Rae (26, Seongnam, K League 2 2023)",70.69862265249624
"Pablo García (22, Alcorcón, Primera División RFEF 22-23)",70.03708072628105
"A. Trumci (22, Bylis Ballsh, Albanian Premier League 22-23)",69.98855369786278
"L. Soares (29, Slavia Sofia, Bulgarian First League 22-23)",69.9363850255406
"J. Kuzdra (25, Chrobry Głogów, Polish I Liga 22-23)",69.31851883292131
"O. Sych (22, Kortrijk, Belgian Pro League 22-23)",69.14414202017318
"Tiago Manso (23, Trofense, Portugal Segunda Liga 22-23)",68.5736813856369
"D. Kuzyk (20, Lviv, Ukrainian Premier Liha 22-23)",68.54100831157179
"U. Çiftçi (31, Sivasspor, Süper Lig 22-23)",68.4629724409551
"O. Darwish (24, Bnei Sakhnin, Ligat Ha'al 22-23)",67.92866223162696
"K. Ríos (20, Pérez Zeledón, Costa Rica Primera División 22-23)",67.88026800751044
"S. Gutiérrez (30, Van, Armenian Premier League 22-23)",67.82659426356248
"E. Veiga (26, Vilafranquense, Portugal Segunda Liga 22-23)",67.74771948417454
"D. Dolmagić (29, Javor Ivanjica, Serbian SuperLiga 22-23)",67.71248198978593
"M. Şahin (22, Manisa BBSK, Turkish 1. Lig 22-23)",67.66273174749226
"A. Taous (22, Club Africain, Tunisian Ligue 1 22-23)",67.45664064213722
"M. Somma (21, Pontedera, Serie C 22-23)",67.15561400222452
"A. Sant'Anna (25, Defensa y Justicia, Argentinian Primera División 2023)",67.08943599394384
"Rafael Fonseca (22, Academico Viseu, Portugal Segunda Liga 22-23)",65.99079266992638
"L. Abanda (22, Lamia, Greek Super League 22-23)",65.90036804703546
"S. Strand (22, Åsane, OBOS Ligaen 2023)",65.86902819195345
