Player,Similarity
"G. Poblete (30, Al Wasl, UAE Pro League 22-23)",88.04933444696098
"T. Kesarat (29, Port FC, Thai League 1 22-23)",85.06850999309206
"Florentino Luís (23, Benfica, Primeira Liga 22-23)",85.03826346667381
"M. Hrimat (28, FAR Rabat, Botola Pro 22-23)",84.19600099532218
"Álex Bergantiños (37, Deportivo La Coruña, Primera División RFEF 22-23)",83.33445785516695
"C. Diniyev (27, Zira, Premyer Liqa 22-23)",83.13191910231603
"V. Tolgyesi (31, Kozármisleny, NB II 22-23)",81.97021445781235
"I. Saavedra (24, Universidad Católica, Chilean Primera División 2023)",81.36450573872374
"O. Castellanos (23, Antigua GFC, Guatemala Liga Nacional 22-23)",80.40902740003693
"E. Pavez (33, Colo Colo, Chilean Primera División 2023)",79.95381147259573
"P. Autra (27, Muang Thong United, Thai League 1 22-23)",79.72363461404987
"F. Sungatulin (21, Ural, Russian Premier League 22-23)",79.58881017719898
"H. Ryahi (29, Atlètic Club d'Escaldes, Andorra Primera Divisió 22-23)",79.09820373523803
"V. Lekhal (29, Le Havre, Ligue 2 22-23)",79.00532296716541
"N. Featherstone (34, Hartlepool United, League Two 22-23)",78.78928211597909
"Ramón Folch (33, Cornellà, Primera División RFEF 22-23)",78.26399862559951
"Petros (34, Al Fateh, Saudi Professional League 22-23)",78.25546918822901
"G. Krychowiak (33, Al Shabab, Saudi Professional League 22-23)",78.1515017769391
"A. Pomerko (33, Arsenal Tula, Russian FNL 2 22-23)",78.04143086164578
"K. Tachibanada (24, Kawasaki Frontale, J1 2023)",78.00517433880582
"Willian Arão (30, Fenerbahçe, Süper Lig 22-23)",77.45516920853017
"N. Wan (22, Johor Darul Ta'zim, Malaysian Super League 2023)",77.44896301954162
"Marc Aguado (23, FC Andorra, La Liga 2 22-23)",77.2155108588978
"J. Bell (24, Brøndby, Superliga 22-23)",76.98426678601595
"Mikel Vesga (30, Athletic Bilbao, La Liga 22-23)",76.71608605049258
