Player,Similarity
"M. Wasielewski (28, Katowice, Polish I Liga 22-23)",83.52656230591774
"A. Gilyazetdinov (28, Volgar Astrakhan, Russian FNL 2 22-23)",82.7387978794632
"T. Wójtowicz (19, Ruch Chorzów, Polish I Liga 22-23)",81.84572499922663
"C. Hadžiosmanović (24, Potenza, Serie C 22-23)",81.63292391425513
"J. Espinoza (24, Lugano, Swiss Super League 22-23)",80.78054847912436
"João Oliveira (24, Feirense, Portugal Segunda Liga 22-23)",80.64073854504312
"Victor García (25, Alcorcón, Primera División RFEF 22-23)",80.561278273702
"D. Abou (27, Bnei Sakhnin, Ligat Ha'al 22-23)",80.5285087411344
"F. Andika (23, Persija, BRI Liga 1 22-23)",80.38817166490315
"D. Zappella (25, Virtus Entella, Serie C 22-23)",80.21409516856328
"Fábio Nunes (30, Widzew Łódź, Ekstraklasa 22-23)",79.81109786257593
"K. Shirai (29, Kyoto Sanga, J1 2023)",79.75417857355687
"J. González (25, Xelajú, Guatemala Liga Nacional 22-23)",79.69745647564939
"O. Darwish (24, Bnei Sakhnin, Ligat Ha'al 22-23)",79.39885980827822
"A. Abdallah (25, Rodez , Ligue 2 22-23)",79.30517408765117
"A. Rustum (24, Maccabi Ahi Nazareth, Liga Leumit 22-23)",79.20224379331
"T. Teniste (35, Tartu Tammeka, Estonian Meistriliiga 2023)",79.17387225407447
"G. Tomaselli (23, Virtus Entella, Serie C 22-23)",78.96161717827263
"M. Ziemann (27, Zagłębie Sosnowiec, Polish I Liga 22-23)",78.86431221483159
"T. Persyn (21, Eindhoven, Eerste Divisie 22-23)",78.84579423183057
"R. Herman (22, Botev Plovdiv, Bulgarian First League 22-23)",78.80965653210906
"P. Gál-Andrezly (33, Csikszereda Miercurea Ciuc, Romanian Liga II 22-23)",78.34169723998286
"Celso Raposo (27, Lokomotiv Sofia 1929, Bulgarian First League 22-23)",78.0937107555652
"B. Bitton (32, Hapoel Tel Aviv, Ligat Ha'al 22-23)",78.02831341627936
"J. Graham (28, Birmingham City, Championship 22-23)",77.98959656957
