Player,Similarity
"D. Churín (33, Cerro Porteño, Paraguay Division Profesional 2023)",75.35527069568059
"P. Rubio (34, Ñublense, Chilean Primera División 2023)",64.0977296667609
"E. Yeboah (20, CFR Cluj, SuperLiga României 22-23)",63.12740542931663
"D. Tumbas (23, Rudar, Montenegro First League 22-23)",61.80510322641829
"Mario Barco (30, Numancia, Primera División RFEF 22-23)",60.07284772264471
"A. Nalini (32, Virtus Verona, Serie C 22-23)",60.00007385721784
"D. Beganović (27, Željezničar, Bosnian Premier League 22-23)",59.98416801830625
"D. Máris (22, Békéscsaba, NB II 22-23)",59.65932056060653
"Roberto Soldado (38, Levante, La Liga 2 22-23)",58.82774320393528
"C. Dépres (28, Rodez , Ligue 2 22-23)",58.81001311611649
"Sascha (36, Inter Club d'Escaldes, Andorra Primera Divisió 22-23)",58.11512506558904
"R. McAllister (35, Montrose, Scottish League One 22-23)",57.394047086682335
"L. Kozák (33, Trinity Zlín, Czech Fortuna Liga 22-23)",57.38635388795876
"A. Džafić (33, Sarajevo, Bosnian Premier League 22-23)",57.30926669784228
"A. Rodríguez (33, Deportivo Saprissa, Costa Rica Primera División 22-23)",56.69749407657633
"Y. Otto (24, Verl, 3. Liga 22-23)",56.662838076699
"A. Kamara (28, Aris, Greek Super League 22-23)",56.43032315163057
"G. Panico (26, Lucchese, Serie C 22-23)",55.91224877760983
"A. Valera (27, Universitario, Peruvian Liga 1 2023)",55.76878969302808
"I. Slimani (34, Brest, Ligue 1 22-23)",55.61443294378148
"Alisson Safira (28, Vitória Guimarães, Primeira Liga 22-23)",55.59593244027056
"J. Thiaré (30, Le Havre, Ligue 2 22-23)",55.49544328359488
"C. Fenninger (28, Bayreuth, 3. Liga 22-23)",55.37491984763538
"A. Sobolev (26, Spartak Moskva, Russian Premier League 22-23)",55.19435427304542
"B. Rubio (26, León, Liga MX 22-23)",55.14565185456208
