Player,Similarity
"Yeong-gyu Lee (25, Sejong Vanesse, K4 League 2023)",75.9524019104582
"T. Hume (21, Sunderland, Championship 22-23)",73.30260348641272
"K. Smith (31, Orlando City, MLS 2023)",72.61293279285418
"Reinildo Mandava (29, Atlético Madrid, La Liga 22-23)",72.23978091561607
"A. van Hoorenbeeck (24, Mechelen, Belgian Pro League 22-23)",70.79737035311685
"D. Hernández (25, Malacateco, Guatemala Liga Nacional 22-23)",68.77826752997755
"S. Ndlovu (26, Golden Arrows, South Africa PSL 22-23)",68.72054387604307
"M. Karamatic (21, Olimpija, 1. SNL 22-23)",68.57367105845718
"V. Samsonyan (22, BKMA, Armenian Premier League 22-23)",68.34832174751917
"I. Reis (23, UD Oliveirense, Portugal Segunda Liga 22-23)",66.8747520032
"J. Arias (30, Millonarios, Colombian Primera Division 22-23)",66.27354305387294
"K. Apostolakis (23, Panetolikos FC, Greek Super League 22-23)",66.2386241783003
"T. Nadaraia (26, Torpedo Kutaisi, Erovnuli Liga 2023)",65.55705119979544
"D. Burn (31, Newcastle United, Premier League 22-23)",65.01127499861255
"Eric Monjonell (21, Lommel SK, Belgian First Division B 22-23)",64.67850674876014
"K. Słaby (29, Sandecja Nowy Sącz, Polish I Liga 22-23)",64.34084262536315
"N. Grajeda (34, Iztapa, Guatemala Liga Nacional 22-23)",63.7004123413913
"F. Escobar (28, Houston Dynamo, MLS 2023)",63.081254241275786
"A. Bogusz (30, Chrobry Głogów, Polish I Liga 22-23)",62.05826904713847
"A. Angileri (21, Messina, Serie C 22-23)",61.94472013202227
"M. Peersman (32, Aris, Greek Super League 22-23)",61.748229659772434
"Y. Chaina (30, Khouribga, Botola Pro 22-23)",61.58403152085378
"J. Greaves (22, Hull City, Championship 22-23)",61.52117250075519
"A. Alese (22, Sunderland, Championship 22-23)",60.59573522122984
"A. Mankowski (22, Floridsdorfer AC, Austrian 2. Liga 22-23)",59.99322527464337
