Player,Similarity
"O. Norburn (30, Peterborough United, League One 22-23)",86.97905838830968
"K. N'Doram (27, Metz, Ligue 2 22-23)",79.03312397333903
"M. Mahamid (25, Hapoel Umm al-Fahm, Liga Leumit 22-23)",78.7908311712557
"M. Mathebula (22, Richards Bay, South Africa PSL 22-23)",78.09984273558095
"Y. Kobayashi (28, JEF United, J2 2023)",76.35366543171746
"D. Glazer (26, Maccabi Tel Aviv, Ligat Ha'al 22-23)",75.70978743249916
"G. Koffie (31, Ironi Tiberias, Liga Leumit 22-23)",75.5880692118931
"L. Ugochukwu (19, Rennes, Ligue 1 22-23)",75.58532825805501
"J. Ogu (35, Maccabi Kabilio Jaffa, Liga Leumit 22-23)",75.01773117497366
"L. Bodnar (23, Perth Glory, A-League Men 22-23)",74.6547360375028
"L. Ablorh (34, Police Tero, Thai League 1 22-23)",74.51902671575974
"A. Kasami (25, Struga, North Macedonia First League 22-23)",74.48598473800278
"J. Meffert (28, Hamburger SV, 2. Bundesliga 22-23)",74.40167998084236
"S. Haudum (28, Rheindorf Altach, Austrian Bundesliga 22-23)",74.31990884151533
"R. Krunić (29, Milan, Serie A 22-23)",74.27259579896169
"İ. Taşkın (28, Eyüpspor, Turkish 1. Lig 22-23)",74.21720818238036
"F. Coulibaly (30, ES Tunis, Tunisian Ligue 1 22-23)",74.1000717560191
"R. Chand (31, Persik Kediri, BRI Liga 1 22-23)",73.77902208763672
"S. Ben Sallam (21, Karmiotissa, Cyprus 1. Division 22-23)",73.73812347603665
"A. Mateiu (33, Universitatea Craiova, SuperLiga României 22-23)",73.70220749622317
"M. Kleinen (21, MVV, Eerste Divisie 22-23)",73.6254192899501
"G. Rodríguez (29, Real Betis, La Liga 22-23)",73.61930168814332
"Á. Vass (34, Soroksár SC, NB II 22-23)",73.00415598813731
"Y. Bissouma (26, Tottenham Hotspur, Premier League 22-23)",72.78998916775869
"R. Babenko (30, Dnipro-1, Ukrainian Premier Liha 22-23)",72.66088832519932
