Player,Similarity
"Jorge de Frutos (26, Levante, La Liga 2 22-23)",93.86776482547596
"Carlos Vicente (24, Racing Ferrol, Primera División RFEF 22-23)",93.75722122243307
"C. Archila (29, Municipal, Guatemala Liga Nacional 22-23)",93.1102086473191
"Edi Semedo (24, Penafiel, Portugal Segunda Liga 22-23)",92.06543664847906
"L. Bolton (23, Salford City, League Two 22-23)",91.77295413137364
"X. Severina (22, ADO Den Haag, Eerste Divisie 22-23)",91.58538931420836
"I. Chouaref (22, Sion, Swiss Super League 22-23)",91.37870057610316
"M. Batna (32, Al Fateh, Saudi Professional League 22-23)",91.08451933871838
"C. Blackett-Taylor (25, Charlton Athletic, League One 22-23)",91.0501254255161
"F. Amuzu (23, Anderlecht, Belgian Pro League 22-23)",90.85478789463198
"W. Alli (22, Zbrojovka Brno, Czech Fortuna Liga 22-23)",90.846854202016
"B. Önal (18, De Graafschap, Eerste Divisie 22-23)",90.69671602359394
"N. Sadaoui (30, Goa, Indian Super League 22-23)",90.637120398411
"D. Chuc (25, Comunicaciones, Guatemala Liga Nacional 22-23)",90.6200426779655
"P. Ampem (25, Rijeka, 1. HNL 22-23)",90.5007977903091
"N. Mendez-Laing (31, Derby County, League One 22-23)",89.86059897578421
"Luis Rioja (29, Deportivo Alavés, La Liga 2 22-23)",89.76080813456862
"N. Bastajić (32, Napredak Kruševac, Serbian SuperLiga 22-23)",89.64550387272851
"A. Bosnjak (29, Jezero, Montenegro First League 22-23)",89.59734385659382
"T. Verlinden (23, Beerschot-Wilrijk, Belgian First Division B 22-23)",89.25648000407843
"C. Antwi-Adjei (29, Bochum, Bundesliga 22-23)",89.18452741562169
"E. Mason-Clark (23, Peterborough United, League One 22-23)",89.0886809101079
"H. Akbunar (29, Eyüpspor, Turkish 1. Lig 22-23)",89.01634725622382
"C. Morrison (23, Falkirk, Scottish League One 22-23)",88.99774341659389
"S. Babicka (23, Aris, Cyprus 1. Division 22-23)",88.98163455558897
