Player,Similarity
"F. Borța (23, Petrolul 52, SuperLiga României 22-23)",88.25134304605746
"T. Delaine (31, Strasbourg, Ligue 1 22-23)",85.55409167791686
"M. Briceag (30, Universitatea Cluj, SuperLiga României 22-23)",85.30607029269765
"Vinícius Nogueira (21, Varbergs, Allsvenskan 2023)",85.08824533108428
"Diego Moreno (21, Osasuna B, Primera División RFEF 22-23)",84.63211656014661
"L. Abanda (22, Lamia, Greek Super League 22-23)",84.09560350850444
"C. Alexe (27, Minaur Baia Mare, Romanian Liga II 22-23)",83.5140219868937
"A. Rizza (20, Piacenza, Serie C 22-23)",83.39645564306237
"G. Nicolao (29, Gubbio, Serie C 22-23)",82.97702404572023
"K. Gordon (25, Crawley Town, League Two 22-23)",82.89807791903743
"D. Ros (25, Unirea Dej, Romanian Liga II 22-23)",82.61460363716576
"L. Bennett (21, Cambridge United, League One 22-23)",82.48341777480238
"L. Falbo (23, Monopoli, Serie C 22-23)",82.29260638409586
"F. Dumbravă (28, Brașov Steagul Renaște, Romanian Liga II 22-23)",82.11095769002067
"O. Gašević (21, Rudar, Montenegro First League 22-23)",82.10999712013812
"A. Dagarchaoui (0, Al Ain, Saudi First Division 22-23)",81.97572659054858
"D. Foulquier (30, Valencia, La Liga 22-23)",81.95902297343369
"M. Kravchenko (25, Kolos Kovalivka, Ukrainian Premier Liha 22-23)",81.51080400861093
"M. Sala (23, Palermo, Serie B 22-23)",81.44506308659801
"M. Seck (27, Portimonense, Primeira Liga 22-23)",81.25103877665366
"K. Sakamoto (22, Giravanz Kitakyushu, J3 2023)",81.09912896319861
"A. Hyčka (32, Teplice, Czech Fortuna Liga 22-23)",81.05978497879333
"Bader Nasser (21, Shabab Al Ahli Dubai, UAE Pro League 22-23)",80.76284659649602
"M. Vukčević (29, UTA Arad, SuperLiga României 22-23)",80.58248503999934
"G. Favale (25, Virtus Entella, Serie C 22-23)",80.4536110449451
