Player,Similarity
"M. Papp (33, Dorogi FC, NB II 22-23)",89.48718773646512
"A. Ballah (22, Persebaya Surabaya, BRI Liga 1 22-23)",87.17119927360069
"M. Isais (22, Pachuca, Liga MX 22-23)",84.11488165976492
"P. Kiss-Szemán (20, Szentlőrinc SE, NB II 22-23)",83.08823935880586
"L. Malešević (24, Petrovac, Montenegro First League 22-23)",82.31885254291925
"A. Ambekar (31, Mohammedan, I-League 22-23)",82.19776874289234
"J. Padilla (29, Mazatlán, Liga MX 22-23)",82.00271605565983
"H. Bhatt (26, Rajasthan United, I-League 22-23)",81.46903147760578
"Junior Morais (36, Rapid Bucureşti, SuperLiga României 22-23)",81.01854969985635
"Mikel Kortazar (24, CD Calahorra, Primera División RFEF 22-23)",80.80825158581432
"N. Lüchinger (28, Thun, Swiss Challenge League 22-23)",79.91121038431966
"Jaume Pol (28, Numancia, Primera División RFEF 22-23)",79.75896095925495
"L. Deinhofer (29, Amstetten, Austrian 2. Liga 22-23)",79.51124322734108
"J. Vinck (27, Excelsior Virton, Belgian First Division B 22-23)",79.48613692094376
"N. Bakboord (24, Heracles, Eerste Divisie 22-23)",79.22205479957512
"D. Magda (25, Zemplín Michalovce, Slovak Super Liga 22-23)",79.02522497635024
"T. Kapetanović (19, Sloboda Tuzla, Bosnian Premier League 22-23)",78.94468639420785
"K. Szűcs (26, Ajka, NB II 22-23)",78.7908691518464
"D. Galazzini (23, Trento, Serie C 22-23)",78.65784227305817
"Saeed Baetaih (0, Jeddah, Saudi First Division 22-23)",78.44137749940175
"C. Zamfirescu (24, Ripensia Timişoara, Romanian Liga II 22-23)",78.0811171471729
"M. Bruscagin (33, Pordenone, Serie C 22-23)",78.04915733701063
"Basem Ali (34, Future, Egyptian Premier League 22-23)",77.93147858902161
"Y. Dibango (21, Kryvbas KR, Ukrainian Premier Liha 22-23)",77.53070858164641
"Y. Güreler (31, Ankaragücü, Süper Lig 22-23)",77.4930225838499
