Player,Similarity
"B. Akos (21, Dorogi FC, NB II 22-23)",88.4494728418639
"C. Allen (19, Fremad Amager, Danish 1. Division 22-23)",84.52931258376898
"A. Boccadamo (23, Taranto, Serie C 22-23)",82.49843587826331
"A. Danek (28, Korona Kielce, Ekstraklasa 22-23)",80.31842662466421
"E. Durm (31, Kaiserslautern, 2. Bundesliga 22-23)",80.04099392754621
"Y. Paz (20, Perugia, Serie B 22-23)",79.78302592202841
"V. Roman (20, Rukh Lviv, Ukrainian Premier Liha 22-23)",79.64363701794635
"Diogo Tavares (25, Belenenses, Portugal Segunda Liga 22-23)",79.47851159974408
"Víctor Parada (21, Real Unión, Primera División RFEF 22-23)",79.22110980302213
"N. Tenaglia (27, Deportivo Alavés, La Liga 2 22-23)",78.07134110076116
"G. Enrique (23, Gimnasia La Plata, Argentinian Primera División 2023)",77.35590719598441
"I. Guri (19, Hapoel Ramat HaSharon, Liga Leumit 22-23)",77.12632989045848
"J. Longo (29, Xinabajul, Guatemala Liga Nacional 22-23)",76.8549720053556
"F. Rodio (21, Viterbese, Serie C 22-23)",76.09852789562106
"I. Ogundere (20, AFC Wimbledon, League Two 22-23)",75.17143313506487
"K. Freeman (23, Dundee United, Scottish Premiership 22-23)",74.98713318843362
"A. Bosec (25, Slaven Belupo, 1. HNL 22-23)",74.65597024584483
"D. Granečný (24, Zbrojovka Brno, Czech Fortuna Liga 22-23)",73.78052171459227
"V. Gaiu (22, Zimbru, Moldovan Super Liga 22-23)",73.27248657760576
"Álvaro Ramón (23, Mérida AD, Primera División RFEF 22-23)",72.94253577211474
"N. Williams (22, Nottingham Forest, Premier League 22-23)",72.81893840117975
"G. Kamel (28, Pharco, Egyptian Premier League 22-23)",72.8081095896464
"I. Budinov (22, OFK Pirin, Bulgarian First League 22-23)",72.55395198733635
"K. Šturm (28, Hapoel Hadera, Ligat Ha'al 22-23)",72.54674096926063
"M. Hellal (21, Hammam-Sousse, Tunisian Ligue 1 22-23)",72.27570946095206
