Player,Similarity
"C. Thomson (32, Edinburgh City, Scottish League Two 22-23)",74.98731040571278
"Á. Présinger (34, Ajka, NB II 22-23)",73.68831341156955
"Antunes (36, Paços de Ferreira, Primeira Liga 22-23)",73.46836171306067
"K. Vega (31, Puntarenas, Costa Rica Primera División 22-23)",73.28877659984158
"G. Manfrin (29, Virtus Verona, Serie C 22-23)",72.56906896259859
"Mikel Iribas (35, Fuenlabrada, Primera División RFEF 22-23)",72.16097046201891
"F. Lepore (37, Lecco, Serie C 22-23)",71.81008078106484
"R. Febrianto (26, Arema, BRI Liga 1 22-23)",71.8098720349338
"C. Failla (37, Mosta, Malta Premier League 22-23)",71.58820766948472
"A. Sütő (28, Kazincbarcika, NB II 22-23)",71.48657183688732
"Y. Román (26, San Carlos, Costa Rica Primera División 22-23)",71.44934243722683
"F. Mullen (29, Cowdenbeath, Scottish League Two 22-23)",71.30615964331557
"S. Tursynbay (24, Maqtaaral, Kazakh Premier League 2023)",71.18304110678208
"D. Andrew (32, Fleetwood Town, League One 22-23)",71.07144884344204
"T. James (27, Leyton Orient, League Two 22-23)",70.67882345330887
"O. Nemssaoui (32, UTS Rabat, Botola Pro 22-23)",70.39758391215307
"M. Olivera (31, Juárez, Liga MX 22-23)",70.18257665229974
"Fran Varela (28, Linares Deportivo, Primera División RFEF 22-23)",69.8720566228984
"Cote (33, Sporting Gijón, La Liga 2 22-23)",69.84371383395143
"Khalid Al-Soubaiy (23, Al Qaisoma, Saudi First Division 22-23)",69.65645935593604
"Z. Ralte (28, Aizawl, I-League 22-23)",68.66430342673378
"R. Hernández (0, Achuapa, Guatemala Liga Nacional 22-23)",68.29150761515154
"Joan Oriol (36, Gimnàstic Tarragona, Primera División RFEF 22-23)",68.2048723355021
"M. Vojtko (22, Gorica, 1. HNL 22-23)",68.15828173200153
"M. Bandarra (27, Farense, Portugal Segunda Liga 22-23)",68.13335238851033
