Player,Similarity
"D. Gazdag (27, Philadelphia Union, MLS 2023)",83.9503601574901
"M. Harness (27, Ipswich Town, League One 22-23)",83.91773015732039
"T. Svetlin (21, AŠK Bravo, 1. SNL 22-23)",81.46714720361706
"A. Kotnik (27, Koper, 1. SNL 22-23)",80.89585829648499
"K. Palmer (26, Coventry City, Championship 22-23)",80.48397414709947
"Lucas Paquetà (25, West Ham United, Premier League 22-23)",80.47981073535566
"Hussein Faisal (24, Smouha, Egyptian Premier League 22-23)",80.39435927127005
"R. Bartoš (30, Tatran Liptovský Mikuláš, Slovak Super Liga 22-23)",80.14091963200673
"L. Stankovski (20, Rabotnički, North Macedonia First League 22-23)",80.00564217769842
"K. Doumbia (20, Reims, Ligue 1 22-23)",79.46461172571938
"N. Stefanelli (28, Inter Miami, MLS 2023)",78.29380325057308
"F. Sassi (31, Al Duhail, Qatari Stars League 22-23)",77.40127621341473
"N. Bätzner (23, Oostende, Belgian Pro League 22-23)",77.04894177550658
"Jon Toral (28, OFI, Greek Super League 22-23)",76.82834078024901
"R. Bezus (32, Omonia Nicosia, Cyprus 1. Division 22-23)",76.33175008890008
"E. Sylvestre (23, Pau, Ligue 2 22-23)",76.2737393278419
"S. Koné (22, Porto II, Portugal Segunda Liga 22-23)",75.85076163563211
"B. El Khannous (19, Genk, Belgian Pro League 22-23)",75.73731539620854
"D. Romanovskij (26, Šiauliai, Lithuanian A Lyga 2023)",75.49663136056725
"Mohamed Reda (22, Future, Egyptian Premier League 22-23)",75.2913208068419
"F. Papoulis (38, Omonia Nicosia, Cyprus 1. Division 22-23)",74.53191622238057
"M. Maertens (28, OH Leuven, Belgian Pro League 22-23)",73.9484193508527
"M. Čermák (24, České Budějovice, Czech Fortuna Liga 22-23)",73.59921160912786
"João Pedro (21, Watford, Championship 22-23)",73.49248783529664
"C. Chaplin (26, Ipswich Town, League One 22-23)",72.32606561072595
