Player,Similarity
"Borja Iglesias (30, Real Betis, La Liga 22-23)",84.59434903178337
"G. Malcore (29, Audace Cerignola, Serie C 22-23)",84.56815280242394
"S. Armenteros (33, Heracles, Eerste Divisie 22-23)",84.25641376700268
"I. Kolev (27, Sirens, Malta Premier League 22-23)",83.56348717226535
"L. Jović (25, Fiorentina, Serie A 22-23)",83.01224890623433
"David Rodríguez (37, Rayo Majadahonda, Primera División RFEF 22-23)",82.92921767807316
"B. Sepúlveda (30, Barracas Central, Argentinian Primera División 2023)",82.53447169558619
"Manu Justo (27, Racing Ferrol, Primera División RFEF 22-23)",82.52129477200015
"B. Białek (21, Vitesse, Eredivisie 22-23)",82.46108959001596
"João Figueiredo (27, İstanbul Başakşehir, Süper Lig 22-23)",82.30375256736825
"Hicham Khaloua (28, UTS Rabat, Botola Pro 22-23)",82.19671388876276
"O. Stijepović (23, Imolese, Serie C 22-23)",82.12309410879847
"B. Burmaz (22, Voždovac, Serbian SuperLiga 22-23)",81.983486168962
"T. Baribo (25, Wolfsberger AC, Austrian Bundesliga 22-23)",81.86904264172638
"N. Martínez (32, Cobán Imperial, Guatemala Liga Nacional 22-23)",81.57239710741231
"S. Prevljak (28, Eupen, Belgian Pro League 22-23)",81.31114239606772
"B. Mikeltadze (25, Newcastle Jets, A-League Men 22-23)",81.28354197555664
"U. Bozok (26, Trabzonspor, Süper Lig 22-23)",81.25554544165324
"I. Shviro (24, Ironi Kiryat Shmona, Ligat Ha'al 22-23)",80.85419513421624
"F. Caputo (35, Empoli, Serie A 22-23)",80.7903325881587
"G. Scamacca (24, West Ham United, Premier League 22-23)",80.73214950867579
"F. Mastroianni (31, Fiorenzuola, Serie C 22-23)",80.53561822079429
"F. Bonazzoli (26, Salernitana, Serie A 22-23)",80.5199736465116
"V. Aboubakar (31, Al Nassr, Saudi Professional League 22-23)",80.51676998076599
"N. Stojiljković (30, Al Riyadh, Saudi First Division 22-23)",80.02864987689269
