Player,Similarity
"I. Marcone (32, Independiente, Argentinian Primera División 2023)",72.42309292000807
"J. Kolenc (29, Chrobry Głogów, Polish I Liga 22-23)",70.41863523469539
"J. Traore (20, Shirak, Armenian Premier League 22-23)",68.97637253484905
"R. Cristóbal (27, River Plate, Uruguay Primera División 2023)",66.64449517622512
"B. Touré (30, Auxerre, Ligue 1 22-23)",66.07684016390067
"Ricardo Ryller (29, Al Feiha, Saudi Professional League 22-23)",65.69263002223288
"Vasco Rocha (34, Trofense, Portugal Segunda Liga 22-23)",63.9441325916922
"E. Matazo (21, Monaco, Ligue 1 22-23)",63.59862712533882
"N. Linares (27, Instituto, Argentinian Primera División 2023)",63.58535425443219
"C. Ortiz (34, Monterrey, Liga MX 22-23)",63.2024250784242
"K. Londoño (22, Boyacá Chicó, Colombian Primera Division 22-23)",62.649031324497216
"K. Palić (26, Metalourg, Uzbek Super League 2023)",62.58834928110206
"E. Almuwallad (0, Al Akhdoud, Saudi First Division 22-23)",62.56374167261287
"E. Orzusa (32, Nacional Asunción, Paraguay Division Profesional 2023)",62.49696185725501
"D. Glaby (27, Coquimbo Unido, Chilean Primera División 2023)",62.47040507168171
"H. Siswanto (33, Borneo FC, BRI Liga 1 22-23)",61.8459989194515
"Pau Bosch (35, Inter Club d'Escaldes, Andorra Primera Divisió 22-23)",61.799889290326014
"M. Hlinka (32, Trinity Zlín, Czech Fortuna Liga 22-23)",61.15960247835153
"A. Bach (25, FUS Rabat, Botola Pro 22-23)",61.10319206165781
"Javi Serrano (20, Ibiza, La Liga 2 22-23)",60.97742086425446
"Dae-won Yun (26, Ulsan Citizen, K3 League 2023)",60.9402733263723
"J. Franco (20, General Caballero JLM, Paraguay Division Profesional 2023)",60.696453208923984
"S. Longo (25, Belgrano, Argentinian Primera División 2023)",60.66721666704883
"S. Tanaka (20, Kortrijk, Belgian Pro League 22-23)",60.42450052977194
"F. Martínez (29, Sarmiento, Argentinian Primera División 2023)",59.78901369679359
