Player,Similarity
"M. Retegui (24, Tigre, Argentinian Primera División 2023)",89.00347614646832
"C. Olivares (24, Deportivo Municipal, Peruvian Liga 1 2023)",87.92933758581941
"A. Šporar (29, Panathinaikos, Greek Super League 22-23)",87.66431482148967
"S. Simeri (30, Imolese, Serie C 22-23)",87.08605791887358
"Andre Clóvis (25, Academico Viseu, Portugal Segunda Liga 22-23)",87.0576891604608
"V. Janssen (28, Antwerp, Belgian Pro League 22-23)",86.74712261070438
"V. Osimhen (24, Napoli, Serie A 22-23)",86.72157107208093
"J. Nsamé (30, Young Boys, Swiss Super League 22-23)",86.60882063936643
"Jefferson (28, Gzira United, Malta Premier League 22-23)",86.27823325599746
"D. Darboe (24, Shkupi, North Macedonia First League 22-23)",86.19256405598546
"G. Sio (34, Sion, Swiss Super League 22-23)",86.17259765762633
"N. Bonfanti (21, Modena, Serie B 22-23)",85.75076071509075
"J. Venegas (34, Alajuelense, Costa Rica Primera División 22-23)",85.65411993467362
"E. Rotondi (31, Municipal, Guatemala Liga Nacional 22-23)",85.3358265663197
"J. East (28, Deportivo Saprissa, Costa Rica Primera División 22-23)",85.28070379522423
"A. Soukouna (30, Maritzburg United, South Africa PSL 22-23)",85.10929252188113
"M. Benyettou (33, Al Wakrah, Qatari Stars League 22-23)",84.9396024047345
"Jeong Woo-Geun (32, Police Tero, Thai League 1 22-23)",84.93275284899472
"J. Dinenno (28, Pumas UNAM, Liga MX 22-23)",84.58486703643148
"J. Murano (33, Potenza, Serie C 22-23)",84.54359979490248
"Nélson Oliveira (31, PAOK, Greek Super League 22-23)",84.52027302402021
"S. Giménez (22, Feyenoord, Eredivisie 22-23)",84.35599741340857
"K. Laba (31, Al Ain, UAE Pro League 22-23)",84.16203569056421
"R. Hennings (35, Fortuna Düsseldorf, 2. Bundesliga 22-23)",84.15241603732736
"M. Nukić (32, Olimpija, 1. SNL 22-23)",84.08355186541634
