Player,Similarity
"D. Gayle (33, Stoke City, Championship 22-23)",88.45943095453268
"Saldanha (23, Neftchi, Premyer Liqa 22-23)",87.5238630621119
"C. Samake (25, Olympic Safi, Botola Pro 22-23)",85.92732213619489
"I. Diomande (28, Al Sahel, Saudi First Division 22-23)",85.15803593433104
"R. Krishna (35, Bengaluru, Indian Super League 22-23)",85.06356860493356
"M. Pavkov (29, Al Feiha, Saudi Professional League 22-23)",84.820643763234
"N. Vergos (27, Lamia, Greek Super League 22-23)",84.6500931544551
"N. Da Silva (26, Resistencia, Paraguay Division Profesional 2023)",84.36757141542233
"Y. Muritala (23, Hibernians, Malta Premier League 22-23)",84.32483483857787
"J. Donnelly (28, Glentoran, Northern Ireland Premiership 22-23)",83.50052099104909
"C. Johnston (28, Montrose, Scottish League One 22-23)",83.41529264512968
"T. Poeiphimai (20, Port FC, Thai League 1 22-23)",83.31294130854356
"A. Chidi Kwem (25, AmaZulu, South Africa PSL 22-23)",83.08459058010764
"T. Thomsen (30, Hvidovre, Danish 1. Division 22-23)",82.4528280933785
"D. Chima (32, Jamshedpur, Indian Super League 22-23)",82.302171509388
"Miguel De La Fuente (23, Deportivo Alavés, La Liga 2 22-23)",82.1022964937854
"M. Sahd (29, FAR Rabat, Botola Pro 22-23)",81.82641469993399
"C. Ikwuemesi (21, Celje, 1. SNL 22-23)",81.70442674794727
"E. Tozlu (32, BB Erzurumspor, Turkish 1. Lig 22-23)",81.66487571293274
"A. Kashtanov (27, Ural, Russian Premier League 22-23)",81.55355891097133
"F. Pittarello (26, FeralpiSalò, Serie C 22-23)",81.37324374662252
"J. Afolabi (23, Bohemians, League of Ireland PL 2023)",81.3439179042406
"J. Mbakogu (30, Triestina, Serie C 22-23)",81.3276288709426
"M. Mølvadgaard (23, Næstved, Danish 1. Division 22-23)",81.31025779588015
"W. Ramdhani (24, Persita, BRI Liga 1 22-23)",81.00535980907088
