Player,Similarity
"A. Ghazoini (22, Vis Pesaro, Serie C 22-23)",72.60102142542296
"A. Temanfo (30, Annecy, Ligue 2 22-23)",71.25675337617811
"G. Lončar (21, Kolubara, Serbian SuperLiga 22-23)",67.56382707507197
"Mohammed Reman (26, Al Akhdoud, Saudi First Division 22-23)",67.24485253822274
"N. Shimura (30, Spartak Subotica, Serbian SuperLiga 22-23)",67.18327004805792
"Amir Saiful (28, PDRM, Malaysian Super League 2023)",66.23742998326946
"Abdel Aziz Mitwali (27, Al Shamal, Qatari Stars League 22-23)",65.16272264510317
"G. Álvarez (23, Getafe, La Liga 22-23)",65.15214466654606
"Jon Aramburu (20, Real Unión, Primera División RFEF 22-23)",65.1288224326029
"A. Szabó (21, Honvéd, NB I 22-23)",64.96019186609846
"Lanchi (21, San Fernando, Primera División RFEF 22-23)",64.53497995056365
"K. Kościelny (31, Warta Poznań, Ekstraklasa 22-23)",64.36220394844693
"M. Ruddy (29, Dungannon Swifts, Northern Ireland Premiership 22-23)",63.97070425824752
"A. Godja (18, Viitorul P. Targu Jiu, Romanian Liga II 22-23)",63.56250641974829
"M. Koj (29, Puszcza Niepołomice, Polish I Liga 22-23)",63.52651777186144
"J. Cirulis (19, SK Super Nova Salaspils, Virsliga 2023)",63.19253826774453
"I. Burnea (30, Mioveni, SuperLiga României 22-23)",62.871396195034826
"M. Gardawski (32, Asteras Tripolis, Greek Super League 22-23)",62.23910815536349
"Óscar Gil (25, Espanyol, La Liga 22-23)",61.80229682868024
"C. Vargas (24, Cruz Azul, Liga MX 22-23)",60.973637790680016
"M. Snoddy (29, Glenavon, Northern Ireland Premiership 22-23)",60.75607647021051
"J. Cardona (24, Once Caldas, Colombian Primera Division 22-23)",60.53740021909854
"Habib Yousuf (27, Dibba Al Fujairah, UAE Pro League 22-23)",60.5050149557058
"S. Abubakar (25, Radnik Surdulica, Serbian SuperLiga 22-23)",59.89506817722765
"R. Župa (25, Tatran Liptovský Mikuláš, Slovak Super Liga 22-23)",59.60567754037767
