Player,Similarity
"Young-min Song (25, Yangpyeong, K3 League 2023)",86.5554781258989
"N. Pavan (29, Cittadella, Serie B 22-23)",80.10751393165107
"Emad Hamdi (30, Ismaily, Egyptian Premier League 22-23)",76.89184556926404
"S. Field (25, Queens Park Rangers, Championship 22-23)",76.56198786652348
"M. Oreščanin (25, Radnik Surdulica, Serbian SuperLiga 22-23)",76.1566657272071
"V. Dican (22, Botoşani, SuperLiga României 22-23)",75.70367810098692
"Markel Lozano (27, UD Logroñés, Primera División RFEF 22-23)",75.24595523728877
"Edson (31, Al Adalah, Saudi Professional League 22-23)",75.23267995641062
"J. Schuurman (25, Roda JC, Eerste Divisie 22-23)",74.10287331399998
"Marcelo (32, Sirens, Malta Premier League 22-23)",73.48104286722531
"D. Hrka (23, Gorica, 1. SNL 22-23)",73.18620669412972
"K. Badoev (23, Veles, Russian FNL 2 22-23)",72.66595509984984
"A. Karazor (26, Stuttgart, Bundesliga 22-23)",72.5084809191264
"D. Brînzan (26, Viitorul P. Targu Jiu, Romanian Liga II 22-23)",72.00928418693509
"G. Galli (27, Lecco, Serie C 22-23)",71.6619898161394
"Jota Gonçalves (22, Tondela, Portugal Segunda Liga 22-23)",71.22951656133687
"A. Şut (24, FCS Bucureşti, SuperLiga României 22-23)",70.49035804547611
"M. Kereki (26, Unirea Dej, Romanian Liga II 22-23)",70.35981109318713
"W. Fernández (29, Puntarenas, Costa Rica Primera División 22-23)",70.23963533050667
"M. Ndiaye (22, Estoril, Primeira Liga 22-23)",70.06474245518704
"S. Njie (21, Zemplín Michalovce, Slovak Super Liga 22-23)",69.45105167480438
"Alvaro Bely (29, CSF Bălți, Moldovan Super Liga 22-23)",69.33600732154802
"S. Khumalo (32, Marumo Gallants, South Africa PSL 22-23)",69.29800395405692
"A. Tanasa (32, Rimini, Serie C 22-23)",69.1510420834747
"T. Naylor (31, Wigan Athletic, Championship 22-23)",69.1027146872394
