Player,Similarity
"O. Korsia (20, Enosis, Cyprus 1. Division 22-23)",79.87098699231741
"D. Yedlin (29, Inter Miami, MLS 2023)",76.14401309779491
"L. De Bock (30, Atromitos, Greek Super League 22-23)",74.17208467303914
"Abdullah Idrees (23, Al Jazira, UAE Pro League 22-23)",73.41535299966851
"T. Kehrer (26, West Ham United, Premier League 22-23)",73.12029272457116
"Alif Zakaria (24, Terengganu, Malaysian Super League 2023)",72.63173913995267
"O. Rodríguez (26, León, Liga MX 22-23)",72.30947276889306
"R. Handa (21, Gamba Osaka, J1 2023)",71.7988106395099
"Y. Pasich (29, Dnipro-1, Ukrainian Premier Liha 22-23)",71.19953449312642
"O. Chornomorets (30, Kolos Kovalivka, Ukrainian Premier Liha 22-23)",71.10051334112667
"Abdalla Yousif (21, Al Gharafa, Qatari Stars League 22-23)",70.59025796593035
"Hazza Salem (33, Al Wasl, UAE Pro League 22-23)",70.572510863903
"I. Govea (26, Club Tijuana, Liga MX 22-23)",70.29601170114546
"I. Vujica (26, Macarthur, A-League Men 22-23)",70.17837471582986
"P. Poór (29, MTK, NB II 22-23)",69.65838399355412
"J. Arias (30, Millonarios, Colombian Primera Division 22-23)",69.61389074985667
"C. Jiménez (28, Antigua GFC, Guatemala Liga Nacional 22-23)",69.59514815284147
"A. Waenlor (28, Lampang, Thai League 1 22-23)",69.30390883022882
"F. Sokoy (25, Barito Putera, BRI Liga 1 22-23)",69.24330195752432
"Y. Hurtado (26, Águilas Doradas, Colombian Primera Division 22-23)",68.94211347726969
"A. Palmezano (24, Atlético Chiriquí, Panama LPF 2023)",68.6465310746823
"Mohammed Ismael (31, Ajman, UAE Pro League 22-23)",68.44223569556735
"A. Marušić (30, Lazio, Serie A 22-23)",67.84309694407165
"E. Valencia (23, Unión La Calera, Chilean Primera División 2023)",67.688515969339
"Antonio Luna (32, Volos NFC, Greek Super League 22-23)",67.57464379673141
