Player,Similarity
"E. Panya (23, Muang Thong United, Thai League 1 22-23)",77.70305764811387
"Alan (23, Moreirense, Portugal Segunda Liga 22-23)",75.78270143990262
"A. Gnezda Čerin (23, Panathinaikos, Greek Super League 22-23)",74.1862841216118
"Ó. Trejo (35, Rayo Vallecano, La Liga 22-23)",73.71526220147207
"A. El Hassouni (28, Wydad Casablanca, Botola Pro 22-23)",73.25131726918575
"T. Zwane (33, Mamelodi Sundowns, South Africa PSL 22-23)",70.84816854510933
"I. Noy (22, First Vienna, Austrian 2. Liga 22-23)",70.42625972796377
"J. Carcela-González (23, Deinze, Belgian First Division B 22-23)",70.35617399884408
"E. Bardhi (27, Trabzonspor, Süper Lig 22-23)",70.26072515347278
"A. Camara (22, Atromitos, Greek Super League 22-23)",70.21533279061258
"S. Rodríguez (23, New York City, MLS 2023)",69.83323379296263
"T. Nguen (29, Ferencváros, NB I 22-23)",68.69723910945818
"Alex Fernandes (20, Cherno More, Bulgarian First League 22-23)",68.50660524928053
"A. Măţan (23, Columbus Crew, MLS 2023)",68.25046474901515
"Z. Kalmár (27, DAC, Slovak Super Liga 22-23)",68.16044958721702
"M. Pronichev (25, Horn, Austrian 2. Liga 22-23)",68.12161597112181
"S. Kowalczyk (24, Pogoń Szczecin, Ekstraklasa 22-23)",68.08749858509088
"A. Colpani (24, Monza, Serie A 22-23)",67.90100374183965
"R. Kronaveter (36, Maribor, 1. SNL 22-23)",67.35996352910247
"Álex López (35, Racing Ferrol, Primera División RFEF 22-23)",67.31606621943553
"Samu (27, Vizela, Primeira Liga 22-23)",67.23852968642576
"P. Altán (25, Municipal, Guatemala Liga Nacional 22-23)",67.18684010076029
"V. Pimentel (32, Sporting San Miguelito, Panama LPF 2023)",67.09943058072963
"B. Toma (23, Genk II, Belgian First Division B 22-23)",66.63434781042106
"G. Konstantelias (20, PAOK, Greek Super League 22-23)",66.59713054818414
