Player,Similarity
"A. Roman (29, CSMS Iaşi, Romanian Liga II 22-23)",90.69824701323154
"Abdelrahman Khaled (27, Al Mokawloon, Egyptian Premier League 22-23)",89.2251376499539
"S. Córdova (25, Tigres UANL, Liga MX 22-23)",88.81397054755863
"Z. Boutmene (22, Etoile du Sahel, Tunisian Ligue 1 22-23)",88.62094060023858
"U. Nikolić (29, Vojvodina, Serbian SuperLiga 22-23)",88.56161721283028
"C. Buonaiuto (30, Cremonese, Serie A 22-23)",88.47418501124655
"D. Illés (29, Mosonmagyaróvári TE, NB II 22-23)",88.10549629787562
"E. Agyiri (25, Levadia, Estonian Meistriliiga 2023)",87.89277780388193
"Y. Kikui (23, Matsumoto Yamaga, J3 2023)",87.36683923857407
"L. Stojković (19, Lokomotiva Zagreb, 1. HNL 22-23)",87.23560435612858
"O. Velanas (24, NAC Breda, Eerste Divisie 22-23)",87.17396168568402
"S. Verdi (30, Hellas Verona, Serie A 22-23)",86.87309983005467
"P. Mišić (28, Tuzla City, Bosnian Premier League 22-23)",86.6666578525453
"E. Hoti (26, Partizani Tirana, Albanian Premier League 22-23)",86.50171021440062
"A. Arena (22, Gubbio, Serie C 22-23)",86.49100169655911
"C. Frýdek (24, Slovan Liberec, Czech Fortuna Liga 22-23)",86.48772295210333
"S. McCartan (28, Glentoran, Northern Ireland Premiership 22-23)",86.47586398133652
"N. Pantović (29, Nyíregyháza Spartacus, NB II 22-23)",86.45976425001804
"A.  Lőrinczy (29, Diósgyőr, NB II 22-23)",86.31074565076008
"B. Rácz (27, Szombathelyi Haladás, NB II 22-23)",86.13008538285364
"A. Roguljić (27, Universitatea Craiova, SuperLiga României 22-23)",86.09859126934425
"A. Fábry (26, Skalica, Slovak Super Liga 22-23)",86.00873242075056
"E. Vidal (27, Persita, BRI Liga 1 22-23)",85.7329751066987
"K. Ouarkhane (23, JS Soualem, Botola Pro 22-23)",85.70978968252437
"J. Busuttil (24, Floriana, Malta Premier League 22-23)",85.63798404732421
