Player,Similarity
"J. Vandeputte (27, Catanzaro, Serie C 22-23)",87.25128351789115
"M. Glynn (21, Larne, Northern Ireland Premiership 22-23)",85.95663155776862
"H. Siquet (20, Cercle Brugge, Belgian Pro League 22-23)",85.54071946222074
"T. Sakamoto (26, Oostende, Belgian Pro League 22-23)",85.46788294305925
"Miiko Albornoz (32, Vejle, Danish 1. Division 22-23)",85.1199193752453
"L. Gibson (17, Queen of the South, Scottish League One 22-23)",84.82448844588856
"P. Ivanovici (33, Minaur Baia Mare, Romanian Liga II 22-23)",84.50466947465863
"Á. Barreal (22, Cincinnati, MLS 2023)",84.38980708731883
"A. Dedov (33, Zimbru, Moldovan Super Liga 22-23)",83.89416153952094
"D. Gojny (28, Arka Gdynia, Polish I Liga 22-23)",83.8018151556373
"M. Costly (27, Ingolstadt, 3. Liga 22-23)",83.65868322988533
"R. Brady (31, Preston North End, Championship 22-23)",83.35360365747687
"Caju (27, Aris, Cyprus 1. Division 22-23)",83.32577891185299
"D. Kabutov (31, Rubin Kazan', Russian FNL 2 22-23)",82.6982940810226
"C. O'Keeffe (24, Forest Green Rovers, League One 22-23)",81.45211093046645
"Adam Lewis (23, Newport County, League Two 22-23)",81.39210022173432
"F. Costa (28, Foggia, Serie C 22-23)",81.35237382481479
"A. Batsula (31, Vorskla, Ukrainian Premier Liha 22-23)",81.32517865116863
"V. N'Simba (29, Bordeaux, Ligue 2 22-23)",81.28936680401571
"B. Doherty (25, Larne, Northern Ireland Premiership 22-23)",81.01236312055319
"İ. Köybaşı (33, Göztepe, Turkish 1. Lig 22-23)",80.98883418205301
"J. Keiblinger (22, St. Pölten, Austrian 2. Liga 22-23)",80.83432928350352
"A. Timovski (28, Sileks, North Macedonia First League 22-23)",80.81791915169482
"Bandar Al Ahbabi (32, Al Ain, UAE Pro League 22-23)",80.80684981339814
"Mohamed Shokry (23, Ceramica, Egyptian Premier League 22-23)",80.75731412880371
