Player,Similarity
"L. Barrios (38, Sportivo Trinidense, Paraguay Division Profesional 2023)",93.33056059774472
"J. Coburn (20, Bristol Rovers, League One 22-23)",91.0667389428063
"A. Méyé (27, Olympic Safi, Botola Pro 22-23)",90.5400645102004
"Raul García (22, Mirandés, La Liga 2 22-23)",90.33030774127576
"D. Molinga (0, Al Shoalah, Saudi First Division 22-23)",89.99757506155521
"M. Rijks (20, Utrecht II, Eerste Divisie 22-23)",89.52021573777512
"T. Baribo (25, Wolfsberger AC, Austrian Bundesliga 22-23)",89.25702415965675
"O. Bogle (29, Newport County, League Two 22-23)",89.09398727045269
"L. Depoitre (34, Gent, Belgian Pro League 22-23)",88.71481083196487
"F. Dursun (18, Rapid Wien II, Austrian 2. Liga 22-23)",88.5901199022684
"N. Karelis (31, Panetolikos FC, Greek Super League 22-23)",88.57267177624514
"Min-Kyu Joo (33, Ulsan Hyundai, K League 1 2023)",88.54117942870981
"R. Kamergi (28, Ben Guerdane, Tunisian Ligue 1 22-23)",88.44290561341009
"Antonio Casas (23, Córdoba, Primera División RFEF 22-23)",88.19239727102104
"G. Melamed (30, Bnei Sakhnin, Ligat Ha'al 22-23)",87.65317292162266
"L. Jephcott (23, Swindon Town, League Two 22-23)",87.38893888829318
"P. Gigić (26, Javor Ivanjica, Serbian SuperLiga 22-23)",87.33450598845921
"M. Dembélé (26, Olympique Lyonnais, Ligue 1 22-23)",87.22696916689206
"A. Mendy (29, Caen, Ligue 2 22-23)",87.14267733012824
"Y. Abuhatzira (26, Hapoel Kfar Saba, Liga Leumit 22-23)",87.0743611152928
"L. Jović (25, Fiorentina, Serie A 22-23)",86.88627934228322
"F. Chaouat (27, Ismaily, Egyptian Premier League 22-23)",86.69126391403074
"Xemi Fernández (28, Intercity SJ D' Alacant, Primera División RFEF 22-23)",86.60656140844554
"J. Collins (32, Derby County, League One 22-23)",86.51422855880001
"C. Dragu (31, Viitorul P. Targu Jiu, Romanian Liga II 22-23)",86.4930653657295
