Player,Similarity
"J. Maxwell (21, Doncaster Rovers, League Two 22-23)",81.67269231846296
"O. Sych (22, Kortrijk, Belgian Pro League 22-23)",80.15248666239852
"A. Espino (31, Cádiz, La Liga 22-23)",78.70141217817772
"D. Balan (29, Veres, Ukrainian Premier Liha 22-23)",76.87283063940676
"Víctor Parada (21, Real Unión, Primera División RFEF 22-23)",76.64660205349753
"S. Mihara (21, Ehime, J3 2023)",75.88143502147878
"Tincho Conde (20, Celta de Vigo B, Primera División RFEF 22-23)",75.81768681143356
"M. Şandru (26, Progresul Spartac, Romanian Liga II 22-23)",74.88768796114528
"J. Edwards (32, Plymouth Argyle, League One 22-23)",74.73335811499047
"L. Hujber (23, Istra 1961, 1. HNL 22-23)",74.70288549566592
"Kike López (35, Cornellà, Primera División RFEF 22-23)",74.62555072146444
"K. Kállai (21, Mezőkövesd-Zsóry, NB I 22-23)",74.5755396355906
"E. Castillo (22, La Luz, Uruguay Primera División 2023)",74.5697969532772
"F. Yeats (19, Falkirk, Scottish League One 22-23)",74.08271503238075
"P. Pešukić (25, Novi Pazar, Serbian SuperLiga 22-23)",74.07272411647683
"B. Akos (21, Dorogi FC, NB II 22-23)",74.01891114104123
"D. Harvie (24, Milton Keynes Dons, League One 22-23)",73.98507230915385
"R. Sălceanu (19, AS FC Buzău, Romanian Liga II 22-23)",73.58448039067692
"E. Mclevy (22, Brechin City, Scottish League Two 22-23)",72.42414977431497
"Samuel Teles (26, Feirense, Portugal Segunda Liga 22-23)",72.281698846931
"A. King (18, Greenock Morton, Scottish Championship 22-23)",72.24870220729017
"Diogo Tavares (25, Belenenses, Portugal Segunda Liga 22-23)",71.73776118773884
"F. Borowski (19, Zagłębie Sosnowiec, Polish I Liga 22-23)",71.63806374865571
"N. Atkinson (23, Hearts, Scottish Premiership 22-23)",71.51625485986716
"T. Rothe (18, Borussia Dortmund II, 3. Liga 22-23)",71.50616774556761
