Player,Similarity
"L. Borghi (19, San Donato Tavarnelle, Serie C 22-23)",83.02367862627999
"M. M'Baye (27, Viterbese, Serie C 22-23)",82.86157947024539
"M. Marina (33, Slaven Belupo, 1. HNL 22-23)",81.75411229384605
"B. Gáncs (19, Mosonmagyaróvári TE, NB II 22-23)",81.72288651003842
"A. Vovkun (21, Lviv, Ukrainian Premier Liha 22-23)",80.90653673891536
"M. Kocijan (28, Slaven Belupo, 1. HNL 22-23)",79.56798207754802
"V. Klymenko (28, Inhulets, Ukrainian Premier Liha 22-23)",79.21291284299461
"D. Rodin (20, Kuban Krasnodar, Russian FNL 2 22-23)",79.13825397004787
"Fausto Tienza (33, Racing Santander, La Liga 2 22-23)",78.92314844741885
"G. Graziano (27, Fermana, Serie C 22-23)",78.23421323793191
"M. Thorsby (27, Union Berlin, Bundesliga 22-23)",77.28116628366686
"L. Flach (22, Philadelphia Union, MLS 2023)",77.07881286860079
"A. Corbari (29, Virtus Entella, Serie C 22-23)",76.63852773925292
"I. Savić (22, Torpedo Moskva, Russian Premier League 22-23)",76.62501294339675
"João Baldé (21, Arbroath, Scottish Championship 22-23)",76.39722709101953
"Javi Robles (22, Pontevedra, Primera División RFEF 22-23)",76.33699197205074
"L. Jäger (29, Rheindorf Altach, Austrian Bundesliga 22-23)",76.2622073250001
"S. Messeguem (22, Academico Viseu, Portugal Segunda Liga 22-23)",76.2153326915179
"A. Saad Al Dhafiri (21, Al Batin, Saudi Professional League 22-23)",75.90943733226428
"J. Ball (27, Rochdale, League Two 22-23)",75.8311508647301
"O. Coumbassa (21, Olympique Béja, Tunisian Ligue 1 22-23)",75.66092105231203
"M. Szpakowski (21, Korona Kielce, Ekstraklasa 22-23)",75.55552321082162
"A. Romano (27, Taranto, Serie C 22-23)",75.34796476381914
"P. Porcile (26, La Luz, Uruguay Primera División 2023)",75.27254392328831
"T. Šikalo (19, Velež, Bosnian Premier League 22-23)",74.8569052245234
