Player,Similarity
"D. Schnegg (24, Sturm Graz, Austrian Bundesliga 22-23)",90.2087163664207
"L. Vignali (27, Como, Serie B 22-23)",80.3223944920362
"L. Obexer (25, Stade Lausanne-Ouchy, Swiss Challenge League 22-23)",80.04363503922704
"M. Dombrowka (31, Meppen, 3. Liga 22-23)",79.79272002738999
"B. Burns (34, Crusaders, Northern Ireland Premiership 22-23)",78.27079320808588
"D. Jakubik (33, Radomiak Radom, Ekstraklasa 22-23)",77.84534756575823
"Joseba Muguruza (29, Cultural Leonesa, Primera División RFEF 22-23)",76.99073118163561
"F. Vezzoni (21, Pro Patria, Serie C 22-23)",76.91576831133867
"Gustavo (24, Nacional, Portugal Segunda Liga 22-23)",76.07788477396733
"M. Suchomel (20, Mladá Boleslav, Czech Fortuna Liga 22-23)",75.69787985924654
"C. Rizzuto (31, Saarbrücken, 3. Liga 22-23)",75.12882744930701
"J. Pintado (25, Defensor Sporting, Uruguay Primera División 2023)",75.07878473350704
"N. Boranijašević (31, Zürich, Swiss Super League 22-23)",74.9164534607002
"J. Forsythe (32, Crusaders, Northern Ireland Premiership 22-23)",74.83617613620982
"L. Scullion (21, Clyde, Scottish League One 22-23)",74.79281876447614
"Cláudio Winck (29, Marítimo, Primeira Liga 22-23)",74.57929728872156
"Gang-Han Lee (23, Gangwon II, K4 League 2023)",74.21835543171376
"M. Bandarra (27, Farense, Portugal Segunda Liga 22-23)",74.19764418602982
"S. Sabelli (30, Genoa, Serie B 22-23)",74.18147508109246
"G. Martirena (23, Liverpool, Uruguay Primera División 2023)",74.12267039470007
"M. Madleňák (24, Ružomberok, Slovak Super Liga 22-23)",74.03730543700405
"L. Hangshing (25, Churchill Brothers, I-League 22-23)",73.8893923634873
"J. Risdon (30, Western United, A-League Men 22-23)",73.57311758691691
"T. Casasola (27, Perugia, Serie B 22-23)",73.49685006024646
"E. Coronel (26, Banfield, Argentinian Primera División 2023)",73.48809188383133
