Player,Similarity
"F. Sokoy (25, Barito Putera, BRI Liga 1 22-23)",81.85070538843821
"O. Rodríguez (26, León, Liga MX 22-23)",81.18159259100902
"M. van der Maarel (33, Utrecht, Eredivisie 22-23)",79.87098699231741
"Y. Hurtado (26, Águilas Doradas, Colombian Primera Division 22-23)",79.17582594877868
"E. Valencia (23, Unión La Calera, Chilean Primera División 2023)",77.69577901703602
"I. Govea (26, Club Tijuana, Liga MX 22-23)",77.03011446840371
"A. Smith (32, Bournemouth, Premier League 22-23)",76.88043382871963
"R. Pinna (23, Torres, Serie C 22-23)",76.56137282927496
"L. Schwechlen (33, Denizlispor, Turkish 1. Lig 22-23)",76.41656026737105
"J. Clemente (35, Churchill Brothers, I-League 22-23)",75.45480240110824
"A. Correa (29, La Equidad, Colombian Primera Division 22-23)",74.75786226569366
"Hazza Salem (33, Al Wasl, UAE Pro League 22-23)",74.53310253119075
"A. Sha'aban (30, Hapoel Acre, Liga Leumit 22-23)",73.98844578659143
"Abdel Aziz Mitwali (27, Al Shamal, Qatari Stars League 22-23)",73.81351370927332
"J. Ward (33, Crystal Palace, Premier League 22-23)",73.71039564166844
"P. Poór (29, MTK, NB II 22-23)",73.27647671046262
"I. Piris (34, Libertad, Paraguay Division Profesional 2023)",72.7790404564275
"Lillo Castellano (34, Alcoyano, Primera División RFEF 22-23)",72.04131922820007
"M. Dickenmann (22, Wil, Swiss Challenge League 22-23)",72.02585785287671
"P. Gede (27, Bhayangkara F.C., BRI Liga 1 22-23)",71.61156528287303
"P. Stolc (28, Arka Gdynia, Polish I Liga 22-23)",71.32887569685205
"D. Vargas (24, Unión Comercio, Peruvian Liga 1 2023)",71.0273553394187
"Aritz Elustondo (29, Real Sociedad, La Liga 22-23)",70.84955679248229
"Muhammad Ariff Farhan (26, Kedah, Malaysian Super League 2023)",70.61592320190177
"A. Palmezano (24, Atlético Chiriquí, Panama LPF 2023)",70.54420630595764
