Player,Similarity
"S. Miranda (22, Bellinzona, Swiss Challenge League 22-23)",80.19152527760811
"S. Tursynbay (24, Maqtaaral, Kazakh Premier League 2023)",79.26777289901842
"C. Celesia (21, Messina, Serie C 22-23)",77.17457269802168
"L. Deinhofer (29, Amstetten, Austrian 2. Liga 22-23)",76.48716664661697
"S. Stevanović (34, Mornar, Montenegro First League 22-23)",73.73394483117596
"S. Panwar (23, Odisha, Indian Super League 22-23)",73.62033425101302
"E. Fuentes (32, Santa Lucía, Guatemala Liga Nacional 22-23)",73.53104043297746
"A. Lynas (27, Albion Rovers, Scottish League Two 22-23)",73.36355894702112
"P. Pavlov (22, Al Dhafra, UAE Pro League 22-23)",73.10328820155388
"L. Hjelde (19, Rotherham United, Championship 22-23)",72.22784455196027
"A. Samsonov (34, Torpedo Moskva, Russian Premier League 22-23)",71.68729671476449
"G. Buta (21, Unirea Dej, Romanian Liga II 22-23)",71.44529389035961
"M. Pérez Acuña (29, CD Badajoz, Primera División RFEF 22-23)",70.97938990538671
"F. Romero (24, Gudja United, Malta Premier League 22-23)",70.6416589471566
"O. Nemssaoui (32, UTS Rabat, Botola Pro 22-23)",70.58082036287772
"S. Burns (31, Stranraer, Scottish League Two 22-23)",70.33642236739644
"L. Malic (22, Željezničar, Bosnian Premier League 22-23)",70.15677855957178
"M. Čivić (30, Sloboda Tuzla, Bosnian Premier League 22-23)",70.13674437690703
"R. Maddaloni (24, Imolese, Serie C 22-23)",70.13616842528714
"G. Longobardi (20, Recanatese, Serie C 22-23)",70.12774354998852
"S. Roughan (19, Lincoln City, League One 22-23)",70.12559468007044
"H. Hubchev (27, OFK Pirin, Bulgarian First League 22-23)",70.01314024171997
"N. Zolotov (28, Kolos Kovalivka, Ukrainian Premier Liha 22-23)",69.99636604716221
"Chang-soo Kim (24, Jeonju, K4 League 2023)",69.63891105767794
"C. Clark (22, Annan Athletic, Scottish League Two 22-23)",69.5577018355293
