Player,Similarity
"M. Ammar (0, Tataouine, Tunisian Ligue 1 22-23)",75.43827864000171
"Lucas Torró (28, Osasuna, La Liga 22-23)",69.73873895519581
"W. Yingyong (29, Nong Bua Pitchaya FC, Thai League 1 22-23)",68.72794058516338
"F. Pasamba (29, Rans Nusantara, BRI Liga 1 22-23)",67.322126510501
"A. Kurtalić (23, Sloboda Tuzla, Bosnian Premier League 22-23)",65.9073533507497
"T. Kaçar (29, Boluspor, Turkish 1. Lig 22-23)",65.56938882795167
"A. Chandarov (24, Levski Sofia, Bulgarian First League 22-23)",65.52061227719784
"V. Kamilov (27, Akhmat Grozny, Russian Premier League 22-23)",63.961367768316336
"V. Christiansson (25, Nykøbing, Danish 1. Division 22-23)",63.84807413283288
"A. Kouame (19, Hammam-Sousse, Tunisian Ligue 1 22-23)",63.8379021203429
"M. Catinean (26, Unirea Dej, Romanian Liga II 22-23)",63.767712605707146
"M. Tahir (29, Rans Nusantara, BRI Liga 1 22-23)",62.92854518402216
"I. Chaykovskyi (31, Metalist Kharkiv, Ukrainian Premier Liha 22-23)",62.85732058268574
"D. Pidgurskyi (20, Rukh Lviv, Ukrainian Premier Liha 22-23)",62.0722576393466
"B. Moussa (19, CS Sfaxien, Tunisian Ligue 1 22-23)",62.06740286696115
"Q. Al Kaibari (0, Al Qadisiyah, Saudi First Division 22-23)",62.02462143106791
"M. Osmić (24, Sloboda Tuzla, Bosnian Premier League 22-23)",62.00788182240159
"J. Caicedo (19, Deportivo Pasto, Colombian Primera Division 22-23)",61.7788960343898
"D. Duga (28, Zlaté Moravce, Slovak Super Liga 22-23)",61.451914833639066
"I. Soro (25, Arouca, Primeira Liga 22-23)",61.34876108562201
"D. Rumbino (27, PSIS Semarang, BRI Liga 1 22-23)",60.87144088834064
"J. Fuentes (31, UMECIT, Panama LPF 2023)",60.60733196960475
"Manuel  Rodríguez (25, Alianza, Panama LPF 2023)",60.53498614465846
"S. El Moudane (29, Ittihad Tanger, Botola Pro 22-23)",60.529062602508986
"P. Zebli (25, Lokomotiv Plovdiv, Bulgarian First League 22-23)",60.436623196334494
