Player,Similarity
"Fares Khalil (22, Al Wasl, UAE Pro League 22-23)",70.2299137958575
"R. Mikulec (25, Resovia Rzeszów, Polish I Liga 22-23)",69.51084596062897
"C. Perotti (20, Pro Patria, Serie C 22-23)",69.1111079591835
"J. Sweeney (21, Leyton Orient, League Two 22-23)",67.7266553973821
"P. Kennedy (22, Clyde, Scottish League One 22-23)",67.62496674838626
"Myung-Sun Kim (22, Cheongju FC, K League 2 2023)",66.13304673811892
"S. Nishikubo (19, JEF United, J2 2023)",65.6278682673598
"Fran García (30, Burgos, La Liga 2 22-23)",63.66515701323985
"Costinha (23, Rio Ave, Primeira Liga 22-23)",63.64567549778636
"E. Brito (29, Dordrecht, Eerste Divisie 22-23)",63.3873495042678
"B. Lila (22, Egnatia Rrogozhinë, Albanian Premier League 22-23)",63.20832633513117
"Salem Juma Awad (30, Al Wasl, UAE Pro League 22-23)",63.08442465307388
"E. Peña (30, Valletta, Malta Premier League 22-23)",62.75726913053013
"H. Quirós (24, Guanacasteca, Costa Rica Primera División 22-23)",62.2551027841818
"G. Pashov (33, Petrolul 52, SuperLiga României 22-23)",61.95485245777862
"Miguel Maga (20, Vitória Guimarães, Primeira Liga 22-23)",61.87167673973497
"M. Sagi (27, Kozármisleny, NB II 22-23)",61.60660356743357
"A. Souquet (31, Chicago Fire, MLS 2023)",61.59188624268841
"A. Llugiqi (20, Ingolstadt, 3. Liga 22-23)",61.371202152074325
"Lucas Rosa (23, Real Valladolid, La Liga 22-23)",61.24917643569445
"Aihen Muñoz (25, Real Sociedad, La Liga 22-23)",61.21626958517604
"M. Andresen (23, Moss, OBOS Ligaen 2023)",61.198360179598495
"E. Masalha (23, Hapoel Rishon LeZion, Liga Leumit 22-23)",61.19764829585
"P. Stolc (28, Arka Gdynia, Polish I Liga 22-23)",60.71176445544973
"A. Csonka (23, Budafoki MTE, NB II 22-23)",60.55061541922026
