Player 1,Player 2,Similarity
"R. Leonard (31, Millwall, Championship 22-23)","L. Fiorini (20, Blackpool, Championship 22-23)",-3.959874445575581
"R. Leonard (31, Millwall, Championship 22-23)","A. Camargo (33, Cobresal, Chilean Primera División 2023)",16.756643515331458
"R. Leonard (31, Millwall, Championship 22-23)","E. Pavez (33, Colo Colo, Chilean Primera División 2023)",19.14062846600148
"R. Leonard (31, Millwall, Championship 22-23)","T. Aránguiz (26, Magallanes, Chilean Primera División 2023)",2.527416427285724
"R. Leonard (31, Millwall, Championship 22-23)","J. Jaime (30, Copiapó, Chilean Primera División 2023)",33.25739383726219
"R. Leonard (31, Millwall, Championship 22-23)","I. Saavedra (24, Universidad Católica, Chilean Primera División 2023)",18.227125398070417
"R. Leonard (31, Millwall, Championship 22-23)","A. Farías (35, Palestino, Chilean Primera División 2023)",36.36450528260029
"R. Leonard (31, Millwall, Championship 22-23)","J. Martínez (26, Huachipato, Chilean Primera División 2023)",23.252322749877
"R. Leonard (31, Millwall, Championship 22-23)","C. Sepúlveda (30, Huachipato, Chilean Primera División 2023)",13.35291189124962
"R. Leonard (31, Millwall, Championship 22-23)","M. Díaz (36, Audax Italiano, Chilean Primera División 2023)",21.429264961571707
"R. Leonard (31, Millwall, Championship 22-23)","A. Nadruz (26, Curicó Unido, Chilean Primera División 2023)",43.87857354472607
"R. Leonard (31, Millwall, Championship 22-23)","S. Leyton (30, Unión Española, Chilean Primera División 2023)",19.01922808506493
"R. Leonard (31, Millwall, Championship 22-23)","V. Larralde (22, O'Higgins, Chilean Primera División 2023)",-12.961227345195477
"R. Leonard (31, Millwall, Championship 22-23)","E. Ojeda (25, Universidad de Chile, Chilean Primera División 2023)",40.90319201865093
"R. Leonard (31, Millwall, Championship 22-23)","L. Reyes (31, Ñublense, Chilean Primera División 2023)",11.165460695254142
"R. Leonard (31, Millwall, Championship 22-23)","Cai Huikang (33, Shanghai Port, Chinese Super League 2023)",19.30080099813919
"R. Leonard (31, Millwall, Championship 22-23)","F. Lozano (29, Boyacá Chicó, Colombian Primera Division 22-23)",41.14397003572686
"R. Leonard (31, Millwall, Championship 22-23)","J. Guevara (31, Jaguares de Córdoba, Colombian Primera Division 22-23)",22.31064598991187
"R. Leonard (31, Millwall, Championship 22-23)","D. Torres (33, Medellín, Colombian Primera Division 22-23)",1.1868894237215135
"R. Leonard (31, Millwall, Championship 22-23)","A. Mejía (34, Unión Magdalena, Colombian Primera Division 22-23)",38.0926345022209
"R. Leonard (31, Millwall, Championship 22-23)","K. Castaño (22, Águilas Doradas, Colombian Primera Division 22-23)",-14.445534155214482
"R. Leonard (31, Millwall, Championship 22-23)","I. Rojas (25, Santa Fe, Colombian Primera Division 22-23)",48.52772173355466
"R. Leonard (31, Millwall, Championship 22-23)","J. Roa (28, Deportivo Pasto, Colombian Primera Division 22-23)",38.3926705766707
"R. Leonard (31, Millwall, Championship 22-23)","L. Pérez (26, Once Caldas, Colombian Primera Division 22-23)",32.35061027873208
"R. Leonard (31, Millwall, Championship 22-23)","R. Manjarrés (23, Alianza Petrolera, Colombian Primera Division 22-23)",7.961446039337636
"R. Leonard (31, Millwall, Championship 22-23)","J. Zapata (23, Envigado, Colombian Primera Division 22-23)",-12.906444393041191
"R. Leonard (31, Millwall, Championship 22-23)","D. Moreno (31, Junior, Colombian Primera Division 22-23)",13.31129061002709
"R. Leonard (31, Millwall, Championship 22-23)","F. Flórez (30, Alianza Petrolera, Colombian Primera Division 22-23)",42.17462442589595
"R. Leonard (31, Millwall, Championship 22-23)","N. Palacio (21, Atlético Nacional, Colombian Primera Division 22-23)",20.632637842197013
"R. Leonard (31, Millwall, Championship 22-23)","D. Giraldo (30, Millonarios, Colombian Primera Division 22-23)",0.5439631349566607
"R. Leonard (31, Millwall, Championship 22-23)","E. Moreno (29, La Equidad, Colombian Primera Division 22-23)",-2.115015826775825
"R. Leonard (31, Millwall, Championship 22-23)","J. Caicedo (19, Deportivo Pasto, Colombian Primera Division 22-23)",11.796027263078935
"R. Leonard (31, Millwall, Championship 22-23)","V. Mejía (30, Atlético Bucaramanga, Colombian Primera Division 22-23)",15.55143283432758
"R. Leonard (31, Millwall, Championship 22-23)","F. Jaramillo (27, Envigado, Colombian Primera Division 22-23)",27.183718313240785
"R. Leonard (31, Millwall, Championship 22-23)","J. Ríos (31, Tolima, Colombian Primera Division 22-23)",-1.9079084414459817
"R. Leonard (31, Millwall, Championship 22-23)","Y. Velásquez (23, Deportivo Pereira, Colombian Primera Division 22-23)",1.8618067711504327
"R. Leonard (31, Millwall, Championship 22-23)","Y. Torres (24, Atlético Huila, Colombian Primera Division 22-23)",27.97435136421317
"R. Leonard (31, Millwall, Championship 22-23)","M. Medina (25, Deportivo Pereira, Colombian Primera Division 22-23)",18.0077416730792
"R. Leonard (31, Millwall, Championship 22-23)","L. Vásquez (30, Millonarios, Colombian Primera Division 22-23)",3.554689855119938
"R. Leonard (31, Millwall, Championship 22-23)","F. Castro (31, Deportivo Cali, Colombian Primera Division 22-23)",32.01725549295134
"R. Leonard (31, Millwall, Championship 22-23)","R. Bustamante (23, Deportivo Cali, Colombian Primera Division 22-23)",31.55457237041515
"R. Leonard (31, Millwall, Championship 22-23)","D. Padilla (29, Jaguares de Córdoba, Colombian Primera Division 22-23)",-0.0652970490963868
"R. Leonard (31, Millwall, Championship 22-23)","S. Vega (25, Millonarios, Colombian Primera Division 22-23)",18.782628573887024
"R. Leonard (31, Millwall, Championship 22-23)","J. Pereira (30, Millonarios, Colombian Primera Division 22-23)",12.04309719817824
"R. Leonard (31, Millwall, Championship 22-23)","H. Martínez (25, Junior, Colombian Primera Division 22-23)",9.529216177464942
"R. Leonard (31, Millwall, Championship 22-23)","D. Quiñonez (22, Once Caldas, Colombian Primera Division 22-23)",7.997472006875029
"R. Leonard (31, Millwall, Championship 22-23)","R. Colpa (28, Alianza Petrolera, Colombian Primera Division 22-23)",15.941616588368973
"R. Leonard (31, Millwall, Championship 22-23)","Al. López (31, Alajuelense, Costa Rica Primera División 22-23)",-22.24629731008069
"R. Leonard (31, Millwall, Championship 22-23)","D. Guzmán (33, Deportivo Saprissa, Costa Rica Primera División 22-23)",10.738821272776365
"R. Leonard (31, Millwall, Championship 22-23)","C. Borges (35, Alajuelense, Costa Rica Primera División 22-23)",-10.00277000451026
"R. Leonard (31, Millwall, Championship 22-23)","C. Martínez (29, San Carlos, Costa Rica Primera División 22-23)",36.73833268059377
"R. Leonard (31, Millwall, Championship 22-23)","W. Fernández (29, Puntarenas, Costa Rica Primera División 22-23)",47.197687738278034
"R. Leonard (31, Millwall, Championship 22-23)","J. Cubero (36, Puntarenas, Costa Rica Primera División 22-23)",32.9811768052425
"R. Leonard (31, Millwall, Championship 22-23)","J. Szöke (27, Aris, Cyprus 1. Division 22-23)",40.43279912703844
"R. Leonard (31, Millwall, Championship 22-23)","G. Mandjeck (34, Nea Salamis, Cyprus 1. Division 22-23)",-0.6512545914682752
"R. Leonard (31, Millwall, Championship 22-23)","I. Kousoulos (26, Omonia Nicosia, Cyprus 1. Division 22-23)",38.303193297077016
"R. Leonard (31, Millwall, Championship 22-23)","C. Kyriakou (28, Apollon, Cyprus 1. Division 22-23)",23.64160647084841
"R. Leonard (31, Millwall, Championship 22-23)","Jon Gaztañaga (31, Karmiotissa, Cyprus 1. Division 22-23)",27.089778814907035
"R. Leonard (31, Millwall, Championship 22-23)","M. Brown (23, Aris, Cyprus 1. Division 22-23)",-15.795483481664288
"R. Leonard (31, Millwall, Championship 22-23)","S. Ben Sallam (21, Karmiotissa, Cyprus 1. Division 22-23)",5.048200761115756
"R. Leonard (31, Millwall, Championship 22-23)","Álex Vallejo (31, Doxa, Cyprus 1. Division 22-23)",28.15464493180478
"R. Leonard (31, Millwall, Championship 22-23)","C. Charalampous (21, Omonia Nicosia, Cyprus 1. Division 22-23)",-19.438861425201985
"R. Leonard (31, Millwall, Championship 22-23)","Moreto Cassamá (25, Omonia Nicosia, Cyprus 1. Division 22-23)",-12.525909776085204
"R. Leonard (31, Millwall, Championship 22-23)","A. Frangos (26, Nea Salamis, Cyprus 1. Division 22-23)",29.393978681639176
"R. Leonard (31, Millwall, Championship 22-23)","G. Ikonomidis (33, Karmiotissa, Cyprus 1. Division 22-23)",22.07339829399168
"R. Leonard (31, Millwall, Championship 22-23)","J. Texl (30, Zbrojovka Brno, Czech Fortuna Liga 22-23)",-7.693367523013461
"R. Leonard (31, Millwall, Championship 22-23)","R. Breite (33, Sigma Olomouc, Czech Fortuna Liga 22-23)",27.457813276736932
"R. Leonard (31, Millwall, Championship 22-23)","F. Kaloč (23, Baník Ostrava, Czech Fortuna Liga 22-23)",-9.889020024438588
"R. Leonard (31, Millwall, Championship 22-23)","V. Daníček (31, Slovácko, Czech Fortuna Liga 22-23)",39.510828642949534
"R. Leonard (31, Millwall, Championship 22-23)","J. Hora (32, České Budějovice, Czech Fortuna Liga 22-23)",-5.924883629621276
"R. Leonard (31, Millwall, Championship 22-23)","T. Hübschman (41, Jablonec, Czech Fortuna Liga 22-23)",68.4013314182478
"R. Leonard (31, Millwall, Championship 22-23)","K. Vacek (36, Pardubice, Czech Fortuna Liga 22-23)",34.65615255241457
"R. Leonard (31, Millwall, Championship 22-23)","S. Falta (30, Zbrojovka Brno, Czech Fortuna Liga 22-23)",-20.8904525335591
"R. Leonard (31, Millwall, Championship 22-23)","D. Ventúra (27, Sigma Olomouc, Czech Fortuna Liga 22-23)",35.619735102419945
"R. Leonard (31, Millwall, Championship 22-23)","F. Souček (22, Zbrojovka Brno, Czech Fortuna Liga 22-23)",31.081369830152305
"R. Leonard (31, Millwall, Championship 22-23)","P. Ševčík (29, Slavia Praha, Czech Fortuna Liga 22-23)",-32.75736454145067
"R. Leonard (31, Millwall, Championship 22-23)","M. Pospíšil (31, Sigma Olomouc, Czech Fortuna Liga 22-23)",-7.464325328762815
"R. Leonard (31, Millwall, Championship 22-23)","J. Hromada (27, Slavia Praha, Czech Fortuna Liga 22-23)",35.00363381396417
"R. Leonard (31, Millwall, Championship 22-23)","D. Donát (21, Mladá Boleslav, Czech Fortuna Liga 22-23)",45.55445008172428
"R. Leonard (31, Millwall, Championship 22-23)","D. Darmovzal (22, Pardubice, Czech Fortuna Liga 22-23)",-26.75396349454805
"R. Leonard (31, Millwall, Championship 22-23)","J. Boula (24, Baník Ostrava, Czech Fortuna Liga 22-23)",36.20152248218015
"R. Leonard (31, Millwall, Championship 22-23)","M. Jensen (35, HB Køge, Danish 1. Division 22-23)",-0.2933942220229296
"R. Leonard (31, Millwall, Championship 22-23)","A. Pyndt (22, Hvidovre, Danish 1. Division 22-23)",-23.530567469546703
"R. Leonard (31, Millwall, Championship 22-23)","M. Haüser (25, Næstved, Danish 1. Division 22-23)",-2.94333990836046
"R. Leonard (31, Millwall, Championship 22-23)","A. Yoda (22, Hobro, Danish 1. Division 22-23)",41.94748904516087
"R. Leonard (31, Millwall, Championship 22-23)","S. Bækgård (23, Fredericia, Danish 1. Division 22-23)",18.63411822678412
"R. Leonard (31, Millwall, Championship 22-23)","M. Kongstedt (27, Næstved, Danish 1. Division 22-23)",5.948778223477574
"R. Leonard (31, Millwall, Championship 22-23)","R. Vinderslev (25, SønderjyskE, Danish 1. Division 22-23)",24.679329649068908
"R. Leonard (31, Millwall, Championship 22-23)","V. Ljuti (32, Nykøbing, Danish 1. Division 22-23)",31.683856637039447
"R. Leonard (31, Millwall, Championship 22-23)","N. Schmidt (27, Hillerød, Danish 1. Division 22-23)",20.40003171806752
"R. Leonard (31, Millwall, Championship 22-23)","M. Carlson (24, Nykøbing, Danish 1. Division 22-23)",-26.44982396859494
"R. Leonard (31, Millwall, Championship 22-23)","C. Palm (21, Fremad Amager, Danish 1. Division 22-23)",24.9392423158772
"R. Leonard (31, Millwall, Championship 22-23)","C. McCowatt (24, Helsingør, Danish 1. Division 22-23)",-40.588082107858895
"R. Leonard (31, Millwall, Championship 22-23)","M. Albæk (33, SønderjyskE, Danish 1. Division 22-23)",-6.95215147125136
"R. Leonard (31, Millwall, Championship 22-23)","F. Christensen (23, Helsingør, Danish 1. Division 22-23)",-21.237877481255985
"R. Leonard (31, Millwall, Championship 22-23)","C. Jørgensen (20, HB Køge, Danish 1. Division 22-23)",10.250319764645033
"R. Leonard (31, Millwall, Championship 22-23)","M. Aaquist (28, Fremad Amager, Danish 1. Division 22-23)",-5.875534987966548
"R. Leonard (31, Millwall, Championship 22-23)","D. Norouzi (31, Helsingør, Danish 1. Division 22-23)",36.46470022959556
"R. Leonard (31, Millwall, Championship 22-23)","V. Christiansson (25, Nykøbing, Danish 1. Division 22-23)",32.156121841446335
"R. Leonard (31, Millwall, Championship 22-23)","A. Okosun (29, Vendsyssel, Danish 1. Division 22-23)",57.6046192736892
"R. Leonard (31, Millwall, Championship 22-23)","V. Mpindi (26, Vendsyssel, Danish 1. Division 22-23)",20.536184871137323
"R. Leonard (31, Millwall, Championship 22-23)","K. Minda (24, Universidad Católica, Ecuador Liga Pro 2023)",-4.434453065912251
"R. Leonard (31, Millwall, Championship 22-23)","Leonai Souza (28, Barcelona, Ecuador Liga Pro 2023)",26.595975623859747
"R. Leonard (31, Millwall, Championship 22-23)","R. Garcés (30, Libertad, Ecuador Liga Pro 2023)",18.62163360513575
"R. Leonard (31, Millwall, Championship 22-23)","A. Assis (30, Orense, Ecuador Liga Pro 2023)",29.62674632099097
"R. Leonard (31, Millwall, Championship 22-23)","B. Téliz (31, Mushuc Runa, Ecuador Liga Pro 2023)",14.626895180615335
"R. Leonard (31, Millwall, Championship 22-23)","F. Flores (31, Gualaceo, Ecuador Liga Pro 2023)",16.233165475169766
"R. Leonard (31, Millwall, Championship 22-23)","F. Gaibor (31, Barcelona, Ecuador Liga Pro 2023)",-18.48379198039229
"R. Leonard (31, Millwall, Championship 22-23)","R. Melo (27, Deportivo Cuenca, Ecuador Liga Pro 2023)",15.242769689031
"R. Leonard (31, Millwall, Championship 22-23)","E. Caicedo (33, Aucas, Ecuador Liga Pro 2023)",26.691599080402543
"R. Leonard (31, Millwall, Championship 22-23)","M. Tielemans (21, PSV II, Eerste Divisie 22-23)",-4.257106550633199
"R. Leonard (31, Millwall, Championship 22-23)","P. Brittijn (19, De Graafschap, Eerste Divisie 22-23)",-11.816687555162432
"R. Leonard (31, Millwall, Championship 22-23)","L. Schoofs (26, Heracles, Eerste Divisie 22-23)",24.684877717334302
"R. Leonard (31, Millwall, Championship 22-23)","S. van Der Heijden (24, Den Bosch, Eerste Divisie 22-23)",37.31882115128087
"R. Leonard (31, Millwall, Championship 22-23)","A. Pena (31, Almere City, Eerste Divisie 22-23)",9.247102636829784
"R. Leonard (31, Millwall, Championship 22-23)","N. Souren (23, MVV, Eerste Divisie 22-23)",1.6233430547737675
"R. Leonard (31, Millwall, Championship 22-23)","R. Klaasen (29, VVV Venlo, Eerste Divisie 22-23)",28.485708374282197
"R. Leonard (31, Millwall, Championship 22-23)","O. Džepar (26, MVV, Eerste Divisie 22-23)",41.38406803603306
"R. Leonard (31, Millwall, Championship 22-23)","S. Resink (20, Almere City, Eerste Divisie 22-23)",12.170658252459209
"R. Leonard (31, Millwall, Championship 22-23)","T. Bruns (31, Heracles, Eerste Divisie 22-23)",-7.60949130395645
"R. Leonard (31, Millwall, Championship 22-23)","R. Stuy van den Herik (29, TOP Oss, Eerste Divisie 22-23)",46.18638122251831
"R. Leonard (31, Millwall, Championship 22-23)","Z. Buurmeester (20, AZ II, Eerste Divisie 22-23)",7.469857062183985
"R. Leonard (31, Millwall, Championship 22-23)","R. Sedláček (23, VVV Venlo, Eerste Divisie 22-23)",-1.4159671470382111
"R. Leonard (31, Millwall, Championship 22-23)","Pol Llonch (30, Willem II, Eerste Divisie 22-23)",33.407295905040144
"R. Leonard (31, Millwall, Championship 22-23)","Ö. Gündüz (22, TOP Oss, Eerste Divisie 22-23)",47.571371944836216
"R. Leonard (31, Millwall, Championship 22-23)","S. Vos (18, Ajax II, Eerste Divisie 22-23)",-4.357062766925557
"R. Leonard (31, Millwall, Championship 22-23)","T. Thomas (21, ADO Den Haag, Eerste Divisie 22-23)",21.35504924007356
"R. Leonard (31, Millwall, Championship 22-23)","L. Schouten (19, AZ II, Eerste Divisie 22-23)",5.095538323507593
"R. Leonard (31, Millwall, Championship 22-23)","A. Ahannach (25, Den Bosch, Eerste Divisie 22-23)",-14.465146194914023
"R. Leonard (31, Millwall, Championship 22-23)","Y. Ikeshita (21, Utrecht II, Eerste Divisie 22-23)",7.918457851893447
"R. Leonard (31, Millwall, Championship 22-23)","M. Vejinović (33, Heracles, Eerste Divisie 22-23)",-4.034563515651003
"R. Leonard (31, Millwall, Championship 22-23)","T. Bijleveld (25, Roda JC, Eerste Divisie 22-23)",32.24650423616857
"R. Leonard (31, Millwall, Championship 22-23)","A. Plat (25, NAC Breda, Eerste Divisie 22-23)",45.62385978776693
"R. Leonard (31, Millwall, Championship 22-23)","N. Twisk (20, AZ II, Eerste Divisie 22-23)",19.51851306222363
"R. Leonard (31, Millwall, Championship 22-23)","R. Shein (19, Utrecht II, Eerste Divisie 22-23)",-6.471708617425056
"R. Leonard (31, Millwall, Championship 22-23)","R. Dekker (28, TOP Oss, Eerste Divisie 22-23)",50.777754870153615
"R. Leonard (31, Millwall, Championship 22-23)","M. Kleinen (21, MVV, Eerste Divisie 22-23)",50.08186994795709
"R. Leonard (31, Millwall, Championship 22-23)","M. Chacón (29, Helmond Sport, Eerste Divisie 22-23)",31.996729372581857
"R. Leonard (31, Millwall, Championship 22-23)","G. Breinburg (31, ADO Den Haag, Eerste Divisie 22-23)",28.79598790157269
"R. Leonard (31, Millwall, Championship 22-23)","D. Klas (22, ADO Den Haag, Eerste Divisie 22-23)",-19.987375876733072
"R. Leonard (31, Millwall, Championship 22-23)","C. Staring (22, NAC Breda, Eerste Divisie 22-23)",59.71330463643857
"R. Leonard (31, Millwall, Championship 22-23)","J. Schuurman (25, Roda JC, Eerste Divisie 22-23)",49.07647862003129
"R. Leonard (31, Millwall, Championship 22-23)","L. Kaak (31, De Graafschap, Eerste Divisie 22-23)",43.04277656388637
"R. Leonard (31, Millwall, Championship 22-23)","T. Receveur (31, Dordrecht, Eerste Divisie 22-23)",22.96506960646321
"R. Leonard (31, Millwall, Championship 22-23)","O. van Eldik (19, Utrecht II, Eerste Divisie 22-23)",-9.685377319773592
"R. Leonard (31, Millwall, Championship 22-23)","I. Jenner (19, Utrecht II, Eerste Divisie 22-23)",14.212681033141372
"R. Leonard (31, Millwall, Championship 22-23)","J. Wehrmann (24, ADO Den Haag, Eerste Divisie 22-23)",6.575387500916134
"R. Leonard (31, Millwall, Championship 22-23)","G. Zelalem (26, Den Bosch, Eerste Divisie 22-23)",40.28236380973724
"R. Leonard (31, Millwall, Championship 22-23)","J. Valencia (28, De Graafschap, Eerste Divisie 22-23)",-30.11657182250046
"R. Leonard (31, Millwall, Championship 22-23)","M. Kanaria (24, Ceramica, Egyptian Premier League 22-23)",-5.548520268284865
"R. Leonard (31, Millwall, Championship 22-23)","K. Chimezie (27, El Daklyeh, Egyptian Premier League 22-23)",34.06755396011046
"R. Leonard (31, Millwall, Championship 22-23)","B. Touré (28, Pyramids Al Ahram FC, Egyptian Premier League 22-23)",-0.7561972770653479
"R. Leonard (31, Millwall, Championship 22-23)","K. Sokari (28, Pharco, Egyptian Premier League 22-23)",35.46242085438103
"R. Leonard (31, Millwall, Championship 22-23)","R. Ayagwa (25, Aswan FC, Egyptian Premier League 22-23)",51.40827680426524
"R. Leonard (31, Millwall, Championship 22-23)","M. Salifu (24, Al Ittihad, Egyptian Premier League 22-23)",16.132235530020395
"R. Leonard (31, Millwall, Championship 22-23)","F. Shawky (33, El Geish, Egyptian Premier League 22-23)",16.70915024199764
"R. Leonard (31, Millwall, Championship 22-23)","H. Mao (30, Ghazl El Mehalla, Egyptian Premier League 22-23)",22.97461346767203
"R. Leonard (31, Millwall, Championship 22-23)","Mohanad Lasheen (27, Future, Egyptian Premier League 22-23)",21.754164867866503
"R. Leonard (31, Millwall, Championship 22-23)","Mohamed Fathi (29, National Bank of Egypt, Egyptian Premier League 22-23)",51.47000113044544
"R. Leonard (31, Millwall, Championship 22-23)","D. Dodo (19, Smouha, Egyptian Premier League 22-23)",43.91106663485036
"R. Leonard (31, Millwall, Championship 22-23)","E. Eze (30, Al Masry, Egyptian Premier League 22-23)",13.412335538329325
"R. Leonard (31, Millwall, Championship 22-23)","W. El Karti (28, Pyramids Al Ahram FC, Egyptian Premier League 22-23)",-17.476978530649305
"R. Leonard (31, Millwall, Championship 22-23)","A. Dieng (25, Al Ahly, Egyptian Premier League 22-23)",16.188949588247684
"R. Leonard (31, Millwall, Championship 22-23)","Mohamed Hassan (29, Ismaily, Egyptian Premier League 22-23)",8.54239639110839
"R. Leonard (31, Millwall, Championship 22-23)","A. El Bahrawi (27, Pharco, Egyptian Premier League 22-23)",49.59924885406591
"R. Leonard (31, Millwall, Championship 22-23)","Nabil Emad Dunga (27, Zamalek, Egyptian Premier League 22-23)",17.140253174418536
"R. Leonard (31, Millwall, Championship 22-23)","Halimo (28, Smouha, Egyptian Premier League 22-23)",69.92918923177376
"R. Leonard (31, Millwall, Championship 22-23)","Mahmoud Sayed (35, National Bank of Egypt, Egyptian Premier League 22-23)",11.88633107591794
"R. Leonard (31, Millwall, Championship 22-23)","Mohamed Ghanam (26, Future, Egyptian Premier League 22-23)",21.74712323071547
"R. Leonard (31, Millwall, Championship 22-23)","Emad Hamdi (30, Ismaily, Egyptian Premier League 22-23)",62.44323320901866
"R. Leonard (31, Millwall, Championship 22-23)","Ahmed Mostafa (25, Smouha, Egyptian Premier League 22-23)",18.707871424918853
"R. Leonard (31, Millwall, Championship 22-23)","Khaled El Ghandour (32, Al Ittihad, Egyptian Premier League 22-23)",-14.954509786447865
"R. Leonard (31, Millwall, Championship 22-23)","Marwan Ateya (24, Al Ahly, Egyptian Premier League 22-23)",-6.2261477322503165
"R. Leonard (31, Millwall, Championship 22-23)","Mohamed Ashraf Roqa (27, Zamalek, Egyptian Premier League 22-23)",18.695269213803765
"R. Leonard (31, Millwall, Championship 22-23)","Amr El Soleya (33, Al Ahly, Egyptian Premier League 22-23)",-5.845843708405781
"R. Leonard (31, Millwall, Championship 22-23)","Karim Nedved (25, Future, Egyptian Premier League 22-23)",-7.746992900767034
"R. Leonard (31, Millwall, Championship 22-23)","Omar El Wahsh (28, Ismaily, Egyptian Premier League 22-23)",16.654745849438005
"R. Leonard (31, Millwall, Championship 22-23)","Hamdi Fathi (28, Al Ahly, Egyptian Premier League 22-23)",6.287731407706351
"R. Leonard (31, Millwall, Championship 22-23)","Mohamed Tony (26, Ceramica, Egyptian Premier League 22-23)",10.963393152434788
"R. Leonard (31, Millwall, Championship 22-23)","J. Karlström (27, Lech Poznań, Ekstraklasa 22-23)",-0.0801463983507767
"R. Leonard (31, Millwall, Championship 22-23)","M. Łęgowski (20, Pogoń Szczecin, Ekstraklasa 22-23)",-42.36704659760248
"R. Leonard (31, Millwall, Championship 22-23)","L. Łakomy (22, Zagłębie Lubin, Ekstraklasa 22-23)",-20.330903669873965
"R. Leonard (31, Millwall, Championship 22-23)","N. Kvekveskiri (30, Lech Poznań, Ekstraklasa 22-23)",-12.836242232231657
"R. Leonard (31, Millwall, Championship 22-23)","R. Murawski (29, Lech Poznań, Ekstraklasa 22-23)",14.70013001984698
"R. Leonard (31, Millwall, Championship 22-23)","D. Dąbrowski (30, Pogoń Szczecin, Ekstraklasa 22-23)",-6.260365391120619
"R. Leonard (31, Millwall, Championship 22-23)","D. Furman (30, Wisła Płock, Ekstraklasa 22-23)",2.988195451889703
"R. Leonard (31, Millwall, Championship 22-23)","J. Kałuziński (20, Lechia Gdańsk, Ekstraklasa 22-23)",-24.97243487613055
"R. Leonard (31, Millwall, Championship 22-23)","G. Tomasiewicz (27, Piast Gliwice, Ekstraklasa 22-23)",1.5917657573892012
"R. Leonard (31, Millwall, Championship 22-23)","P. Dziczek (25, Piast Gliwice, Ekstraklasa 22-23)",-1.867329282456005
"R. Leonard (31, Millwall, Championship 22-23)","Roberto Alves (25, Radomiak Radom, Ekstraklasa 22-23)",-25.606667097229497
"R. Leonard (31, Millwall, Championship 22-23)","T. Makowski (23, Zagłębie Lubin, Ekstraklasa 22-23)",16.109775201094585
"R. Leonard (31, Millwall, Championship 22-23)","J. Kubicki (27, Lechia Gdańsk, Ekstraklasa 22-23)",-7.911507221722733
"R. Leonard (31, Millwall, Championship 22-23)","R. Kurzawa (30, Pogoń Szczecin, Ekstraklasa 22-23)",-8.795695747742306
"R. Leonard (31, Millwall, Championship 22-23)","C. Donis (28, Radomiak Radom, Ekstraklasa 22-23)",56.43039201792954
"R. Leonard (31, Millwall, Championship 22-23)","M. Poletanović (29, Zagłębie Lubin, Ekstraklasa 22-23)",-1.2652002983518922
"R. Leonard (31, Millwall, Championship 22-23)","K. Petrov (32, Korona Kielce, Ekstraklasa 22-23)",30.46025199025616
"R. Leonard (31, Millwall, Championship 22-23)","T. Hateley (33, Piast Gliwice, Ekstraklasa 22-23)",11.230367119138046
"R. Leonard (31, Millwall, Championship 22-23)","P. Berg (25, Bodø / Glimt, Eliteserien 2023)",-16.15753446522907
"R. Leonard (31, Millwall, Championship 22-23)","S. Mannsverk (21, Molde, Eliteserien 2023)",-27.96777918303592
"R. Leonard (31, Millwall, Championship 22-23)","S. Nilsen (31, Brann, Eliteserien 2023)",-6.814138190413798
"R. Leonard (31, Millwall, Championship 22-23)","F. Ottosson (26, Sandefjord, Eliteserien 2023)",30.660724416629133
"R. Leonard (31, Millwall, Championship 22-23)","I. Sangaré (25, PSV, Eredivisie 22-23)",-4.077854700091689
"R. Leonard (31, Millwall, Championship 22-23)","E. Álvarez (25, Ajax, Eredivisie 22-23)",-1.802993396335516
"R. Leonard (31, Millwall, Championship 22-23)","O. Kökçü (22, Feyenoord, Eredivisie 22-23)",-36.52272252913037
"R. Leonard (31, Millwall, Championship 22-23)","J. Veerman (24, PSV, Eredivisie 22-23)",-16.425728626959675
"R. Leonard (31, Millwall, Championship 22-23)","Q. Timber (21, Feyenoord, Eredivisie 22-23)",-27.14450988421404
"R. Leonard (31, Millwall, Championship 22-23)","T. Reijnders (24, AZ, Eredivisie 22-23)",-43.3114473996089
"R. Leonard (31, Millwall, Championship 22-23)","M. Wieffer (23, Feyenoord, Eredivisie 22-23)",9.98048741031263
