Player 1,Player 2,Similarity
"R. Leonard (31, Millwall, Championship 22-23)","Ricardo Guima (27, Chaves, Primeira Liga 22-23)",-1.6623055712394503
"R. Leonard (31, Millwall, Championship 22-23)","G. Aburjania (28, Gil Vicente, Primeira Liga 22-23)",-7.124067183056246
"R. Leonard (31, Millwall, Championship 22-23)","I. Soro (25, Arouca, Primeira Liga 22-23)",10.144691924971418
"R. Leonard (31, Millwall, Championship 22-23)","M. Ndiaye (22, Estoril, Primeira Liga 22-23)",37.07893980707244
"R. Leonard (31, Millwall, Championship 22-23)","M. Diaby (26, Portimonense, Primeira Liga 22-23)",28.221827915238507
"R. Leonard (31, Millwall, Championship 22-23)","Chiquinho (27, Benfica, Primeira Liga 22-23)",-31.145244176596183
"R. Leonard (31, Millwall, Championship 22-23)","Claudemir (35, Vizela, Primeira Liga 22-23)",33.52017862015667
"R. Leonard (31, Millwall, Championship 22-23)","E. Fernández (22, Benfica, Primeira Liga 22-23)",-21.44071019972153
"R. Leonard (31, Millwall, Championship 22-23)","Pedro Silva (34, Gil Vicente, Primeira Liga 22-23)",-34.86017493466027
"R. Leonard (31, Millwall, Championship 22-23)","Val (26, Marítimo, Primeira Liga 22-23)",-8.987688546204176
"R. Leonard (31, Millwall, Championship 22-23)","Oriol Busquets (24, Arouca, Primeira Liga 22-23)",28.85321468725417
"R. Leonard (31, Millwall, Championship 22-23)","João Gamboa (26, Estoril, Primeira Liga 22-23)",26.91917313533892
"R. Leonard (31, Millwall, Championship 22-23)","Gustavo Assunção (23, Famalicão, Primeira Liga 22-23)",0.9429859981574183
"R. Leonard (31, Millwall, Championship 22-23)","Maurício (34, Portimonense, Primeira Liga 22-23)",17.580754358934385
"R. Leonard (31, Millwall, Championship 22-23)","Pedro Mosquera (35, Alcorcón, Primera División RFEF 22-23)",20.275369263697023
"R. Leonard (31, Millwall, Championship 22-23)","Ander Vidorreta (25, CD Calahorra, Primera División RFEF 22-23)",51.84387654053535
"R. Leonard (31, Millwall, Championship 22-23)","Fran Manzanara (26, Racing Ferrol, Primera División RFEF 22-23)",34.8444334892073
"R. Leonard (31, Millwall, Championship 22-23)","Miguel Román (20, Pontevedra, Primera División RFEF 22-23)",32.251739061228974
"R. Leonard (31, Millwall, Championship 22-23)","Markel Lozano (27, UD Logroñés, Primera División RFEF 22-23)",45.7246824637705
"R. Leonard (31, Millwall, Championship 22-23)","Iván Turrillo (34, Algeciras, Primera División RFEF 22-23)",22.195768012524056
"R. Leonard (31, Millwall, Championship 22-23)","Jesús Bernal (26, Racing Ferrol, Primera División RFEF 22-23)",46.47346568643193
"R. Leonard (31, Millwall, Championship 22-23)","Cristian Rodríguez (27, Castellón, Primera División RFEF 22-23)",-17.636133981929344
"R. Leonard (31, Millwall, Championship 22-23)","Borja Martínez (28, SD Logroñés, Primera División RFEF 22-23)",13.27365290219634
"R. Leonard (31, Millwall, Championship 22-23)","Josep Calavera (23, Castellón, Primera División RFEF 22-23)",34.02678197379653
"R. Leonard (31, Millwall, Championship 22-23)","Marc Casadó (19, Barcelona B, Primera División RFEF 22-23)",23.51354114590082
"R. Leonard (31, Millwall, Championship 22-23)","Imanol Sarriegi (28, SD Logroñés, Primera División RFEF 22-23)",34.520931024217546
"R. Leonard (31, Millwall, Championship 22-23)","Diego Villares (26, Deportivo La Coruña, Primera División RFEF 22-23)",10.052243037437943
"R. Leonard (31, Millwall, Championship 22-23)","Iker Muñoz (20, Osasuna B, Primera División RFEF 22-23)",49.0571701903546
"R. Leonard (31, Millwall, Championship 22-23)","L. Sangaré (21, Talavera CF, Primera División RFEF 22-23)",16.222924587153113
"R. Leonard (31, Millwall, Championship 22-23)","Fran Miranda (35, Alcoyano, Primera División RFEF 22-23)",51.93029380325344
"R. Leonard (31, Millwall, Championship 22-23)","Jon Gorrotxategi (21, Real Sociedad B, Primera División RFEF 22-23)",2.525531867167938
"R. Leonard (31, Millwall, Championship 22-23)","Roberto Olabe (27, Deportivo La Coruña, Primera División RFEF 22-23)",10.550181589390537
"R. Leonard (31, Millwall, Championship 22-23)","Mario Martín (19, Real Madrid Castilla, Primera División RFEF 22-23)",20.7055315784059
"R. Leonard (31, Millwall, Championship 22-23)","Borja Fernández (27, Algeciras, Primera División RFEF 22-23)",22.996303565813296
"R. Leonard (31, Millwall, Championship 22-23)","Urko González (22, Real Sociedad B, Primera División RFEF 22-23)",21.535155418661
"R. Leonard (31, Millwall, Championship 22-23)","Álex Sala (21, Sabadell, Primera División RFEF 22-23)",10.29955117619005
"R. Leonard (31, Millwall, Championship 22-23)","Miguel Marí (25, Intercity SJ D' Alacant, Primera División RFEF 22-23)",20.639604859298508
"R. Leonard (31, Millwall, Championship 22-23)","Alejandro Rego (19, Bilbao Athletic, Primera División RFEF 22-23)",29.87152326060428
"R. Leonard (31, Millwall, Championship 22-23)","Raúl Palma (28, CD Badajoz, Primera División RFEF 22-23)",19.50504946835789
"R. Leonard (31, Millwall, Championship 22-23)","Armando Corbalán (29, Sabadell, Primera División RFEF 22-23)",11.37165156653102
"R. Leonard (31, Millwall, Championship 22-23)","Jagoba Beobide (36, Real Unión, Primera División RFEF 22-23)",38.17290463336899
"R. Leonard (31, Millwall, Championship 22-23)","M. De Iriondo (30, Rayo Majadahonda, Primera División RFEF 22-23)",34.12584839428
"R. Leonard (31, Millwall, Championship 22-23)","Mario Ortiz (34, Algeciras, Primera División RFEF 22-23)",22.039523338929705
"R. Leonard (31, Millwall, Championship 22-23)","Theo Zidane (21, Real Madrid Castilla, Primera División RFEF 22-23)",-5.699488464968283
"R. Leonard (31, Millwall, Championship 22-23)","Ramón Folch (33, Cornellà, Primera División RFEF 22-23)",22.81422940232391
"R. Leonard (31, Millwall, Championship 22-23)","R. Selasi (26, Ceuta, Primera División RFEF 22-23)",37.00929430038054
"R. Leonard (31, Millwall, Championship 22-23)","Unai Naveira (21, Bilbao Athletic, Primera División RFEF 22-23)",27.8029959849294
"R. Leonard (31, Millwall, Championship 22-23)","Rafael Salama (25, Rayo Majadahonda, Primera División RFEF 22-23)",21.341903723909383
"R. Leonard (31, Millwall, Championship 22-23)","Álex Bergantiños (37, Deportivo La Coruña, Primera División RFEF 22-23)",10.9925721524449
"R. Leonard (31, Millwall, Championship 22-23)","Samuel Casais (31, Ceuta, Primera División RFEF 22-23)",31.48978116988669
"R. Leonard (31, Millwall, Championship 22-23)","Tilal Ali Ali (32, Al Markhiya, Qatari Stars League 22-23)",16.657767027618615
"R. Leonard (31, Millwall, Championship 22-23)","S. Nzonzi (34, Al Rayyan, Qatari Stars League 22-23)",4.613526621617129
"R. Leonard (31, Millwall, Championship 22-23)","Mohammed Al Jabri (32, Al Shamal, Qatari Stars League 22-23)",43.25612320610659
"R. Leonard (31, Millwall, Championship 22-23)","Nasser Al Ahrak (24, Al Gharafa, Qatari Stars League 22-23)",15.297998804030795
"R. Leonard (31, Millwall, Championship 22-23)","N. Vukčević (31, Al Ahli, Qatari Stars League 22-23)",19.311343617426303
"R. Leonard (31, Millwall, Championship 22-23)","Woo-Young Jung (33, Al Sadd, Qatari Stars League 22-23)",8.677397656067454
"R. Leonard (31, Millwall, Championship 22-23)","Luiz Ceará (34, Al Duhail, Qatari Stars League 22-23)",1.97235778437009
"R. Leonard (31, Millwall, Championship 22-23)","Khaled Al Zereiqi (32, Umm Salal, Qatari Stars League 22-23)",10.650202016743588
"R. Leonard (31, Millwall, Championship 22-23)","O. Ebrahimi (35, Al Wakrah, Qatari Stars League 22-23)",9.011766528557684
"R. Leonard (31, Millwall, Championship 22-23)","Abdelrahman Zaky (20, Umm Salal, Qatari Stars League 22-23)",8.278040905078303
"R. Leonard (31, Millwall, Championship 22-23)","Ahmed Fadel (30, Al Wakrah, Qatari Stars League 22-23)",17.002567031179296
"R. Leonard (31, Millwall, Championship 22-23)","B. Saidani (29, Al Sailiya, Qatari Stars League 22-23)",3.5900609291241934
"R. Leonard (31, Millwall, Championship 22-23)","N. Roșu (29, Dinamo Bucureşti, Romanian Liga II 22-23)",-14.822083682646284
"R. Leonard (31, Millwall, Championship 22-23)","D. Codrea (25, Concordia Chiajna, Romanian Liga II 22-23)",37.71272131552274
"R. Leonard (31, Millwall, Championship 22-23)","I. Neagu (33, Oţelul, Romanian Liga II 22-23)",15.432985439189215
"R. Leonard (31, Millwall, Championship 22-23)","R. Lazăr (24, Brașov Steagul Renaște, Romanian Liga II 22-23)",9.014248494369411
"R. Leonard (31, Millwall, Championship 22-23)","Gorka Larrucea (30, Dinamo Bucureşti, Romanian Liga II 22-23)",29.97597822758132
"R. Leonard (31, Millwall, Championship 22-23)","J. Marchioni (30, CSMS Iaşi, Romanian Liga II 22-23)",42.83474810080609
"R. Leonard (31, Millwall, Championship 22-23)","I. Tănase (25, Dumbrăviţa, Romanian Liga II 22-23)",29.362297147203563
"R. Leonard (31, Millwall, Championship 22-23)","G. Stoi (27, Ripensia Timişoara, Romanian Liga II 22-23)",25.415798195214244
"R. Leonard (31, Millwall, Championship 22-23)","F. Răsdan (27, Viitorul P. Targu Jiu, Romanian Liga II 22-23)",-19.07238441803858
"R. Leonard (31, Millwall, Championship 22-23)","P. Gaitán (31, AS FC Buzău, Romanian Liga II 22-23)",19.35823535093729
"R. Leonard (31, Millwall, Championship 22-23)","D. Brînzan (26, Viitorul P. Targu Jiu, Romanian Liga II 22-23)",44.02035523602345
"R. Leonard (31, Millwall, Championship 22-23)","M. Kereki (26, Unirea Dej, Romanian Liga II 22-23)",59.7401182167142
"R. Leonard (31, Millwall, Championship 22-23)","R. Vidrăsan (24, Ripensia Timişoara, Romanian Liga II 22-23)",32.666412158316284
"R. Leonard (31, Millwall, Championship 22-23)","D. Trebotić (32, AS FC Buzău, Romanian Liga II 22-23)",34.33813502883432
"R. Leonard (31, Millwall, Championship 22-23)","G. Vașvari (36, CSMS Iaşi, Romanian Liga II 22-23)",21.865230859553645
"R. Leonard (31, Millwall, Championship 22-23)","A. Ciuciulete (20, Metaloglobus, Romanian Liga II 22-23)",51.40437943259606
"R. Leonard (31, Millwall, Championship 22-23)","M. Catinean (26, Unirea Dej, Romanian Liga II 22-23)",34.926128934736845
"R. Leonard (31, Millwall, Championship 22-23)","A. Răuță (27, Metaloglobus, Romanian Liga II 22-23)",29.95831623051795
"R. Leonard (31, Millwall, Championship 22-23)","I. Chudin (33, Akron Togliatti, Russian FNL 2 22-23)",28.65137792251749
"R. Leonard (31, Millwall, Championship 22-23)","K. Khosonov (24, Alaniya Vladikavkaz, Russian FNL 2 22-23)",22.649203170851347
"R. Leonard (31, Millwall, Championship 22-23)","Y. Kazaev (31, Baltika, Russian FNL 2 22-23)",43.6514823409014
"R. Leonard (31, Millwall, Championship 22-23)","N. Miroshnichenko (22, SKA-Khabarovsk, Russian FNL 2 22-23)",-13.303726171438145
"R. Leonard (31, Millwall, Championship 22-23)","O. Lanin (27, Yenisey, Russian FNL 2 22-23)",31.985687080637508
"R. Leonard (31, Millwall, Championship 22-23)","V. Moskvichev (23, Neftekhimik, Russian FNL 2 22-23)",44.52845729137197
"R. Leonard (31, Millwall, Championship 22-23)","I. Nduka (19, Krasnodar II, Russian FNL 2 22-23)",30.524724586179225
"R. Leonard (31, Millwall, Championship 22-23)","R. Makhmutov (32, Volga Ulyanovsk, Russian FNL 2 22-23)",-41.69228685754115
"R. Leonard (31, Millwall, Championship 22-23)","K. Badoev (23, Veles, Russian FNL 2 22-23)",53.5152919421544
"R. Leonard (31, Millwall, Championship 22-23)","M. Kaynov (21, Arsenal Tula, Russian FNL 2 22-23)",50.655008117925206
"R. Leonard (31, Millwall, Championship 22-23)","I. Bezdenezhnykh (26, Kuban Krasnodar, Russian FNL 2 22-23)",31.444769207821967
"R. Leonard (31, Millwall, Championship 22-23)","R. Emelyanov (31, Shinnik, Russian FNL 2 22-23)",52.82717985699373
"R. Leonard (31, Millwall, Championship 22-23)","M. Kuzmin (26, Baltika, Russian FNL 2 22-23)",-23.83518751959853
"R. Leonard (31, Millwall, Championship 22-23)","Dmitriy Rakhmanov (27, Volga Ulyanovsk, Russian FNL 2 22-23)",31.87548348840336
"R. Leonard (31, Millwall, Championship 22-23)","M. Apshatsev (22, Rubin Kazan', Russian FNL 2 22-23)",10.715388789642894
"R. Leonard (31, Millwall, Championship 22-23)","O. Ivanov (36, Rubin Kazan', Russian FNL 2 22-23)",20.151159234799547
"R. Leonard (31, Millwall, Championship 22-23)","A. Pomerko (33, Arsenal Tula, Russian FNL 2 22-23)",12.099375388232051
"R. Leonard (31, Millwall, Championship 22-23)","M. Maltsev (22, Rodina Moskva, Russian FNL 2 22-23)",-13.138443888228943
"R. Leonard (31, Millwall, Championship 22-23)","S. Abdullahi (22, Veles, Russian FNL 2 22-23)",53.06419887602789
"R. Leonard (31, Millwall, Championship 22-23)","A. Khugaev (31, Ufa, Russian FNL 2 22-23)",19.58695804593837
"R. Leonard (31, Millwall, Championship 22-23)","S. Dmitriev (26, Rodina Moskva, Russian FNL 2 22-23)",34.371381829904486
"R. Leonard (31, Millwall, Championship 22-23)","D. Glebov (23, Rostov, Russian Premier League 22-23)",35.73974306905416
"R. Leonard (31, Millwall, Championship 22-23)","D. Barinov (26, Lokomotiv Moskva, Russian Premier League 22-23)",20.80843270228384
"R. Leonard (31, Millwall, Championship 22-23)","D. Miškić (29, Ural, Russian Premier League 22-23)",-15.225179546042646
"R. Leonard (31, Millwall, Championship 22-23)","W. Barrios (29, Zenit, Russian Premier League 22-23)",16.60650032457829
"R. Leonard (31, Millwall, Championship 22-23)","A. Karpukas (20, Lokomotiv Moskva, Russian Premier League 22-23)",30.712464484121675
"R. Leonard (31, Millwall, Championship 22-23)","A. Timofeev (29, Akhmat Grozny, Russian Premier League 22-23)",36.70851734763899
"R. Leonard (31, Millwall, Championship 22-23)","K. Kaplenko (23, Orenburg, Russian Premier League 22-23)",39.819845062141965
"R. Leonard (31, Millwall, Championship 22-23)","A. Kutitskiy (21, Dinamo Moskva, Russian Premier League 22-23)",35.94214699202497
"R. Leonard (31, Millwall, Championship 22-23)","V. Kamilov (27, Akhmat Grozny, Russian Premier League 22-23)",17.11148508338893
"R. Leonard (31, Millwall, Championship 22-23)","I. Cissé (29, Ural, Russian Premier League 22-23)",33.38318041064567
"R. Leonard (31, Millwall, Championship 22-23)","M. Gbane (22, Khimki, Russian Premier League 22-23)",24.743614738931743
"R. Leonard (31, Millwall, Championship 22-23)","M. Ćurić (24, Torpedo Moskva, Russian Premier League 22-23)",2.380879515833334
"R. Leonard (31, Millwall, Championship 22-23)","Kevin Lenini (26, Krasnodar, Russian Premier League 22-23)",9.727664371343096
"R. Leonard (31, Millwall, Championship 22-23)","F. Sungatulin (21, Ural, Russian Premier League 22-23)",16.538449406967402
"R. Leonard (31, Millwall, Championship 22-23)","A. Ryazantsev (36, Torpedo Moskva, Russian Premier League 22-23)",-6.918839973041904
"R. Leonard (31, Millwall, Championship 22-23)","K. Nèche (28, Al Qaisoma, Saudi First Division 22-23)",12.11589300202781
"R. Leonard (31, Millwall, Championship 22-23)","O. George (28, Al Qaisoma, Saudi First Division 22-23)",31.90640921682844
"R. Leonard (31, Millwall, Championship 22-23)","K. Maaouani (28, Al Kholood, Saudi First Division 22-23)",22.834545480213176
"R. Leonard (31, Millwall, Championship 22-23)","B. Boulhroud (30, Ohod, Saudi First Division 22-23)",21.469755160763917
"R. Leonard (31, Millwall, Championship 22-23)","Mohamed Al-Aqeel (0, Najran, Saudi First Division 22-23)",21.80926298501057
"R. Leonard (31, Millwall, Championship 22-23)","A. Al Shikhai (0, Al Ain, Saudi First Division 22-23)",32.70944038770122
"R. Leonard (31, Millwall, Championship 22-23)","Sulaiman Al Nakhli (27, Al Sahel, Saudi First Division 22-23)",20.943411147225603
"R. Leonard (31, Millwall, Championship 22-23)","B. Al Sayali (0, Al Hazem, Saudi First Division 22-23)",-2.204510405483373
"R. Leonard (31, Millwall, Championship 22-23)","F. Al Rashedy (0, Al Riyadh, Saudi First Division 22-23)",49.72591373102944
"R. Leonard (31, Millwall, Championship 22-23)","Ibrahim Al Nakhli (0, Al Arabi, Saudi First Division 22-23)",18.60409246614126
"R. Leonard (31, Millwall, Championship 22-23)","H. Faik (31, Al Ahli, Saudi First Division 22-23)",-4.756640328175953
"R. Leonard (31, Millwall, Championship 22-23)","Ahmed Karenshi (34, Al Riyadh, Saudi First Division 22-23)",33.75333878790761
"R. Leonard (31, Millwall, Championship 22-23)","Meshary Al-Qahtani (26, Al Qadisiyah, Saudi First Division 22-23)",23.3780805093514
"R. Leonard (31, Millwall, Championship 22-23)","Sandro Manoel (34, Al Arabi, Saudi First Division 22-23)",6.294255210112494
"R. Leonard (31, Millwall, Championship 22-23)","Rayan Al Harbi (29, Al Jabalain, Saudi First Division 22-23)",39.91589105062394
"R. Leonard (31, Millwall, Championship 22-23)","Mohammed Al Safri (32, Jeddah, Saudi First Division 22-23)",-0.9639510149088438
"R. Leonard (31, Millwall, Championship 22-23)","Jobson (27, Al Kholood, Saudi First Division 22-23)",1.663665364919916
"R. Leonard (31, Millwall, Championship 22-23)","Tariq Al-Kabe (30, Al Kholood, Saudi First Division 22-23)",51.319797753599005
"R. Leonard (31, Millwall, Championship 22-23)","H. Fallatah (30, Al Jabalain, Saudi First Division 22-23)",33.09727502951308
"R. Leonard (31, Millwall, Championship 22-23)","Omar Siraj Al Zayni (29, Jeddah, Saudi First Division 22-23)",20.03067192723687
"R. Leonard (31, Millwall, Championship 22-23)","B. Traoré (23, Al Hazem, Saudi First Division 22-23)",37.88737807785368
"R. Leonard (31, Millwall, Championship 22-23)","C. Bitang (30, Hajer, Saudi First Division 22-23)",25.5591786574084
"R. Leonard (31, Millwall, Championship 22-23)","N. Milesi (30, Al Ahli, Saudi First Division 22-23)",19.389434185968803
"R. Leonard (31, Millwall, Championship 22-23)","Ahmed Al-Najei (28, Al Hazem, Saudi First Division 22-23)",11.493167587101883
"R. Leonard (31, Millwall, Championship 22-23)","Hassan Jafari (31, Hajer, Saudi First Division 22-23)",33.40806030233136
"R. Leonard (31, Millwall, Championship 22-23)","H. Al Issi (0, Hajer, Saudi First Division 22-23)",12.961070471092528
"R. Leonard (31, Millwall, Championship 22-23)","A. Zakaria (0, Al Sahel, Saudi First Division 22-23)",-13.746121290765204
"R. Leonard (31, Millwall, Championship 22-23)","F. Kom (31, Al Ahli, Saudi First Division 22-23)",25.30499643244723
"R. Leonard (31, Millwall, Championship 22-23)","R. Alexandre (0, Ohod, Saudi First Division 22-23)",20.85801188183086
"R. Leonard (31, Millwall, Championship 22-23)","S. Cissé (31, Hajer, Saudi First Division 22-23)",19.82331660578009
"R. Leonard (31, Millwall, Championship 22-23)","Khalid Al Ghuwainem (24, Ohod, Saudi First Division 22-23)",22.86183012674068
"R. Leonard (31, Millwall, Championship 22-23)","Q. Al Kaibari (0, Al Qadisiyah, Saudi First Division 22-23)",10.82160535161912
"R. Leonard (31, Millwall, Championship 22-23)","A. El Mahdioui (27, Al Taawon, Saudi Professional League 22-23)",0.8868848215918358
"R. Leonard (31, Millwall, Championship 22-23)","G. Krychowiak (33, Al Shabab, Saudi Professional League 22-23)",2.036361303827701
"R. Leonard (31, Millwall, Championship 22-23)","Lucas Souza (32, Al Khaleej, Saudi Professional League 22-23)",23.85237838655825
"R. Leonard (31, Millwall, Championship 22-23)","Luiz Gustavo (35, Al Nassr, Saudi Professional League 22-23)",-14.383431203511982
"R. Leonard (31, Millwall, Championship 22-23)","A. Maher (29, Dhamk, Saudi Professional League 22-23)",16.032887007572008
"R. Leonard (31, Millwall, Championship 22-23)","Alfa Semedo (25, Al Ta'ee, Saudi Professional League 22-23)",41.66407892164961
"R. Leonard (31, Millwall, Championship 22-23)","Petros (34, Al Fateh, Saudi Professional League 22-23)",-0.5305686120155183
"R. Leonard (31, Millwall, Championship 22-23)","U. Matić (33, Abha, Saudi Professional League 22-23)",-14.69934358790418
"R. Leonard (31, Millwall, Championship 22-23)","Waleed Bakshween (33, Al Wahda, Saudi Professional League 22-23)",23.382337945235847
"R. Leonard (31, Millwall, Championship 22-23)","Bruno Henrique (33, Al Ittihad, Saudi Professional League 22-23)",-17.566815423776657
"R. Leonard (31, Millwall, Championship 22-23)","G. Cuéllar (30, Al Hilal, Saudi Professional League 22-23)",2.1749319471669675
"R. Leonard (31, Millwall, Championship 22-23)","Tarek Hamed (34, Al Ittihad, Saudi Professional League 22-23)",9.196620405715697
"R. Leonard (31, Millwall, Championship 22-23)","Mukhtar Ali (25, Al Ta'ee, Saudi Professional League 22-23)",14.26540809238713
"R. Leonard (31, Millwall, Championship 22-23)","Zakaria Sami (30, Abha, Saudi Professional League 22-23)",14.697352854210038
"R. Leonard (31, Millwall, Championship 22-23)","Abdullah Al Khaibari (26, Al Nassr, Saudi Professional League 22-23)",-3.032055043664433
"R. Leonard (31, Millwall, Championship 22-23)","Sultan Farhan (26, Al Raed, Saudi Professional League 22-23)",4.147429343865751
"R. Leonard (31, Millwall, Championship 22-23)","Ibrahim Mahnashi (23, Al Ettifaq, Saudi Professional League 22-23)",44.640909002897466
"R. Leonard (31, Millwall, Championship 22-23)","Edson (31, Al Adalah, Saudi Professional League 22-23)",49.97005168562344
"R. Leonard (31, Millwall, Championship 22-23)","Abdulmajeed Al-Sulaiheem (29, Al Nassr, Saudi Professional League 22-23)",-39.514006400849055
"R. Leonard (31, Millwall, Championship 22-23)","Driess Saddiki (26, Abha, Saudi Professional League 22-23)",15.621186767135582
"R. Leonard (31, Millwall, Championship 22-23)","K. Hamdi (31, Al Adalah, Saudi Professional League 22-23)",23.928266336279385
"R. Leonard (31, Millwall, Championship 22-23)","S. Brown (28, Raith Rovers, Scottish Championship 22-23)",41.27260708341951
"R. Leonard (31, Millwall, Championship 22-23)","M. Boateng (20, Queen's Park, Scottish Championship 22-23)",49.28835830209082
"R. Leonard (31, Millwall, Championship 22-23)","S. Martin (26, Hamilton Academical, Scottish Championship 22-23)",24.070654198042
"R. Leonard (31, Millwall, Championship 22-23)","C. Blues (25, Greenock Morton, Scottish Championship 22-23)",53.308330722217214
"R. Leonard (31, Millwall, Championship 22-23)","S. Bannigan (30, Partick Thistle, Scottish Championship 22-23)",8.844392996874625
"R. Leonard (31, Millwall, Championship 22-23)","J. Thomson (23, Queen's Park, Scottish Championship 22-23)",6.219750933858329
"R. Leonard (31, Millwall, Championship 22-23)","G. Gillespie (31, Greenock Morton, Scottish Championship 22-23)",48.39391867247167
"R. Leonard (31, Millwall, Championship 22-23)","R. Docherty (30, Partick Thistle, Scottish Championship 22-23)",12.652081820246003
"R. Leonard (31, Millwall, Championship 22-23)","S. Lawson (28, Hamilton Academical, Scottish Championship 22-23)",6.262478435048764
"R. Leonard (31, Millwall, Championship 22-23)","B. Spencer (27, Raith Rovers, Scottish Championship 22-23)",35.48019714560818
"R. Leonard (31, Millwall, Championship 22-23)","L. Hodson (31, Partick Thistle, Scottish Championship 22-23)",47.222219903497184
"R. Leonard (31, Millwall, Championship 22-23)","S. Bitsindou (26, Arbroath, Scottish Championship 22-23)",47.25652171712504
"R. Leonard (31, Millwall, Championship 22-23)","S. McGinn (34, Falkirk, Scottish League One 22-23)",18.11406273325586
"R. Leonard (31, Millwall, Championship 22-23)","M. Tidser (33, Kelty Hearts, Scottish League One 22-23)",5.844681471722931
"R. Leonard (31, Millwall, Championship 22-23)","D. Lyon (27, Kelty Hearts, Scottish League One 22-23)",39.08495739878637
"R. Leonard (31, Millwall, Championship 22-23)","J. Robertson (34, Alloa Athletic, Scottish League One 22-23)",56.18985040031807
"R. Leonard (31, Millwall, Championship 22-23)","R. McCabe (30, Airdrieonians, Scottish League One 22-23)",18.847869412173164
"R. Leonard (31, Millwall, Championship 22-23)","T. Masson (34, Montrose, Scottish League One 22-23)",5.21975242325393
"R. Leonard (31, Millwall, Championship 22-23)","H. Cochrane (22, Queen of the South, Scottish League One 22-23)",1.3370310842369049
"R. Leonard (31, Millwall, Championship 22-23)","M. Whatley (32, Montrose, Scottish League One 22-23)",58.507924942665326
"R. Leonard (31, Millwall, Championship 22-23)","C. McGrory (23, Queen of the South, Scottish League One 22-23)",-4.394940627618317
"R. Leonard (31, Millwall, Championship 22-23)","D. McMaster (20, Airdrieonians, Scottish League One 22-23)",31.30189453585318
"R. Leonard (31, Millwall, Championship 22-23)","C. Ballantyne (22, Montrose, Scottish League One 22-23)",10.152417335261893
"R. Leonard (31, Millwall, Championship 22-23)","L. Hunter (26, Annan Athletic, Scottish League Two 22-23)",47.97871781456187
"R. Leonard (31, Millwall, Championship 22-23)","C. Tapping (29, Stenhousemuir, Scottish League Two 22-23)",-10.45458190936416
"R. Leonard (31, Millwall, Championship 22-23)","D. Wilson (28, Stirling Albion, Scottish League Two 22-23)",5.705659913276111
"R. Leonard (31, Millwall, Championship 22-23)","Y. Ramadani (27, Aberdeen, Scottish Premiership 22-23)",29.20063590088757
"R. Leonard (31, Millwall, Championship 22-23)","S. Goss (27, Motherwell, Scottish Premiership 22-23)",17.831037928618574
"R. Leonard (31, Millwall, Championship 22-23)","J. Lundstram (29, Rangers, Scottish Premiership 22-23)",-6.773638266576097
"R. Leonard (31, Millwall, Championship 22-23)","C. McGregor (29, Celtic, Scottish Premiership 22-23)",-9.84856803639395
"R. Leonard (31, Millwall, Championship 22-23)","L. Clarkson (21, Aberdeen, Scottish Premiership 22-23)",-9.676847531130347
"R. Leonard (31, Millwall, Championship 22-23)","S. Kelly (29, Livingston, Scottish Premiership 22-23)",28.58666694882633
"R. Leonard (31, Millwall, Championship 22-23)","J. Holt (30, Livingston, Scottish Premiership 22-23)",41.404653179923216
"R. Leonard (31, Millwall, Championship 22-23)","A. Gogić (29, St. Mirren, Scottish Premiership 22-23)",40.18957884904385
"R. Leonard (31, Millwall, Championship 22-23)","J. Tillson (30, Ross County, Scottish Premiership 22-23)",57.53487108704667
"R. Leonard (31, Millwall, Championship 22-23)","D. Cancola (26, Ross County, Scottish Premiership 22-23)",34.69136244035752
"R. Leonard (31, Millwall, Championship 22-23)","E. Erhahon (22, St. Mirren, Scottish Premiership 22-23)",31.394529228587736
