Player,Similarity
"M. Pérez Acuña (29, CD Badajoz, Primera División RFEF 22-23)",85.7505440745017
"H. Hubchev (27, OFK Pirin, Bulgarian First League 22-23)",83.91285448037587
"C. Celesia (21, Messina, Serie C 22-23)",83.12187517298987
"Luis Ruiz (30, San Fernando, Primera División RFEF 22-23)",81.87007835482028
"F. Cavallo (21, Mixco, Guatemala Liga Nacional 22-23)",81.41965960777826
"A. Tutyškinas (19, Łódzki KS, Polish I Liga 22-23)",81.32859274409856
"Simao Martins (25, Trofense, Portugal Segunda Liga 22-23)",80.79630215368802
"G. Álvarez (23, Getafe, La Liga 22-23)",80.72968465728201
"L. Hjelde (19, Rotherham United, Championship 22-23)",80.13095036519668
"L. Malic (22, Željezničar, Bosnian Premier League 22-23)",79.69781569342207
"E. Taufik (32, Persis Solo, BRI Liga 1 22-23)",79.66168411128533
"F. Ermacora (23, Renate, Serie C 22-23)",79.02698387242705
"I. Burnea (30, Mioveni, SuperLiga României 22-23)",78.47066415193905
"F. Romero (24, Gudja United, Malta Premier League 22-23)",77.58785182914013
"G. Kamel (28, Pharco, Egyptian Premier League 22-23)",76.58928175548238
"S. Miranda (22, Bellinzona, Swiss Challenge League 22-23)",75.27518678797392
"N. Zolotov (28, Kolos Kovalivka, Ukrainian Premier Liha 22-23)",74.93047072203748
"A. Salvi (34, Cittadella, Serie B 22-23)",74.8116975875767
"A. Nakach (21, UTS Rabat, Botola Pro 22-23)",74.62187190905921
"S. Grabež (32, Javor Ivanjica, Serbian SuperLiga 22-23)",74.48020448948218
"S. Mrsulja (23, Arsenal Tivat, Montenegro First League 22-23)",74.23316638246384
"S. Abubakar (25, Radnik Surdulica, Serbian SuperLiga 22-23)",74.074481653904
"F. Dadić (22, Sloga Doboj, Bosnian Premier League 22-23)",73.85541725072493
"J. Díaz (24, Club Tijuana, Liga MX 22-23)",73.61778687022247
"J. Cardona (24, Once Caldas, Colombian Primera Division 22-23)",73.5324625113148
