Player,Similarity
"R. Peretz (28, Maccabi Kabilio Jaffa, Liga Leumit 22-23)",81.78714956599995
"B. Reichert (29, Hapoel Ramat HaSharon, Liga Leumit 22-23)",80.652211508964
"S. Branca (31, Cittadella, Serie B 22-23)",78.91869444659514
"R. Syuhada (18, PSIS Semarang, BRI Liga 1 22-23)",77.14420519697457
"C. Slattery (24, Motherwell, Scottish Premiership 22-23)",76.5506166652015
"Y. Bodiger (28, Granada, La Liga 2 22-23)",76.31749616186109
"T. Nnadi (19, Botev Plovdiv, Bulgarian First League 22-23)",76.17221085320185
"A. Jankewitz (21, Thun, Swiss Challenge League 22-23)",75.9493071561496
"M. Spelmann (36, Hvidovre, Danish 1. Division 22-23)",75.22174710969591
"S. Paulet (23, Excelsior Virton, Belgian First Division B 22-23)",74.87083886771151
"S. Tronchin (20, Virtus Verona, Serie C 22-23)",73.96267984103845
"Á. Szekér (21, Duna Aszfalt Tiszakécskei, NB II 22-23)",73.92004627503829
"C. Balgiu (28, CSA Steaua Bucureşti, Romanian Liga II 22-23)",73.44166417598751
"К. Struski (22, Aris, Cyprus 1. Division 22-23)",73.40803793290064
"A. Persia (24, Piacenza, Serie C 22-23)",73.16659483881463
"A. Burlamaqui (21, Intercity SJ D' Alacant, Primera División RFEF 22-23)",73.10234576665331
"S. Jevtoski (25, Rabotnički, North Macedonia First League 22-23)",73.09475397459605
"A. Zejnullai (24, Shkendija, North Macedonia First League 22-23)",72.89725691932662
"C. Ohene (29, CSKA 1948 Sofia, Bulgarian First League 22-23)",72.44578831033328
"Sergio Aguza (30, Real Murcia, Primera División RFEF 22-23)",72.43462220782467
"S. Cipriott (25, Sirens, Malta Premier League 22-23)",72.19100706314224
"M. Maita (28, Bari, Serie B 22-23)",72.18001854237698
"M. Al Shamat (0, Al Qadisiyah, Saudi First Division 22-23)",71.77155487878044
"K. Lemus (29, Santa Lucía, Guatemala Liga Nacional 22-23)",71.7666365568752
"R. De Rosa (28, Giugliano, Serie C 22-23)",71.55520230499309
