Player,Similarity
"S. Mihara (21, Ehime, J3 2023)",78.12833177306065
"I. Damaşcan (27, Zimbru, Moldovan Super Liga 22-23)",74.5559868955542
"J. Dombaxi (26, Vorwärts Steyr, Austrian 2. Liga 22-23)",69.81861955002815
"P. Sutter (24, St. Gallen, Swiss Super League 22-23)",68.64077749745972
"B. Mesinović (21, Tuzla City, Bosnian Premier League 22-23)",67.40729998432617
"T. Santos (24, Horsens, Superliga 22-23)",67.28504326938697
"Edu Viaña (23, Linares Deportivo, Primera División RFEF 22-23)",67.02203606843133
"Binu Bairam (22, Santa Lucia, Malta Premier League 22-23)",66.63969829243861
"F. Borowski (19, Zagłębie Sosnowiec, Polish I Liga 22-23)",66.41725031146616
"M. Keskin (21, Bandırmaspor, Turkish 1. Lig 22-23)",65.61179514578677
"R. Haxhiu (24, Tirana, Albanian Premier League 22-23)",65.38117718294254
"B. Chrisene (19, Kilmarnock, Scottish Premiership 22-23)",65.32458542609386
"E. Ercolano (20, Turris, Serie C 22-23)",64.39172896093794
"Derick Poloni (29, Casa Pia AC, Primeira Liga 22-23)",64.00445559817372
"F. Ronstadt (25, Darmstadt 98, 2. Bundesliga 22-23)",63.733112196804655
"P. Ternován (25, Soroksár SC, NB II 22-23)",63.55022683453743
"Sultan Alzaabi (24, Al Ittihad Kalba, UAE Pro League 22-23)",63.45967520406143
"Enric Franquesa (26, Leganés, La Liga 2 22-23)",63.424877841196846
"J. Ngakia (22, Watford, Championship 22-23)",63.02540779622971
"T. Schumacher (25, Austria Klagenfurt, Austrian Bundesliga 22-23)",62.468406107170914
"A. Navarro (35, Xelajú, Guatemala Liga Nacional 22-23)",62.37850043439524
"R. Mulders (22, Den Bosch, Eerste Divisie 22-23)",62.31891235813216
"Dylan Tavares (26, Bastia, Ligue 2 22-23)",62.21799254946993
"R. D'Haese (24, Oostende, Belgian Pro League 22-23)",62.21017143065865
"J. Doig (21, Hellas Verona, Serie A 22-23)",61.82285076438917
