Player,Similarity
"Mohammed Al-Amri (31, Al Faisaly, Saudi First Division 22-23)",92.4888654751181
"E. Salomonsson (34, IFK Göteborg, Allsvenskan 2023)",91.54504360179251
"Y. Mor (30, Hapoel Umm al-Fahm, Liga Leumit 22-23)",89.33133846288051
"Saleh Al-Qumayzi (31, Al Faisaly, Saudi First Division 22-23)",89.01424194224937
"R. Oliveira (27, Torreense, Portugal Segunda Liga 22-23)",88.85682475216153
"S. Lárusson (31, Valur, Iceland Besta-Deild Karla 2023)",88.39990709450838
"L. Blum (21, Young Boys, Swiss Super League 22-23)",88.25696730004285
"Saud Abdulhamid (23, Al Hilal, Saudi Professional League 22-23)",88.18576931263705
"S. Channgom (26, BG Pathum United FC, Thai League 1 22-23)",87.88304086978883
"Manu Sánchez (27, Castellón, Primera División RFEF 22-23)",87.73666561481306
"F. Kostić (30, Juventus, Serie A 22-23)",87.58971118231722
"Aurélio Buta (26, Eintracht Frankfurt, Bundesliga 22-23)",87.52178121786967
"M. Layún (34, América, Liga MX 22-23)",87.48794366955583
"C. Fai (30, Al Ta'ee, Saudi Professional League 22-23)",87.27152994380639
"A. Sorada (26, BG Pathum United FC, Thai League 1 22-23)",86.61751970195287
"U. Dell'Orfanello (22, Juve Stabia, Serie C 22-23)",86.58802838637321
"D. Guedes de Almeida (25, Mafra, Portugal Segunda Liga 22-23)",86.5346502164509
"B. Cipetić (28, Lokomotiva Zagreb, 1. HNL 22-23)",86.10108962879154
"C. Martínez (24, Alajuelense, Costa Rica Primera División 22-23)",85.9479753565045
"Rafael Fonseca (22, Academico Viseu, Portugal Segunda Liga 22-23)",85.91955182256986
"L. Dickmann (26, SPAL, Serie B 22-23)",85.56594823178472
"José Gayá (28, Valencia, La Liga 22-23)",85.49490021821727
"U. Garcia (27, Young Boys, Swiss Super League 22-23)",85.11486546713076
"J. Morales (26, Municipal, Guatemala Liga Nacional 22-23)",85.0425938984247
"J. Mosquera (20, Portland Timbers, MLS 2023)",84.63883414057148
