Player,Similarity
"J. Lindsay (27, Rotherham United, Championship 22-23)",79.33266112312027
"Tropi (28, Atlético Baleares, Primera División RFEF 22-23)",76.53781808725773
"N. Livnat (21, Agudat Sport Ashdod, Liga Leumit 22-23)",76.53097540949895
"F. Vaško (23, Zemplín Michalovce, Slovak Super Liga 22-23)",74.97751516909548
"A. Mizzi (27, Zebbug Rangers, Malta Premier League 22-23)",73.68845957739155
"E. Mustafayev (22, Shamakhi FK, Premyer Liqa 22-23)",73.37545670835173
"A. Faltsetas (35, Utsikten, Superettan 2023)",70.78004296442366
"H. Kite (22, Exeter City, League One 22-23)",70.41295651468691
"A. Ashta (23, Hapoel Jerusalem, Ligat Ha'al 22-23)",70.34727997463152
"Julen Azkue (27, Real Unión, Primera División RFEF 22-23)",69.93306493405605
"Victor Braga (22, Maqtaaral, Kazakh Premier League 2023)",69.57547608409358
"D. Pureca (18, ASU Poli, Romanian Liga II 22-23)",68.67426001745572
"I. Doumbia (19, AlbinoLeffe, Serie C 22-23)",68.17748181111075
"G. Graziano (27, Fermana, Serie C 22-23)",68.05005674530697
"A. Rinomhota (26, Cardiff City, Championship 22-23)",67.94797541554708
"Mohamad Abdulnaser Alabbasi (24, Al Wakrah, Qatari Stars League 22-23)",67.84879538934666
"S. O'Keefe (32, Gillingham, League Two 22-23)",67.33313932022608
"K. Rõõmussaar (20, Laagri, Estonian Meistriliiga 2023)",67.10191469986175
"Islam Mohareb (31, El Geish, Egyptian Premier League 22-23)",66.9378339447588
"B. Barr (22, Dungannon Swifts, Northern Ireland Premiership 22-23)",66.9066214266399
"Arthur Bonaldo (27, Numancia, Primera División RFEF 22-23)",66.06266681196131
"S. Galani (25, Coquimbo Unido, Chilean Primera División 2023)",65.9241477142263
"S. Paolini (26, Fidelis Andria, Serie C 22-23)",65.03319514647646
"José Gragera (22, Sporting Gijón, La Liga 2 22-23)",64.5207142049649
"T. Doumbia (33, Western United, A-League Men 22-23)",64.44593154961483
