Player,Similarity
"Ekollo (24, Unirea Slobozia, Romanian Liga II 22-23)",83.41540156994397
"G. Acheampong (26, Mosta, Malta Premier League 22-23)",73.64515409692316
"A. Ćetković (19, Arsenal Tivat, Montenegro First League 22-23)",73.14376751049346
"O. Peev (35, Belasica, North Macedonia First League 22-23)",72.47972026113771
"A. Rodas (30, Xelajú, Guatemala Liga Nacional 22-23)",72.44632052518669
"J. Adams (22, Stellenbosch FC, South Africa PSL 22-23)",72.1910808254103
"M. Raičković (29, Aktobe, Kazakh Premier League 2023)",72.17780111971706
"C. Merrie (24, Tranmere Rovers, League Two 22-23)",72.15451027008483
"L. Romo (27, Monterrey, Liga MX 22-23)",71.78299023357565
"I. Gudiño (22, Tauro, Panama LPF 2023)",71.42546493627854
"B. Kristensen (30, Hibernians, Malta Premier League 22-23)",71.35636260950551
"J. Bosch (23, Willem II, Eerste Divisie 22-23)",70.56134049824972
"B. Stambouli (32, Adana Demirspor, Süper Lig 22-23)",70.40677109583379
"C. Grameni (20, Farul Constanţa, SuperLiga României 22-23)",70.04262916018071
"T. Baack (24, Verl, 3. Liga 22-23)",69.92187039284936
"A. Andronikashvili (24, Shukura, Erovnuli Liga 2023)",69.17422249076122
"M. Doumbia (24, Slovan Liberec, Czech Fortuna Liga 22-23)",68.57369112231318
"N. Sabag (30, Ashdod, Ligat Ha'al 22-23)",68.45659785904505
"R. Lambert (24, Kuala Lumpur City, Malaysian Super League 2023)",67.7212876641982
"J. Castillo (21, Sporting Cristal, Peruvian Liga 1 2023)",67.29287793665063
"B. Asamoah (29, Doxa, Cyprus 1. Division 22-23)",66.61974260529703
"Y. Wakasa (27, Fagiano Okayama, J2 2023)",66.61760806955907
"A. Sadybekov (21, Kairat, Kazakh Premier League 2023)",66.13283751108777
"J. Williams (26, Bristol City, Championship 22-23)",65.82392390306467
"M. Corboz (28, Verl, 3. Liga 22-23)",65.54130328715596
