Player,Similarity
"C. Guanca (30, Al Shabab, Saudi Professional League 22-23)",88.84226803425413
"A. Taarabt (33, Al Nasr, UAE Pro League 22-23)",86.54792386844441
"Afsha (27, Al Ahly, Egyptian Premier League 22-23)",86.37117485234641
"Pascu (23, Almere City, Eerste Divisie 22-23)",86.18981452179567
"K. Drzazga (27, Podbeskidzie Bielsko-Biała, Polish I Liga 22-23)",85.52536318950011
"S. Jørgensen (22, Silkeborg, Superliga 22-23)",85.26119462312755
"Bruno Fernandes (28, Manchester United, Premier League 22-23)",85.03674049364574
"S. Tomović (21, Čukarički, Serbian SuperLiga 22-23)",84.7125038011546
"Joan Román (30, Podbeskidzie Bielsko-Biała, Polish I Liga 22-23)",84.64535836963508
"J. Bauza (27, U Craiova 1948, SuperLiga României 22-23)",84.6032242211686
"D. Silva (36, Millonarios, Colombian Primera Division 22-23)",84.58933917074953
"A. Suárez (20, Alajuelense, Costa Rica Primera División 22-23)",84.45688782490659
"H. Adamczyk (25, Arka Gdynia, Polish I Liga 22-23)",84.39885393391319
"R. Gauld (27, Vancouver Whitecaps, MLS 2023)",84.38153719226614
"M. Tolić (26, Maribor, 1. SNL 22-23)",84.07803301558062
"T. Nguen (29, Ferencváros, NB I 22-23)",84.07614942842436
"M. Bottani (32, Lugano, Swiss Super League 22-23)",84.05789408967313
"Diego Lopes (29, Lion City Sailors FC, Singapore Premier League 2023)",84.05448047302083
"S. Buletsa (24, Zorya, Ukrainian Premier Liha 22-23)",83.8040705404921
"T. Almada (22, Atlanta United, MLS 2023)",83.65996236586653
"S. Kowalczyk (24, Pogoń Szczecin, Ekstraklasa 22-23)",83.39011481859845
"S. Mirzaev (32, Muang Thong United, Thai League 1 22-23)",83.10349141415242
"Samu Sáiz (32, Sivasspor, Süper Lig 22-23)",82.73325100261458
"Kaká (30, Al Akhdoud, Saudi First Division 22-23)",82.57862019070677
"V. Buyalskyi (30, Dynamo Kyiv, Ukrainian Premier Liha 22-23)",82.54794312514882
