Player,Similarity
"P. Maghoma (22, Milton Keynes Dons, League One 22-23)",68.00855735956145
"E. Kuliev (21, Zira, Premyer Liqa 22-23)",66.366953493967
"N. Ahamada (20, Stuttgart, Bundesliga 22-23)",63.32974931243416
"L. Kuavita (18, Standard Liège II, Belgian First Division B 22-23)",62.60548763230912
"E. Dahan (26, Hapoel Rishon LeZion, Liga Leumit 22-23)",61.267234983503215
"K. Mahlasela (32, Royal AM, South Africa PSL 22-23)",61.02576731444172
"B. Servania (24, Toronto, MLS 2023)",60.44426329973888
"Y. Kang (21, Jeonbuk Motors II, K4 League 2023)",60.12770820092253
"Abdullah Hakawi (23, Jeddah, Saudi First Division 22-23)",60.04475925075838
"J. Rothwell (28, Bournemouth, Premier League 22-23)",59.64728990863748
"A. Tsaraev (24, Alaniya Vladikavkaz, Russian FNL 2 22-23)",58.821002038138616
"T. Corbaz (29, Winterthur, Swiss Super League 22-23)",58.771641918825054
"K. Morita (22, Tokyo Verdy, J2 2023)",58.52201825419064
"E. Berezkin (26, Kyzyl-Zhar, Kazakh Premier League 2023)",58.390713257924965
"Romário Baró (23, Casa Pia AC, Primeira Liga 22-23)",57.89515249180464
"Martim Neto (20, Benfica II, Portugal Segunda Liga 22-23)",57.72155669515552
"R. Fujii (26, PSIS Semarang, BRI Liga 1 22-23)",57.57738034542405
"P. Salomon (34, Šibenik, 1. HNL 22-23)",57.42000901073887
"J. O'Doherty (25, East Bengal, Indian Super League 22-23)",56.7030198955084
"C. Jones (22, Liverpool, Premier League 22-23)",56.49755155778428
"P. Sajdak (23, SKRA Częstochowa, Polish I Liga 22-23)",56.29816814080285
"I. Doumbia (25, Alanyaspor, Süper Lig 22-23)",56.01000378399482
"N. Amiri (26, Bayer Leverkusen, Bundesliga 22-23)",55.97918679282198
"S. Vasiliadis (25, Arminia Bielefeld, 2. Bundesliga 22-23)",55.8068406715538
"Álex López (26, Alcorcón, Primera División RFEF 22-23)",55.51045580487646
