Player,Similarity
"L. Łakomy (22, Zagłębie Lubin, Ekstraklasa 22-23)",85.1632639695122
"Amr El Soleya (33, Al Ahly, Egyptian Premier League 22-23)",83.58724878351819
"W. El Karti (28, Pyramids Al Ahram FC, Egyptian Premier League 22-23)",83.35039873446233
"M. Matanović (22, Sutjeska, Montenegro First League 22-23)",83.03081882578981
"M. Bešić (30, Ferencváros, NB I 22-23)",82.4436921439564
"Abdullah Ramadan (25, Al Jazira, UAE Pro League 22-23)",81.16419315464186
"J. Taylor (24, Peterborough United, League One 22-23)",81.03187578590317
"Bruno Guimarães (25, Newcastle United, Premier League 22-23)",80.38641135269177
"S. Morsy (31, Ipswich Town, League One 22-23)",80.24702008641081
"A. Alimi (35, Shkendija, North Macedonia First League 22-23)",79.72860633932146
"W. Pomphan (26, Muang Thong United, Thai League 1 22-23)",79.57434971795624
"B. Poczobut (29, Stal Rzeszów, Polish I Liga 22-23)",79.16640222930592
"K. McLean (31, Norwich City, Championship 22-23)",78.90566237328834
"E. Fernández (22, Benfica, Primeira Liga 22-23)",78.30926212394208
"J. Bellingham (19, Borussia Dortmund, Bundesliga 22-23)",77.70578650825807
"A. Jaber (28, Neftchi, Premyer Liqa 22-23)",77.32649164889693
"M. Kanaria (24, Ceramica, Egyptian Premier League 22-23)",76.34387067348881
"Gyu-Sung Lee (29, Ulsan Hyundai, K League 1 2023)",76.18018330442379
"J. Texl (30, Zbrojovka Brno, Czech Fortuna Liga 22-23)",75.78727068453381
"D. Miškić (29, Ural, Russian Premier League 22-23)",75.62965020062728
"A. Kozar (28, Balestier Khalsa, Singapore Premier League 2023)",75.5857131830536
"Al. López (31, Alajuelense, Costa Rica Primera División 22-23)",74.9834088239361
"Abdulmajeed Al-Sulaiheem (29, Al Nassr, Saudi Professional League 22-23)",74.22532449744362
"S. Mannsverk (21, Molde, Eliteserien 2023)",73.61952423931697
"J. Kubicki (27, Lechia Gdańsk, Ekstraklasa 22-23)",73.04064607356986
