Player,Similarity
"N. Alioui (24, Le Havre, Ligue 2 22-23)",85.61929915729517
"S. Bourard (27, Hapoel Hadera, Ligat Ha'al 22-23)",85.40127588310612
"A. Hohberg (31, Sporting Cristal, Peruvian Liga 1 2023)",85.2483389848929
"Toni García (31, Real Balompédica Linense, Primera División RFEF 22-23)",85.16834649771612
"Isi Palazón (28, Rayo Vallecano, La Liga 22-23)",85.01622434273861
"A. Ocampo (25, Fénix, Uruguay Primera División 2023)",84.75882209681454
"D. Genov (34, Botev Vratsa, Bulgarian First League 22-23)",84.70214344886459
"V. van Crooij (27, Sparta Rotterdam, Eredivisie 22-23)",83.95308691021857
"R. Salas (29, Municipal Grecia, Costa Rica Primera División 22-23)",83.53053950011623
"B. Simakala (26, Osnabrück, 3. Liga 22-23)",83.44349877698521
"R. Maarman (23, Chippa United, South Africa PSL 22-23)",83.34450153379096
"K. Despodov (26, Ludogorets, Bulgarian First League 22-23)",83.14319767309946
"B. Nowak (29, Raków Częstochowa, Ekstraklasa 22-23)",82.8506822776971
"Pedro León (36, Real Murcia, Primera División RFEF 22-23)",82.64381719825903
"Bruno Xadas (25, Marítimo, Primeira Liga 22-23)",82.58790263185249
"M. Tanković (28, Pafos, Cyprus 1. Division 22-23)",81.86083210653597
"Mateus (28, Nagoya Grampus, J1 2023)",81.80971665752796
"A. Ramazanov (30, Sabail, Premyer Liqa 22-23)",81.63937690661417
"S. Singh (24, Jahn Regensburg, 2. Bundesliga 22-23)",81.57501363564919
"Ewandro Costa (27, Spartak Varna, Bulgarian First League 22-23)",81.52590071983623
"C. Ponde (28, Farense, Portugal Segunda Liga 22-23)",81.46928645378657
"A. Yushin (28, Ural, Russian Premier League 22-23)",81.46816056174944
"V. Bichakhchyan (23, Pogoń Szczecin, Ekstraklasa 22-23)",81.08235291922206
"T. Kunimoto (25, Casa Pia AC, Primeira Liga 22-23)",81.03361942634841
"R. Santos (31, Torreense, Portugal Segunda Liga 22-23)",80.73649569641434
