Player,Similarity
"A. Tshibola (28, AEL, Cyprus 1. Division 22-23)",84.93860515154552
"J. Santos (24, Torreense, Portugal Segunda Liga 22-23)",84.91722061147102
"Higor Meritão (28, Pumas UNAM, Liga MX 22-23)",83.35480439170699
"F. Abdullahi (20, Doxa, Cyprus 1. Division 22-23)",83.24734215006461
"F. Fonseca (31, Farense, Portugal Segunda Liga 22-23)",82.50517798957779
"S. Tassanai (31, Police Tero, Thai League 1 22-23)",82.1178754511777
"K. Baccus (31, Macarthur, A-League Men 22-23)",80.05431983385486
"G. Kutsia (23, FK Liepāja, Virsliga 2023)",79.4429613526199
"M. Maita (28, Bari, Serie B 22-23)",79.40254647068532
"Aitor Sanz (38, Tenerife, La Liga 2 22-23)",79.2761627639831
"M. Muroni (27, Reggiana, Serie C 22-23)",79.04768214232351
"R. Paraj (30, Podbrezová, Slovak Super Liga 22-23)",78.9330845911916
"André André (33, Vitória Guimarães, Primeira Liga 22-23)",78.87771957359172
"M. Ugarte (22, Sporting CP, Primeira Liga 22-23)",78.8150200484081
"M. Mellado (30, OFI, Greek Super League 22-23)",78.798779157335
"R. Akhmatov (26, Chindia Târgovişte, SuperLiga României 22-23)",78.67477760784612
"K. Aldair (21, Comunicaciones, Guatemala Liga Nacional 22-23)",78.66315706687139
"K. Adorján (30, Budafoki MTE, NB II 22-23)",78.57270460052334
"T. Nnadi (19, Botev Plovdiv, Bulgarian First League 22-23)",78.247621891149
"A. Pasche (32, Neuchâtel Xamax, Swiss Challenge League 22-23)",78.18970931018406
"P. Aquino (28, América, Liga MX 22-23)",78.17787948080083
"Cristóbal Márquez (39, Fuenlabrada, Primera División RFEF 22-23)",78.07954620758069
"V. Chuperka (30, Kuban Krasnodar, Russian FNL 2 22-23)",78.02538747460989
"S. Taipi (26, Kukësi, Albanian Premier League 22-23)",77.46563955562385
"A. Knight (21, Plaza Amador, Panama LPF 2023)",77.46047954151882
