Player,Similarity
"Mohamad Abdulnaser Alabbasi (24, Al Wakrah, Qatari Stars League 22-23)",83.49753057673927
"N. Đorić (23, Šibenik, 1. HNL 22-23)",81.5809546551174
"A. Meir (22, Maccabi Bnei Raina, Ligat Ha'al 22-23)",81.42604464995192
"Marc Ferrè (29, Penya Encarnada, Andorra Primera Divisió 22-23)",80.6599640146786
"G. Tomovski (24, Akademija Pandev, North Macedonia First League 22-23)",79.01590787863472
"S. Galani (25, Coquimbo Unido, Chilean Primera División 2023)",78.61176905092482
"João Afonso (28, Marítimo, Primeira Liga 22-23)",78.52476142734119
"G. Mancuso (25, CD Badajoz, Primera División RFEF 22-23)",78.18771833758184
"A. Vovkun (21, Lviv, Ukrainian Premier Liha 22-23)",77.86100417293247
"N. Linares (27, Instituto, Argentinian Primera División 2023)",77.58759926595692
"B. Innocent (27, Lorient, Ligue 1 22-23)",76.97234529117219
"G. Marsh (24, AFC Wimbledon, League Two 22-23)",76.80757030073529
"G. Nagy (30, Mezőkövesd-Zsóry, NB I 22-23)",75.81280861973592
"A. Gheorghe (20, Metaloglobus, Romanian Liga II 22-23)",75.53332667731297
"J. Traore (20, Shirak, Armenian Premier League 22-23)",75.38098151379606
"S. Marjanović (28, Radnički Niš, Serbian SuperLiga 22-23)",75.14807400111367
"N. Vossebelt (31, Roda JC, Eerste Divisie 22-23)",75.09290299864857
"Fausto Tienza (33, Racing Santander, La Liga 2 22-23)",75.04544234129503
"I. Baba (27, Mallorca, La Liga 22-23)",74.77702349001292
"M. Gönülaçar (28, Denizlispor, Turkish 1. Lig 22-23)",74.75983656789916
"D. Metaxas (19, Volos NFC, Greek Super League 22-23)",74.71329871238608
"Luis Blanco (33, Engordany, Andorra Primera Divisió 22-23)",74.03547775711708
"D. Lovric (23, Široki Brijeg, Bosnian Premier League 22-23)",73.98053679975337
"Javi Robles (22, Pontevedra, Primera División RFEF 22-23)",73.81495741058302
"David Timor (33, Huesca, La Liga 2 22-23)",73.5488136930128
