Player,Similarity
"D. Maftei (18, Unirea Dej, Romanian Liga II 22-23)",87.18516070209145
"G. Nicolao (29, Gubbio, Serie C 22-23)",86.8476247926815
"D. Inazumi (26, Vanraure Hachinohe, J3 2023)",86.18494538851083
"A. Dagarchaoui (0, Al Ain, Saudi First Division 22-23)",85.59094468162206
"M. Johnston (19, Motherwell, Scottish Premiership 22-23)",85.25114367067445
"M. Morello (28, Van, Armenian Premier League 22-23)",85.00046253621305
"Jorge Valín (23, Numancia, Primera División RFEF 22-23)",83.53952605407045
"D. Diekmeier (33, Sandhausen, 2. Bundesliga 22-23)",82.72406365361627
"Saúl García (28, Racing Santander, La Liga 2 22-23)",82.65501586485584
"F. De Col (29, Südtirol, Serie B 22-23)",82.29092727622434
"Mohamed Reda (31, Haras El Hodood, Egyptian Premier League 22-23)",81.4647753640502
"L. Holík (25, Viktoria Plzeň, Czech Fortuna Liga 22-23)",80.89464400975903
"A. Breslin (26, St. Patrick's Ath., League of Ireland PL 2023)",80.86498333298479
"L. Abanda (22, Lamia, Greek Super League 22-23)",80.5987411303893
"P. Kadeřábek (31, Hoffenheim, Bundesliga 22-23)",80.17681135566245
"F. Borța (23, Petrolul 52, SuperLiga României 22-23)",80.13960782898066
"M. Anzolin (22, Wolfsberger AC, Austrian Bundesliga 22-23)",79.99183818420444
"A. Jaber (30, Maccabi Bnei Raina, Ligat Ha'al 22-23)",79.96918497114478
"G. Nurse (24, Shrewsbury Town, League One 22-23)",79.93100241987938
"O. Kakay (25, Queens Park Rangers, Championship 22-23)",79.78901251181135
"E. Matus (21, Audax Italiano, Chilean Primera División 2023)",79.67020744584963
"Felipe Alfonso (30, Mérida AD, Primera División RFEF 22-23)",78.96582329279546
"José David (20, Ibiza, La Liga 2 22-23)",78.91181103756811
"Abdullah Al Ammar (29, Dhamk, Saudi Professional League 22-23)",78.72855869562493
"Moi Delgado (29, Ponferradina, La Liga 2 22-23)",78.3182998174051
