Player,Similarity
"D. Terteryan (25, Ararat-Armenia, Armenian Premier League 22-23)",94.0137193685377
"J. Faussurier (36, Sochaux, Ligue 2 22-23)",92.6480873389927
"A. Jafer (28, Bnei Yehuda, Liga Leumit 22-23)",92.07653610282853
"C. Fai (30, Al Ta'ee, Saudi Professional League 22-23)",91.59166421593235
"P. Cornud (26, Maccabi Haifa, Ligat Ha'al 22-23)",91.21971598185638
"Tony Abad (26, Eldense, Primera División RFEF 22-23)",90.89326148049334
"H. Hakobyan (26, Ararat-Armenia, Armenian Premier League 22-23)",90.45351298238168
"T. Cancellotti (31, Pescara, Serie C 22-23)",90.39945692066765
"H. Vandermersch (24, Caen, Ligue 2 22-23)",90.28633534168506
"R. Oliveira (27, Torreense, Portugal Segunda Liga 22-23)",90.12043119532356
"K. Koštrna (29, Spartak Trnava, Slovak Super Liga 22-23)",89.80934647028029
"C. Martínez (24, Alajuelense, Costa Rica Primera División 22-23)",89.49682556396982
"E. Dasa (30, Dinamo Moskva, Russian Premier League 22-23)",89.30040225014547
"S. Klaiber (28, Utrecht, Eredivisie 22-23)",89.26394733901647
"N. Weerawatnodom (28, Buriram United, Thai League 1 22-23)",89.06039810874485
"M. Tuychibaev (30, Alay, Kyrgyz Premier League 2023)",89.04912271283777
"David Bruno (31, Moreirense, Portugal Segunda Liga 22-23)",88.89962954653528
"M. Huard (25, Brescia, Serie B 22-23)",88.71696885729715
"D. Akhmadaliev (28, AGMK, Uzbek Super League 2023)",88.66561738655003
"Á. Roldán (26, Seattle Sounders, MLS 2023)",88.61162601624096
"A. Rizzo (24, Avellino, Serie C 22-23)",88.45719764150589
"D. Zappella (25, Virtus Entella, Serie C 22-23)",88.45122592363502
"A. Ceresoli (20, Mantova, Serie C 22-23)",88.36768934161738
"M. Hindi (27, Maccabi Petah Tikva, Liga Leumit 22-23)",88.34469878357055
"E. Karic (25, Darmstadt 98, 2. Bundesliga 22-23)",88.26165582761699
